"title","url","stars","name","reviewUrl","text"
"Warung Makan Asem-Asem Koh Liem","https://www.google.com/maps/search/?api=1&query=Warung%20Makan%20Asem-Asem%20Koh%20Liem&query_place_id=ChIJWx7SjNL0cC4RmhXwXxTnmUs","4","Abon Rebon","https://www.google.com/maps/reviews/data=!4m8!14m7!1m6!2m5!1sChZDSUhNMG9nS0VJQ0FnSUNXLVAzd2FnEAE!2m1!1s0x0:0x4b99e7145ff0159a!3m1!1s2@1:CIHM0ogKEICAgICW-P3wag%7CCgwInum6kAYQgKjvkwM%7C?hl=id","Asem-asem Koh Liem ini termasuk warung makan legend di Semarang.
Sudah buka jam 7 pagi.
Menu nya banyak (chinese food & masakan jawa) : sedep sedep semuaa ; rasa cenderung manis.
Ada yg non halal 🙏

Ini saya sarapan sama gambas, buncis, sosis babi, kekian goreng, tempe goreng ;
Total Rp 56.000 .

Ruangan gak ada AC,
Bersih,
Karyawan + karyawati : ramah & sopan semua."
"Warung Makan Asem-Asem Koh Liem","https://www.google.com/maps/search/?api=1&query=Warung%20Makan%20Asem-Asem%20Koh%20Liem&query_place_id=ChIJWx7SjNL0cC4RmhXwXxTnmUs","4","K S W","https://www.google.com/maps/reviews/data=!4m8!14m7!1m6!2m5!1sChZDSUhNMG9nS0VJQ0FnSURULTRLYkV3EAE!2m1!1s0x0:0x4b99e7145ff0159a!3m1!1s2@1:CIHM0ogKEICAgIDT-4KbEw%7CCgwIm9rXsgYQkK7gpgE%7C?hl=id","One of the Legendary local menu in Semarang.
Garang asam urat sapi, kikil sapi, gimbal peyek udang, udang masak mentega.

Delicious and tender beef. Only one thing, the soup is too sweet."
"Warung Makan Asem-Asem Koh Liem","https://www.google.com/maps/search/?api=1&query=Warung%20Makan%20Asem-Asem%20Koh%20Liem&query_place_id=ChIJWx7SjNL0cC4RmhXwXxTnmUs","4","Vivi Alvionita Adiwijaya","https://www.google.com/maps/reviews/data=!4m8!14m7!1m6!2m5!1sChZDSUhNMG9nS0VJQ0FnSURJdzVmV0h3EAE!2m1!1s0x0:0x4b99e7145ff0159a!3m1!1s2@1:CIHM0ogKEICAgIDIw5fWHw%7CCgwI1b-K4gUQjpzWkwI%7C?hl=id","Asem2 nya enak
harga nya bervariasi tergantung menu
Ada makan nasi campur jg bs pilih lakuk sendiri
Bersih tempatnya pelayanan cepat
Cuma untuk parkir agak susah yah karena depan sekolah jd rame gitu."
"Warung Makan Asem-Asem Koh Liem","https://www.google.com/maps/search/?api=1&query=Warung%20Makan%20Asem-Asem%20Koh%20Liem&query_place_id=ChIJWx7SjNL0cC4RmhXwXxTnmUs","4","Purba, Kris","https://www.google.com/maps/reviews/data=!4m8!14m7!1m6!2m5!1sChZDSUhNMG9nS0VJQ0FnSURCMjRuLUJBEAE!2m1!1s0x0:0x4b99e7145ff0159a!3m1!1s2@1:CIHM0ogKEICAgIDB24n-BA%7CCgwImcPangYQgJvNhAM%7C?hl=id","Soal rasa makanan, tempat ini emang enak. Menunya juga unik & beragam, dari halal sampai non-halal. Cuma soal penyajian perporsi & harga, baiknya ditanyakan kepada pramusaji sebelum pesan. Tempatnya bersih, kapasitas juga lumayan besar. Pas buat kulineran makan siang."
"Warung Makan Asem-Asem Koh Liem","https://www.google.com/maps/search/?api=1&query=Warung%20Makan%20Asem-Asem%20Koh%20Liem&query_place_id=ChIJWx7SjNL0cC4RmhXwXxTnmUs","4","Pelly Sianova","https://www.google.com/maps/reviews/data=!4m8!14m7!1m6!2m5!1sChZDSUhNMG9nS0VJQ0FnSUNZeV9IaGR3EAE!2m1!1s0x0:0x4b99e7145ff0159a!3m1!1s2@1:CIHM0ogKEICAgICYy_Hhdw%7CCgsI443r5QUQsO29Pw%7C?hl=id","Rumah makan legendaris di kawasan Pecinan (Kampung Cina / Chinatown) di Semarang. Bangunan rumah makan dan interiornya berlihat sudah “kuno”, begitu juga sajian menunya yg klasik dipasang di tembok tempat makan ini. Terbilang harganya tidak murah untuk ukuran Semarang pada umumnya.

Tempat ini menyajikan menu khas Semarang seperti Garang Asam atau Kuah Asam non halal. Patut dicoba saat berkunjung ke Semarang."
"Warung Makan Asem-Asem Koh Liem","https://www.google.com/maps/search/?api=1&query=Warung%20Makan%20Asem-Asem%20Koh%20Liem&query_place_id=ChIJWx7SjNL0cC4RmhXwXxTnmUs","4","Sophia Yoo","https://www.google.com/maps/reviews/data=!4m8!14m7!1m6!2m5!1sChdDSUhNMG9nS0VJQ0FnSUNCbzliNHR3RRAB!2m1!1s0x0:0x4b99e7145ff0159a!3m1!1s2@1:CIHM0ogKEICAgICBo9b4twE%7CCgwItbbPnQYQ6JfYygI%7C?hl=id","Enak, pelayanan cepat, banyak pegawai, cekatan, cuma agak khawatir dengan kebersihan makanan matang yg terbuka."
"Warung Makan Asem-Asem Koh Liem","https://www.google.com/maps/search/?api=1&query=Warung%20Makan%20Asem-Asem%20Koh%20Liem&query_place_id=ChIJWx7SjNL0cC4RmhXwXxTnmUs","4","dedi r","https://www.google.com/maps/reviews/data=!4m8!14m7!1m6!2m5!1sChdDSUhNMG9nS0VJQ0FnSUNodVktMnRBRRAB!2m1!1s0x0:0x4b99e7145ff0159a!3m1!1s2@1:CIHM0ogKEICAgIChuY-2tAE%7CCgwI-ey8nwYQ-I6dlAI%7C?hl=id","Yang istimewa asem-asem dagingnya. Kuah kaldu light, asam tomat+belimbing wuluh. Daging tebal-tebal. Tidak alot namun tak bisa dibilang lembut dagingnya.
Suasananya ramai. Tak bisa berlama-lama. Parkiran cuma bisa 3 mobil.
Semangkok asem-asem daging, nasi setengah dan teh tawar hangat dibandrol Rp 58.000."
"Warung Makan Asem-Asem Koh Liem","https://www.google.com/maps/search/?api=1&query=Warung%20Makan%20Asem-Asem%20Koh%20Liem&query_place_id=ChIJWx7SjNL0cC4RmhXwXxTnmUs","4","Justina WS","https://www.google.com/maps/reviews/data=!4m8!14m7!1m6!2m5!1sChZDSUhNMG9nS0VJQ0FnSURJek9la05BEAE!2m1!1s0x0:0x4b99e7145ff0159a!3m1!1s2@1:CIHM0ogKEICAgIDIzOekNA%7CCgwIpKmG4QUQ4ertjAI%7C?hl=id","Warung makan masakan indonesia, variasi makanan sangat banyak. Tersedia aneka lauk, bisa pilih-pilih sendiri sesuai selera kita. Ramai khususnya di jam-jam makan. Rasanya enak. Pelayanan cepat."
"Warung Makan Asem-Asem Koh Liem","https://www.google.com/maps/search/?api=1&query=Warung%20Makan%20Asem-Asem%20Koh%20Liem&query_place_id=ChIJWx7SjNL0cC4RmhXwXxTnmUs","4","Alvin C F","https://www.google.com/maps/reviews/data=!4m8!14m7!1m6!2m5!1sChdDSUhNMG9nS0VJQ0FnSURVaU1IY3VnRRAB!2m1!1s0x0:0x4b99e7145ff0159a!3m1!1s2@1:CIHM0ogKEICAgIDUiMHcugE%7CCgwIht7E6gUQgM7HsAE%7C?hl=id","Tempat sebrang sma loyola
Dekat dengan leker paimo dan mudah ditemukan
Pelayanannya ramah menjelaskan dengan detail untuk model masakannya
Varian makanan banyak
Mulai dari mengandung babi dan tidak.
Spesial menu yaitu asem-asem,kikil dan babi kecap. Tersedia juga minuman winter melon tea.
Rasanya menurut ku lumayan enak, namun harga nya mahal."
"Warung Makan Asem-Asem Koh Liem","https://www.google.com/maps/search/?api=1&query=Warung%20Makan%20Asem-Asem%20Koh%20Liem&query_place_id=ChIJWx7SjNL0cC4RmhXwXxTnmUs","4","Veronica H","https://www.google.com/maps/reviews/data=!4m8!14m7!1m6!2m5!1sChZDSUhNMG9nS0VJQ0FnSURNM09xYlhREAE!2m1!1s0x0:0x4b99e7145ff0159a!3m1!1s2@1:CIHM0ogKEICAgIDM3OqbXQ%7CCgwIjtn27wUQ8J_YhQM%7C?hl=id","Menu populer dari warung makan ini adalah Asem2 nya. Sebagian besar orang yang datang ke sini mencoba menu tsb. Beberapa menu lainnya yg kami coba adalah sosis & telor, sate babi, kekian goreng, dan bakwan jagung.
Menurut saya pribadi asem2nya enak tapi not the best. Sate babi dan sosisnya juga enak. Favorit saya adalah kekian gorengnya.
Biasanya yg jadi tantangan adalah parkirnya, karena area parkir di pinggir jalan, dan sebagian bangunan di area tsb memberi larangan parkir di depan bangunan mereka.
Selain itu suasana warung makan yg panas. Sehingga kita selesai makan maunya cepat2 keluar 😅
Harga makanan lumayan mahal, terutama asem2nya. Nasi asem2 dibandrol 24rb padahal isinya hanya sedikit daging 🤣
Untuk sosis+telor 30rb, kekian 13rb, sate babi 10rb/tusuk.
Overall makanan lumayan rasanya."
"Warung Makan Asem-Asem Koh Liem","https://www.google.com/maps/search/?api=1&query=Warung%20Makan%20Asem-Asem%20Koh%20Liem&query_place_id=ChIJWx7SjNL0cC4RmhXwXxTnmUs","4","Michelle Purwagani","https://www.google.com/maps/reviews/data=!4m8!14m7!1m6!2m5!1sChZDSUhNMG9nS0VJQ0FnSUN3LTlISGFnEAE!2m1!1s0x0:0x4b99e7145ff0159a!3m1!1s2@1:CIHM0ogKEICAgICw-9HHag%7CCgwIxtnJzQUQwIv2ggI%7C?hl=id","Asem2 Daging dihargai 30.000 per porsi.
Dagingnya banyak, kuahnya manis.
Saya beri bintang 4 krn enak, tp kurang begitu spesial.
Kalau mau ke sini sebaiknya pagi/siang.
Klo sore, biasanya sdh habis."
"Warung Makan Asem-Asem Koh Liem","https://www.google.com/maps/search/?api=1&query=Warung%20Makan%20Asem-Asem%20Koh%20Liem&query_place_id=ChIJWx7SjNL0cC4RmhXwXxTnmUs","4","Sylvia Rhodia","https://www.google.com/maps/reviews/data=!4m8!14m7!1m6!2m5!1sChdDSUhNMG9nS0VJQ0FnSUMwZ29uTHFBRRAB!2m1!1s0x0:0x4b99e7145ff0159a!3m1!1s2@1:CIHM0ogKEICAgIC0gonLqAE%7CCgwIyOmN7AUQyPCzzAE%7C?hl=id","Asem asemnya memang enak, cukup pedas juga. Masakan peranakan dengan gaya warteg.  Banyak jajanan juga. Saya juga coba sate babinya, enak. Susah parkir."
"Warung Makan Asem-Asem Koh Liem","https://www.google.com/maps/search/?api=1&query=Warung%20Makan%20Asem-Asem%20Koh%20Liem&query_place_id=ChIJWx7SjNL0cC4RmhXwXxTnmUs","4","Lia Jap","https://www.google.com/maps/reviews/data=!4m8!14m7!1m6!2m5!1sChZDSUhNMG9nS0VJQ0FnSURBc3F6SmNREAE!2m1!1s0x0:0x4b99e7145ff0159a!3m1!1s2@1:CIHM0ogKEICAgIDAsqzJcQ%7CCgsI3YSq2wUQwI3Aew%7C?hl=id","Asem - asem sapi yg luar biasa segar dan enak.
Rasanya asem pedes, favoritku banget.
Kalo lagi one day trip dari Jakarta, tempat ini adalah destinasi pertama aku.
Pelayanannya ramah dan cepat.
Letaknya di gang besar atau kompleks perumahan dekat sebuah sekolahan, lupa nama sekolahnya.
Aku naik ojol kesini.
Bahkan aku bungkus loh utk dibawa ke Jakarta, sampai di Jakarta keesokan paginya tinggal dipanaskan.
Pembayarannya hanya menerima cash, cmiiw."
"Warung Makan Asem-Asem Koh Liem","https://www.google.com/maps/search/?api=1&query=Warung%20Makan%20Asem-Asem%20Koh%20Liem&query_place_id=ChIJWx7SjNL0cC4RmhXwXxTnmUs","4","Aris Dharmawan","https://www.google.com/maps/reviews/data=!4m8!14m7!1m6!2m5!1sChZDSUhNMG9nS0VJQ0FnSUNvbE5EN2RBEAE!2m1!1s0x0:0x4b99e7145ff0159a!3m1!1s2@1:CIHM0ogKEICAgIColND7dA%7CCgwI34vq4gUQ_MaqrAM%7C?hl=id","Warteg gaya cina peranakan, kurang lebih begitulah analoginya.

Berawal dari jualan Asem-asem daging dan Bandeng Sarden (Ikan Bandeng Presto dimasak mirip Sardin Kaleng) di tahun 1978 kini menjelma menjadi restoran siap saji yang menyajikan puluhan jenis makanan, restoran ini menempati bangunan permanen restoran yang selalu ramai pada saat jam makan siang persis diseberang Sekolah Swasta terkenal di Semarang.

Rekomendasi lain, Cumi goreng mentega, Oseng Koyor Cabe Ijo, Udang Goreng Mentega, Dadar Olor (sumsum sapi), Ikan Blanak Goreng dll.

Yang unik, kita boleh saja memesan makanan masing2 1/2 porsi saja."
"Warung Makan Asem-Asem Koh Liem","https://www.google.com/maps/search/?api=1&query=Warung%20Makan%20Asem-Asem%20Koh%20Liem&query_place_id=ChIJWx7SjNL0cC4RmhXwXxTnmUs","4","Tikno","https://www.google.com/maps/reviews/data=!4m8!14m7!1m6!2m5!1sChZDSUhNMG9nS0VJQ0FnSURBNHZmTEFnEAE!2m1!1s0x0:0x4b99e7145ff0159a!3m1!1s2@1:CIHM0ogKEICAgIDA4vfLAg%7CCgwI_fmbzAUQwPLj7AI%7C?hl=id","Dari tampak luar bangunan ruko, dengan parkiran yg cukup padat, tapi begi masuk dalam, berasa seperti warteg, susunan meja dan kursinya seperti di foto.
Tapi makanan mantap, terutama asam asam Koh Liem (makanan khas Semarang yg mirip2 sayur ayam tapi isinya ditambah daging sapi yg bener2 enakkk), dan jangan ketinggalan sate b2 nya. :D"
"Warung Makan Asem-Asem Koh Liem","https://www.google.com/maps/search/?api=1&query=Warung%20Makan%20Asem-Asem%20Koh%20Liem&query_place_id=ChIJWx7SjNL0cC4RmhXwXxTnmUs","4","Andrew Lie","https://www.google.com/maps/reviews/data=!4m8!14m7!1m6!2m5!1sChdDSUhNMG9nS0VJQ0FnSUR5LXAtaDhBRRAB!2m1!1s0x0:0x4b99e7145ff0159a!3m1!1s2@1:CIHM0ogKEICAgIDy-p-h8AE%7CCgsI8o6GggYQ8PTmbw%7C?hl=id","Enak2 masakannya, tempat bersih dan ckup luas. Saya pesan nasi campur dan pete udang kecapnya, mantaabss tastenya 👍🏼"
"Warung Makan Asem-Asem Koh Liem","https://www.google.com/maps/search/?api=1&query=Warung%20Makan%20Asem-Asem%20Koh%20Liem&query_place_id=ChIJWx7SjNL0cC4RmhXwXxTnmUs","4","jyndraya","https://www.google.com/maps/reviews/data=!4m8!14m7!1m6!2m5!1sCi9DQUlRQUNvZENodHljRjlvT25oclpWSmtZMnB2UmtVNFpVOWpZMFZFUTAxM1IyYxAB!2m1!1s0x0:0x4b99e7145ff0159a!3m1!1s2@1:CAIQACodChtycF9oOnhrZVJkY2pvRkU4ZU9jY0VEQ013R2c%7C0cTAngRXZ1u%7C?hl=id","Asem2 nya enak, cumi goreng mentega jg enak, yg lain gak tau enak atau gak, parkiran agak susah untuk gak begitu ramai 👍🏼"
"Warung Makan Asem-Asem Koh Liem","https://www.google.com/maps/search/?api=1&query=Warung%20Makan%20Asem-Asem%20Koh%20Liem&query_place_id=ChIJWx7SjNL0cC4RmhXwXxTnmUs","4","Sanda Purata","https://www.google.com/maps/reviews/data=!4m8!14m7!1m6!2m5!1sChdDSUhNMG9nS0VJQ0FnSUN3NXJXMDBnRRAB!2m1!1s0x0:0x4b99e7145ff0159a!3m1!1s2@1:CIHM0ogKEICAgICw5rW00gE%7CCgwI3tSR1gUQwOvF2AM%7C?hl=id","Baru pertama kali kesini dan ternyata enaak bangeet ,, kalian harus nyobain asem asem semarang koh liem .. Enak dijamin nagih deket dengan leker paimo pula nahh .. Biasa untuk makan siang para pekerja dan anak sekolah juga nih .. Harganya pun standar ya wajar untuk harga kota .. Wkwkkww"
"Warung Makan Asem-Asem Koh Liem","https://www.google.com/maps/search/?api=1&query=Warung%20Makan%20Asem-Asem%20Koh%20Liem&query_place_id=ChIJWx7SjNL0cC4RmhXwXxTnmUs","4","Vania Hugeng","https://www.google.com/maps/reviews/data=!4m8!14m7!1m6!2m5!1sChdDSUhNMG9nS0VJQ0FnSUNHX3QzUXh3RRAB!2m1!1s0x0:0x4b99e7145ff0159a!3m1!1s2@1:CIHM0ogKEICAgICG_t3QxwE%7CCgwI2IL4iwYQsMrO0wI%7C?hl=id","Pilihan menu nya cukup banyak dan menarik2..pertama kali mampir kesini nyobain salah satu menu mereka yang terkenal banget yaitu asem2 daging nya..kuah nya seger dan nikmat banget dimakan pakai nasi putih anget2..daging nya juga empuk cuma pas makan kemarin lumayan banyak dapet lemak..harga nya agak mahal 40rb an..boleh dicoba kalo ke semarang.."
"Warung Makan Asem-Asem Koh Liem","https://www.google.com/maps/search/?api=1&query=Warung%20Makan%20Asem-Asem%20Koh%20Liem&query_place_id=ChIJWx7SjNL0cC4RmhXwXxTnmUs","4","Novie Yanti","https://www.google.com/maps/reviews/data=!4m8!14m7!1m6!2m5!1sChdDSUhNMG9nS0VJQ0FnSURJMGEyZHhBRRAB!2m1!1s0x0:0x4b99e7145ff0159a!3m1!1s2@1:CIHM0ogKEICAgIDI0a2dxAE%7CCgwI3ZvX4QUQwsmwkQM%7C?hl=id","warung asem asem koh liem ini cukup mudah ditemukan.. buka mulai dari jam 7 pagi.. kebetulan saat datang pagi hari sehingga tidak begitu ramai.. ada banyak pilihan menu makanan dan menyediakan makanan non halal.."
"Warung Makan Asem-Asem Koh Liem","https://www.google.com/maps/search/?api=1&query=Warung%20Makan%20Asem-Asem%20Koh%20Liem&query_place_id=ChIJWx7SjNL0cC4RmhXwXxTnmUs","4","Agnes YT","https://www.google.com/maps/reviews/data=!4m8!14m7!1m6!2m5!1sChZDSUhNMG9nS0VJQ0FnSUNwdG9IRU93EAE!2m1!1s0x0:0x4b99e7145ff0159a!3m1!1s2@1:CIHM0ogKEICAgICptoHEOw%7CCgwI67aupgYQsOrh1wI%7C?hl=id","Nasi asem-asem rasanya kuahnya agak manis, dagingnya banyak, enak sih. Ada makanan prasmanannya. Setting tempatnya mirip warteg-an."
"Warung Makan Asem-Asem Koh Liem","https://www.google.com/maps/search/?api=1&query=Warung%20Makan%20Asem-Asem%20Koh%20Liem&query_place_id=ChIJWx7SjNL0cC4RmhXwXxTnmUs","4","Natalia Liezar","https://www.google.com/maps/reviews/data=!4m8!14m7!1m6!2m5!1sChZDSUhNMG9nS0VJQ0FnSURaOHNfTFFnEAE!2m1!1s0x0:0x4b99e7145ff0159a!3m1!1s2@1:CIHM0ogKEICAgIDZ8s_LQg%7CCgwIyfLUqAYQ2KPkvAI%7C?hl=id","Asem Asem-nya enakkk cuma daging nya agak keras. Overall OK sii....tmptnya rame and panasss. Sebuah memory makan disini."
"Warung Makan Asem-Asem Koh Liem","https://www.google.com/maps/search/?api=1&query=Warung%20Makan%20Asem-Asem%20Koh%20Liem&query_place_id=ChIJWx7SjNL0cC4RmhXwXxTnmUs","4","Austin Reggy","https://www.google.com/maps/reviews/data=!4m8!14m7!1m6!2m5!1sChdDSUhNMG9nS0VJQ0FnSUNLd2VlRzF3RRAB!2m1!1s0x0:0x4b99e7145ff0159a!3m1!1s2@1:CIHM0ogKEICAgICKweeG1wE%7CCgwIs7a5gwYQ8JnRiwI%7C?hl=id","Uenak iki mantap djiwa, its good its like an Chinese Java food many food inside so many like cantik manis, sweet fried chicken, pepes,rempeyek, seafood,pork, tempe,tahu isi, bakwan jagung, lumpia many more, recommended at semarang"
"Warung Makan Asem-Asem Koh Liem","https://www.google.com/maps/search/?api=1&query=Warung%20Makan%20Asem-Asem%20Koh%20Liem&query_place_id=ChIJWx7SjNL0cC4RmhXwXxTnmUs","4","H Hengki","https://www.google.com/maps/reviews/data=!4m8!14m7!1m6!2m5!1sChZDSUhNMG9nS0VJQ0FnSUNnb2E2ZUh3EAE!2m1!1s0x0:0x4b99e7145ff0159a!3m1!1s2@1:CIHM0ogKEICAgICgoa6eHw%7CCgwI7unJ3AUQwLK66AE%7C?hl=id","Salah satu tempat makanan legendaris dan khas di semarang.
Penasaran apa itu asem2..?? Asem2 tuh masakan yang seperti rawon tapi rada asem, ato seperti pindang gitulah rasanya."
"Warung Makan Asem-Asem Koh Liem","https://www.google.com/maps/search/?api=1&query=Warung%20Makan%20Asem-Asem%20Koh%20Liem&query_place_id=ChIJWx7SjNL0cC4RmhXwXxTnmUs","4","Steven Xlalu","https://www.google.com/maps/reviews/data=!4m8!14m7!1m6!2m5!1sChZDSUhNMG9nS0VJQ0FnSUNCeVl6a1hBEAE!2m1!1s0x0:0x4b99e7145ff0159a!3m1!1s2@1:CIHM0ogKEICAgICByYzkXA%7CCgwIxO6znQYQqNin6wE%7C?hl=id","Tempat makan chinesefood jadul yang menyajikan berbagai macam menu tp karena yg terkenalnya asem2 ya kita coba, okelah rasa enak dan seger"
"Warung Makan Asem-Asem Koh Liem","https://www.google.com/maps/search/?api=1&query=Warung%20Makan%20Asem-Asem%20Koh%20Liem&query_place_id=ChIJWx7SjNL0cC4RmhXwXxTnmUs","4","Eddy Setyawan","https://www.google.com/maps/reviews/data=!4m8!14m7!1m6!2m5!1sChdDSUhNMG9nS0VJQ0FnSUR3bkxYc3JBRRAB!2m1!1s0x0:0x4b99e7145ff0159a!3m1!1s2@1:CIHM0ogKEICAgIDwnLXsrAE%7CCgwI7KbK3gUQ6In6yQM%7C?hl=id","LEGENDA ASEM - ASEM KOH LIEM SEMARANG

Berdiri sejak 1978, yang terkenal ya asem - asem dagingnya ! Benar - benar mak nyuss !! Pelanggan pesohor antara lain : Mbak Mega, Cahyo Kumolo, Vicky Notonegoro, Rano Karno dan Ahok ! Mbak Mega suka dengan peyek jumbo nya ! Pak Cahyo Kumolo selalu makan Belanak Goreng kalau ke sini !
Harga transparan dan masuk akal"
"Warung Makan Asem-Asem Koh Liem","https://www.google.com/maps/search/?api=1&query=Warung%20Makan%20Asem-Asem%20Koh%20Liem&query_place_id=ChIJWx7SjNL0cC4RmhXwXxTnmUs","4","Budi GilaKopi","https://www.google.com/maps/reviews/data=!4m8!14m7!1m6!2m5!1sChdDSUhNMG9nS0VJQ0FnSUN5djkzZV9RRRAB!2m1!1s0x0:0x4b99e7145ff0159a!3m1!1s2@1:CIHM0ogKEICAgICyv93e_QE%7CCgwIwcy9gQYQqIDMnQM%7C?hl=id","Rasa khas Asem-Asem Koh Liem sejak 1978 memang bikin kangen.
Sempatkan ke sini kalau di kota Semarang.
Sosis babinya juga mantap.
Tersedia toilet di belakang."
"Warung Makan Asem-Asem Koh Liem","https://www.google.com/maps/search/?api=1&query=Warung%20Makan%20Asem-Asem%20Koh%20Liem&query_place_id=ChIJWx7SjNL0cC4RmhXwXxTnmUs","4","Tri Armalia","https://www.google.com/maps/reviews/data=!4m8!14m7!1m6!2m5!1sChdDSUhNMG9nS0VJQ0FnSUN5cS1XbHFRRRAB!2m1!1s0x0:0x4b99e7145ff0159a!3m1!1s2@1:CIHM0ogKEICAgICyq-WlqQE%7CCgwIpo2fgQYQgJ-C6AE%7C?hl=id","Ke sini selalu pesennya asem2 daging. Dari kecil dulu udah suka dengan cumi nya. Juara. Pilihan sayur nya juga enak. Tumis oyong nya sedap. cuma harganya a bit pricey"
"Warung Makan Asem-Asem Koh Liem","https://www.google.com/maps/search/?api=1&query=Warung%20Makan%20Asem-Asem%20Koh%20Liem&query_place_id=ChIJWx7SjNL0cC4RmhXwXxTnmUs","4","Yohanes Tommy Rusmandani","https://www.google.com/maps/reviews/data=!4m8!14m7!1m6!2m5!1sChdDSUhNMG9nS0VJQ0FnSURwOGUyLW93RRAB!2m1!1s0x0:0x4b99e7145ff0159a!3m1!1s2@1:CIHM0ogKEICAgIDp8e2-owE%7CCgwIyvebpwYQgOmo4QE%7C?hl=id","Untuk daging agak lembut dan kikil nya agak keras. Dan saya agak kecewa dengan kasir yang lelet. Tolong kedepannya di perbaiki. Terimakasih 🙂 🙏🏻"
"Warung Makan Asem-Asem Koh Liem","https://www.google.com/maps/search/?api=1&query=Warung%20Makan%20Asem-Asem%20Koh%20Liem&query_place_id=ChIJWx7SjNL0cC4RmhXwXxTnmUs","4","Anita Witanto","https://www.google.com/maps/reviews/data=!4m8!14m7!1m6!2m5!1sChdDSUhNMG9nS0VJQ0FnSUNBcElhVHd3RRAB!2m1!1s0x0:0x4b99e7145ff0159a!3m1!1s2@1:CIHM0ogKEICAgICApIaTwwE%7CCgsIw9OP3gUQiJvhXg%7C?hl=id","Makanan enak,pelayanan cepat.harga sebanding, hanya utk kulit goreng kemahalan, 1 plastik 25rb."
"Warung Makan Asem-Asem Koh Liem","https://www.google.com/maps/search/?api=1&query=Warung%20Makan%20Asem-Asem%20Koh%20Liem&query_place_id=ChIJWx7SjNL0cC4RmhXwXxTnmUs","4","Pepen Wicaksono","https://www.google.com/maps/reviews/data=!4m8!14m7!1m6!2m5!1sChdDSUhNMG9nS0VJQ0FnSUNzeDl5SnVnRRAB!2m1!1s0x0:0x4b99e7145ff0159a!3m1!1s2@1:CIHM0ogKEICAgICsx9yJugE%7CCgwIlZ2k8gUQ4Jqj2gE%7C?hl=id","Pertama kali berkunjung kesini karna tertarik dg menu asem-asem daging'nya. Kuah'nya segar, kecut plus ditambahkan sambal 👍"
"Warung Makan Asem-Asem Koh Liem","https://www.google.com/maps/search/?api=1&query=Warung%20Makan%20Asem-Asem%20Koh%20Liem&query_place_id=ChIJWx7SjNL0cC4RmhXwXxTnmUs","4","Nicholas","https://www.google.com/maps/reviews/data=!4m8!14m7!1m6!2m5!1sChdDSUhNMG9nS0VJQ0FnSURNLWVEaGtnRRAB!2m1!1s0x0:0x4b99e7145ff0159a!3m1!1s2@1:CIHM0ogKEICAgIDM-eDhkgE%7CCgwIqMfF8AUQoIiAxQE%7C?hl=id","Banyak pilihan menu disini, rasa kuah segar cuman agak kemanisan menurut saya, daging empuk, dan banyak camilan khas lokal disana"
"Warung Makan Asem-Asem Koh Liem","https://www.google.com/maps/search/?api=1&query=Warung%20Makan%20Asem-Asem%20Koh%20Liem&query_place_id=ChIJWx7SjNL0cC4RmhXwXxTnmUs","4","Eleonora Aprilita","https://www.google.com/maps/reviews/data=!4m8!14m7!1m6!2m5!1sChdDSUhNMG9nS0VJQ0FnSURVOE5XUjZBRRAB!2m1!1s0x0:0x4b99e7145ff0159a!3m1!1s2@1:CIHM0ogKEICAgIDU8NWR6AE%7CCgwIxszD6gUQ0JyTjgI%7C?hl=id","Wajib nih kalau ke semarang. Enak, aapalagi peyek udang dan kekiannya nya. Uenakkkkkk"
"Warung Makan Asem-Asem Koh Liem","https://www.google.com/maps/search/?api=1&query=Warung%20Makan%20Asem-Asem%20Koh%20Liem&query_place_id=ChIJWx7SjNL0cC4RmhXwXxTnmUs","4","Pieter Candra","https://www.google.com/maps/reviews/data=!4m8!14m7!1m6!2m5!1sChdDSUhNMG9nS0VJQ0FnSUNIZ19MSDhnRRAB!2m1!1s0x0:0x4b99e7145ff0159a!3m1!1s2@1:CIHM0ogKEICAgICHg_LH8gE%7CCgwIotL0tgYQ6LCqnwI%7C?hl=id","Tempat luas, parkir yg cukup sulit karena ada parkir untuk sekolahan loyola juga. Makanan enak, terkenal di semarang. Servis nya ramah. Atmosphere nya dari dulu sampai sekarang cozy meskipun rame. Harga normal untuk makanannya.. Mantab 👍"
"Warung Makan Asem-Asem Koh Liem","https://www.google.com/maps/search/?api=1&query=Warung%20Makan%20Asem-Asem%20Koh%20Liem&query_place_id=ChIJWx7SjNL0cC4RmhXwXxTnmUs","4","Budi Joe","https://www.google.com/maps/reviews/data=!4m8!14m7!1m6!2m5!1sChdDSUhNMG9nS0VJQ0FnSURTN2R1RG1nRRAB!2m1!1s0x0:0x4b99e7145ff0159a!3m1!1s2@1:CIHM0ogKEICAgIDS7duDmgE%7CCgsI4IjR_wUQqKXuXA%7C?hl=id","Kuah asem²nya unik, enak bagi yang suka, aneh bagi yang ga suka hihihi....
Menu parasmanan nya banyak pilihan"
"Warung Makan Asem-Asem Koh Liem","https://www.google.com/maps/search/?api=1&query=Warung%20Makan%20Asem-Asem%20Koh%20Liem&query_place_id=ChIJWx7SjNL0cC4RmhXwXxTnmUs","4","Bennadi Adiandrian","https://www.google.com/maps/reviews/data=!4m8!14m7!1m6!2m5!1sChZDSUhNMG9nS0VJQ0FnSURrdnFDYmFREAE!2m1!1s0x0:0x4b99e7145ff0159a!3m1!1s2@1:CIHM0ogKEICAgIDkvqCbaQ%7CCgwIxsjO6AUQuOCLigI%7C?hl=id","Lumayan enak. Ramai banget. Penuh di siang hari..terutama jam istirahat.. Harga masih reasonable"
"Warung Makan Asem-Asem Koh Liem","https://www.google.com/maps/search/?api=1&query=Warung%20Makan%20Asem-Asem%20Koh%20Liem&query_place_id=ChIJWx7SjNL0cC4RmhXwXxTnmUs","4","Pak Teguh Gun","https://www.google.com/maps/reviews/data=!4m8!14m7!1m6!2m5!1sChZDSUhNMG9nS0VJQ0FnSUNKNkwzNkFnEAE!2m1!1s0x0:0x4b99e7145ff0159a!3m1!1s2@1:CIHM0ogKEICAgICJ6L36Ag%7CCgwIr47FpAYQgMSGqAI%7C?hl=id","Tersedia aneka menu masakan, pilihan menu sesuai selera
Rasa begitu mantap
Harga menengah"
"Warung Makan Asem-Asem Koh Liem","https://www.google.com/maps/search/?api=1&query=Warung%20Makan%20Asem-Asem%20Koh%20Liem&query_place_id=ChIJWx7SjNL0cC4RmhXwXxTnmUs","4","Christanty K","https://www.google.com/maps/reviews/data=!4m8!14m7!1m6!2m5!1sChZDSUhNMG9nS0VJQ0FnSURndy1PRk5BEAE!2m1!1s0x0:0x4b99e7145ff0159a!3m1!1s2@1:CIHM0ogKEICAgIDgw-OFNA%7CCgwIrKfB3AUQyPH1ogM%7C?hl=id","Enak asem - asemnya rada manis khas makanan Jateng plus dagingnya banyak dan besar2. Tempatnya juga lumayan luas dengan tampilan ala tempo dulu"
"Warung Makan Asem-Asem Koh Liem","https://www.google.com/maps/search/?api=1&query=Warung%20Makan%20Asem-Asem%20Koh%20Liem&query_place_id=ChIJWx7SjNL0cC4RmhXwXxTnmUs","4","bimo dwiyanto","https://www.google.com/maps/reviews/data=!4m8!14m7!1m6!2m5!1sChdDSUhNMG9nS0VJQ0FnSUNveS0tNF9BRRAB!2m1!1s0x0:0x4b99e7145ff0159a!3m1!1s2@1:CIHM0ogKEICAgICoy--4_AE%7CCgsIk_nh4wUQ2IbNPw%7C?hl=id","Masakan chinese food yang di gabungkan masakan lokal .rasanya enak range harga 5rb -50rb . Ada produk halal dan non halal"
"Warung Makan Asem-Asem Koh Liem","https://www.google.com/maps/search/?api=1&query=Warung%20Makan%20Asem-Asem%20Koh%20Liem&query_place_id=ChIJWx7SjNL0cC4RmhXwXxTnmUs","4","Maria Roswita","https://www.google.com/maps/reviews/data=!4m8!14m7!1m6!2m5!1sChdDSUhNMG9nS0VJQ0FnSURJaTV5UXZBRRAB!2m1!1s0x0:0x4b99e7145ff0159a!3m1!1s2@1:CIHM0ogKEICAgIDIi5yQvAE%7CCgwI0IKb4gUQtYOZxwI%7C?hl=id","Asem-asem dagingnya enak banget. Cumi-cumi juga enak. Pokoknya semua enakk. Sewajarnya dengan harga seperti itu hehe. Bakwan dan tahu baksonya aja enakk."
"Warung Makan Asem-Asem Koh Liem","https://www.google.com/maps/search/?api=1&query=Warung%20Makan%20Asem-Asem%20Koh%20Liem&query_place_id=ChIJWx7SjNL0cC4RmhXwXxTnmUs","4","Fadlillah Ariani Suroso","https://www.google.com/maps/reviews/data=!4m8!14m7!1m6!2m5!1sChZDSUhNMG9nS0VJQ0FnSUMtaTZfOVhBEAE!2m1!1s0x0:0x4b99e7145ff0159a!3m1!1s2@1:CIHM0ogKEICAgIC-i6_9XA%7CCgsIg_rDmwYQqNCsDA%7C?hl=id","Ada namanya olor jadi dia telor dadar dicampur dengan sum sum."
"Warung Makan Asem-Asem Koh Liem","https://www.google.com/maps/search/?api=1&query=Warung%20Makan%20Asem-Asem%20Koh%20Liem&query_place_id=ChIJWx7SjNL0cC4RmhXwXxTnmUs","4","Febry Anto","https://www.google.com/maps/reviews/data=!4m8!14m7!1m6!2m5!1sChdDSUhNMG9nS0VJQ0FnSURJaHREY3J3RRAB!2m1!1s0x0:0x4b99e7145ff0159a!3m1!1s2@1:CIHM0ogKEICAgIDIhtDcrwE%7CCgwIr5Gx4QUQ8YHRzAE%7C?hl=id","Makanannya enak, menunya banyak. Tp parkir mobilnya agak susah. Menu rekomendasinya adalah Asem Asem-nya."
"Warung Makan Asem-Asem Koh Liem","https://www.google.com/maps/search/?api=1&query=Warung%20Makan%20Asem-Asem%20Koh%20Liem&query_place_id=ChIJWx7SjNL0cC4RmhXwXxTnmUs","4","Susan Simagala","https://www.google.com/maps/reviews/data=!4m8!14m7!1m6!2m5!1sChZDSUhNMG9nS0VJQ0FnSUNMdnFHNU1REAE!2m1!1s0x0:0x4b99e7145ff0159a!3m1!1s2@1:CIHM0ogKEICAgICLvqG5MQ%7CCgwIi4DMswYQiJDZ0QE%7C?hl=id","Banyak menu nya, fav nya asem2 koyor ..."
