"title","url","stars","name","reviewUrl","text"
"Pesta Keboen Restoran","https://www.google.com/maps/search/?api=1&query=Pesta%20Keboen%20Restoran&query_place_id=ChIJQ2Mc7meLcC4RXm4PJgP1pZA","5","Bernard Ferdinand","https://www.google.com/maps/reviews/data=!4m8!14m7!1m6!2m5!1sCi9DQUlRQUNvZENodHljRjlvT2tjdFNqZGFWREJZWVVWclRqaGtaMDlFYkUxamRrRRAB!2m1!1s0x0:0x90a5f503260f6e5e!3m1!1s2@1:CAIQACodChtycF9oOkctSjdaVDBYYUVrTjhkZ09EbE1jdkE%7C0dHJUDCxOnb%7C?hl=id","Restoran dengan suasana serba tempo doeloe.
Makanan dan minumannya enak‐enak.
Tempatnya di dalam luas banget ternyata.
Pelayanannya juga baik dan ramah."
"Pesta Keboen Restoran","https://www.google.com/maps/search/?api=1&query=Pesta%20Keboen%20Restoran&query_place_id=ChIJQ2Mc7meLcC4RXm4PJgP1pZA","5","Ririt RB","https://www.google.com/maps/reviews/data=!4m8!14m7!1m6!2m5!1sCi9DQUlRQUNvZENodHljRjlvT2pCMVUxbFhkSFJ5VDIxTVpVeFdPRUpzUlhKV09WRRAB!2m1!1s0x0:0x90a5f503260f6e5e!3m1!1s2@1:CAIQACodChtycF9oOjB1U1lXdHRyT21MZUxWOEJsRXJWOVE%7C0cZ9Cbn9eoj%7C?hl=id","Fancy Resto yang sangat cantik , estetik , nyaman dg nuansa Herritage yang mewah .
Banyak spot foto yg sangat cantik buat yang hobi foto. Suasananya sangat nyaman dan tenang .
Sesuai dg nama restonya pesta Keboen , mmg pantas untuk dijadikan tempat untuk event2 spt ultah , nikahan , kumpul keluarga dan temen2 dg nuansa garden party .

Beberapa perabot dan hiasan menambah nuansa vintage di resto ini . Dijamin betah 😍🥹❤️
Untuk makanan enak2 semua standar hotel berbintang .
Staff ramah2 .

Very Recommended ❤️"
"Pesta Keboen Restoran","https://www.google.com/maps/search/?api=1&query=Pesta%20Keboen%20Restoran&query_place_id=ChIJQ2Mc7meLcC4RXm4PJgP1pZA","5","Muhammad Alief","https://www.google.com/maps/reviews/data=!4m8!14m7!1m6!2m5!1sCi9DQUlRQUNvZENodHljRjlvT2xoMFprUXdkemgwTUVocVVWWmhMVVYyT0hCSFFtYxAB!2m1!1s0x0:0x90a5f503260f6e5e!3m1!1s2@1:CAIQACodChtycF9oOlh0ZkQwdzh0MEhqUVZhLUV2OHBHQmc%7C0c_Luie3FuY%7C?hl=id","Pesta Keboen adalah salah satu restoran yang menarik dan penuh vibes nostalgia. Begitu masuk, mata langsung dimanjakan dengan berbagai pernak-pernik jadul: ada koleksi kaset, setrika antik, poster-poster lawas, dan yang paling unik—seorang bapak-bapak sedang mengamen menggunakan siter, alat musik tradisional yang jarang ditemui.

Untuk urusan makanan dan minuman, semuanya memuaskan. Kemarin saya sempat memesan es teler—rasanya enak banget, segar dan pas manisnya. Ayam gorengnya juga lezat, hanya saja sambalnya terasa kurang banyak, hehe.

Pelayanan dari para waitress pun ramah dan sopan. Saya datang saat jam makan siang, suasana cukup ramai, tapi tetap nyaman. Satu hal yang perlu diperhatikan mungkin adalah area parkir yang kurang memadai.

Secara keseluruhan, Pesta Keboen adalah tempat makan yang bukan hanya memanjakan lidah, tapi juga membawa kita bernostalgia lewat suasananya."
"Pesta Keboen Restoran","https://www.google.com/maps/search/?api=1&query=Pesta%20Keboen%20Restoran&query_place_id=ChIJQ2Mc7meLcC4RXm4PJgP1pZA","5","Sarjana Hukum","https://www.google.com/maps/reviews/data=!4m8!14m7!1m6!2m5!1sCi9DQUlRQUNvZENodHljRjlvT2kxVWVIRXpXalY1YVRKT2MyZEtTMVptVTBkV1RIYxAB!2m1!1s0x0:0x90a5f503260f6e5e!3m1!1s2@1:CAIQACodChtycF9oOi1UeHEzWjV5aTJOc2dKS1ZmU0dWTHc%7C0cqwHmk_nP7%7C?hl=id","Dekorasi dan tempat lumayan bagus dengan tema vintage, banyak koleksi koleksi barang antik juga, namun untuk penataan ruangan sedikit diperbaiki mengingat bagian indoor ada ac jd belum berasa sejuk udaranya, kemudian untuk pengajian makanan cukup cepat dan terlihat fresh, namun masukan dari saya kedepannya bisa riset dan mengembangkan lagi terkait rasa dan menu baru."
"Pesta Keboen Restoran","https://www.google.com/maps/search/?api=1&query=Pesta%20Keboen%20Restoran&query_place_id=ChIJQ2Mc7meLcC4RXm4PJgP1pZA","5","Yuni Kurniati","https://www.google.com/maps/reviews/data=!4m8!14m7!1m6!2m5!1sChdDSUhNMG9nS0VOSHVxZW5zLS1qTGlBRRAB!2m1!1s0x0:0x90a5f503260f6e5e!3m1!1s2@1:CIHM0ogKENHuqens--jLiAE%7CCgwIlpSQwgYQuL6_tAI%7C?hl=id","Pesta Keboen Semarang cocok untuk semua usia! Saya datang bersama keluarga, dan semua merasa nyaman dengan suasananya yang tenang dan tempat duduk ramah lansia. Interiornya cantik dengan nuansa Jawa klasik yang penuh nostalgia. Makanannya enak banget—empal penyet, ayam bakar, dan satenya mantap! Tempat yang pas untuk menikmati hidangan lezat sambil bersantai."
"Pesta Keboen Restoran","https://www.google.com/maps/search/?api=1&query=Pesta%20Keboen%20Restoran&query_place_id=ChIJQ2Mc7meLcC4RXm4PJgP1pZA","5","Novian Bramantiyo","https://www.google.com/maps/reviews/data=!4m8!14m7!1m6!2m5!1sCi9DQUlRQUNvZENodHljRjlvT25oUFFXODBhSGRPWDFOVVpWWTVOV0Z4U1ZCdGVIYxAB!2m1!1s0x0:0x90a5f503260f6e5e!3m1!1s2@1:CAIQACodChtycF9oOnhPQW80aHdOX1NUZVY5NWFxSVBteHc%7C0dFeUbgogz8%7C?hl=id","Ikonik sekali dengan nuansa vintage ala belanda,mulai dari konsep,pramusaji sampai ke hiasan2 nya"
"Pesta Keboen Restoran","https://www.google.com/maps/search/?api=1&query=Pesta%20Keboen%20Restoran&query_place_id=ChIJQ2Mc7meLcC4RXm4PJgP1pZA","5","sds168.property","https://www.google.com/maps/reviews/data=!4m8!14m7!1m6!2m5!1sCi9DQUlRQUNvZENodHljRjlvT2xWRVRWaHFjbWxaU1hsR1ZVY3lZMGhhZVVwWlIwRRAB!2m1!1s0x0:0x90a5f503260f6e5e!3m1!1s2@1:CAIQACodChtycF9oOlVETVhqcmlZSXlGVUcyY0haeUpZR0E%7C0cbmlYKQI4R%7C?hl=id","Musik keroncong ,suasana nyaman.
Yg favorit Bandeng Kropok, Ayam Asap. Salad Bangkok nya okay ada apel nya jadi rasa okay."
"Pesta Keboen Restoran","https://www.google.com/maps/search/?api=1&query=Pesta%20Keboen%20Restoran&query_place_id=ChIJQ2Mc7meLcC4RXm4PJgP1pZA","5","Beny Novatama","https://www.google.com/maps/reviews/data=!4m8!14m7!1m6!2m5!1sCi9DQUlRQUNvZENodHljRjlvT25OWmRtcENlRlpJVDBwRlMyeG5NSFV3VTNGbE9XYxAB!2m1!1s0x0:0x90a5f503260f6e5e!3m1!1s2@1:CAIQACodChtycF9oOnNZdmpCeFZIT0pFS2xnMHUwU3FlOWc%7C0cMxX4HIR3P%7C?hl=id","Restoran yang menurut saya makanannya beranekaragam, enak, dan terlihat mewah,, untuk tempat duduk banyak, jangan khawatir,  gaya resto yang klasik, ada mushola nya juga, mainan anak, lengkap deh .. yang paling keren disini adalah pelayanannya yang cepat dan profesional,, rekomen deh kalau makan disini.."
"Pesta Keboen Restoran","https://www.google.com/maps/search/?api=1&query=Pesta%20Keboen%20Restoran&query_place_id=ChIJQ2Mc7meLcC4RXm4PJgP1pZA","5","Anisah Fajar","https://www.google.com/maps/reviews/data=!4m8!14m7!1m6!2m5!1sChdDSUhNMG9nS0VKcS00TEsyeTVPdm13RRAB!2m1!1s0x0:0x90a5f503260f6e5e!3m1!1s2@1:CIHM0ogKEJq-4LK2y5OvmwE%7CCgwIm6qgwQYQgPaRhgE%7C?hl=id","Harganya pricey tapi worth it. Cita rasa pas enak. Menu yang tersedia kombinas Jawa dan Belanda (sepertinya). Suasananya nyaman, tenang, ditemani live music dengan lagu2 lawas era 2000an awal yang bikin nostalgia. Desain interior bangunannya sangat menarik banyak ornamen serasa makan di rumah nenek. Bangunannya bangunan kuno Belanda yang oke banget deh. Must try! Dijamin ga bakal nyesel. Servisnya ok banget dan ramah semua pegawainya. Berasa jadi Njonja dan Toean 😆"
"Pesta Keboen Restoran","https://www.google.com/maps/search/?api=1&query=Pesta%20Keboen%20Restoran&query_place_id=ChIJQ2Mc7meLcC4RXm4PJgP1pZA","5","nugraheni kusumawati","https://www.google.com/maps/reviews/data=!4m8!14m7!1m6!2m5!1sCi9DQUlRQUNvZENodHljRjlvT2pCUVVXZDZPRmxsZFZWMFZuSnZlVEZ3WVY5MFVsRRAB!2m1!1s0x0:0x90a5f503260f6e5e!3m1!1s2@1:CAIQACodChtycF9oOjBQUWd6OFlldVV0VnJveTFwYV90UlE%7C0cu3SND7Wsi%7C?hl=id","Makanan indonesia dari segi rasa oke, tempat strategis dan parkiran luas. Pelayanan juga cepat"
"Pesta Keboen Restoran","https://www.google.com/maps/search/?api=1&query=Pesta%20Keboen%20Restoran&query_place_id=ChIJQ2Mc7meLcC4RXm4PJgP1pZA","5","yulius wahyu kuncoro Adi","https://www.google.com/maps/reviews/data=!4m8!14m7!1m6!2m5!1sChZDSUhNMG9nS0VNRC02TmJINzZ6LVlnEAE!2m1!1s0x0:0x90a5f503260f6e5e!3m1!1s2@1:CIHM0ogKEMD-6NbH76z-Yg%7CCgwIg_fMwQYQkIm6mwE%7C?hl=id","Suatu hari saat menghadiri pesta pernikahan temand kami yang diadakan di Pesta Keboen. Suasananya Nyaman bgt,bersih,rapi dan Instagramable bgt. Makanannya juga enakkk bgt tp lupa foto makanannya. Di sini juga ada wahana anak juga,jd kalau pas makan di sini dan bawa anak kecil tdak usah repot dan bingung karena ada wahana anak. Selain itu juga ada motor n mobil jadul yang bisa banget untuk foto.Pokoknya selain makanannya enak suasana dan fasilitasnya lengkap.Gak nyesel dech dateng kemari Pakdhe."
"Pesta Keboen Restoran","https://www.google.com/maps/search/?api=1&query=Pesta%20Keboen%20Restoran&query_place_id=ChIJQ2Mc7meLcC4RXm4PJgP1pZA","5","Laluna _Bella","https://www.google.com/maps/reviews/data=!4m8!14m7!1m6!2m5!1sCi9DQUlRQUNvZENodHljRjlvT2tnMFlrdG1Rbmd4UmpkeGEwRk5aMDVyVGxwaU1HYxAB!2m1!1s0x0:0x90a5f503260f6e5e!3m1!1s2@1:CAIQACodChtycF9oOkg0YktmQngxRjdxa0FNZ05rTlpiMGc%7C0cW6Vxd-2sh%7C?hl=id","Sabtu 26 Juli 2025

All good! Bakal balik lagi sih nantinya. Kakaknya ramah semuaa. Makanannya juga enak ga ada yang fail. Aku suka poffertjes nya 🤩🤩 oh ya, tadi siang waktu makan sama keluarga sempat pindah meja (posisi minuman sudah disajikan) dan minta untuk pindah karena adik saya tapi kakaknya ramah dan mau membantu. Selain itu, tadi juga ada bapak yang memainkan alat musik. (Jujur jadi terharu krn keinget kakek akuu 😭) Bagus, keren sekali! Kalau boleh tau, memang stay disana ya bapaknya untuk live memainkan alat musik? Terimakasih ^^"
"Pesta Keboen Restoran","https://www.google.com/maps/search/?api=1&query=Pesta%20Keboen%20Restoran&query_place_id=ChIJQ2Mc7meLcC4RXm4PJgP1pZA","5","Ika Rakhmawati Hilal","https://www.google.com/maps/reviews/data=!4m8!14m7!1m6!2m5!1sChdDSUhNMG9nS0VJQ0FnTUNBX1piLWxBRRAB!2m1!1s0x0:0x90a5f503260f6e5e!3m1!1s2@1:CIHM0ogKEICAgMCA_Zb-lAE%7CCgwIjKqDvQYQuLHttAI%7C?hl=id","Pertama kalinya dinner di sini. Tempatnya luar biasa keren. Bangunan dan atmosfernya menyenangkan sekali. Sangat memanjakan mata.

Udah tempatnya keren banget, makanannya enak pula. Servisnya oke. Pramuniaga ramah, sopan dan komunikatif.

Aneka hidangan lezat tersedia. Mulai dari menu Western, Chinese food, menu tradisional Indonesia, juga menu peranakan.

Cocok banget untuk lunch maupun dinner."
"Pesta Keboen Restoran","https://www.google.com/maps/search/?api=1&query=Pesta%20Keboen%20Restoran&query_place_id=ChIJQ2Mc7meLcC4RXm4PJgP1pZA","5","Ta kenal Ta sayang","https://www.google.com/maps/reviews/data=!4m8!14m7!1m6!2m5!1sCi9DQUlRQUNvZENodHljRjlvT2xSTU0ybzJTRkJXTm5oV05GZEhOVWMyTFY5bVduYxAB!2m1!1s0x0:0x90a5f503260f6e5e!3m1!1s2@1:CAIQACodChtycF9oOlRMM2o2SFBWNnhWNFdHNUc2LV9mWnc%7C0cXl-CIGjDu%7C?hl=id","Salah satu tempat favorit dari jaman aku remaja, dl sering ksni setiap siang sama mantan pacar hihi, rasa outentiknya dpt. Oiya menu macaroni schotel ny kenapa hilang yaa, jujur macaroni schotel ala pesta keboen beda dr yg lain, 🥲🥲🫶🏼🫶🏼"
"Pesta Keboen Restoran","https://www.google.com/maps/search/?api=1&query=Pesta%20Keboen%20Restoran&query_place_id=ChIJQ2Mc7meLcC4RXm4PJgP1pZA","5","indrawanid","https://www.google.com/maps/reviews/data=!4m8!14m7!1m6!2m5!1sChZDSUhNMG9nS0VJQ0FnSUQzaWEyMUd3EAE!2m1!1s0x0:0x90a5f503260f6e5e!3m1!1s2@1:CIHM0ogKEICAgID3ia21Gw%7CCgwIuf_guQYQwNPK3wE%7C?hl=id","Restoran Pesta Keboen yang terletak di Jalan Veteran No. 29, Semarang, menawarkan pengalaman bersantap dengan nuansa vintage yang unik. Desain interiornya menggabungkan dekorasi kolonial, lengkap dengan foto-foto Semarang tempo dulu yang menghiasi dinding, menciptakan suasana nostalgia dan menarik bagi pengunjung yang ingin menikmati makan sambil merasakan sejarah kota.

Menu Pesta Keboen menyajikan berbagai hidangan khas Indonesia dan Asia, dengan pilihan menu yang variatif. Meskipun harga menu cenderung agak mahal, kualitas rasa makanannya dinilai memuaskan oleh banyak pengunjung. Beberapa pengunjung mengungkapkan bahwa pengalaman makan di sini romantis, cocok untuk acara spesial seperti makan malam bersama pasangan.

Fasilitas di restoran ini termasuk tempat duduk dalam dan luar ruangan, layanan pesan antar, dan reservasi. Ada juga hiburan berupa musik live pada kesempatan tertentu, yang menambah kenyamanan suasana bersantap.

Bagi Anda yang ingin mencoba suasana makan yang berbeda di Semarang dengan sentuhan kolonial, Pesta Keboen bisa menjadi pilihan yang menarik."
"Pesta Keboen Restoran","https://www.google.com/maps/search/?api=1&query=Pesta%20Keboen%20Restoran&query_place_id=ChIJQ2Mc7meLcC4RXm4PJgP1pZA","5","Hervina Nurullita","https://www.google.com/maps/reviews/data=!4m8!14m7!1m6!2m5!1sChdDSUhNMG9nS0VJQ0FnSUR2bDVtTnZRRRAB!2m1!1s0x0:0x90a5f503260f6e5e!3m1!1s2@1:CIHM0ogKEICAgIDvl5mNvQE%7CCgsIiuasuwYQoNqkJQ%7C?hl=id","Kesini tanggal 20 Desember 2024. Acara perjamuan makan. Tempatnya asik, ada nuansa kolonial dan modern. Sayur brokoli endul, sapi tahu endul. Hanya es jeruknya yg kecut sekali. Ada live musik, tapi mungkin karena di area live musik gak ada pengunjung, masx nyanyinya dikit2."
"Pesta Keboen Restoran","https://www.google.com/maps/search/?api=1&query=Pesta%20Keboen%20Restoran&query_place_id=ChIJQ2Mc7meLcC4RXm4PJgP1pZA","5","izza","https://www.google.com/maps/reviews/data=!4m8!14m7!1m6!2m5!1sChdDSUhNMG9nS0VJQ0FnSURmX3I3RnR3RRAB!2m1!1s0x0:0x90a5f503260f6e5e!3m1!1s2@1:CIHM0ogKEICAgIDf_r7FtwE%7CCgwI_KbyuwYQkP7ShgE%7C?hl=id","Restaurant dengan suasana homey di kota Semarang. Desain interior maupun exterior yang menggabungkan suasana kolonial & modern ini menyajikan pengalaman baru bagi pendatang dan menarik minat dalam mengetahui sejarah singkat tentang Kota Semarang secara umum pada tempo doeloe.
Makanan yang disajikan berupa menu Nusantara Indonesia dengan cita rasa khas mereka. Minumannya sangat enak terutama jus sehat dengan porsi gelas yang cukup besar.
Pelayanan staff semuanya ramah dan informatif dengan pakaian yang sopan. Tempat parkir pun cukup luas."
"Pesta Keboen Restoran","https://www.google.com/maps/search/?api=1&query=Pesta%20Keboen%20Restoran&query_place_id=ChIJQ2Mc7meLcC4RXm4PJgP1pZA","5","Jap Family","https://www.google.com/maps/reviews/data=!4m8!14m7!1m6!2m5!1sChdDSUhNMG9nS0VLenlwc3Zzd05xWmpnRRAB!2m1!1s0x0:0x90a5f503260f6e5e!3m1!1s2@1:CIHM0ogKEKzypsvswNqZjgE%7CCgwIqNerwgYQ0O_LgAI%7C?hl=id","Makanan rumahan dengan dekor artistik khas Jawa dan penuh dengan sudut cantik utk foto 🎼👌"
"Pesta Keboen Restoran","https://www.google.com/maps/search/?api=1&query=Pesta%20Keboen%20Restoran&query_place_id=ChIJQ2Mc7meLcC4RXm4PJgP1pZA","5","AIG","https://www.google.com/maps/reviews/data=!4m8!14m7!1m6!2m5!1sChZDSUhNMG9nS0VJQ0FnSUQ1b3ZTY1JnEAE!2m1!1s0x0:0x90a5f503260f6e5e!3m1!1s2@1:CIHM0ogKEICAgID5ovScRg%7CCgwIxICmuQYQgK_CvQM%7C?hl=id","Tempatnya unik konsep model doeloe. Bangunan, isi, layout dan design-nya semuanya pas bagus. Bagus juga buat foto2. Areanya luas banyak mejanya dan aman kalau bawa rombongan agak banyak. Makanya pas datang makan siang hari kerja, banyak rombongan ibu2 arisan di sini. Makanan dan minumannya juga oke-oke dan variatif."
"Pesta Keboen Restoran","https://www.google.com/maps/search/?api=1&query=Pesta%20Keboen%20Restoran&query_place_id=ChIJQ2Mc7meLcC4RXm4PJgP1pZA","5","Dita Ayu","https://www.google.com/maps/reviews/data=!4m8!14m7!1m6!2m5!1sCi9DQUlRQUNvZENodHljRjlvT25acVQyMHlWRTR3Tlc4elMxcFVRbkZ5VVRVMU5rRRAB!2m1!1s0x0:0x90a5f503260f6e5e!3m1!1s2@1:CAIQACodChtycF9oOnZqT20yVE4wNW8zS1pUQnFyUTU1NkE%7C0cpzIX_McS6%7C?hl=id","Tempat makan untuk berbagai acara, tempatnya nyaman, pelayanannya super ramah, makanan enak."
"Pesta Keboen Restoran","https://www.google.com/maps/search/?api=1&query=Pesta%20Keboen%20Restoran&query_place_id=ChIJQ2Mc7meLcC4RXm4PJgP1pZA","5","Dona Soedarno","https://www.google.com/maps/reviews/data=!4m8!14m7!1m6!2m5!1sChZDSUhNMG9nS0VJQ0FnSURiNTdQc093EAE!2m1!1s0x0:0x90a5f503260f6e5e!3m1!1s2@1:CIHM0ogKEICAgIDb57PsOw%7CCgwI9bDctQYQuJeHzgE%7C?hl=id","Yg demen ama suasana jadul, foto2 instagramble, cucok nii.. bnyk spot foto yang vintage banget. Space makan big family or cuma berduaan cadle light diner juga cocok dan bagus banget. Makanannya semua enak, cocok di lidah. Buat reunion, birthday party, arisan, juga bagus nii.. love it✨️✨️✨️✨️✨️"
"Pesta Keboen Restoran","https://www.google.com/maps/search/?api=1&query=Pesta%20Keboen%20Restoran&query_place_id=ChIJQ2Mc7meLcC4RXm4PJgP1pZA","5","Purji","https://www.google.com/maps/reviews/data=!4m8!14m7!1m6!2m5!1sChdDSUhNMG9nS0VJQ0FnSURMOGZMdWp3RRAB!2m1!1s0x0:0x90a5f503260f6e5e!3m1!1s2@1:CIHM0ogKEICAgIDL8fLujwE%7CCgsIkZr7swYQqJT0Tg%7C?hl=id","Buat yg ke Semarang mau dapat resto yg tenang, asri dan klasik disini cocok tempatnya
Resto dg design rumah jawa klasik dg berbagai ornamen nya
Menu makanannya juga khas makanan jawa
Suasananya tenang dan cocok buat makan sekeluarga

Kami cobain nasi pecel nya, nasi uduk ayam goreng, nasi uduk empal goreng. Semuanya enak. Pelayanannya ramah2
Harga dibilang mahal nggak juga sesuai dengan suasana, pelayanan dan masakannya"
"Pesta Keboen Restoran","https://www.google.com/maps/search/?api=1&query=Pesta%20Keboen%20Restoran&query_place_id=ChIJQ2Mc7meLcC4RXm4PJgP1pZA","5","Hansen Nugraha","https://www.google.com/maps/reviews/data=!4m8!14m7!1m6!2m5!1sChZDSUhNMG9nS0VJQ0FnSURPNTVYX2JBEAE!2m1!1s0x0:0x90a5f503260f6e5e!3m1!1s2@1:CIHM0ogKEICAgIDO55X_bA%7CCgsI4_DIlgYQ0Ku3MA%7C?hl=id","Ketika Agan dan Sista memasuki lokasi restoran tersebut, nuansa ala tempoe doeloe udah terasa dari bangunan klasik yang menjadi tempat makan pengunjung. Bangunan restoran tersebut diperkirakan dibangun sejak tahun 1850 an. Interior yang terdapat di lokasi juga terasa klasik dilihat dari tiangnya yang berukuran besar.

Restoran Pesta Keboen pertama kali dibuka pada tahun 2000. Pilihan menu di Restoran Pesta Keboen Semarang ini beragam. Secara khusus, terdapat menu andalan yang merupakan hasil kreasi pemilik restoran. Menu andalan tersebut antara lain adalah udang masak bawang serta es spesial pesta keboen.

Tidak ketinggalan, para pengunjung juga bisa menikmati sajian kuliner yang sudah sering ditemui di jalanan. Di antaranya adalah lumpia, nasi pecel, es buah, dan lain-lain. Menariknya, semua menu tersebut disajikan berupa paket yang memakai nama-nama ikon Semarang seperti simpang Lima, Tugu Muda, ataupun Gereja Blenduk.

Restoran Pesta Keboen, buka setiap hari dari jam 08.00-20.00 WIB. Restoran ini menyediakan menu berupa masakan Indonesia dan Eropa. Seperti sup, ayam asap, beef cordon bleu, chicken cordon bleu, ikan gurame goreng kipas, hingga menu penutup berupa bubur mutiara atau wedang ronde"
"Pesta Keboen Restoran","https://www.google.com/maps/search/?api=1&query=Pesta%20Keboen%20Restoran&query_place_id=ChIJQ2Mc7meLcC4RXm4PJgP1pZA","5","Ika Hapsari","https://www.google.com/maps/reviews/data=!4m8!14m7!1m6!2m5!1sChZDSUhNMG9nS0VJQ0FnSUNPLUstMUJREAE!2m1!1s0x0:0x90a5f503260f6e5e!3m1!1s2@1:CIHM0ogKEICAgICO-K-1BQ%7CCgwI8-rdlAYQgLrV8AI%7C?hl=id","Restoran dengan eksterior klasik dan vintage bergaya jawa. Lokasinya di Jalan Veteran, cukup mudah dijangkau dari Simpang Lima. Parkir cukup luas. Selain desain bangunannya yg jadul, desain interiornya pun klasik jawa. Ada display aneka jajanan jadul. Di area belakang terdapat taman indoor yang cukup bagus. Ruangannya juga luas, cocok untuk perkumpulan keluarga atau kantor. Untuk menu sangat variatif, mulai dari masakan Jawa, Nusantara, dan western. Untuk harga menurut saya pribadi lumayan pricey, namun rasa lumayanlah. Saya memesan nasi timbel dan porsinya cukup besar dan isiannya lengkap. Pelayanan baik, fasilitas lengkap"
"Pesta Keboen Restoran","https://www.google.com/maps/search/?api=1&query=Pesta%20Keboen%20Restoran&query_place_id=ChIJQ2Mc7meLcC4RXm4PJgP1pZA","5","Refi Aditya Bayu Putra","https://www.google.com/maps/reviews/data=!4m8!14m7!1m6!2m5!1sChZDSUhNMG9nS0VJQ0FnSUNSMGFLOE1nEAE!2m1!1s0x0:0x90a5f503260f6e5e!3m1!1s2@1:CIHM0ogKEICAgICR0aK8Mg%7CCgwIys6voQYQgKCJrgE%7C?hl=id","Suka sekali dengan tempat ini! Bangunannya, dekorasinya, detail sekecil seragam waiters nya pun diperhatikan dan bikin nyaman pengunjung.
Dan yg paling penting adalah makanan yg enak dan beragam menu disajikan. Mostly tradisional food dengan modifikasi. Hanya parkiran agak kurang luas. Recommended 🔥"
"Pesta Keboen Restoran","https://www.google.com/maps/search/?api=1&query=Pesta%20Keboen%20Restoran&query_place_id=ChIJQ2Mc7meLcC4RXm4PJgP1pZA","5","Ainul Hakim","https://www.google.com/maps/reviews/data=!4m8!14m7!1m6!2m5!1sChZDSUhNMG9nS0VJQ0FnSUNkZ3FtS1NREAE!2m1!1s0x0:0x90a5f503260f6e5e!3m1!1s2@1:CIHM0ogKEICAgICdgqmKSQ%7CCgsI6dfxsAYQoOTZLg%7C?hl=id","Nuansa Djadoel Kota Semarang disajikan di sini.
Ya kalo ke sini siapin dompet yg tebel ya gaes
Nuansa jadul Dan Asri tersaji di resto ini

Kapasitas bagian belakang termasuk luas, ini pertemuan keluarga besar hampir 100 orang cukup"
"Pesta Keboen Restoran","https://www.google.com/maps/search/?api=1&query=Pesta%20Keboen%20Restoran&query_place_id=ChIJQ2Mc7meLcC4RXm4PJgP1pZA","5","MatemaViki","https://www.google.com/maps/reviews/data=!4m8!14m7!1m6!2m5!1sChZDSUhNMG9nS0VJQ0FnSUR5eFl2TEhBEAE!2m1!1s0x0:0x90a5f503260f6e5e!3m1!1s2@1:CIHM0ogKEICAgIDyxYvLHA%7CCgsI9Jy1ggYQuOXjfQ%7C?hl=id","Tempat parkir cukup luas, untuk mobil maupun motor. Pembayaran bisa debit ataupun cash. Untuk QR code, karena jarang dipakai, ga mereka sediakan (katanya ada, tapi disimpen, gatau disimpen di mana). Kami ke sana Februari 2021.

Area makannya luas. Ada yg indoor, ber AC, tapi tidak terlalu dingin, karena langsung nyambung ke area semi outdoor yaaa.

Lalu di sini ada area mainnya, posisinya ada di dalam ruangan deket area makan, tapi atapnya bolong, jadi kalau panas/hujan bisa kena. Area mainnya kurang terawat, tapi masih layak main. Kemarin pas kami ke sana, lagi dipakai buat jemur keset/lap dan ada lap pel juga.

Pelayanannya cukup cepat, waiternya ngebantu banget buat ditanya-tanyain menunya.

Kami cobain ayam bakar sama udang bawang putih, favorite di sini katanya. Dua-duanya enak.

Selain itu, di sini banyak spot fotonya. Tempatnya cook buat acara keluarga atau kumpul-kumpul. Di area tengah ada panggungnya juga."
"Pesta Keboen Restoran","https://www.google.com/maps/search/?api=1&query=Pesta%20Keboen%20Restoran&query_place_id=ChIJQ2Mc7meLcC4RXm4PJgP1pZA","5","Alala Muliba","https://www.google.com/maps/reviews/data=!4m8!14m7!1m6!2m5!1sChZDSUhNMG9nS0VJQ0FnSUN4cmEyRldnEAE!2m1!1s0x0:0x90a5f503260f6e5e!3m1!1s2@1:CIHM0ogKEICAgICxra2FWg%7CCgwI5ZKzowYQwNyqvAI%7C?hl=id","Pertama melihat, bangunan restonya terbilang unik, mirip rumah belanda jaman dahulu. Parkirannya luas. Saat masuk kita disambut oleh permainan musik tradisional. Dan depan kasir terdapat jajanan jaman dahulu. Dekorasi mirip rumah eropa masa masa perjuangan kemerdekaan. Selain itu ada  pernak pernik seperti foto foto jaman dahulu, telpon putar jadul dll. Ada arena kecil bermain anak juga.

Terinfo dari staff yang favorit disini ayam asap dan tumis udang . Akhirnya saya pesan ayam asap, tumis udang, gurame asam manis, tumis tauge dan sayur brokoli. Sambil nunggu saya pesan mendoan dan tahu (isi rebung). Untuk rasa saya cocok yang udang dan guramenya. Mantap....

Tempatnya cocok buat untuk makan bersama keluarga atau ketemuan dengan rekan kerja atau klien. Ademm.. cocok buat ngobrol santai.."
"Pesta Keboen Restoran","https://www.google.com/maps/search/?api=1&query=Pesta%20Keboen%20Restoran&query_place_id=ChIJQ2Mc7meLcC4RXm4PJgP1pZA","5","Jajan Nyok","https://www.google.com/maps/reviews/data=!4m8!14m7!1m6!2m5!1sChdDSUhNMG9nS0VJQ0FnSUMtODgtU21BRRAB!2m1!1s0x0:0x90a5f503260f6e5e!3m1!1s2@1:CIHM0ogKEICAgIC-88-SmAE%7CCgsIpfrCmwYQsLj4TQ%7C?hl=id","Tempat makannya cozy dan menyenangkan, ada indoor dan outdoor buatan ala2 kebun…menu di sini tersedia dari makanan berat dan menu2 ringan seperti snack pun ada. Untuk menu minuman ada yang dingin dan juga panas…harga variatif mulai dari 20k…jam buka mulai dari pkl 10.00 sd 22.00 wib…bisa juga buat acara/event yakkk"
"Pesta Keboen Restoran","https://www.google.com/maps/search/?api=1&query=Pesta%20Keboen%20Restoran&query_place_id=ChIJQ2Mc7meLcC4RXm4PJgP1pZA","5","ursulin setyastika","https://www.google.com/maps/reviews/data=!4m8!14m7!1m6!2m5!1sChZDSUhNMG9nS0VJQ0FnSUNPamU3MEp3EAE!2m1!1s0x0:0x90a5f503260f6e5e!3m1!1s2@1:CIHM0ogKEICAgICOje70Jw%7CCgwIhKWslQYQ-OShlAM%7C?hl=id","Restoran yang menawarkan suasana tempo dulu di tengah Kota Semarang & makanan yang ditawarkan juga enak-enak. Menu yang kami makan berupa nasi ajam asap (menu yang ditawarkan), nasi oedoek ajam, nasi petjel empal, sup djagoeng, fresh orange (100% buah jeruk), teh tjahe, wedang tjahe, dan untuk koedapannya ada lumpia semarang dll., dan semuanya enak, recommended bagiku 👍🏻 Untuk kumpul""; keluarga, teman, rapat"" juga oke 👍🏻 Harga sesuai sih sama suasana dan makanan yang ditawarkan. Pelayan restonya pada pakai kebaya-kebaya gitu 🤩 Resto yang menawarkan tempo doeloe banget 🤭"
"Pesta Keboen Restoran","https://www.google.com/maps/search/?api=1&query=Pesta%20Keboen%20Restoran&query_place_id=ChIJQ2Mc7meLcC4RXm4PJgP1pZA","5","Galih Andika","https://www.google.com/maps/reviews/data=!4m8!14m7!1m6!2m5!1sCi9DQUlRQUNvZENodHljRjlvT2xsdk5XMU5OVWhUVTNkaFMzSmxkREJpUzNCamRsRRAB!2m1!1s0x0:0x90a5f503260f6e5e!3m1!1s2@1:CAIQACodChtycF9oOllvNW1NNUhTU3dhS3JldDBiS3BjdlE%7C0cLAnUDioW8%7C?hl=id","Suasananya nyaman, bafus, cocok buat acara keluarga"
"Pesta Keboen Restoran","https://www.google.com/maps/search/?api=1&query=Pesta%20Keboen%20Restoran&query_place_id=ChIJQ2Mc7meLcC4RXm4PJgP1pZA","5","Ryan R Hakim","https://www.google.com/maps/reviews/data=!4m8!14m7!1m6!2m5!1sCi9DQUlRQUNvZENodHljRjlvT25wSU5FTXhRWGx1UjBscWNGOUdNazlvWTJGNVZHYxAB!2m1!1s0x0:0x90a5f503260f6e5e!3m1!1s2@1:CAIQACodChtycF9oOnpINEMxQXluR0lqcF9GMk9oY2F5VGc%7C0cKpMnuL3vH%7C?hl=id","Resto yang sudah cukup lama berdiri di kota Semarang. Makanan, suasana dan afmosfir sangat nyaman."
