"title","url","stars","name","reviewUrl","text"
"Pesta Keboen Restoran","https://www.google.com/maps/search/?api=1&query=Pesta%20Keboen%20Restoran&query_place_id=ChIJQ2Mc7meLcC4RXm4PJgP1pZA","5","Sugianto Soemo","https://www.google.com/maps/reviews/data=!4m8!14m7!1m6!2m5!1sChZDSUhNMG9nS0VJQ0FnSUNPM01qU0FREAE!2m1!1s0x0:0x90a5f503260f6e5e!3m1!1s2@1:CIHM0ogKEICAgICO3MjSAQ%7CCgwIvOLslAYQkL2itgI%7C?hl=id","Undangan halal bi halal RT. 4 RW. 5 Sumurboto,  suasana nyaman, dihadiri +/- 60 orang, acara meriah, makanan yang disajikan enak sesuai selera."
"Pesta Keboen Restoran","https://www.google.com/maps/search/?api=1&query=Pesta%20Keboen%20Restoran&query_place_id=ChIJQ2Mc7meLcC4RXm4PJgP1pZA","5","Eko Kohlay","https://www.google.com/maps/reviews/data=!4m8!14m7!1m6!2m5!1sChdDSUhNMG9nS0VJQ0FnSUNvdFBmUGdnRRAB!2m1!1s0x0:0x90a5f503260f6e5e!3m1!1s2@1:CIHM0ogKEICAgICotPfPggE%7CCgsI987r4gUQibuMXA%7C?hl=id","Tempat yg bagus utk kuliner anda, ada tempat buat fasilitas weding dan meething."
"Pesta Keboen Restoran","https://www.google.com/maps/search/?api=1&query=Pesta%20Keboen%20Restoran&query_place_id=ChIJQ2Mc7meLcC4RXm4PJgP1pZA","5","YR channel","https://www.google.com/maps/reviews/data=!4m8!14m7!1m6!2m5!1sChZDSUhNMG9nS0VJQ0FnSURVaHR2Z0RBEAE!2m1!1s0x0:0x90a5f503260f6e5e!3m1!1s2@1:CIHM0ogKEICAgIDUhtvgDA%7CCgwIkLr16gUQyPm5xgI%7C?hl=id","Nuansa restaurant tempo doloe.serasa berada di jaman kolonial belanda.barang""antik sengaja di tampilkan di ruangan makan.recomended buat ketemu klien."
"Pesta Keboen Restoran","https://www.google.com/maps/search/?api=1&query=Pesta%20Keboen%20Restoran&query_place_id=ChIJQ2Mc7meLcC4RXm4PJgP1pZA","5","Tio Hwa","https://www.google.com/maps/reviews/data=!4m8!14m7!1m6!2m5!1sChdDSUhNMG9nS0VJQ0FnSUNCc3RtWGlRRRAB!2m1!1s0x0:0x90a5f503260f6e5e!3m1!1s2@1:CIHM0ogKEICAgICBstmXiQE%7CCgwI8duMnQYQuKWqnwM%7C?hl=id","Tempatnya nyentrik bekas rumah kuno jadi banyak kamar2 besar buat meja dan tempat duduk diltata hingga bagus dan makanannya enak semua rugi klu tdk datang.👍"
"Pesta Keboen Restoran","https://www.google.com/maps/search/?api=1&query=Pesta%20Keboen%20Restoran&query_place_id=ChIJQ2Mc7meLcC4RXm4PJgP1pZA","5","Bebbi Bintang","https://www.google.com/maps/reviews/data=!4m8!14m7!1m6!2m5!1sChdDSUhNMG9nS0VJQ0FnSUQ2X3VicmpnRRAB!2m1!1s0x0:0x90a5f503260f6e5e!3m1!1s2@1:CIHM0ogKEICAgID6_ubrjgE%7CCgwIlszaigYQuK_xqAE%7C?hl=id","Makanan enak, suasana asri, cuman yg outdoor kalau panas ya syumuk ..
Ruang ber AC nyaman dan adem.
Bisa untuk wedding juga"
"Pesta Keboen Restoran","https://www.google.com/maps/search/?api=1&query=Pesta%20Keboen%20Restoran&query_place_id=ChIJQ2Mc7meLcC4RXm4PJgP1pZA","5","raisha","https://www.google.com/maps/reviews/data=!4m8!14m7!1m6!2m5!1sChdDSUhNMG9nS0VJQ0FnSUQtbnBxUHV3RRAB!2m1!1s0x0:0x90a5f503260f6e5e!3m1!1s2@1:CIHM0ogKEICAgID-npqPuwE%7CCgwItMCdnAYQoJDf3AE%7C?hl=id","Rumah makan luas dan ada beberapa ruangan privat,  yang cantik dan memang  dirancang untuk punya banyak spot foto."
"Pesta Keboen Restoran","https://www.google.com/maps/search/?api=1&query=Pesta%20Keboen%20Restoran&query_place_id=ChIJQ2Mc7meLcC4RXm4PJgP1pZA","5","widiyarto kurniawan","https://www.google.com/maps/reviews/data=!4m8!14m7!1m6!2m5!1sChZDSUhNMG9nS0VJQ0FnSUNCNXJueFFREAE!2m1!1s0x0:0x90a5f503260f6e5e!3m1!1s2@1:CIHM0ogKEICAgICB5rnxQQ%7CCgsIuYSbnQYQ0OSdXA%7C?hl=id","cocok suasana nya, nyaman buat santai...."
"Pesta Keboen Restoran","https://www.google.com/maps/search/?api=1&query=Pesta%20Keboen%20Restoran&query_place_id=ChIJQ2Mc7meLcC4RXm4PJgP1pZA","5","Ruds 03","https://www.google.com/maps/reviews/data=!4m8!14m7!1m6!2m5!1sCi9DQUlRQUNvZENodHljRjlvT2tKQlNXbHNiVUZrZURWR2NWVlRaa1JOWkVKdVpFRRAB!2m1!1s0x0:0x90a5f503260f6e5e!3m1!1s2@1:CAIQACodChtycF9oOkJBSWlsbUFkeDVGcVVTZkRNZEJuZEE%7C0cJJo9rL7mQ%7C?hl=id","Sangat kids friendly dan mewah"
"Pesta Keboen Restoran","https://www.google.com/maps/search/?api=1&query=Pesta%20Keboen%20Restoran&query_place_id=ChIJQ2Mc7meLcC4RXm4PJgP1pZA","5","Nur Kholis","https://www.google.com/maps/reviews/data=!4m8!14m7!1m6!2m5!1sCi9DQUlRQUNvZENodHljRjlvT25OVmMxRlFkMnBCVGxOV2Vrd3hNSGhoU0hkclUyYxAB!2m1!1s0x0:0x90a5f503260f6e5e!3m1!1s2@1:CAIQACodChtycF9oOnNVc1FQd2pBTlNWekwxMHhhSHdrU2c%7C0cT787imDkG%7C?hl=id","Makanan bervariasi , enak bgt. Leker nya juga enak"
"Pesta Keboen Restoran","https://www.google.com/maps/search/?api=1&query=Pesta%20Keboen%20Restoran&query_place_id=ChIJQ2Mc7meLcC4RXm4PJgP1pZA","5","ajeng devie andasarie","https://www.google.com/maps/reviews/data=!4m8!14m7!1m6!2m5!1sChZDSUhNMG9nS0VJQ0FnSUQwcUpqNE9BEAE!2m1!1s0x0:0x90a5f503260f6e5e!3m1!1s2@1:CIHM0ogKEICAgID0qJj4OA%7CCgwIxfex7QUQ6Iz3swI%7C?hl=id","Makanan enak.. pelayanan cepat dan ramah... Suasana nyaman.. ada tempat bermain anak juga..."
"Pesta Keboen Restoran","https://www.google.com/maps/search/?api=1&query=Pesta%20Keboen%20Restoran&query_place_id=ChIJQ2Mc7meLcC4RXm4PJgP1pZA","5","Stisi Farah","https://www.google.com/maps/reviews/data=!4m8!14m7!1m6!2m5!1sChdDSUhNMG9nS0VJQ0FnSURPbXJhMjZBRRAB!2m1!1s0x0:0x90a5f503260f6e5e!3m1!1s2@1:CIHM0ogKEICAgIDOmra26AE%7CCgwI0OKDlgYQ6Onj2QI%7C?hl=id","Salah satu resto favorit.. ada live musicnya, ada banyak koleksi foto2 semarang tempo dulu, masakannya jg enak2 dan harga terjangkau..
tenpatnya jg unik"
"Pesta Keboen Restoran","https://www.google.com/maps/search/?api=1&query=Pesta%20Keboen%20Restoran&query_place_id=ChIJQ2Mc7meLcC4RXm4PJgP1pZA","5","amelia wijaya","https://www.google.com/maps/reviews/data=!4m8!14m7!1m6!2m5!1sChZDSUhNMG9nS0VJQ0FnSUMyeWF2WUdnEAE!2m1!1s0x0:0x90a5f503260f6e5e!3m1!1s2@1:CIHM0ogKEICAgIC2yavYGg%7CCgwIq5OVkwYQ4OiG2wE%7C?hl=id","Makanan nya enak, bersih, tempat nyaman. Sesuai sama harga lah ya. Pelayan juga baik2 ramah"
"Pesta Keboen Restoran","https://www.google.com/maps/search/?api=1&query=Pesta%20Keboen%20Restoran&query_place_id=ChIJQ2Mc7meLcC4RXm4PJgP1pZA","5","Sugeng Item","https://www.google.com/maps/reviews/data=!4m8!14m7!1m6!2m5!1sChdDSUhNMG9nS0VJQ0FnSURlaTRHcXpnRRAB!2m1!1s0x0:0x90a5f503260f6e5e!3m1!1s2@1:CIHM0ogKEICAgIDei4GqzgE%7CCgsIu-e_mgYQ6JfELQ%7C?hl=id","Enak, nyaman dan selalu rame sini..
hemmm,,, bikin candu.. 😁"
"Pesta Keboen Restoran","https://www.google.com/maps/search/?api=1&query=Pesta%20Keboen%20Restoran&query_place_id=ChIJQ2Mc7meLcC4RXm4PJgP1pZA","5","KEBON DOELKUNYIT","https://www.google.com/maps/reviews/data=!4m8!14m7!1m6!2m5!1sChZDSUhNMG9nS0VJQ0FnSUNXa0lqVUFnEAE!2m1!1s0x0:0x90a5f503260f6e5e!3m1!1s2@1:CIHM0ogKEICAgICWkIjUAg%7CCgwI3dCtkAYQgKWCjgM%7C?hl=id","Restorannya bagus dengan menu tradiaional dengan cita rasa yang wah, rekomen untuk dikunjungi"
"Pesta Keboen Restoran","https://www.google.com/maps/search/?api=1&query=Pesta%20Keboen%20Restoran&query_place_id=ChIJQ2Mc7meLcC4RXm4PJgP1pZA","5","Evy Chendana Tandi","https://www.google.com/maps/reviews/data=!4m8!14m7!1m6!2m5!1sChdDSUhNMG9nS0VJQ0FnSUNHaE1hQ3VRRRAB!2m1!1s0x0:0x90a5f503260f6e5e!3m1!1s2@1:CIHM0ogKEICAgICGhMaCuQE%7CCgwIjsq_iwYQ-K7P5AE%7C?hl=id","Restoran dgn nuansa tempo doeloe, makanannya enak2 order nasi timbel, nasi pecel, steak sapi, lekker"
"Pesta Keboen Restoran","https://www.google.com/maps/search/?api=1&query=Pesta%20Keboen%20Restoran&query_place_id=ChIJQ2Mc7meLcC4RXm4PJgP1pZA","5","Suyono Thamrin","https://www.google.com/maps/reviews/data=!4m8!14m7!1m6!2m5!1sChZDSUhNMG9nS0VJQ0FnSUMzN2VuV0NBEAE!2m1!1s0x0:0x90a5f503260f6e5e!3m1!1s2@1:CIHM0ogKEICAgIC37enWCA%7CCgwIpcS2uQYQgIr4wAI%7C?hl=id","Suasana terkesan klasik dan old style, mantabs"
"Pesta Keboen Restoran","https://www.google.com/maps/search/?api=1&query=Pesta%20Keboen%20Restoran&query_place_id=ChIJQ2Mc7meLcC4RXm4PJgP1pZA","5","stevanus christian","https://www.google.com/maps/reviews/data=!4m8!14m7!1m6!2m5!1sChZDSUhNMG9nS0VJQ0FnSURTbHZxSkZBEAE!2m1!1s0x0:0x90a5f503260f6e5e!3m1!1s2@1:CIHM0ogKEICAgIDSlvqJFA%7CCgwIutWQ_wUQ6Ozr0wM%7C?hl=id","Restoran bernuasa jadoel, makanannya gk begitu mahal"
"Pesta Keboen Restoran","https://www.google.com/maps/search/?api=1&query=Pesta%20Keboen%20Restoran&query_place_id=ChIJQ2Mc7meLcC4RXm4PJgP1pZA","5","Dewi Kartika","https://www.google.com/maps/reviews/data=!4m8!14m7!1m6!2m5!1sChZDSUhNMG9nS0VJQ0FnSUN0b1p2SUVREAE!2m1!1s0x0:0x90a5f503260f6e5e!3m1!1s2@1:CIHM0ogKEICAgICtoZvIEQ%7CCgwIsbzkrQYQwMraqwM%7C?hl=id","Feels at home banget tempat makannya 👌🏾 klo makanannya jangan ditanya, cucok laaah"
"Pesta Keboen Restoran","https://www.google.com/maps/search/?api=1&query=Pesta%20Keboen%20Restoran&query_place_id=ChIJQ2Mc7meLcC4RXm4PJgP1pZA","5","susan wati","https://www.google.com/maps/reviews/data=!4m8!14m7!1m6!2m5!1sChdDSUhNMG9nS0VJQ0FnSUNUM1BQLWtRRRAB!2m1!1s0x0:0x90a5f503260f6e5e!3m1!1s2@1:CIHM0ogKEICAgICT3PP-kQE%7CCgwImsmBsgYQ-L2cnQI%7C?hl=id","Sdh dua kali kesini. Makanannya Enak cocok dengan lihat,  suasananya tempo dulu rumahnya adem, dan interiornya banyak koleksi jaman doeloe. Bisa utk rombongan dan klo lunch / dinner hari2 libur perlu booking dulu karena penuh. Alternatifnya makan pas brunch time (jam 10 n gitu) pas buka pas makan."
"Pesta Keboen Restoran","https://www.google.com/maps/search/?api=1&query=Pesta%20Keboen%20Restoran&query_place_id=ChIJQ2Mc7meLcC4RXm4PJgP1pZA","5","Darma Darma123","https://www.google.com/maps/reviews/data=!4m8!14m7!1m6!2m5!1sChZDSUhNMG9nS0VJQ0FnSUNPOGFtY0lBEAE!2m1!1s0x0:0x90a5f503260f6e5e!3m1!1s2@1:CIHM0ogKEICAgICO8amcIA%7CCgsIwqqalQYQkICMWA%7C?hl=id","Terima kasih atas pelayanan jamu makanya.orangnya sangat sopan santun dan ramah."
"Pesta Keboen Restoran","https://www.google.com/maps/search/?api=1&query=Pesta%20Keboen%20Restoran&query_place_id=ChIJQ2Mc7meLcC4RXm4PJgP1pZA","5","Vera Ira Leonawati","https://www.google.com/maps/reviews/data=!4m8!14m7!1m6!2m5!1sChdDSUhNMG9nS0VJQ0FnTURJMVBMNXNRRRAB!2m1!1s0x0:0x90a5f503260f6e5e!3m1!1s2@1:CIHM0ogKEICAgMDI1PL5sQE%7CCgwI7JDPvwYQ2ObgqwE%7C?hl=id","Tempat cozy abisss, bareng klrga ter LOVE syukaaa dg konsep nya , makan an oke juga seruu pokokee"
"Pesta Keboen Restoran","https://www.google.com/maps/search/?api=1&query=Pesta%20Keboen%20Restoran&query_place_id=ChIJQ2Mc7meLcC4RXm4PJgP1pZA","5","Yosephin Nelly","https://www.google.com/maps/reviews/data=!4m8!14m7!1m6!2m5!1sChdDSUhNMG9nS0VJQ0FnSURlanNqTS13RRAB!2m1!1s0x0:0x90a5f503260f6e5e!3m1!1s2@1:CIHM0ogKEICAgIDejsjM-wE%7CCgsIga-PmgYQ6MDoVA%7C?hl=id","Restoran dengan banyak spot foto instagramble
Harga nya affordable, dan enak .."
"Pesta Keboen Restoran","https://www.google.com/maps/search/?api=1&query=Pesta%20Keboen%20Restoran&query_place_id=ChIJQ2Mc7meLcC4RXm4PJgP1pZA","5","Yusuf Spencer","https://www.google.com/maps/reviews/data=!4m8!14m7!1m6!2m5!1sChdDSUhNMG9nS0VJQ0FnSUMxdXJxeXB3RRAB!2m1!1s0x0:0x90a5f503260f6e5e!3m1!1s2@1:CIHM0ogKEICAgIC1urqypwE%7CCgwI_9e0rAYQ6OGTugM%7C?hl=id","Tempat estetik unik, kaya tahun 90-an. Makanan enak."
"Pesta Keboen Restoran","https://www.google.com/maps/search/?api=1&query=Pesta%20Keboen%20Restoran&query_place_id=ChIJQ2Mc7meLcC4RXm4PJgP1pZA","5","Kang Ghieks (Ngghiek)","https://www.google.com/maps/reviews/data=!4m8!14m7!1m6!2m5!1sChZDSUhNMG9nS0VJQ0FnSUQtNHNQVVRnEAE!2m1!1s0x0:0x90a5f503260f6e5e!3m1!1s2@1:CIHM0ogKEICAgID-4sPUTg%7CCgsI5MmCnAYQiOuYKA%7C?hl=id","Makanan enak, suasana jadul tp mewah. Banyak spot buat selfie mania."
"Pesta Keboen Restoran","https://www.google.com/maps/search/?api=1&query=Pesta%20Keboen%20Restoran&query_place_id=ChIJQ2Mc7meLcC4RXm4PJgP1pZA","5","Primadhani Dyah Larasati","https://www.google.com/maps/reviews/data=!4m8!14m7!1m6!2m5!1sChZDSUhNMG9nS0VJQ0FnSUN4OWVmYUh3EAE!2m1!1s0x0:0x90a5f503260f6e5e!3m1!1s2@1:CIHM0ogKEICAgICx9efaHw%7CCgwI8N6wowYQgIPPhgM%7C?hl=id","Porsi makan nasi timbel disini lengkap banget ada gudangan, sayur asem dan lauknya juga lengkap"
"Pesta Keboen Restoran","https://www.google.com/maps/search/?api=1&query=Pesta%20Keboen%20Restoran&query_place_id=ChIJQ2Mc7meLcC4RXm4PJgP1pZA","5","seto aji","https://www.google.com/maps/reviews/data=!4m8!14m7!1m6!2m5!1sChdDSUhNMG9nS0VJQ0FnSUREaWJLT3B3RRAB!2m1!1s0x0:0x90a5f503260f6e5e!3m1!1s2@1:CIHM0ogKEICAgIDDibKOpwE%7CCgwIyYnesAYQuImzrQM%7C?hl=id","Makanan enak puooool, pelayanan cukup bagus. Perlu ditingkatkan dalam kecepatan dalam pelayanannya. Nasigoreng kambing, kambingnya tralu sedikit, tapi rasanya enak banget. Bistik lidah juga enak banget!

Di sini di handle oleh Kak Brigitta Woods"
"Pesta Keboen Restoran","https://www.google.com/maps/search/?api=1&query=Pesta%20Keboen%20Restoran&query_place_id=ChIJQ2Mc7meLcC4RXm4PJgP1pZA","5","Ruth Angela","https://www.google.com/maps/reviews/data=!4m8!14m7!1m6!2m5!1sChZDSUhNMG9nS0VJQ0FnSUNEaHRERWFREAE!2m1!1s0x0:0x90a5f503260f6e5e!3m1!1s2@1:CIHM0ogKEICAgICDhtDEaQ%7CCgwIhZyQsAYQsPbhrAI%7C?hl=id","resto keluarga nuansa oldies dan homey, tempat luas tapi pelayanannya kurang inisiatif mungkin karna saking ramainya, harganya agak pricey tapi rasanya ga mengecewakan masih oke lah, byk spot foto dan area parkir cukup luas juga"
"Pesta Keboen Restoran","https://www.google.com/maps/search/?api=1&query=Pesta%20Keboen%20Restoran&query_place_id=ChIJQ2Mc7meLcC4RXm4PJgP1pZA","5","Rudy Ryan","https://www.google.com/maps/reviews/data=!4m8!14m7!1m6!2m5!1sChdDSUhNMG9nS0VJQ0FnSUNKdkpfUTl3RRAB!2m1!1s0x0:0x90a5f503260f6e5e!3m1!1s2@1:CIHM0ogKEICAgICJvJ_Q9wE%7CCgwI-uPUpAYQiKWjtwE%7C?hl=id","Nyaman utk acara kumpul2.."
"Pesta Keboen Restoran","https://www.google.com/maps/search/?api=1&query=Pesta%20Keboen%20Restoran&query_place_id=ChIJQ2Mc7meLcC4RXm4PJgP1pZA","5","Steven S","https://www.google.com/maps/reviews/data=!4m8!14m7!1m6!2m5!1sChZDSUhNMG9nS0VJQ0FnSUM5emQ3aENBEAE!2m1!1s0x0:0x90a5f503260f6e5e!3m1!1s2@1:CIHM0ogKEICAgIC9zd7hCA%7CCgwIq5yrrwYQyM7lzQE%7C?hl=id","Suasana indonesia tempo doeloe dengan jenis makanan Indonesia dan Belanda."
"Pesta Keboen Restoran","https://www.google.com/maps/search/?api=1&query=Pesta%20Keboen%20Restoran&query_place_id=ChIJQ2Mc7meLcC4RXm4PJgP1pZA","5","Siti Isti","https://www.google.com/maps/reviews/data=!4m8!14m7!1m6!2m5!1sChdDSUhNMG9nS0VJQ0FnSUMtcjUyV2hnRRAB!2m1!1s0x0:0x90a5f503260f6e5e!3m1!1s2@1:CIHM0ogKEICAgIC-r52WhgE%7CCgsI1PzVmwYQqMehZA%7C?hl=id","Resto untuk keluarga yang nyaman banget."
"Pesta Keboen Restoran","https://www.google.com/maps/search/?api=1&query=Pesta%20Keboen%20Restoran&query_place_id=ChIJQ2Mc7meLcC4RXm4PJgP1pZA","5","Indri K","https://www.google.com/maps/reviews/data=!4m8!14m7!1m6!2m5!1sChZDSUhNMG9nS0VJQ0FnSURzNnZ2TlBBEAE!2m1!1s0x0:0x90a5f503260f6e5e!3m1!1s2@1:CIHM0ogKEICAgIDs6vvNPA%7CCgwI-Yfu8gUQqLmX1QI%7C?hl=id","Untuk outdoor view nya lumayan bagus, makanan standar"
"Pesta Keboen Restoran","https://www.google.com/maps/search/?api=1&query=Pesta%20Keboen%20Restoran&query_place_id=ChIJQ2Mc7meLcC4RXm4PJgP1pZA","5","Inawati Gabriella","https://www.google.com/maps/reviews/data=!4m8!14m7!1m6!2m5!1sChZDSUhNMG9nS0VJQ0FnSUNSeE9mbWFREAE!2m1!1s0x0:0x90a5f503260f6e5e!3m1!1s2@1:CIHM0ogKEICAgICRxOfmaQ%7CCgwIkPb7oAYQ8PKZ9QI%7C?hl=id","AC nya ga terasa dingin
Makanan lumayan tapi menurut saya cenderung manis"
"Pesta Keboen Restoran","https://www.google.com/maps/search/?api=1&query=Pesta%20Keboen%20Restoran&query_place_id=ChIJQ2Mc7meLcC4RXm4PJgP1pZA","5","Happy Mommy","https://www.google.com/maps/reviews/data=!4m8!14m7!1m6!2m5!1sChdDSUhNMG9nS0VJQ0FnSUNsNDVlRnZBRRAB!2m1!1s0x0:0x90a5f503260f6e5e!3m1!1s2@1:CIHM0ogKEICAgICl45eFvAE%7CCgwI66iLqwYQyOvQsgI%7C?hl=id","• Tempatnya sangat estetik dan vintage ala jaman dulu
• Saya pesan sop buntut, rasanya enak & light banget krn rempahnya nggak begitu kencang
• Beras kencurnya juga enak hanya saja gelasnya terlalu kecil utk ukuran minuman jamu ya
• Harga relatif mahal tp sesuai dengan rasa & tempatnya yg nyaman banget
• Kamar mandinya agak pesing
• Tempat wudhu wanita pria digabung, agak kurang nyaman bagi hijabers, terpaksa wudhu di kamar mandi"
"Pesta Keboen Restoran","https://www.google.com/maps/search/?api=1&query=Pesta%20Keboen%20Restoran&query_place_id=ChIJQ2Mc7meLcC4RXm4PJgP1pZA","5","Helma Agustiawan (ahelma)","https://www.google.com/maps/reviews/data=!4m8!14m7!1m6!2m5!1sChZDSUhNMG9nS0VJQ0FnSUNwbkw3T0xBEAE!2m1!1s0x0:0x90a5f503260f6e5e!3m1!1s2@1:CIHM0ogKEICAgICpnL7OLA%7CCgsI0uuZpgYQ4NbxZg%7C?hl=id","Good food, good place nuansa Belanda dan oldies, pelayanan juga bagus"
"Pesta Keboen Restoran","https://www.google.com/maps/search/?api=1&query=Pesta%20Keboen%20Restoran&query_place_id=ChIJQ2Mc7meLcC4RXm4PJgP1pZA","5","Iwan walimban","https://www.google.com/maps/reviews/data=!4m8!14m7!1m6!2m5!1sChdDSUhNMG9nS0VJQ0FnSURPOHFidzR3RRAB!2m1!1s0x0:0x90a5f503260f6e5e!3m1!1s2@1:CIHM0ogKEICAgIDO8qbw4wE%7CCgwIhbX-lQYQ8Pv0rwE%7C?hl=id","Tempat unik dan banyak pernak pernik barang antik, foto bersejarah masa lalu kota Semarang"
"Pesta Keboen Restoran","https://www.google.com/maps/search/?api=1&query=Pesta%20Keboen%20Restoran&query_place_id=ChIJQ2Mc7meLcC4RXm4PJgP1pZA","5","Mas Brengoz","https://www.google.com/maps/reviews/data=!4m8!14m7!1m6!2m5!1sChZDSUhNMG9nS0VJQ0FnSURYcEtxdENBEAE!2m1!1s0x0:0x90a5f503260f6e5e!3m1!1s2@1:CIHM0ogKEICAgIDXpKqtCA%7CCgwI7LLouAYQ4PyVsgM%7C?hl=id","Dari luar terkesan seperti rumah biasa. Utk toilet yg cm satu, bila rombongan dg bis hrs ngantri ke toilet."
"Pesta Keboen Restoran","https://www.google.com/maps/search/?api=1&query=Pesta%20Keboen%20Restoran&query_place_id=ChIJQ2Mc7meLcC4RXm4PJgP1pZA","5","Abraham Soediro","https://www.google.com/maps/reviews/data=!4m8!14m7!1m6!2m5!1sChZDSUhNMG9nS0VJQ0FnSURneUlQZEhBEAE!2m1!1s0x0:0x90a5f503260f6e5e!3m1!1s2@1:CIHM0ogKEICAgIDgyIPdHA%7CCgsIvPzSrAYQ2PbJJg%7C?hl=id","Salah 1 restoran legendaris di kota Semarang. Berdiri lebih dari 20thn, menyajikan berbagai menu makanan.

Rasa makanan enak, lokasi strategis, dan vibes bangunannya khas ala rumah tempo 80an."
"Pesta Keboen Restoran","https://www.google.com/maps/search/?api=1&query=Pesta%20Keboen%20Restoran&query_place_id=ChIJQ2Mc7meLcC4RXm4PJgP1pZA","5","adeline gunawan","https://www.google.com/maps/reviews/data=!4m8!14m7!1m6!2m5!1sChZDSUhNMG9nS0VJQ0FnSUNlN2ZpWVB3EAE!2m1!1s0x0:0x90a5f503260f6e5e!3m1!1s2@1:CIHM0ogKEICAgICe7fiYPw%7CCgwIodipmQYQsOueiQM%7C?hl=id","Restoran Pesta Keboen ini termasuk restoran yang unik--yang menyajikan menu masakan Indonesia dan sedikit masakan Belanda--krn ornamen dan pernak-pernik restoran khas tempo dulu. Bahkan hingga buku menunya tertulis dengan ejaan lawas.

Saya pesan sup iga, ayam bakar bumbu kuning dan udang bakar. Semuanya enak. Sop yang disajikan kuahnya kurang panas, tapi saat kami minta pelayan utk memanaskan kembali masakan tersebut, kami dilayani dengan sangat baik. Semua pelayan ramah.

Untuk harga memang agak relatif tinggi--saya kira cukup sesuai dengan keunikan ornamen tempo dulu yang adalah sebuah investasi dan keunggulan."
"Pesta Keboen Restoran","https://www.google.com/maps/search/?api=1&query=Pesta%20Keboen%20Restoran&query_place_id=ChIJQ2Mc7meLcC4RXm4PJgP1pZA","5","Ari HEquipment","https://www.google.com/maps/reviews/data=!4m8!14m7!1m6!2m5!1sChdDSUhNMG9nS0VJQ0FnSUNEaHRXbHBnRRAB!2m1!1s0x0:0x90a5f503260f6e5e!3m1!1s2@1:CIHM0ogKEICAgICDhtWlpgE%7CCgwIhcGQsAYQgKLQngM%7C?hl=id","Pertama kali datang untuk acara buka puasa bersama, untuk tempat lumayan bagus, ada live musik nya, ada mushola kecil juga,,untuk foto bersama juga bagus."
"Pesta Keboen Restoran","https://www.google.com/maps/search/?api=1&query=Pesta%20Keboen%20Restoran&query_place_id=ChIJQ2Mc7meLcC4RXm4PJgP1pZA","5","Raden Yatim","https://www.google.com/maps/reviews/data=!4m8!14m7!1m6!2m5!1sChdDSUhNMG9nS0VJQ0FnSUNZaE16NWh3RRAB!2m1!1s0x0:0x90a5f503260f6e5e!3m1!1s2@1:CIHM0ogKEICAgICYhMz5hwE%7CCgwIv9uN5QUQiJG7ygI%7C?hl=id","Tempat nyaman pokok e vintage...menu komplit"
"Pesta Keboen Restoran","https://www.google.com/maps/search/?api=1&query=Pesta%20Keboen%20Restoran&query_place_id=ChIJQ2Mc7meLcC4RXm4PJgP1pZA","5","Dessy Yunita Dewi","https://www.google.com/maps/reviews/data=!4m8!14m7!1m6!2m5!1sChdDSUhNMG9nS0VJQ0FnSURFeHNEc3BnRRAB!2m1!1s0x0:0x90a5f503260f6e5e!3m1!1s2@1:CIHM0ogKEICAgIDExsDspgE%7CCgwIpMmo6AUQgKDXlAE%7C?hl=id","Makanannya enak, tempatnya bagus, untuk foto2 juga bagus, nyaman."
"Pesta Keboen Restoran","https://www.google.com/maps/search/?api=1&query=Pesta%20Keboen%20Restoran&query_place_id=ChIJQ2Mc7meLcC4RXm4PJgP1pZA","5","Floriawan Wibowo","https://www.google.com/maps/reviews/data=!4m8!14m7!1m6!2m5!1sChdDSUhNMG9nS0VJQ0FnSUN4c3NDM2xRRRAB!2m1!1s0x0:0x90a5f503260f6e5e!3m1!1s2@1:CIHM0ogKEICAgICxssC3lQE%7CCgsIvsWDowYQsP7tOw%7C?hl=id","Makanan nya enak, harga wajar..
Ayam asapppp nya Uenakkk tenannn..
Gurami bakar madu jg enak..
Suasana nyaman.. pelayanan cepat, tanggap..
Ada Live music nya, tapi suara ga berisik.. Sound nya bagus.. 👍👍"
"Pesta Keboen Restoran","https://www.google.com/maps/search/?api=1&query=Pesta%20Keboen%20Restoran&query_place_id=ChIJQ2Mc7meLcC4RXm4PJgP1pZA","5","Aridya Pryahita Yanuandari","https://www.google.com/maps/reviews/data=!4m8!14m7!1m6!2m5!1sChZDSUhNMG9nS0VJQ0FnSURSdzh2UWFBEAE!2m1!1s0x0:0x90a5f503260f6e5e!3m1!1s2@1:CIHM0ogKEICAgIDRw8vQaA%7CCgsI37bEogYQoNudQw%7C?hl=id","Restonya unik dalamnya banyak barang kuno, masakannya enak"
"Pesta Keboen Restoran","https://www.google.com/maps/search/?api=1&query=Pesta%20Keboen%20Restoran&query_place_id=ChIJQ2Mc7meLcC4RXm4PJgP1pZA","5","norce yo","https://www.google.com/maps/reviews/data=!4m8!14m7!1m6!2m5!1sChZDSUhNMG9nS0VJQ0FnSUNZdktfN2V3EAE!2m1!1s0x0:0x90a5f503260f6e5e!3m1!1s2@1:CIHM0ogKEICAgICYvK_7ew%7CCgwI2e2m5QUQwJTGlAE%7C?hl=id","Menu makanan di Pesta keboen Semarang, lumayan enak²"
"Pesta Keboen Restoran","https://www.google.com/maps/search/?api=1&query=Pesta%20Keboen%20Restoran&query_place_id=ChIJQ2Mc7meLcC4RXm4PJgP1pZA","5","Sam Ito","https://www.google.com/maps/reviews/data=!4m8!14m7!1m6!2m5!1sChdDSUhNMG9nS0VJQ0FnSUNMMGF2RW93RRAB!2m1!1s0x0:0x90a5f503260f6e5e!3m1!1s2@1:CIHM0ogKEICAgICL0avEowE%7CCgsI9-3PswYQ0Lf1Gg%7C?hl=id","Makanan enak dan tempat nyaman  apalagi buat keluarga dan furnitur nya cantik buat foto sama pelayanan good servis dengan mas cristoper"
"Pesta Keboen Restoran","https://www.google.com/maps/search/?api=1&query=Pesta%20Keboen%20Restoran&query_place_id=ChIJQ2Mc7meLcC4RXm4PJgP1pZA","5","Lutfi Hermawan","https://www.google.com/maps/reviews/data=!4m8!14m7!1m6!2m5!1sCi9DQUlRQUNvZENodHljRjlvT21nNFRGVklNbVJVVmxOQ09HZG5TMU5sUlhKNllXYxAB!2m1!1s0x0:0x90a5f503260f6e5e!3m1!1s2@1:CAIQACodChtycF9oOmg4TFVIMmRUVlNCOGdnS1NlRXJ6YWc%7C0cLbUkbGtkD%7C?hl=id","makanan enak, tempat nyaman"
"Pesta Keboen Restoran","https://www.google.com/maps/search/?api=1&query=Pesta%20Keboen%20Restoran&query_place_id=ChIJQ2Mc7meLcC4RXm4PJgP1pZA","5","andin af","https://www.google.com/maps/reviews/data=!4m8!14m7!1m6!2m5!1sChdDSUhNMG9nS0VJQ0FnSUNDLV9MOTRRRRAB!2m1!1s0x0:0x90a5f503260f6e5e!3m1!1s2@1:CIHM0ogKEICAgICC-_L94QE%7CCgwI_JDN-gUQ6P2cpgM%7C?hl=id","Quiet place,pelayanan kurang murah senyum tp sopan,makanan enak porsi besar,harga mahal tp ya worth it lah,menu nya pake ejaan lama,ada di ponggir jalan raya jadi mudah tetlihat ya,untuk pandemi gini kebersihanya juara double check dan pake diinfektan juga,ada timbangan kuno yang masih akurat dong,cumq untuk garden panas ya bikin saya keringetan haha ealaupun udah milih deket mini blower,kamar mandi bau pesing tapi bersih."
"Pesta Keboen Restoran","https://www.google.com/maps/search/?api=1&query=Pesta%20Keboen%20Restoran&query_place_id=ChIJQ2Mc7meLcC4RXm4PJgP1pZA","5","Yuli Asnanik","https://www.google.com/maps/reviews/data=!4m8!14m7!1m6!2m5!1sChdDSUhNMG9nS0VJQ0FnSUNUc3M3a3dBRRAB!2m1!1s0x0:0x90a5f503260f6e5e!3m1!1s2@1:CIHM0ogKEICAgICTss7kwAE%7CCgwIv92FsgYQ-OLXpAE%7C?hl=id","Kerennn suasana dan makanannya 🙏"
"Pesta Keboen Restoran","https://www.google.com/maps/search/?api=1&query=Pesta%20Keboen%20Restoran&query_place_id=ChIJQ2Mc7meLcC4RXm4PJgP1pZA","5","Bruce Zack Eugene Hurip","https://www.google.com/maps/reviews/data=!4m8!14m7!1m6!2m5!1sCi9DQUlRQUNvZENodHljRjlvT2xoWU0wVXlSV1ZIZUUwelprOVhhVWxTZERGWlRtYxAB!2m1!1s0x0:0x90a5f503260f6e5e!3m1!1s2@1:CAIQACodChtycF9oOlhYM0UyRWVHeE0zZk9XaUlSdDFZTmc%7C0cHfHUHEwDL%7C?hl=id","Tempat nya bagus.. Estetik, nyaman.."
"Pesta Keboen Restoran","https://www.google.com/maps/search/?api=1&query=Pesta%20Keboen%20Restoran&query_place_id=ChIJQ2Mc7meLcC4RXm4PJgP1pZA","5","Angela Verani","https://www.google.com/maps/reviews/data=!4m8!14m7!1m6!2m5!1sChZDSUhNMG9nS0VJQ0FnSURBbkpYV05REAE!2m1!1s0x0:0x90a5f503260f6e5e!3m1!1s2@1:CIHM0ogKEICAgIDAnJXWNQ%7CCgsI_rvt1AUQwK_MEg%7C?hl=id","Lokasi'nya strategis, di depan ada taman indah dihias lampu dan lampion untuk berfoto... Ruangan di dalam'nya suasana jadul dan di belakang ada taman untuk berfoto, jangan lupa untuk mencicipi jajanan masa lampau yang ditawarkan disana... dijamin nostalgiaa... 😍👍"
"Pesta Keboen Restoran","https://www.google.com/maps/search/?api=1&query=Pesta%20Keboen%20Restoran&query_place_id=ChIJQ2Mc7meLcC4RXm4PJgP1pZA","5","Harun Al Rasyid","https://www.google.com/maps/reviews/data=!4m8!14m7!1m6!2m5!1sChZDSUhNMG9nS0VJQ0FnSUNpaXNPckV3EAE!2m1!1s0x0:0x90a5f503260f6e5e!3m1!1s2@1:CIHM0ogKEICAgICiisOrEw%7CCgwIk5nl_AUQgJu-jAI%7C?hl=id","Tempatnya bersih dan rapi. ketika saya datang sangat memperhatikan protokol kesehatan, ada sensor panas tubuh dan desinfektan sprayer.

Makanan enak dan cukup beragam. Hanya saja kalau kesini pakailah busana casual agar tidak kepanasan."
"Pesta Keboen Restoran","https://www.google.com/maps/search/?api=1&query=Pesta%20Keboen%20Restoran&query_place_id=ChIJQ2Mc7meLcC4RXm4PJgP1pZA","5","Indra Ilyas","https://www.google.com/maps/reviews/data=!4m8!14m7!1m6!2m5!1sChdDSUhNMG9nS0VJQ0FnSUNRNXNyZzNnRRAB!2m1!1s0x0:0x90a5f503260f6e5e!3m1!1s2@1:CIHM0ogKEICAgICQ5srg3gE%7CCgwIz6bo2gUQgPjOowM%7C?hl=id","Gak pernah bosan makan di sini, suasana dan pelayanannya luar biasa. Hidangannya beragam dan enak, harganya pun cukup terjangkau. Tapi entah kenapa, pajangan vintage yang dulu mengesankan, sekarang jadi tampak penuh, mungkin karena kebanyakan ya. Penataannya pun jadi mirip etalase, tidak seperti pajangan rumahan yang alami."
