"title","url","stars","name","reviewUrl","text"
"Warung Bakaran Pleburan","https://www.google.com/maps/search/?api=1&query=Warung%20Bakaran%20Pleburan&query_place_id=ChIJvV8Hx2GLcC4RlzSBBGk_yfA","5","Romantika Kusuma","https://www.google.com/maps/reviews/data=!4m8!14m7!1m6!2m5!1sCi9DQUlRQUNvZENodHljRjlvT2tSbE1IWlFWbWRLY1VwNmFVMXBhMjlXWkU5MGNXYxAB!2m1!1s0x0:0xf0c93f6904813497!3m1!1s2@1:CAIQACodChtycF9oOkRlMHZQVmdKcUp6aU1pa29WZE90cWc%7C0d4FDHOaJVw%7C?hl=id","Warung langganan sejak zaman kuliah
Selalu mampir kesini kalau lagi di semarang
Penjualnya mirip dul"
"Warung Bakaran Pleburan","https://www.google.com/maps/search/?api=1&query=Warung%20Bakaran%20Pleburan&query_place_id=ChIJvV8Hx2GLcC4RlzSBBGk_yfA","5","Sri Redjeki","https://www.google.com/maps/reviews/data=!4m8!14m7!1m6!2m5!1sChdDSUhNMG9nS0VJQ0FnSUNtblpIMHZnRRAB!2m1!1s0x0:0xf0c93f6904813497!3m1!1s2@1:CIHM0ogKEICAgICmnZH0vgE%7CCgwI37bbjgYQiOHt6AI%7C?hl=id","Anak Undip mana suaraaanyaaa? Klangenan number #1
Cuma ada disini gorengan di cemplungin ke kuah baceman - bakar - celupin - bakar lagiii, meresapp rasanya! Terbaik!!

Nasi Rames, Nasi Bakar, aneka sate"
"Warung Bakaran Pleburan","https://www.google.com/maps/search/?api=1&query=Warung%20Bakaran%20Pleburan&query_place_id=ChIJvV8Hx2GLcC4RlzSBBGk_yfA","5","Ardian Murdianto","https://www.google.com/maps/reviews/data=!4m8!14m7!1m6!2m5!1sChdDSUhNMG9nS0VJQ0FnSURJb2YyYnZnRRAB!2m1!1s0x0:0xf0c93f6904813497!3m1!1s2@1:CIHM0ogKEICAgIDIof2bvgE%7CCgwIorPR4QUQqKbjrwE%7C?hl=id","Yeay! Warung bakaran Pleburan! Tempat yang asik dengan bakarannya, mulai dari tempe mendoan hingga sate, kalau favorit saya itu sate kulit plus sambelnya dan nasi hangat! Itu jossss sekali! Dan selain itu ada nasi bakar, nasi rames (campur) ataupun soto. Komplit pokoknya!

Oiya warung ini bukanya diatas jam 6 malam, dijalan kampung Pleburan! Dan jangan heran kalau pas sampai sana ramai ya! Karena ini memang enak sekali!

Untuk harga persate sekitar 3 ribu, karena kalau kesana pasti pesannya sate kulit jadi tahunya cuma harga satenya saja. Hehe. Dan sambalnya itu lho bikin nambah jossss!

Warung Bakaran Pleburan Semarang memang joss!"
"Warung Bakaran Pleburan","https://www.google.com/maps/search/?api=1&query=Warung%20Bakaran%20Pleburan&query_place_id=ChIJvV8Hx2GLcC4RlzSBBGk_yfA","5","Renren’s","https://www.google.com/maps/reviews/data=!4m8!14m7!1m6!2m5!1sChZDSUhNMG9nS0VJQ0FnSUNlM2ZMZUhBEAE!2m1!1s0x0:0xf0c93f6904813497!3m1!1s2@1:CIHM0ogKEICAgICe3fLeHA%7CCgsIn5usmQYQ4OqNFg%7C?hl=id","Bakaran ter-debes di Semarang. Nasi bakarnya enak bgtt, nasi ramesnya juga enakk, apalagi sate kulitnyaaaaa wahh 10/10 gilsss. Sambelnya debesss parah
Harga mulai naik dari semenjak minyak naik, bensin naik. Beberapa ada yg naik tapi masih tetep terjangkau yaaa.
All menu ga ada yg di atas 10rb.
Kalo makan bisa bikin kalappp karena ga kerasa tetau dah ngambil sate banyak😋🤣"
"Warung Bakaran Pleburan","https://www.google.com/maps/search/?api=1&query=Warung%20Bakaran%20Pleburan&query_place_id=ChIJvV8Hx2GLcC4RlzSBBGk_yfA","5","Vany Citra Nabila","https://www.google.com/maps/reviews/data=!4m8!14m7!1m6!2m5!1sChdDSUhNMG9nS0VJQ0FnSUNmcWFlLXFBRRAB!2m1!1s0x0:0xf0c93f6904813497!3m1!1s2@1:CIHM0ogKEICAgICfqae-qAE%7CCgwI-5XKuwYQqOqA9gE%7C?hl=id","Ini aku udah cari2 dari beberapa tahun baru ketemu lagi, ternyata udh pindah dirumah rasanya tetep enaaakkk ga berubaah"
"Warung Bakaran Pleburan","https://www.google.com/maps/search/?api=1&query=Warung%20Bakaran%20Pleburan&query_place_id=ChIJvV8Hx2GLcC4RlzSBBGk_yfA","5","yawnzzzn __","https://www.google.com/maps/reviews/data=!4m8!14m7!1m6!2m5!1sChZDSUhNMG9nS0VJQ0FnSUNzak9LX2V3EAE!2m1!1s0x0:0xf0c93f6904813497!3m1!1s2@1:CIHM0ogKEICAgICsjOK_ew%7CCgsIoICq8QUQyI7rYw%7C?hl=id","Warung angkringan yang selalu ramai, setiap beli makan di sini pasti antre. Disini makanannya enak dan murah cocok buat mahasiswa. Ada berbagai macam gorengan, tahu tempe bacem, ceker, kepala ayam, sate usus ayam, sate kulit ayam dan masih banyak lagi. Ada juga nasi rames, soto ayam, dan nasi bakar. Patut di coba kalau lagi main ke Semarang"
"Warung Bakaran Pleburan","https://www.google.com/maps/search/?api=1&query=Warung%20Bakaran%20Pleburan&query_place_id=ChIJvV8Hx2GLcC4RlzSBBGk_yfA","5","Chrisma Wibowo","https://www.google.com/maps/reviews/data=!4m8!14m7!1m6!2m5!1sChdDSUhNMG9nS0VJQ0FnSUNJaWNxXy1BRRAB!2m1!1s0x0:0xf0c93f6904813497!3m1!1s2@1:CIHM0ogKEICAgICIicq_-AE%7CCgwIkfza3wUQxuuYzwM%7C?hl=id","Angkringan favorit saya setiap ke Semarang. Rasanya manis, sedep dan sambalnya pedas terasa

Pilihan andalan saya: ceker, sate kulit, mendoan, nasi bakar

Daaaaan harganya bikin ngangenin"
"Warung Bakaran Pleburan","https://www.google.com/maps/search/?api=1&query=Warung%20Bakaran%20Pleburan&query_place_id=ChIJvV8Hx2GLcC4RlzSBBGk_yfA","5","Andita Nurhandayani","https://www.google.com/maps/reviews/data=!4m8!14m7!1m6!2m5!1sChdDSUhNMG9nS0VJQ0FnSURJbGE3enZBRRAB!2m1!1s0x0:0xf0c93f6904813497!3m1!1s2@1:CIHM0ogKEICAgIDIla7zvAE%7CCgwI6Yjw4QUQ0IXapwM%7C?hl=id","ini enak bgt, lengkap. dari gorengan, sate, ayam, kepala, ceker, ati, rempelo, kulit, nasi bakar, soto, rames, semua enak. sambel.a juarak!"
"Warung Bakaran Pleburan","https://www.google.com/maps/search/?api=1&query=Warung%20Bakaran%20Pleburan&query_place_id=ChIJvV8Hx2GLcC4RlzSBBGk_yfA","5","An Widi17","https://www.google.com/maps/reviews/data=!4m8!14m7!1m6!2m5!1sChZDSUhNMG9nS0VJQ0FnSUNvaWY3UlJBEAE!2m1!1s0x0:0xf0c93f6904813497!3m1!1s2@1:CIHM0ogKEICAgICoif7RRA%7CCgwIq4C24wUQqLDFoAE%7C?hl=id","Awalnya tempat  fav nya temen. Eh aku jadi ikut suka.  Tp agak mahal dikit . .Recommended 😍😀"
"Warung Bakaran Pleburan","https://www.google.com/maps/search/?api=1&query=Warung%20Bakaran%20Pleburan&query_place_id=ChIJvV8Hx2GLcC4RlzSBBGk_yfA","5","Scholastica Yunita","https://www.google.com/maps/reviews/data=!4m8!14m7!1m6!2m5!1sChdDSUhNMG9nS0VJQ0FnSUQta3UzcTZ3RRAB!2m1!1s0x0:0xf0c93f6904813497!3m1!1s2@1:CIHM0ogKEICAgID-ku3q6wE%7CCgsIuryDnAYQsJy9SA%7C?hl=id","a grill stall which is located narrowly behind the house in a small alley. The price, in my opinion, is quite cheap for college kids, so don't be afraid of the prices there. The grilled rice is okay, the various satay are also okay, the fried food is also okay because everything is grilled before serving. You can give it a try if you want something different
Warung bakaran yang terletak dibelakang rumah orang lewat jalan sempit. Harga menurut saya murah karena harga anak kuliah jadi jangan takut dengan harga disitu. Nasi bakar oke, macam-macam sate juga oke, gorengan juga oke karena semua dibakar dulu sebelum disajikan. Anda bisa mencobanya jika ingin sesuatu yang berbeda"
"Warung Bakaran Pleburan","https://www.google.com/maps/search/?api=1&query=Warung%20Bakaran%20Pleburan&query_place_id=ChIJvV8Hx2GLcC4RlzSBBGk_yfA","5","Iguh Dhira","https://www.google.com/maps/reviews/data=!4m8!14m7!1m6!2m5!1sChZDSUhNMG9nS0VJQ0FnSURNcXB6bVJBEAE!2m1!1s0x0:0xf0c93f6904813497!3m1!1s2@1:CIHM0ogKEICAgIDMqpzmRA%7CCgsIqr6Q8AUQ0MLbWQ%7C?hl=id","Terkenal dengan bakaran anaknya Ahmad Dhani karena mas penjualnya mirip sekali dengan anaknya Ahmad Dhani. Makanan yang dibakar enak-enak, nasi bakarnya jg enak. Harga masih terjangkau. Sayangnya untuk parkiran cukup sempit dikarenakan lokasinya terletak di tengah2 lingkungan perumahan yang padat."
"Warung Bakaran Pleburan","https://www.google.com/maps/search/?api=1&query=Warung%20Bakaran%20Pleburan&query_place_id=ChIJvV8Hx2GLcC4RlzSBBGk_yfA","5","Asami Nini","https://www.google.com/maps/reviews/data=!4m8!14m7!1m6!2m5!1sChdDSUhNMG9nS0VJQ0FnSUNTcUozQTVRRRAB!2m1!1s0x0:0xf0c93f6904813497!3m1!1s2@1:CIHM0ogKEICAgICSqJ3A5QE%7CCgwIhJHd_gUQgKCo9AI%7C?hl=id","Ya Allah bunnnn bakaran di sini tu enak banget. Gorengan dan sate nya ada macem2 jenis bisa milih sesuai selera. Harganya juga murah bun 20k udh dpt minum, nasi, sama sate2 nya buunnnnn. Apalagi kalo hujan2 makan ke sini behhhh masyaallah bunnnn. Nah kannnn ngene iki malah marai kudu reng bakaran maem sate jantung😭😭😭😭😭"
"Warung Bakaran Pleburan","https://www.google.com/maps/search/?api=1&query=Warung%20Bakaran%20Pleburan&query_place_id=ChIJvV8Hx2GLcC4RlzSBBGk_yfA","5","daily eat & wanderlust","https://www.google.com/maps/reviews/data=!4m8!14m7!1m6!2m5!1sChZDSUhNMG9nS0VJQ0FnSUNLellIdktnEAE!2m1!1s0x0:0xf0c93f6904813497!3m1!1s2@1:CIHM0ogKEICAgICKzYHvKg%7CCgsI69LbgwYQ6MW-HA%7C?hl=id","Angkringan paling enak di semarang, nasi bakar, gorengan bakar, sate bakar. Kesini sudah puluhan kali, cita rasa tetap sama, tempat semakin baik. Sukses selalu mas dan sejat selalu, pertahankan esklusifitas untjk tidak buka cabang, nilai 9/10."
"Warung Bakaran Pleburan","https://www.google.com/maps/search/?api=1&query=Warung%20Bakaran%20Pleburan&query_place_id=ChIJvV8Hx2GLcC4RlzSBBGk_yfA","5","Yoghi Raditya","https://www.google.com/maps/reviews/data=!4m8!14m7!1m6!2m5!1sChdDSUhNMG9nS0VJQ0FnSUNNaGVQLXd3RRAB!2m1!1s0x0:0xf0c93f6904813497!3m1!1s2@1:CIHM0ogKEICAgICMheP-wwE%7CCgsI6Oz57gUQgKXFVA%7C?hl=id","Legenda, karena abangnya mirip bang Dul anaknya ahmad dhani 😬"
"Warung Bakaran Pleburan","https://www.google.com/maps/search/?api=1&query=Warung%20Bakaran%20Pleburan&query_place_id=ChIJvV8Hx2GLcC4RlzSBBGk_yfA","5","Amalia Fauzia","https://www.google.com/maps/reviews/data=!4m8!14m7!1m6!2m5!1sChZDSUhNMG9nS0VJQ0FnSURJenN5R1FREAE!2m1!1s0x0:0xf0c93f6904813497!3m1!1s2@1:CIHM0ogKEICAgIDIzsyGQQ%7CCgwIhqDA4QUQjcOTvgM%7C?hl=id","Ga nyangka tempatnya sederhana tapi enak dan murah, wajib coba sate kulit ayamnya, nasi bakar 1 gak cukup ya.. sambelnya pedes enak agak tp dijatah karna harus berbagi bagi lah ya sama pelanggan lain, tapi tetep recommended!"
"Warung Bakaran Pleburan","https://www.google.com/maps/search/?api=1&query=Warung%20Bakaran%20Pleburan&query_place_id=ChIJvV8Hx2GLcC4RlzSBBGk_yfA","5","Sella Atinandya","https://www.google.com/maps/reviews/data=!4m8!14m7!1m6!2m5!1sChZDSUhNMG9nS0VJQ0FnTUNndHZXOVlnEAE!2m1!1s0x0:0xf0c93f6904813497!3m1!1s2@1:CIHM0ogKEICAgMCgtvW9Yg%7CCgwIseHKvQYQ2IOQpAI%7C?hl=id","Bakaran paling fenomenal dipleburan. Nasi bakar, nasi rame, gorengan bisa dibakar, sate. Ati2 kalap kyk akuuhh"
"Warung Bakaran Pleburan","https://www.google.com/maps/search/?api=1&query=Warung%20Bakaran%20Pleburan&query_place_id=ChIJvV8Hx2GLcC4RlzSBBGk_yfA","5","Daras Fevicha","https://www.google.com/maps/reviews/data=!4m8!14m7!1m6!2m5!1sCi9DQUlRQUNvZENodHljRjlvT21aRmIxRmhSMGxvV1hObFJ6Vm1kQzB3WW1wbGFrRRAB!2m1!1s0x0:0xf0c93f6904813497!3m1!1s2@1:CAIQACodChtycF9oOmZFb1FhR0loWXNlRzVmdC0wYmplakE%7C0cwPxeFLVy1%7C?hl=id","Sambal dan bakarannya kangenin 🔥👌"
"Warung Bakaran Pleburan","https://www.google.com/maps/search/?api=1&query=Warung%20Bakaran%20Pleburan&query_place_id=ChIJvV8Hx2GLcC4RlzSBBGk_yfA","5","A. Anugrahni","https://www.google.com/maps/reviews/data=!4m8!14m7!1m6!2m5!1sChZDSUhNMG9nS0VJQ0FnSURHcmRXTlZBEAE!2m1!1s0x0:0xf0c93f6904813497!3m1!1s2@1:CIHM0ogKEICAgIDGrdWNVA%7CCgsIzMy3jQYQiNK2BQ%7C?hl=id","Nasi bakarnya joss!!! Banyak pilihan gorengan dan aneka sate yang bisa request dibakar ulang dengan kecap biar rasanya makin jos! Ada sambal cocolannya juga. Mantap. Harga murah meriah 👍"
"Warung Bakaran Pleburan","https://www.google.com/maps/search/?api=1&query=Warung%20Bakaran%20Pleburan&query_place_id=ChIJvV8Hx2GLcC4RlzSBBGk_yfA","5","Clara Gamesindo","https://www.google.com/maps/reviews/data=!4m8!14m7!1m6!2m5!1sChdDSUhNMG9nS0VJQ0FnSUNNMTQ2czJRRRAB!2m1!1s0x0:0xf0c93f6904813497!3m1!1s2@1:CIHM0ogKEICAgICM146s2QE%7CCgsIrYy57wUQoIyQXg%7C?hl=id","Bakaran pling enak yg prnh sy temui"
"Warung Bakaran Pleburan","https://www.google.com/maps/search/?api=1&query=Warung%20Bakaran%20Pleburan&query_place_id=ChIJvV8Hx2GLcC4RlzSBBGk_yfA","5","Moch Syafrizal Azhar","https://www.google.com/maps/reviews/data=!4m8!14m7!1m6!2m5!1sChZDSUhNMG9nS0VJQ0FnSURlNHMtNEdREAE!2m1!1s0x0:0xf0c93f6904813497!3m1!1s2@1:CIHM0ogKEICAgIDe4s-4GQ%7CCgwIgqT6mQYQ8PCfkgI%7C?hl=id","Tidak usah diragukan lagi. Ini seperti hidden gem, karena tempatnya yang kedalam tetapi selalu ramai karena harga yang bersahabat. Disini juga tersedia kos"
"Warung Bakaran Pleburan","https://www.google.com/maps/search/?api=1&query=Warung%20Bakaran%20Pleburan&query_place_id=ChIJvV8Hx2GLcC4RlzSBBGk_yfA","5","anjas yanuar nugraha","https://www.google.com/maps/reviews/data=!4m8!14m7!1m6!2m5!1sChZDSUhNMG9nS0VJQ0FnSURZMDRfUEF3EAE!2m1!1s0x0:0xf0c93f6904813497!3m1!1s2@1:CIHM0ogKEICAgIDY04_PAw%7CCgwI85WS5wUQkI2Q7gE%7C?hl=id","Warung kucingan yang berbeda pada umumnya karena lauk yg ingin dimakan dibakar dahulu agar menambah nikmat rasa."
"Warung Bakaran Pleburan","https://www.google.com/maps/search/?api=1&query=Warung%20Bakaran%20Pleburan&query_place_id=ChIJvV8Hx2GLcC4RlzSBBGk_yfA","5","Prayogi Nugraha Taunay (Yogi)","https://www.google.com/maps/reviews/data=!4m8!14m7!1m6!2m5!1sChZDSUhNMG9nS0VJQ0FnSUNva0plbGZ3EAE!2m1!1s0x0:0xf0c93f6904813497!3m1!1s2@1:CIHM0ogKEICAgICokJelfw%7CCgwIrL7O4gUQj6e6ngM%7C?hl=id","Tempat memang kurang luas, cuma bisa menampung beberapa, jd kadang harus antri, tp sensasi rasanya hmmm top markotop"
"Warung Bakaran Pleburan","https://www.google.com/maps/search/?api=1&query=Warung%20Bakaran%20Pleburan&query_place_id=ChIJvV8Hx2GLcC4RlzSBBGk_yfA","5","Idha Larasati","https://www.google.com/maps/reviews/data=!4m8!14m7!1m6!2m5!1sChZDSUhNMG9nS0VJQ0FnSURDM3NDcmVnEAE!2m1!1s0x0:0xf0c93f6904813497!3m1!1s2@1:CIHM0ogKEICAgIDC3sCreg%7CCgsIrbXH-wUQ2NvqHg%7C?hl=id","Bakaran sekarang pindah di belakang masjid ada pamletnya ikutin aja panahnya, rasa masih sama harga masih sama enak bangeeeetttttt mau meninggoy"
"Warung Bakaran Pleburan","https://www.google.com/maps/search/?api=1&query=Warung%20Bakaran%20Pleburan&query_place_id=ChIJvV8Hx2GLcC4RlzSBBGk_yfA","5","emillia chandra","https://www.google.com/maps/reviews/data=!4m8!14m7!1m6!2m5!1sChdDSUhNMG9nS0VJQ0FnSUNvd1BDRmxBRRAB!2m1!1s0x0:0xf0c93f6904813497!3m1!1s2@1:CIHM0ogKEICAgICowPCFlAE%7CCgwI-LzG4gUQ6Mi7xAI%7C?hl=id","Rasa enak, harga bersahabat, pnjual ramah, tp rame banget, jd ssh dpt tempat duduk."
"Warung Bakaran Pleburan","https://www.google.com/maps/search/?api=1&query=Warung%20Bakaran%20Pleburan&query_place_id=ChIJvV8Hx2GLcC4RlzSBBGk_yfA","5","surya ramadhana","https://www.google.com/maps/reviews/data=!4m8!14m7!1m6!2m5!1sChZDSUhNMG9nS0VJQ0FnSUN4Z3BMX1lnEAE!2m1!1s0x0:0xf0c93f6904813497!3m1!1s2@1:CIHM0ogKEICAgICxgpL_Yg%7CCgwIj-P9ogYQwMSW8gE%7C?hl=id","Letaknya memang tersembunyi, tapi rasanya juara. Makanan dibumbui sebelum di bakar. Menu rekomended: nasi bakar dan bakwan/mendoan bakar"
"Warung Bakaran Pleburan","https://www.google.com/maps/search/?api=1&query=Warung%20Bakaran%20Pleburan&query_place_id=ChIJvV8Hx2GLcC4RlzSBBGk_yfA","5","Rheza Rahadiyan","https://www.google.com/maps/reviews/data=!4m8!14m7!1m6!2m5!1sChdDSUhNMG9nS0VJQ0FnSUNzazdieXdRRRAB!2m1!1s0x0:0xf0c93f6904813497!3m1!1s2@1:CIHM0ogKEICAgICsk7bywQE%7CCgwI-t2T8gUQoJTQowM%7C?hl=id","Bakaran paling favourite di semarang kota, makanan nya enak, harga murah.
Buka dari jam 5 sore"
"Warung Bakaran Pleburan","https://www.google.com/maps/search/?api=1&query=Warung%20Bakaran%20Pleburan&query_place_id=ChIJvV8Hx2GLcC4RlzSBBGk_yfA","5","marita prasetyani","https://www.google.com/maps/reviews/data=!4m8!14m7!1m6!2m5!1sChZDSUhNMG9nS0VJQ0FnSUNBX19lS1B3EAE!2m1!1s0x0:0xf0c93f6904813497!3m1!1s2@1:CIHM0ogKEICAgICA__eKPw%7CCgwI1e2t3QUQmJX_gQM%7C?hl=id","Menu banyak dari gorengan ayam ati usus bacem dll. Ada nasi rames dan nasi bakar... Rame setwlah magrib.."
"Warung Bakaran Pleburan","https://www.google.com/maps/search/?api=1&query=Warung%20Bakaran%20Pleburan&query_place_id=ChIJvV8Hx2GLcC4RlzSBBGk_yfA","5","Ventti Munif","https://www.google.com/maps/reviews/data=!4m8!14m7!1m6!2m5!1sChdDSUhNMG9nS0VJQ0FnSUNJdzZYVDRnRRAB!2m1!1s0x0:0xf0c93f6904813497!3m1!1s2@1:CIHM0ogKEICAgICIw6XT4gE%7CCgwI9tGX4AUQlpOAygM%7C?hl=id","Mendoan bakar juara👍👍parkir mobil pinggir rumah warga. Nasi bakarnya juaraaaa👍👍👍pilihan gorengan/sate untuk bakaran banyak. Harga jg murah"
"Warung Bakaran Pleburan","https://www.google.com/maps/search/?api=1&query=Warung%20Bakaran%20Pleburan&query_place_id=ChIJvV8Hx2GLcC4RlzSBBGk_yfA","5","EKJ Entertainment","https://www.google.com/maps/reviews/data=!4m8!14m7!1m6!2m5!1sChZDSUhNMG9nS0VJQ0FnSUNVamI3WEJ3EAE!2m1!1s0x0:0xf0c93f6904813497!3m1!1s2@1:CIHM0ogKEICAgICUjb7XBw%7CCgwIyY2H6gUQ-Kzf0QE%7C?hl=id","Muantap
Mendoan bakar Rp.1000
+
Sambal dan nasi
Uenak tenan anget !
Salam dari Aniek Rosella bp.DARMANTO"
"Warung Bakaran Pleburan","https://www.google.com/maps/search/?api=1&query=Warung%20Bakaran%20Pleburan&query_place_id=ChIJvV8Hx2GLcC4RlzSBBGk_yfA","5","Putri Kenanga","https://www.google.com/maps/reviews/data=!4m8!14m7!1m6!2m5!1sChdDSUhNMG9nS0VJQ0FnSUM5azhHNzF3RRAB!2m1!1s0x0:0xf0c93f6904813497!3m1!1s2@1:CIHM0ogKEICAgIC9k8G71wE%7CCgsIhNSwrwYQyJbRTw%7C?hl=id","Ini legen, dr tahun 2008 saya kuliah tetep konsisten jualan bakaran yg enak"
"Warung Bakaran Pleburan","https://www.google.com/maps/search/?api=1&query=Warung%20Bakaran%20Pleburan&query_place_id=ChIJvV8Hx2GLcC4RlzSBBGk_yfA","5","C. Hardiani Puspita","https://www.google.com/maps/reviews/data=!4m8!14m7!1m6!2m5!1sChdDSUhNMG9nS0VJQ0FnSUN3MXQ2UTBBRRAB!2m1!1s0x0:0xf0c93f6904813497!3m1!1s2@1:CIHM0ogKEICAgICw1t6Q0AE%7CCgwIte6p0QUQwLLoqQM%7C?hl=id","Harga kaki lama rasa bintang lima,terbaeg dr aku pertama kali makan disini 2012"
"Warung Bakaran Pleburan","https://www.google.com/maps/search/?api=1&query=Warung%20Bakaran%20Pleburan&query_place_id=ChIJvV8Hx2GLcC4RlzSBBGk_yfA","5","Vera Trg","https://www.google.com/maps/reviews/data=!4m8!14m7!1m6!2m5!1sChZDSUhNMG9nS0VJQ0FnSUNzeXRxV2ZREAE!2m1!1s0x0:0xf0c93f6904813497!3m1!1s2@1:CIHM0ogKEICAgICsytqWfQ%7CCgwIkcHB8QUQqIus5AE%7C?hl=id","Selalu rame,ngantri karena tempat duduk terbatas..rasa enak n harga terjangkau"
"Warung Bakaran Pleburan","https://www.google.com/maps/search/?api=1&query=Warung%20Bakaran%20Pleburan&query_place_id=ChIJvV8Hx2GLcC4RlzSBBGk_yfA","5","Justinus Cahyo","https://www.google.com/maps/reviews/data=!4m8!14m7!1m6!2m5!1sChdDSUhNMG9nS0VJQ0FnSURZejU3dzJ3RRAB!2m1!1s0x0:0xf0c93f6904813497!3m1!1s2@1:CIHM0ogKEICAgIDYz57w2wE%7CCgwIm4aw5wUQyNeU5AI%7C?hl=id","lezat,  banyak pilihan menu untuk dibakar, yg jual kayak dul, anaknya ahmad dhani."
"Warung Bakaran Pleburan","https://www.google.com/maps/search/?api=1&query=Warung%20Bakaran%20Pleburan&query_place_id=ChIJvV8Hx2GLcC4RlzSBBGk_yfA","5","Renn Ekawati","https://www.google.com/maps/reviews/data=!4m8!14m7!1m6!2m5!1sChdDSUhNMG9nS0VJQ0FnSUNZeS0tc3V3RRAB!2m1!1s0x0:0xf0c93f6904813497!3m1!1s2@1:CIHM0ogKEICAgICYy--suwE%7CCgwIu9zr5QUQ0JKy6QE%7C?hl=id","Harga ekonomis.. pilihan banyak.. yg pnya ramah.. yg punya mukanya persis kayak Doel nya Maia Estianty"
"Warung Bakaran Pleburan","https://www.google.com/maps/search/?api=1&query=Warung%20Bakaran%20Pleburan&query_place_id=ChIJvV8Hx2GLcC4RlzSBBGk_yfA","5","Fauzia Sesaria A W","https://www.google.com/maps/reviews/data=!4m8!14m7!1m6!2m5!1sChdDSUhNMG9nS0VJQ0FnSURrM2E2T3NnRRAB!2m1!1s0x0:0xf0c93f6904813497!3m1!1s2@1:CIHM0ogKEICAgIDk3a6OsgE%7CCgsIovf66AUQyPOCXw%7C?hl=id","variasi lauknya banyak, semua makanan serba bakaran, nasi bakarnya enak mantap👍"
"Warung Bakaran Pleburan","https://www.google.com/maps/search/?api=1&query=Warung%20Bakaran%20Pleburan&query_place_id=ChIJvV8Hx2GLcC4RlzSBBGk_yfA","5","Edwin Amanullah","https://www.google.com/maps/reviews/data=!4m8!14m7!1m6!2m5!1sChdDSUhNMG9nS0VJQ0FnSUR3a3FPVDhnRRAB!2m1!1s0x0:0xf0c93f6904813497!3m1!1s2@1:CIHM0ogKEICAgIDwkqOT8gE%7CCgsIz7K73gUQsOTmXA%7C?hl=id","tempat sederhana dengan bebakaran yang menggugah selera, pilihan makan malam yang hemat namun nikmat"
"Warung Bakaran Pleburan","https://www.google.com/maps/search/?api=1&query=Warung%20Bakaran%20Pleburan&query_place_id=ChIJvV8Hx2GLcC4RlzSBBGk_yfA","5","Khaerudin “Bang Udin”","https://www.google.com/maps/reviews/data=!4m8!14m7!1m6!2m5!1sChZDSUhNMG9nS0VJQ0FnSURtM2VETU1BEAE!2m1!1s0x0:0xf0c93f6904813497!3m1!1s2@1:CIHM0ogKEICAgIDm3eDMMA%7CCgwItqf_jwYQ0O62mAE%7C?hl=id","Mantap ..menunya banyak dan samballnya joss  harga sesuai kantong celana"
"Warung Bakaran Pleburan","https://www.google.com/maps/search/?api=1&query=Warung%20Bakaran%20Pleburan&query_place_id=ChIJvV8Hx2GLcC4RlzSBBGk_yfA","5","Devi Nurita Noviana","https://www.google.com/maps/reviews/data=!4m8!14m7!1m6!2m5!1sChdDSUhNMG9nS0VJQ0FnSURROGQzZmt3RRAB!2m1!1s0x0:0xf0c93f6904813497!3m1!1s2@1:CIHM0ogKEICAgIDQ8d3fkwE%7CCgsIzv6y1gUQwL_tIQ%7C?hl=id","Favorite abis pulang kantor. Makan banyak . Harga murah . The best lah pokoknya"
"Warung Bakaran Pleburan","https://www.google.com/maps/search/?api=1&query=Warung%20Bakaran%20Pleburan&query_place_id=ChIJvV8Hx2GLcC4RlzSBBGk_yfA","5","Rijal Haidar","https://www.google.com/maps/reviews/data=!4m8!14m7!1m6!2m5!1sChZDSUhNMG9nS0VJQ0FnSUNzcVBXekxREAE!2m1!1s0x0:0xf0c93f6904813497!3m1!1s2@1:CIHM0ogKEICAgICsqPWzLQ%7CCgwIpvaW8QUQ0JKL8wI%7C?hl=id","tak tau kenapa Bakaran e enak ae, soal harga tergolong murce"
"Warung Bakaran Pleburan","https://www.google.com/maps/search/?api=1&query=Warung%20Bakaran%20Pleburan&query_place_id=ChIJvV8Hx2GLcC4RlzSBBGk_yfA","5","Vincentius Diyas Adikrisna","https://www.google.com/maps/reviews/data=!4m8!14m7!1m6!2m5!1sChdDSUhNMG9nS0VJQ0FnSUNINmZuODNnRRAB!2m1!1s0x0:0xf0c93f6904813497!3m1!1s2@1:CIHM0ogKEICAgICH6fn83gE%7CCgsI6tnrtgYQ0KrfBw%7C?hl=id","Top Markotop pokok'e 👍"
"Warung Bakaran Pleburan","https://www.google.com/maps/search/?api=1&query=Warung%20Bakaran%20Pleburan&query_place_id=ChIJvV8Hx2GLcC4RlzSBBGk_yfA","5","Rinda Dew","https://www.google.com/maps/reviews/data=!4m8!14m7!1m6!2m5!1sChdDSUhNMG9nS0VJQ0FnSURvam9LdW53RRAB!2m1!1s0x0:0xf0c93f6904813497!3m1!1s2@1:CIHM0ogKEICAgIDojoKunwE%7CCgwI2Oiv5AUQ6KK9tgI%7C?hl=id","Bakaran enak!! My favourite dish for dinner! Haha, yang jual Ahmad Dhani KW 😂"
"Warung Bakaran Pleburan","https://www.google.com/maps/search/?api=1&query=Warung%20Bakaran%20Pleburan&query_place_id=ChIJvV8Hx2GLcC4RlzSBBGk_yfA","5","Heni Rahmawati","https://www.google.com/maps/reviews/data=!4m8!14m7!1m6!2m5!1sChdDSUhNMG9nS0VJQ0FnSUMxd0w2TG53RRAB!2m1!1s0x0:0xf0c93f6904813497!3m1!1s2@1:CIHM0ogKEICAgIC1wL6LnwE%7CCgwI4oqKrAYQqIadrAM%7C?hl=id","Bakaran best ever selama di semarang
Hidden game jg"
"Warung Bakaran Pleburan","https://www.google.com/maps/search/?api=1&query=Warung%20Bakaran%20Pleburan&query_place_id=ChIJvV8Hx2GLcC4RlzSBBGk_yfA","5","elsa dwi Armaliza","https://www.google.com/maps/reviews/data=!4m8!14m7!1m6!2m5!1sChZDSUhNMG9nS0VJQ0FnSUNvX1pPMldBEAE!2m1!1s0x0:0xf0c93f6904813497!3m1!1s2@1:CIHM0ogKEICAgICo_ZO2WA%7CCgwIlJPO4wUQ6LjM9wE%7C?hl=id","Nasi bakarnya enak, harga murah dan terjangkau, selalu ramai"
"Warung Bakaran Pleburan","https://www.google.com/maps/search/?api=1&query=Warung%20Bakaran%20Pleburan&query_place_id=ChIJvV8Hx2GLcC4RlzSBBGk_yfA","5","APP Like Natalia Safitri","https://www.google.com/maps/reviews/data=!4m8!14m7!1m6!2m5!1sChZDSUhNMG9nS0VJQ0FnSUNPbklmUUVREAE!2m1!1s0x0:0xf0c93f6904813497!3m1!1s2@1:CIHM0ogKEICAgICOnIfQEQ%7CCgwIssHslAYQ4KD-uAI%7C?hl=id","Enak sih
Cuma terlau dikit porsi nasi bakarnya"
"Warung Bakaran Pleburan","https://www.google.com/maps/search/?api=1&query=Warung%20Bakaran%20Pleburan&query_place_id=ChIJvV8Hx2GLcC4RlzSBBGk_yfA","5","any saputri","https://www.google.com/maps/reviews/data=!4m8!14m7!1m6!2m5!1sChZDSUhNMG9nS0VJQ0FnSUNzdE1MdFdnEAE!2m1!1s0x0:0xf0c93f6904813497!3m1!1s2@1:CIHM0ogKEICAgICstMLtWg%7CCgsI7_Om8QUQqPzNCg%7C?hl=id","Enak banget Bakaran nya, u must try it, guys. Pasti nagieehh"
"Warung Bakaran Pleburan","https://www.google.com/maps/search/?api=1&query=Warung%20Bakaran%20Pleburan&query_place_id=ChIJvV8Hx2GLcC4RlzSBBGk_yfA","5","firdiliawan zulvi","https://www.google.com/maps/reviews/data=!4m8!14m7!1m6!2m5!1sChdDSUhNMG9nS0VJQ0FnSUR3Mm9PZHlnRRAB!2m1!1s0x0:0xf0c93f6904813497!3m1!1s2@1:CIHM0ogKEICAgIDw2oOdygE%7CCgwI1NmS3gUQoJuNhAI%7C?hl=id","Saya udah cobain makanan warung angkringan di Depok, Jakarta, Bandung, Surabaya, dan Semarang. Ini juaranya !"
"Warung Bakaran Pleburan","https://www.google.com/maps/search/?api=1&query=Warung%20Bakaran%20Pleburan&query_place_id=ChIJvV8Hx2GLcC4RlzSBBGk_yfA","5","Juniawan Widyatmaja","https://www.google.com/maps/reviews/data=!4m8!14m7!1m6!2m5!1sChZDSUhNMG9nS0VJQ0FnSUQ2MWNtMVJnEAE!2m1!1s0x0:0xf0c93f6904813497!3m1!1s2@1:CIHM0ogKEICAgID61cm1Rg%7CCgwI-Pf2igYQuN-yiwI%7C?hl=id","Jos pol ini. Bakaran terbaik. Wajib dicoba. Bakwan + Kecap trus dibakar. Kepala bakarnya. Juara pol! Sukses ya!"
"Warung Bakaran Pleburan","https://www.google.com/maps/search/?api=1&query=Warung%20Bakaran%20Pleburan&query_place_id=ChIJvV8Hx2GLcC4RlzSBBGk_yfA","5","Irwan Pramana Putra","https://www.google.com/maps/reviews/data=!4m8!14m7!1m6!2m5!1sChdDSUhNMG9nS0VJQ0FnSURJcmVHb19nRRAB!2m1!1s0x0:0xf0c93f6904813497!3m1!1s2@1:CIHM0ogKEICAgIDIreGo_gE%7CCgwInf_74QUQ-Kjx0wM%7C?hl=id","Satu satunya di semarang angkringan yg segala macam lauk dan nasi di bakar"
"Warung Bakaran Pleburan","https://www.google.com/maps/search/?api=1&query=Warung%20Bakaran%20Pleburan&query_place_id=ChIJvV8Hx2GLcC4RlzSBBGk_yfA","5","Sujono","https://www.google.com/maps/reviews/data=!4m8!14m7!1m6!2m5!1sChZDSUhNMG9nS0VJQ0FnSURJdjltRERnEAE!2m1!1s0x0:0xf0c93f6904813497!3m1!1s2@1:CIHM0ogKEICAgIDIv9mDDg%7CCgwI57HB4gUQ8b382AI%7C?hl=id","Nostalgia jaman kuliah tahun 2000. Makan di sini sampai sekarang bakarannya juaraan"
"Warung Bakaran Pleburan","https://www.google.com/maps/search/?api=1&query=Warung%20Bakaran%20Pleburan&query_place_id=ChIJvV8Hx2GLcC4RlzSBBGk_yfA","5","St4r_LOvers1","https://www.google.com/maps/reviews/data=!4m8!14m7!1m6!2m5!1sChZDSUhNMG9nS0VJQ0FnSUN5cTUyelJnEAE!2m1!1s0x0:0xf0c93f6904813497!3m1!1s2@1:CIHM0ogKEICAgICyq52zRg%7CCgwIypifgQYQ2L_hrAI%7C?hl=id","Asyiik, murah meriah, paling enak dimakan pas hangat.."
