"title","url","stars","name","reviewUrl","text"
"Rumah Makan Idaman - Manyar Kertoarjo 5","https://www.google.com/maps/search/?api=1&query=Rumah%20Makan%20Idaman%20-%20Manyar%20Kertoarjo%205&query_place_id=ChIJsY_NmDP61y0R5eSC1y6XIuw","5","Marisa Marwangi","https://www.google.com/maps/reviews/data=!4m8!14m7!1m6!2m5!1sCi9DQUlRQUNvZENodHljRjlvT2paWFFuWXRkalp1Vm5oQ1QzRnJaREZxZERoTE4wRRAB!2m1!1s0x0:0xec22972ed782e4e5!3m1!1s2@1:CAIQACodChtycF9oOjZXQnYtdjZuVnhCT3FrZDFqdDhLN0E%7C0dD_X5JUyZK%7C?hl=id","Makanannya enak-enak semua. Terutama nasi kuningnya. Sudah berlangganan 10 tahun, rasa tidak berubah, tetap enak. Apalagi sekarang tempatnya direnovasi, menjadi semakin nyaman."
"Rumah Makan Idaman - Manyar Kertoarjo 5","https://www.google.com/maps/search/?api=1&query=Rumah%20Makan%20Idaman%20-%20Manyar%20Kertoarjo%205&query_place_id=ChIJsY_NmDP61y0R5eSC1y6XIuw","5","cindillicious","https://www.google.com/maps/reviews/data=!4m8!14m7!1m6!2m5!1sCi9DQUlRQUNvZENodHljRjlvT2pGb01XMHlRV1J1UTBWelNXUlVlSHBJVUV4RU1FRRAB!2m1!1s0x0:0xec22972ed782e4e5!3m1!1s2@1:CAIQACodChtycF9oOjFoMW0yQWRuQ0VzSWRUeHpIUExEMEE%7C0ceIHRGFZgV%7C?hl=id","Makanan enak, nasi kuning recommended banget, pelayanan oke, tempat bersih dan adem ada AC. Rasa nasi kuning yang klasik ini sudah jadi pilihan orang-orang dari jaman dulu, baik untuk makan di tempat, acara utk nasi box, tumpeng dll. Untuk makanan lain, so far kami coba juga enak-enak dan fresh. Porsi juga banyak, kenyang bangets."
"Rumah Makan Idaman - Manyar Kertoarjo 5","https://www.google.com/maps/search/?api=1&query=Rumah%20Makan%20Idaman%20-%20Manyar%20Kertoarjo%205&query_place_id=ChIJsY_NmDP61y0R5eSC1y6XIuw","5","gabriel amelia","https://www.google.com/maps/reviews/data=!4m8!14m7!1m6!2m5!1sCi9DQUlRQUNvZENodHljRjlvT21STFdIZHFlV1JhTjBGYU1tOUJUMEZLTkVZMlNVRRAB!2m1!1s0x0:0xec22972ed782e4e5!3m1!1s2@1:CAIQACodChtycF9oOmRLWHdqeWRaN0FaMm9BT0FKNEY2SUE%7C0cef-GQLh-2%7C?hl=id","Pesan 3 menu Indonesia, semuanya enak. Rasa pas. Harga affordable, cuma kalau mau tambah lauk beda harga. Tempatnya nyaman, adem ber AC. Pelayanan ramah."
"Rumah Makan Idaman - Manyar Kertoarjo 5","https://www.google.com/maps/search/?api=1&query=Rumah%20Makan%20Idaman%20-%20Manyar%20Kertoarjo%205&query_place_id=ChIJsY_NmDP61y0R5eSC1y6XIuw","5","Kiky Dwiyanto Pratidina","https://www.google.com/maps/reviews/data=!4m8!14m7!1m6!2m5!1sCi9DQUlRQUNvZENodHljRjlvT25OQ1pqTmpRM28yTFdSVlJHbG1kVVF6YmxkMWFYYxAB!2m1!1s0x0:0xec22972ed782e4e5!3m1!1s2@1:CAIQACodChtycF9oOnNCZjNjQ3o2LWRVRGlmdUQzbld1aXc%7C0ciOUJN1znu%7C?hl=id","Salah satu resto legend du surbaya,terkenal dengan nasi kuningnya dgn lauk yg lengkap dan porsi besr..harga standar kisaran 20rb - 50rb menu variatif ada masakan indonesia dan Chinese"
"Rumah Makan Idaman - Manyar Kertoarjo 5","https://www.google.com/maps/search/?api=1&query=Rumah%20Makan%20Idaman%20-%20Manyar%20Kertoarjo%205&query_place_id=ChIJsY_NmDP61y0R5eSC1y6XIuw","5","Fiola Kosasih","https://www.google.com/maps/reviews/data=!4m8!14m7!1m6!2m5!1sCi9DQUlRQUNvZENodHljRjlvT25nMVIyVk1RbUZVWDE5amQxUm9hVlYzU0ZOeFkzYxAB!2m1!1s0x0:0xec22972ed782e4e5!3m1!1s2@1:CAIQACodChtycF9oOng1R2VMQmFUX19jd1RoaVV3SFNxY3c%7C0cuuRgL1UNJ%7C?hl=id","Porsinya banyak, makananya enakk, beberapa kurang asin, sambal penyet cenderung manis
Pelayanan baik, enak untuk makan disini lagi"
"Rumah Makan Idaman - Manyar Kertoarjo 5","https://www.google.com/maps/search/?api=1&query=Rumah%20Makan%20Idaman%20-%20Manyar%20Kertoarjo%205&query_place_id=ChIJsY_NmDP61y0R5eSC1y6XIuw","5","melysia liyanto","https://www.google.com/maps/reviews/data=!4m8!14m7!1m6!2m5!1sCi9DQUlRQUNvZENodHljRjlvT2xST2RHdGlMVmhhYWw4eWFrMUNSVWwxWlhWNVVrRRAB!2m1!1s0x0:0xec22972ed782e4e5!3m1!1s2@1:CAIQACodChtycF9oOlROdGtiLVhaal8yak1CRUl1ZXV5UkE%7C0cb0mEZfj8X%7C?hl=id","First time here n langsung suka, dari tempatnya yg nyaman n pilihan menunya juga banyak. Nasi kuning empalnya enak, terutama empalnya oke banget, no lemak no otot, empuknya pas n so gooood"
"Rumah Makan Idaman - Manyar Kertoarjo 5","https://www.google.com/maps/search/?api=1&query=Rumah%20Makan%20Idaman%20-%20Manyar%20Kertoarjo%205&query_place_id=ChIJsY_NmDP61y0R5eSC1y6XIuw","5","it's me yoona","https://www.google.com/maps/reviews/data=!4m8!14m7!1m6!2m5!1sCi9DQUlRQUNvZENodHljRjlvT2paRExUTmFSRkV5T0RsSlN5MDJlVkpUVUhwckxWRRAB!2m1!1s0x0:0xec22972ed782e4e5!3m1!1s2@1:CAIQACodChtycF9oOjZDLTNaRFEyODlJSy02eVJTUHprLVE%7C0d5g6ZDjmvx%7C?hl=id","7 tahun disurabaya , paling favorit makan dsni, tempatnya bersih, makanan enak pas di perut, banyak pilihan, terbaikkk"
"Rumah Makan Idaman - Manyar Kertoarjo 5","https://www.google.com/maps/search/?api=1&query=Rumah%20Makan%20Idaman%20-%20Manyar%20Kertoarjo%205&query_place_id=ChIJsY_NmDP61y0R5eSC1y6XIuw","5","Rainer VP","https://www.google.com/maps/reviews/data=!4m8!14m7!1m6!2m5!1sCi9DQUlRQUNvZENodHljRjlvT25acVNVNXhjR052VlU1eFIwUllZWEJLWDFBemNGRRAB!2m1!1s0x0:0xec22972ed782e4e5!3m1!1s2@1:CAIQACodChtycF9oOnZqSU5xcGNvVU5xR0RYYXBKX1AzcFE%7C0d7OuSsPqLd%7C?hl=id","Porsi makanan sangat lengkap, ini pesen ayam goreng saus mentega sama rujak, porsinya banyak gak pelit."
"Rumah Makan Idaman - Manyar Kertoarjo 5","https://www.google.com/maps/search/?api=1&query=Rumah%20Makan%20Idaman%20-%20Manyar%20Kertoarjo%205&query_place_id=ChIJsY_NmDP61y0R5eSC1y6XIuw","5","Jessica Ardelia95","https://www.google.com/maps/reviews/data=!4m8!14m7!1m6!2m5!1sCi9DQUlRQUNvZENodHljRjlvT21zd1dGTjNkMll4ZG5KTGJVRTVVMHRUWlhKSVpGRRAB!2m1!1s0x0:0xec22972ed782e4e5!3m1!1s2@1:CAIQACodChtycF9oOmswWFN3d2YxdnJLbUE5U0tTZXJIZFE%7C0cuEUnCxAES%7C?hl=id","Pisang nya enak, chinese food dan indonesia foodnya jg enak, bersih dan higienis. Harus dicoba makan di sini. Mantab"
"Rumah Makan Idaman - Manyar Kertoarjo 5","https://www.google.com/maps/search/?api=1&query=Rumah%20Makan%20Idaman%20-%20Manyar%20Kertoarjo%205&query_place_id=ChIJsY_NmDP61y0R5eSC1y6XIuw","5","vebrika sarintohe","https://www.google.com/maps/reviews/data=!4m8!14m7!1m6!2m5!1sCi9DQUlRQUNvZENodHljRjlvT2pSV04yeFpNWHA0V2psVldqVm9lRlZTV1ZwMGFtYxAB!2m1!1s0x0:0xec22972ed782e4e5!3m1!1s2@1:CAIQACodChtycF9oOjRWN2xZMXp4WjlVWjVoeFVSWVp0amc%7C0ced09p0R79%7C?hl=id","menunya enak semuaaa... ga ada yg zonk 👍👍 pelayanannya okee. Menurutku ini rumah makan yg paling recomend di depan bonnet.
harga terjangkau sebanding dengan rasa 👌👌👌👌"
"Rumah Makan Idaman - Manyar Kertoarjo 5","https://www.google.com/maps/search/?api=1&query=Rumah%20Makan%20Idaman%20-%20Manyar%20Kertoarjo%205&query_place_id=ChIJsY_NmDP61y0R5eSC1y6XIuw","5","Duo Angelo","https://www.google.com/maps/reviews/data=!4m8!14m7!1m6!2m5!1sCi9DQUlRQUNvZENodHljRjlvT25GVVJtcGZOekpRYnpGT2NuTXhkamhEZWxRNUxXYxAB!2m1!1s0x0:0xec22972ed782e4e5!3m1!1s2@1:CAIQACodChtycF9oOnFURmpfNzJQbzFOcnMxdjhDelQ5LWc%7C0cu_I6h01aH%7C?hl=id","Makan di sini, aneka rasa nostalgia begitu kuat. Rasa makanan seperti di rumah, minuman soda gembira (happy soda) yang sudah tak tau ditemui pun ada di sini 😆

Utk porsi makanan sesuai foto, berlimpah 😆 bisa untuk berdua krn nasi kuningnya berbobot banget 🤩

Ternyata, di sini ada chinesse food juga lho."
"Rumah Makan Idaman - Manyar Kertoarjo 5","https://www.google.com/maps/search/?api=1&query=Rumah%20Makan%20Idaman%20-%20Manyar%20Kertoarjo%205&query_place_id=ChIJsY_NmDP61y0R5eSC1y6XIuw","5","kayston cake","https://www.google.com/maps/reviews/data=!4m8!14m7!1m6!2m5!1sCi9DQUlRQUNvZENodHljRjlvT2pWeGRXeEZlSGhrTFZaVWJFSm5RbEZuZFUxb09GRRAB!2m1!1s0x0:0xec22972ed782e4e5!3m1!1s2@1:CAIQACodChtycF9oOjVxdWxFeHhkLVZUbEJnQlFndU1oOFE%7C0cu_owJxjWz%7C?hl=id","Enakkkkkkk Alwayssss , Juara sihhh makanannya, untuk harga sebanding dengan rasa dan porsi 🤩👍🏻👍🏻 Wajibbb kembali lagi dan coba menu lainnya 🥰🥰"
"Rumah Makan Idaman - Manyar Kertoarjo 5","https://www.google.com/maps/search/?api=1&query=Rumah%20Makan%20Idaman%20-%20Manyar%20Kertoarjo%205&query_place_id=ChIJsY_NmDP61y0R5eSC1y6XIuw","5","Haze Jean","https://www.google.com/maps/reviews/data=!4m8!14m7!1m6!2m5!1sCi9DQUlRQUNvZENodHljRjlvT2tKQ09IUnBSWEZ2Y1VSVldIVmZlRFpYUTJGc1ltYxAB!2m1!1s0x0:0xec22972ed782e4e5!3m1!1s2@1:CAIQACodChtycF9oOkJCOHRpRXFvcURVWHVfeDZXQ2FsYmc%7C0d479JfAg8b%7C?hl=id","Makanan enak, langganan dari dulu enak, rasa masih enak spt dulu"
"Rumah Makan Idaman - Manyar Kertoarjo 5","https://www.google.com/maps/search/?api=1&query=Rumah%20Makan%20Idaman%20-%20Manyar%20Kertoarjo%205&query_place_id=ChIJsY_NmDP61y0R5eSC1y6XIuw","5","Daut","https://www.google.com/maps/reviews/data=!4m8!14m7!1m6!2m5!1sCi9DQUlRQUNvZENodHljRjlvT21kUlprWkZlakpHZVdSWVlqQXlVbUZ5TmtoSk1GRRAB!2m1!1s0x0:0xec22972ed782e4e5!3m1!1s2@1:CAIQACodChtycF9oOmdRZkZFejJGeWRYYjAyUmFyNkhJMFE%7C0csvGPCD7qV%7C?hl=id","Pertama makan sini, pelayanan oke, suasananya bersih, nyaman.. Makanan nya enak.. Sy cb nasi kuning nya enak, recommended.. Sukses terus ya"
"Rumah Makan Idaman - Manyar Kertoarjo 5","https://www.google.com/maps/search/?api=1&query=Rumah%20Makan%20Idaman%20-%20Manyar%20Kertoarjo%205&query_place_id=ChIJsY_NmDP61y0R5eSC1y6XIuw","5","Vivi Lestari","https://www.google.com/maps/reviews/data=!4m8!14m7!1m6!2m5!1sCi9DQUlRQUNvZENodHljRjlvT201eVZHWmZWVTFzTW1oNU1FMWxOekZ0UkZSNVZFRRAB!2m1!1s0x0:0xec22972ed782e4e5!3m1!1s2@1:CAIQACodChtycF9oOm5yVGZfVU1sMmh5ME1lNzFtRFR5VEE%7C0cf4if4LBlr%7C?hl=id","Makanan nya enak. Harga terjangkau"
"Rumah Makan Idaman - Manyar Kertoarjo 5","https://www.google.com/maps/search/?api=1&query=Rumah%20Makan%20Idaman%20-%20Manyar%20Kertoarjo%205&query_place_id=ChIJsY_NmDP61y0R5eSC1y6XIuw","5","Twenty Twenty","https://www.google.com/maps/reviews/data=!4m8!14m7!1m6!2m5!1sCi9DQUlRQUNvZENodHljRjlvT2xwNU16QTROR3cxZEhod1pGZFlUMWxmVTE5Wk5sRRAB!2m1!1s0x0:0xec22972ed782e4e5!3m1!1s2@1:CAIQACodChtycF9oOlp5MzA4NGw1dHhwZFdYT1lfU19ZNlE%7C0dD1YFWrtWS%7C?hl=id","Menjual Chinese food dan Indonesian food.
Nasi kuningnya favorit 😁👍🏻"
"Rumah Makan Idaman - Manyar Kertoarjo 5","https://www.google.com/maps/search/?api=1&query=Rumah%20Makan%20Idaman%20-%20Manyar%20Kertoarjo%205&query_place_id=ChIJsY_NmDP61y0R5eSC1y6XIuw","5","Cahaya E. Wardhani","https://www.google.com/maps/reviews/data=!4m8!14m7!1m6!2m5!1sCi9DQUlRQUNvZENodHljRjlvT2pGak9FcFVXbmg0VjBoc01UVkpSR3RNZERGelRXYxAB!2m1!1s0x0:0xec22972ed782e4e5!3m1!1s2@1:CAIQACodChtycF9oOjFjOEpUWnh4V0hsMTVJRGtMdDFzTWc%7C0cpF0blIW9d%7C?hl=id","Menyajikan chinese food dan nusantara. Rasanya mantap, pisaang gorengnya uenak banget. Sukak. Rekomended banget. Harga makanannya juga pas dikantong."
"Rumah Makan Idaman - Manyar Kertoarjo 5","https://www.google.com/maps/search/?api=1&query=Rumah%20Makan%20Idaman%20-%20Manyar%20Kertoarjo%205&query_place_id=ChIJsY_NmDP61y0R5eSC1y6XIuw","5","Christian Halim","https://www.google.com/maps/reviews/data=!4m8!14m7!1m6!2m5!1sChdDSUhNMG9nS0VJQ0FnTUNZckxmaXJ3RRAB!2m1!1s0x0:0xec22972ed782e4e5!3m1!1s2@1:CIHM0ogKEICAgMCYrLfirwE%7C0cbUQNu_VvL%7C?hl=id","Sesuai namanya, menu disini adalah idaman semua warga Surabaya. Ada indonesian food dan chinese food. Rasanya cukup enak, pas di lidah, pelayanannya cukup cepat, dan suasananya juga nyaman (ber ac dan bersih). Untuk parkiran yang agak sulit, apabila malam hari. Menu favorite, soto, sop, galantine, nasi campur."
"Rumah Makan Idaman - Manyar Kertoarjo 5","https://www.google.com/maps/search/?api=1&query=Rumah%20Makan%20Idaman%20-%20Manyar%20Kertoarjo%205&query_place_id=ChIJsY_NmDP61y0R5eSC1y6XIuw","5","Andrew Christianto","https://www.google.com/maps/reviews/data=!4m8!14m7!1m6!2m5!1sCi9DQUlRQUNvZENodHljRjlvT2tOaVRsVkxiV2RaTVdndFNEbFJOMUpZTUVOSGNXYxAB!2m1!1s0x0:0xec22972ed782e4e5!3m1!1s2@1:CAIQACodChtycF9oOkNiTlVLbWdZMWgtSDlRN1JYMENHcWc%7C0c_2M2uEpvW%7C?hl=id","Makanan enak, tempat bersih dan nyaman 😍"
"Rumah Makan Idaman - Manyar Kertoarjo 5","https://www.google.com/maps/search/?api=1&query=Rumah%20Makan%20Idaman%20-%20Manyar%20Kertoarjo%205&query_place_id=ChIJsY_NmDP61y0R5eSC1y6XIuw","5","li sha","https://www.google.com/maps/reviews/data=!4m8!14m7!1m6!2m5!1sCi9DQUlRQUNvZENodHljRjlvT2psSWNUTkJkbnA0VDI1TWVGbEVVR2hPV1hoTFkwRRAB!2m1!1s0x0:0xec22972ed782e4e5!3m1!1s2@1:CAIQACodChtycF9oOjlIcTNBdnp4T25MeFlEUGhOWXhLY0E%7C0cYhjcAeFPN%7C?hl=id","Tempat bersih, rapi, nyaman.
Fav : nasi kuning, lauk ayam panggang bumbu rujak atau ayam goreng"
"Rumah Makan Idaman - Manyar Kertoarjo 5","https://www.google.com/maps/search/?api=1&query=Rumah%20Makan%20Idaman%20-%20Manyar%20Kertoarjo%205&query_place_id=ChIJsY_NmDP61y0R5eSC1y6XIuw","5","destinasi Koe","https://www.google.com/maps/reviews/data=!4m8!14m7!1m6!2m5!1sCi9DQUlRQUNvZENodHljRjlvT2xjdGNsTTNVMlJCY1hGM1puUXhNbDlDY2tadFZuYxAB!2m1!1s0x0:0xec22972ed782e4e5!3m1!1s2@1:CAIQACodChtycF9oOlctclM3U2RBcXF3ZnQxMl9CckZtVnc%7C0dCIMjpDUZ3%7C?hl=id","Best sellernya nasi kuning menurut saya, tapi semua menu di sini enak enak, capcay juga enak lauknya banyakk"
"Rumah Makan Idaman - Manyar Kertoarjo 5","https://www.google.com/maps/search/?api=1&query=Rumah%20Makan%20Idaman%20-%20Manyar%20Kertoarjo%205&query_place_id=ChIJsY_NmDP61y0R5eSC1y6XIuw","5","Martinus Hendriyanto","https://www.google.com/maps/reviews/data=!4m8!14m7!1m6!2m5!1sCi9DQUlRQUNvZENodHljRjlvT2twTFRtWmhTVXBvUXpCWmJtWkNlbVp3UlhsdE1GRRAB!2m1!1s0x0:0xec22972ed782e4e5!3m1!1s2@1:CAIQACodChtycF9oOkpLTmZhSUpoQzBZbmZCemZwRXltMFE%7C0d6c16ZMlRU%7C?hl=id","Makanan Indonesia yg lezat tidak membosankan, selalu ada di hati kami sekeluarga. Enak,tempat nyaman dan tenang."
"Rumah Makan Idaman - Manyar Kertoarjo 5","https://www.google.com/maps/search/?api=1&query=Rumah%20Makan%20Idaman%20-%20Manyar%20Kertoarjo%205&query_place_id=ChIJsY_NmDP61y0R5eSC1y6XIuw","5","Sion Homestay","https://www.google.com/maps/reviews/data=!4m8!14m7!1m6!2m5!1sCi9DQUlRQUNvZENodHljRjlvT25salMweDBUbWRPWW13elZVVk1VV2R5VjJkUk9XYxAB!2m1!1s0x0:0xec22972ed782e4e5!3m1!1s2@1:CAIQACodChtycF9oOnljS0x0TmdOYmwzVUVMUWdyV2dROWc%7C0caKS1vY1nN%7C?hl=id","Menu bervariasi
Enak"" semua
Tempat dan pelayanan bersih
Next time kesini lagi ya"
"Rumah Makan Idaman - Manyar Kertoarjo 5","https://www.google.com/maps/search/?api=1&query=Rumah%20Makan%20Idaman%20-%20Manyar%20Kertoarjo%205&query_place_id=ChIJsY_NmDP61y0R5eSC1y6XIuw","5","AnnyeongTa","https://www.google.com/maps/reviews/data=!4m8!14m7!1m6!2m5!1sChZDSUhNMG9nS0VJQ0FnTUNJeDlUcFF3EAE!2m1!1s0x0:0xec22972ed782e4e5!3m1!1s2@1:CIHM0ogKEICAgMCIx9TpQw%7CCgwIitDCvwYQ8KOi3AM%7C?hl=id","Makanannya variannya sangat lengkap. Harga sesuai dengan porsinya yg jumbo. Pelayanan ramah. Tempat besih dan nyaman. Sudah Halal MUI."
"Rumah Makan Idaman - Manyar Kertoarjo 5","https://www.google.com/maps/search/?api=1&query=Rumah%20Makan%20Idaman%20-%20Manyar%20Kertoarjo%205&query_place_id=ChIJsY_NmDP61y0R5eSC1y6XIuw","5","pod lod","https://www.google.com/maps/reviews/data=!4m8!14m7!1m6!2m5!1sChdDSUhNMG9nS0VJQ0FnTUNJaG95eXlRRRAB!2m1!1s0x0:0xec22972ed782e4e5!3m1!1s2@1:CIHM0ogKEICAgMCIhoyyyQE%7CCgsI7bKvvwYQqMa4Fw%7C?hl=id","Sudah lama tau Idaman... Sekarang sudah lebih maju, makanan tetap sesuai lidah... Ada masakan Indonesia & Chinese..
Cuman datang di saat ramai, AC agak panas sedikit."
"Rumah Makan Idaman - Manyar Kertoarjo 5","https://www.google.com/maps/search/?api=1&query=Rumah%20Makan%20Idaman%20-%20Manyar%20Kertoarjo%205&query_place_id=ChIJsY_NmDP61y0R5eSC1y6XIuw","5","Charles E. Tumbel","https://www.google.com/maps/reviews/data=!4m8!14m7!1m6!2m5!1sChdDSUhNMG9nS0VJQ0FnTURRdnVXY3VBRRAB!2m1!1s0x0:0xec22972ed782e4e5!3m1!1s2@1:CIHM0ogKEICAgMDQvuWcuAE%7CCgwIlpnAvgYQyIyJ8wE%7C?hl=id","Makanannya enak, tempatnya nyaman, harganya terjangkau, pelayanannya baik dan parkirannya luas! Ok, lah!"
"Rumah Makan Idaman - Manyar Kertoarjo 5","https://www.google.com/maps/search/?api=1&query=Rumah%20Makan%20Idaman%20-%20Manyar%20Kertoarjo%205&query_place_id=ChIJsY_NmDP61y0R5eSC1y6XIuw","5","Victor","https://www.google.com/maps/reviews/data=!4m8!14m7!1m6!2m5!1sCi9DQUlRQUNvZENodHljRjlvT2paMldsSm1SM0V4ZVc5cFEyOWpibXd5WnpoTFRWRRAB!2m1!1s0x0:0xec22972ed782e4e5!3m1!1s2@1:CAIQACodChtycF9oOjZ2WlJmR3ExeW9pQ29jbmwyZzhLTVE%7C0cjGO_C-fvJ%7C?hl=id","Nasi lodeh nya enak, nasi timbel juga, mantap"
"Rumah Makan Idaman - Manyar Kertoarjo 5","https://www.google.com/maps/search/?api=1&query=Rumah%20Makan%20Idaman%20-%20Manyar%20Kertoarjo%205&query_place_id=ChIJsY_NmDP61y0R5eSC1y6XIuw","5","Dwininta P","https://www.google.com/maps/reviews/data=!4m8!14m7!1m6!2m5!1sChdDSUhNMG9nS0VMN1F0ZV9BczlDdjh3RRAB!2m1!1s0x0:0xec22972ed782e4e5!3m1!1s2@1:CIHM0ogKEL7Qte_As9Cv8wE%7CCgwIoPmHwQYQqLn_3wE%7C?hl=id","Kali pertama kesini. Penasaran awalnya karena jarang ada resto yang jual beranekaragam menu makanan Cina dan Indonesia. Disambut dengan tempat yang terang dan suasana udah cukup modern, walau mungkin untuk jumlah meja cukup terbatas (sepertinya ruang makannya hanya 1 lantai). Ada 1 pelayan resto (cewek) yang juga sangat ramah saat melayani. Good job!

Yang dipesan:
- sup jagung ayam kepiting: porsi super besar (bisa untuk 4-5 orang), rasa enak dan pas
- nasi goreng spesial (merah): porsi cukup besar untuk 1 orang, isiannya cukup melimpah, mantap
- lontong mie: nggak cobain penuh, tapi bumbunya terasa apalagi kalo dikasi petis
- es sari labu: salah satu menu yang menurutku jarang ditemukan di resto lain. Rasanya segar, unik, manis.

Overall semua rasanya pas di lidah kami, harganya juga cukup terjangkau dengan porsi yang pas dan lokasi yang strategis. Akan kesini lagi jika mampir ke Surabaya di lain waktu!"
"Rumah Makan Idaman - Manyar Kertoarjo 5","https://www.google.com/maps/search/?api=1&query=Rumah%20Makan%20Idaman%20-%20Manyar%20Kertoarjo%205&query_place_id=ChIJsY_NmDP61y0R5eSC1y6XIuw","5","kurnia tasnima","https://www.google.com/maps/reviews/data=!4m8!14m7!1m6!2m5!1sCi9DQUlRQUNvZENodHljRjlvT205T1FWaDZPRzVzVW5wb1FqZHBjSE5hYm5OM2VHYxAB!2m1!1s0x0:0xec22972ed782e4e5!3m1!1s2@1:CAIQACodChtycF9oOm9OQVh6OG5sUnpoQjdpcHNabnN3eGc%7C0d19gurrFGl%7C?hl=id","Kesini pesen ayam gr telur asin, telur orak arik + jagung manis, dan minum sari labu. Overall, secara makanan dan minumannyang dipesan enak dan diservice dengan baik. Secara porsi cocok untuk berkeluarga. Secara kebersihan, restaurant ini bersih. Secara pelayanan, baik dan ramah sekali. Recommend untuk makan bersama keluarga."
"Rumah Makan Idaman - Manyar Kertoarjo 5","https://www.google.com/maps/search/?api=1&query=Rumah%20Makan%20Idaman%20-%20Manyar%20Kertoarjo%205&query_place_id=ChIJsY_NmDP61y0R5eSC1y6XIuw","5","herman nagaseta","https://www.google.com/maps/reviews/data=!4m8!14m7!1m6!2m5!1sCi9DQUlRQUNvZENodHljRjlvT20wMlV5MXRSbXBVZVVoWk5FdzFYM0pNWkdkVGVGRRAB!2m1!1s0x0:0xec22972ed782e4e5!3m1!1s2@1:CAIQACodChtycF9oOm02Uy1tRmpUeUhZNEw1X3JMZGdTeFE%7C0ciarbv4Plr%7C?hl=id","Enak makanannya, pisang goreng nya enak, banyak macam gorengan"
"Rumah Makan Idaman - Manyar Kertoarjo 5","https://www.google.com/maps/search/?api=1&query=Rumah%20Makan%20Idaman%20-%20Manyar%20Kertoarjo%205&query_place_id=ChIJsY_NmDP61y0R5eSC1y6XIuw","5","Agusta Indra","https://www.google.com/maps/reviews/data=!4m8!14m7!1m6!2m5!1sCi9DQUlRQUNvZENodHljRjlvT21aR2JsVnhTVGRmTWxBeE0yVlBRVEptWnpCbU1VRRAB!2m1!1s0x0:0xec22972ed782e4e5!3m1!1s2@1:CAIQACodChtycF9oOmZGblVxSTdfMlAxM2VPQTJmZzBmMUE%7C0dBNndhSR9n%7C?hl=id","makannya enak, comfort food"
"Rumah Makan Idaman - Manyar Kertoarjo 5","https://www.google.com/maps/search/?api=1&query=Rumah%20Makan%20Idaman%20-%20Manyar%20Kertoarjo%205&query_place_id=ChIJsY_NmDP61y0R5eSC1y6XIuw","5","Richard Hardy","https://www.google.com/maps/reviews/data=!4m8!14m7!1m6!2m5!1sCi9DQUlRQUNvZENodHljRjlvT25ONVJFeFdlbHBTVm5sU1ExYzVUMmN3ZVZZek0zYxAB!2m1!1s0x0:0xec22972ed782e4e5!3m1!1s2@1:CAIQACodChtycF9oOnN5RExWelpSVnlSQ1c5T2cweVYzM3c%7C0clKxVivP6l%7C?hl=id","Makanan mantap, pelayanan cepat pokoknya top top top"
"Rumah Makan Idaman - Manyar Kertoarjo 5","https://www.google.com/maps/search/?api=1&query=Rumah%20Makan%20Idaman%20-%20Manyar%20Kertoarjo%205&query_place_id=ChIJsY_NmDP61y0R5eSC1y6XIuw","5","Robert Santoso","https://www.google.com/maps/reviews/data=!4m8!14m7!1m6!2m5!1sCi9DQUlRQUNvZENodHljRjlvT2tSMFMwWnlhMkZLVlcwdE16RnBWa0ZhT1c5VGNVRRAB!2m1!1s0x0:0xec22972ed782e4e5!3m1!1s2@1:CAIQACodChtycF9oOkR0S0Zya2FKVW0tMzFpVkFaOW9TcUE%7C0cpVQiCbmxa%7C?hl=id","Pertama kali ke sini dan merasakan enaknya. Unik seleksinya. Sejenis depot bu rudy"
"Rumah Makan Idaman - Manyar Kertoarjo 5","https://www.google.com/maps/search/?api=1&query=Rumah%20Makan%20Idaman%20-%20Manyar%20Kertoarjo%205&query_place_id=ChIJsY_NmDP61y0R5eSC1y6XIuw","5","luvita sesilia","https://www.google.com/maps/reviews/data=!4m8!14m7!1m6!2m5!1sChZDSUhNMG9nS0VJQ0FnSURmM2Nibk93EAE!2m1!1s0x0:0xec22972ed782e4e5!3m1!1s2@1:CIHM0ogKEICAgIDf3cbnOw%7CCgwI_Y7_uwYQqI2mxwI%7C?hl=id","Ngga sengaja lewat dan liat kok rame, nyobain deh ternyata enak banget best nasi lodeh ayam panggang bumbu rujaknya 👍"
"Rumah Makan Idaman - Manyar Kertoarjo 5","https://www.google.com/maps/search/?api=1&query=Rumah%20Makan%20Idaman%20-%20Manyar%20Kertoarjo%205&query_place_id=ChIJsY_NmDP61y0R5eSC1y6XIuw","5","Eileen Lee Sindhunata","https://www.google.com/maps/reviews/data=!4m8!14m7!1m6!2m5!1sCi9DQUlRQUNvZENodHljRjlvT25kSE4zWndWbVZpV2pWaVZrOXFTVXBSZURCYWRIYxAB!2m1!1s0x0:0xec22972ed782e4e5!3m1!1s2@1:CAIQACodChtycF9oOndHN3ZwVmViWjViVk9qSUpReDBadHc%7C0cidpCCHvge%7C?hl=id","Resto legend yang masakannya enak enak 🥰"
"Rumah Makan Idaman - Manyar Kertoarjo 5","https://www.google.com/maps/search/?api=1&query=Rumah%20Makan%20Idaman%20-%20Manyar%20Kertoarjo%205&query_place_id=ChIJsY_NmDP61y0R5eSC1y6XIuw","5","Sisca","https://www.google.com/maps/reviews/data=!4m8!14m7!1m6!2m5!1sCi9DQUlRQUNvZENodHljRjlvT2xaUVFtUklWR3hHWVdaV2VrbE9NamhGT0RCR05tYxAB!2m1!1s0x0:0xec22972ed782e4e5!3m1!1s2@1:CAIQACodChtycF9oOlZQQmRIVGxGYWZWeklOMjhFODBGNmc%7C0d9yKkfZP8i%7C?hl=id","Makanan enak, pelayanan cepat.."
"Rumah Makan Idaman - Manyar Kertoarjo 5","https://www.google.com/maps/search/?api=1&query=Rumah%20Makan%20Idaman%20-%20Manyar%20Kertoarjo%205&query_place_id=ChIJsY_NmDP61y0R5eSC1y6XIuw","5","hans kristian","https://www.google.com/maps/reviews/data=!4m8!14m7!1m6!2m5!1sCi9DQUlRQUNvZENodHljRjlvT2pGMk1USmpjRzgxYmtOSE1FTkNVM05NVDBkaWNYYxAB!2m1!1s0x0:0xec22972ed782e4e5!3m1!1s2@1:CAIQACodChtycF9oOjF2MTJjcG81bkNHMENCU3NMT0dicXc%7C0cxB0s-5abW%7C?hl=id","Mantap nasi kuningnya
Ayam goreng idamannya beda dari yg lain"
"Rumah Makan Idaman - Manyar Kertoarjo 5","https://www.google.com/maps/search/?api=1&query=Rumah%20Makan%20Idaman%20-%20Manyar%20Kertoarjo%205&query_place_id=ChIJsY_NmDP61y0R5eSC1y6XIuw","5","Cyntia Mutia Sari","https://www.google.com/maps/reviews/data=!4m8!14m7!1m6!2m5!1sCi9DQUlRQUNvZENodHljRjlvT200eVozWjRURTF5Um1aMFJscHJlRUpFY1dnM1owRRAB!2m1!1s0x0:0xec22972ed782e4e5!3m1!1s2@1:CAIQACodChtycF9oOm4yZ3Z4TE1yRmZ0RlpreEJEcWg3Z0E%7C0cibZJmwF1T%7C?hl=id","Makanan favorit, setiap minggu pasti mampir makan.
Nasi kuning nya besttt 🫶"
"Rumah Makan Idaman - Manyar Kertoarjo 5","https://www.google.com/maps/search/?api=1&query=Rumah%20Makan%20Idaman%20-%20Manyar%20Kertoarjo%205&query_place_id=ChIJsY_NmDP61y0R5eSC1y6XIuw","5","juliasman gunardja","https://www.google.com/maps/reviews/data=!4m8!14m7!1m6!2m5!1sChdDSUhNMG9nS0VJQ0FnSURMM01PMDJ3RRAB!2m1!1s0x0:0xec22972ed782e4e5!3m1!1s2@1:CIHM0ogKEICAgIDL3MO02wE%7CCgwIuOruswYQ4KblkwM%7C?hl=id","Indonesian food nya enak.. wajib dipesen kalo kesini.. ayam goreng kering pake lada garam enak sekali.. rawon, nasi lodeh ikan asin, lontong cap gomek.. lauknya banyak.. harganya murah 😍😍"
"Rumah Makan Idaman - Manyar Kertoarjo 5","https://www.google.com/maps/search/?api=1&query=Rumah%20Makan%20Idaman%20-%20Manyar%20Kertoarjo%205&query_place_id=ChIJsY_NmDP61y0R5eSC1y6XIuw","5","Steph","https://www.google.com/maps/reviews/data=!4m8!14m7!1m6!2m5!1sCi9DQUlRQUNvZENodHljRjlvT2tZeGN6VmphMlpXWTBscmJ6UmZTV2hsZEVkcE1XYxAB!2m1!1s0x0:0xec22972ed782e4e5!3m1!1s2@1:CAIQACodChtycF9oOkYxczVja2ZWY0lrbzRfSWhldEdpMWc%7C0cfiEcduQfe%7C?hl=id","cozy and clean place, banyak variasi gorengan😍 so homey!"
"Rumah Makan Idaman - Manyar Kertoarjo 5","https://www.google.com/maps/search/?api=1&query=Rumah%20Makan%20Idaman%20-%20Manyar%20Kertoarjo%205&query_place_id=ChIJsY_NmDP61y0R5eSC1y6XIuw","5","Cahyadi tan","https://www.google.com/maps/reviews/data=!4m8!14m7!1m6!2m5!1sChdDSUhNMG9nS0VJQ0FnSUR0cjgtcDJ3RRAB!2m1!1s0x0:0xec22972ed782e4e5!3m1!1s2@1:CIHM0ogKEICAgIDtr8-p2wE%7CCgsIioeUrgYQqJWnMA%7C?hl=id","Tempat makan yg selalu rame. Pertama kali ke sini. Lokasi kuliner semua jd macet dan rame. Parkir mobil sulit.
Makanannya enak2 dan porsinya jumbo. Saya perjalanan jauh jd happy makannya enak, pelayanan baik."
"Rumah Makan Idaman - Manyar Kertoarjo 5","https://www.google.com/maps/search/?api=1&query=Rumah%20Makan%20Idaman%20-%20Manyar%20Kertoarjo%205&query_place_id=ChIJsY_NmDP61y0R5eSC1y6XIuw","5","Fellicia Kristanto","https://www.google.com/maps/reviews/data=!4m8!14m7!1m6!2m5!1sChdDSUhNMG9nS0VJQ0FnSUR4cXBEeXB3RRAB!2m1!1s0x0:0xec22972ed782e4e5!3m1!1s2@1:CIHM0ogKEICAgIDxqpDypwE%7CCgwI8sDcpAYQoLS2uQI%7C?hl=id","sarapan wajib buat setiap kita yang punya banyak aktivitas.. boleh coba sarapan di RUMAH MAKAN IDAMAN, karen banyak menu yang bisa jadi pilihan kita.. kali ini ak makan SUP SEHAT dan AYAM PENYET nya bisa request sambal tdk pedas.. penasaran?? ke sini langsung aja ya, buka dari jam 7.30 pagi, lho!! 😍"
"Rumah Makan Idaman - Manyar Kertoarjo 5","https://www.google.com/maps/search/?api=1&query=Rumah%20Makan%20Idaman%20-%20Manyar%20Kertoarjo%205&query_place_id=ChIJsY_NmDP61y0R5eSC1y6XIuw","5","Stevie PramuditaD","https://www.google.com/maps/reviews/data=!4m8!14m7!1m6!2m5!1sCi9DQUlRQUNvZENodHljRjlvT21jMFpHdGxSRkZWYUc1ellVOTNiV3M1VkZKU1UyYxAB!2m1!1s0x0:0xec22972ed782e4e5!3m1!1s2@1:CAIQACodChtycF9oOmc0ZGtlRFFVaG5zYU93bWs5VFJSU2c%7C0cicHxiNYqL%7C?hl=id","Makanan ny enak, pelayanan ny cepat, tmpat ny nyaman"
