"title","url","stars","name","reviewUrl","text"
"Bale Raos - The Sultan's Dishes","https://www.google.com/maps/search/?api=1&query=Bale%20Raos%20-%20The%20Sultan's%20Dishes&query_place_id=ChIJH03CYY1Xei4RTDTe65njvUk","5","Ajeng Fitria Riski","https://www.google.com/maps/reviews/data=!4m8!14m7!1m6!2m5!1sChdDSUhNMG9nS0VJQ0FnSUNBMWFyUTVnRRAB!2m1!1s0x0:0x49bde399ebde344c!3m1!1s2@1:CIHM0ogKEICAgICA1arQ5gE%7CCgwImqelzwUQwOSM1gE%7C?hl=id","You can enjoy Keraton's royal family food here. Foods and drinks are very tasteful. Good ambience."
"Bale Raos - The Sultan's Dishes","https://www.google.com/maps/search/?api=1&query=Bale%20Raos%20-%20The%20Sultan's%20Dishes&query_place_id=ChIJH03CYY1Xei4RTDTe65njvUk","5","Yuliasari","https://www.google.com/maps/reviews/data=!4m8!14m7!1m6!2m5!1sChZDSUhNMG9nS0VJQ0FnSURZNU0ySFF3EAE!2m1!1s0x0:0x49bde399ebde344c!3m1!1s2@1:CIHM0ogKEICAgIDY5M2HQw%7CCgwIq7-h5gUQ6PzdzgE%7C?hl=id","Great place, great food"
"Bale Raos - The Sultan's Dishes","https://www.google.com/maps/search/?api=1&query=Bale%20Raos%20-%20The%20Sultan's%20Dishes&query_place_id=ChIJH03CYY1Xei4RTDTe65njvUk","5","Sulung Sakyamuni","https://www.google.com/maps/reviews/data=!4m8!14m7!1m6!2m5!1sCi9DQUlRQUNvZENodHljRjlvT2pkM2FtZE5YekZQYUZGT09WVnBNbEZ5Y3kweFNFRRAB!2m1!1s0x0:0x49bde399ebde344c!3m1!1s2@1:CAIQACodChtycF9oOjd3amdNXzFPaFFOOVVpMlFycy0xSEE%7C0chJxl2Po9F%7C?hl=id",
"Bale Raos - The Sultan's Dishes","https://www.google.com/maps/search/?api=1&query=Bale%20Raos%20-%20The%20Sultan's%20Dishes&query_place_id=ChIJH03CYY1Xei4RTDTe65njvUk","5","Brahmadhata Prasetyo","https://www.google.com/maps/reviews/data=!4m8!14m7!1m6!2m5!1sChdDSUhNMG9nS0VJQ0FnSURXNHJQMXNnRRAB!2m1!1s0x0:0x49bde399ebde344c!3m1!1s2@1:CIHM0ogKEICAgIDW4rP1sgE%7CCgwI-uTYkwYQ4JXYuwE%7C?hl=id","Nice resto with delicious food."
"Bale Raos - The Sultan's Dishes","https://www.google.com/maps/search/?api=1&query=Bale%20Raos%20-%20The%20Sultan's%20Dishes&query_place_id=ChIJH03CYY1Xei4RTDTe65njvUk","5","Maz Tyo Pleret","https://www.google.com/maps/reviews/data=!4m8!14m7!1m6!2m5!1sChdDSUhNMG9nS0VJQ0FnSURZNzhDUWhBRRAB!2m1!1s0x0:0x49bde399ebde344c!3m1!1s2@1:CIHM0ogKEICAgIDY78CQhAE%7CCgwIku6y5wUQsMzl2QI%7C?hl=id","Menu nya mantappp not expensive
...
Javanis food fery nice 😍😍😍"
"Bale Raos - The Sultan's Dishes","https://www.google.com/maps/search/?api=1&query=Bale%20Raos%20-%20The%20Sultan's%20Dishes&query_place_id=ChIJH03CYY1Xei4RTDTe65njvUk","5","Titie Yustisia Lestari","https://www.google.com/maps/reviews/data=!4m8!14m7!1m6!2m5!1sChZDSUhNMG9nS0VJQ0FnSURZbmNyWk13EAE!2m1!1s0x0:0x49bde399ebde344c!3m1!1s2@1:CIHM0ogKEICAgIDYncrZMw%7CCgwIyPGB5wUQsNbFqwI%7C?hl=id","It's a nice place to taste royal food. Definitely an experience to spend time here."
"Bale Raos - The Sultan's Dishes","https://www.google.com/maps/search/?api=1&query=Bale%20Raos%20-%20The%20Sultan's%20Dishes&query_place_id=ChIJH03CYY1Xei4RTDTe65njvUk","5","Frank Roggenbuck","https://www.google.com/maps/reviews/data=!4m8!14m7!1m6!2m5!1sChdDSUhNMG9nS0VJQ0FnSUNEMTgtNWt3RRAB!2m1!1s0x0:0x49bde399ebde344c!3m1!1s2@1:CIHM0ogKEICAgICD18-5kwE%7CCgwI_u2ysAYQ2KjFrQE%7C?hl=id","Sehr gut zum Essen"
"Bale Raos - The Sultan's Dishes","https://www.google.com/maps/search/?api=1&query=Bale%20Raos%20-%20The%20Sultan's%20Dishes&query_place_id=ChIJH03CYY1Xei4RTDTe65njvUk","5","Mario","https://www.google.com/maps/reviews/data=!4m8!14m7!1m6!2m5!1sChZDSUhNMG9nS0VJQ0FnSUQ4eHJLNUFnEAE!2m1!1s0x0:0x49bde399ebde344c!3m1!1s2@1:CIHM0ogKEICAgID8xrK5Ag%7CCgwI0NPL-AUQ8K_mxAM%7C?hl=id","Vey nice place to eat inside a well preserved Javanese palace.
The ambience amd food is very nice"
"Bale Raos - The Sultan's Dishes","https://www.google.com/maps/search/?api=1&query=Bale%20Raos%20-%20The%20Sultan's%20Dishes&query_place_id=ChIJH03CYY1Xei4RTDTe65njvUk","5","Andrew Daniel","https://www.google.com/maps/reviews/data=!4m8!14m7!1m6!2m5!1sChZDSUhNMG9nS0VJQ0FnSUNmcnNpQkxnEAE!2m1!1s0x0:0x49bde399ebde344c!3m1!1s2@1:CIHM0ogKEICAgICfrsiBLg%7CCgsIvLfDuwYQsNWadw%7C?hl=id","Makan disini terasa orang kerajaan"
"Bale Raos - The Sultan's Dishes","https://www.google.com/maps/search/?api=1&query=Bale%20Raos%20-%20The%20Sultan's%20Dishes&query_place_id=ChIJH03CYY1Xei4RTDTe65njvUk","5","katsu","https://www.google.com/maps/reviews/data=!4m8!14m7!1m6!2m5!1sChZDSUhNMG9nS0VKZlg3WjM3MnV5c2NREAE!2m1!1s0x0:0x49bde399ebde344c!3m1!1s2@1:CIHM0ogKEJfX7Z372uyscQ%7CCgwI4ZWlwgYQkJuj8QI%7C?hl=id",
"Bale Raos - The Sultan's Dishes","https://www.google.com/maps/search/?api=1&query=Bale%20Raos%20-%20The%20Sultan's%20Dishes&query_place_id=ChIJH03CYY1Xei4RTDTe65njvUk","5","arif yunianto","https://www.google.com/maps/reviews/data=!4m8!14m7!1m6!2m5!1sChdDSUhNMG9nS0VJQ0FnSURaclBmYTlRRRAB!2m1!1s0x0:0x49bde399ebde344c!3m1!1s2@1:CIHM0ogKEICAgIDZrPfa9QE%7CCgsI8_bJqAYQyKfNCQ%7C?hl=id","Ono rego ono rupo"
"Bale Raos - The Sultan's Dishes","https://www.google.com/maps/search/?api=1&query=Bale%20Raos%20-%20The%20Sultan's%20Dishes&query_place_id=ChIJH03CYY1Xei4RTDTe65njvUk","5","mrlngn p.s.","https://www.google.com/maps/reviews/data=!4m8!14m7!1m6!2m5!1sChdDSUhNMG9nS0VJQ0FnSUNROFAyM3p3RRAB!2m1!1s0x0:0x49bde399ebde344c!3m1!1s2@1:CIHM0ogKEICAgICQ8P23zwE%7CCgsInPSo2QUQgM_3FQ%7C?hl=id","A place to taste Keraton's food. Good place, food and service. And price worthy."
"Bale Raos - The Sultan's Dishes","https://www.google.com/maps/search/?api=1&query=Bale%20Raos%20-%20The%20Sultan's%20Dishes&query_place_id=ChIJH03CYY1Xei4RTDTe65njvUk","5","SanSan Sanjay","https://www.google.com/maps/reviews/data=!4m8!14m7!1m6!2m5!1sChZDSUhNMG9nS0VJQ0FnSUNRZ0tiV0F3EAE!2m1!1s0x0:0x49bde399ebde344c!3m1!1s2@1:CIHM0ogKEICAgICQgKbWAw%7CCgsIjbzbzgUQgM2kIw%7C?hl=id","the best place if you want to try some autenthics and fusion traditional javanese cuisines"
"Bale Raos - The Sultan's Dishes","https://www.google.com/maps/search/?api=1&query=Bale%20Raos%20-%20The%20Sultan's%20Dishes&query_place_id=ChIJH03CYY1Xei4RTDTe65njvUk","5","Dapur OliviaRu","https://www.google.com/maps/reviews/data=!4m8!14m7!1m6!2m5!1sChdDSUhNMG9nS0VJQ0FnSURRdnNfMHNRRRAB!2m1!1s0x0:0x49bde399ebde344c!3m1!1s2@1:CIHM0ogKEICAgIDQvs_0sQE%7CCgwIhKHb2gUQgN6F3QI%7C?hl=id","Good traditional food"
"Bale Raos - The Sultan's Dishes","https://www.google.com/maps/search/?api=1&query=Bale%20Raos%20-%20The%20Sultan's%20Dishes&query_place_id=ChIJH03CYY1Xei4RTDTe65njvUk","5","Sarewanen","https://www.google.com/maps/reviews/data=!4m8!14m7!1m6!2m5!1sChZDSUhNMG9nS0VJQ0FnTUNJX2FLMmVnEAE!2m1!1s0x0:0x49bde399ebde344c!3m1!1s2@1:CIHM0ogKEICAgMCI_aK2eg%7CCgwI_Pm9vwYQwOe-vwM%7C?hl=id",
"Bale Raos - The Sultan's Dishes","https://www.google.com/maps/search/?api=1&query=Bale%20Raos%20-%20The%20Sultan's%20Dishes&query_place_id=ChIJH03CYY1Xei4RTDTe65njvUk","5","Yonke Mulyono","https://www.google.com/maps/reviews/data=!4m8!14m7!1m6!2m5!1sChdDSUhNMG9nS0VJQ0FnSURVby1XczdBRRAB!2m1!1s0x0:0x49bde399ebde344c!3m1!1s2@1:CIHM0ogKEICAgIDUo-Ws7AE%7CCgsIio616wUQ8IqWUA%7C?hl=id","Best place. Best price. Nobel recipe from the Palace kitchen."
"Bale Raos - The Sultan's Dishes","https://www.google.com/maps/search/?api=1&query=Bale%20Raos%20-%20The%20Sultan's%20Dishes&query_place_id=ChIJH03CYY1Xei4RTDTe65njvUk","5","MAHANI Chanel","https://www.google.com/maps/reviews/data=!4m8!14m7!1m6!2m5!1sChdDSUhNMG9nS0VJQ0FnSURBOVoycndRRRAB!2m1!1s0x0:0x49bde399ebde344c!3m1!1s2@1:CIHM0ogKEICAgIDA9Z2rwQE%7CCgwIse7R0wUQgJfjiwM%7C?hl=id","Rajanya masakan jawa, matap raosipun.....Rahayu Rahayu Rahayu"
"Bale Raos - The Sultan's Dishes","https://www.google.com/maps/search/?api=1&query=Bale%20Raos%20-%20The%20Sultan's%20Dishes&query_place_id=ChIJH03CYY1Xei4RTDTe65njvUk","5","Edwin Hendra Kusuma","https://www.google.com/maps/reviews/data=!4m8!14m7!1m6!2m5!1sChdDSUhNMG9nS0VJQ0FnSURLZ0pUdDFnRRAB!2m1!1s0x0:0x49bde399ebde344c!3m1!1s2@1:CIHM0ogKEICAgIDKgJTt1gE%7CCgwIraK9wgYQuNuW9gI%7C?hl=id",
"Bale Raos - The Sultan's Dishes","https://www.google.com/maps/search/?api=1&query=Bale%20Raos%20-%20The%20Sultan's%20Dishes&query_place_id=ChIJH03CYY1Xei4RTDTe65njvUk","4","Nur Fadilla Octavianasari","https://www.google.com/maps/reviews/data=!4m8!14m7!1m6!2m5!1sCi9DQUlRQUNvZENodHljRjlvT2pSeFNFbzVWVEJTYTNCR1MwOVNlV1J6ZGtkYVpuYxAB!2m1!1s0x0:0x49bde399ebde344c!3m1!1s2@1:CAIQACodChtycF9oOjRxSEo5VTBSa3BGS09SeWRzdkdaZnc%7C0d41xRTp-pT%7C?hl=id","Kesini dec 2023 dulu, dan baru sempat review gegara bukain si ipin. The real kalau mau makan ala-ala sultan bisalah coba makan disini wkwk.

Buat makanan emang unik-unik yaa, dulu pilih makanan yang direkomendasi sama chef juna ama renata, fyi menu menu disini emang sultan dishes ya. Pengunjung waktu saya kesana juga banyakan bule kalo ngga in group gitu.

Rekomendasi menu:
1. Gecok Ganem
2. Manok Nom for dessert
3. Beer Djawa

Agak sedikit panas kalau kesininya siang bolong macem saya, apalagi kalau makan yang di joglo outdoor ya, kayanya kalau kesininya sorean gitu enak adem."
"Bale Raos - The Sultan's Dishes","https://www.google.com/maps/search/?api=1&query=Bale%20Raos%20-%20The%20Sultan's%20Dishes&query_place_id=ChIJH03CYY1Xei4RTDTe65njvUk","4","Chicha Rosa","https://www.google.com/maps/reviews/data=!4m8!14m7!1m6!2m5!1sCi9DQUlRQUNvZENodHljRjlvT25wSVlsRmphVzgxWTFKdFprWndkV3RJUkVwS1RuYxAB!2m1!1s0x0:0x49bde399ebde344c!3m1!1s2@1:CAIQACodChtycF9oOnpIYlFjaW81Y1JtZkZwdWtIREpKTnc%7C0cNXfMBIvpl%7C?hl=id","Salah 1 destinasi kuliner yg wajib di coba kalau di Jogja. Suasana nya seperti makan dengan raja. Ada live music tradisional kalau malam minggu sekitar jam 6 atau 7 malam. Tempat nya semi outdoor tapi tidak panas. Makanan bervariasi. Harga standard, masih masuk akal. Air putih free. Toilet nya perlu di renovasi dan bagusin lagi yaa, supaya nyaman.. parkiran tersedia luas. Pelayanan OK. Bisa bayar non tunai. Makan sebanyak itu habis sekitar 300rb-an."
"Bale Raos - The Sultan's Dishes","https://www.google.com/maps/search/?api=1&query=Bale%20Raos%20-%20The%20Sultan's%20Dishes&query_place_id=ChIJH03CYY1Xei4RTDTe65njvUk","4","Parithustha Mahayati","https://www.google.com/maps/reviews/data=!4m8!14m7!1m6!2m5!1sCi9DQUlRQUNvZENodHljRjlvT2tGUGFXRkViM1pxTVRrNU5VeHhkMnB6ZG10TWEzYxAB!2m1!1s0x0:0x49bde399ebde344c!3m1!1s2@1:CAIQACodChtycF9oOkFPaWFEb3ZqMTk5NUxxd2pzdmtMa3c%7C0cK_R51ZuH2%7C?hl=id","Kuliner di Jogja emang ga pernah ada habisnya. Kali ini berkesempatan nyoba masakan khas keraton di Bale Raos. Bale Raos adalah restoran dalam keraton Yogyakarta yg menyajikan banyak hidangan kesukaan para raja keraton yg khas dan otentik. Visinya untuk melestarikan budaya keraton lewat kulinernya. Lokasi restoran ada di dalem area Keraton Yogyakarta bagian belakang. Area parkirnya muat untuk mobil, motor atau mini bus.

Arsitektur bangunan memang dibuat layaknya keraton Yogyakarta dari mulai atap, tiang penyangga,  dan ornamen dinding. Ukiran dan warna yg dominan hijau memang khasnya keraton Yogya. Makan disini berasa sehari jadi bangsawan keraton. Meja dan kursi yg disediakan cukup banyak. Mau bikin acara gathering atau kumpul2 bisa banget, pastikan reservasi terlebih dahulu.

Disini pesen menu nasi tradisional set yg isinya gecok ganem (bola daging santan), oseng daun pepaya, tempe tahu bacem, lombok kethok yg disajikan sama nasi merah dan kerupuk karak. Satu set seharga 67,5k dan sangat amat bikin kenyang. Untuk overall rasanya menurutku agak kemanisan terutama untuk bacem, oseng daun pepaya dan lombok kethoknya. Favorit ada di gecok ganem karena rasanya unik dan gurih mirip garang asem tapi versi lebih light. Selain menu set nasi, pesen wedang secang (20k) dan kapiratu (17,5k). Kapiratu mirip bgt rasanya kaya sosis solo, tapi versi lebih manis.

Overall nice, tapi kemaren waktu kesana ga tau kenapa makanannya diserve ga panas dan cenderung dingin. Jadi waktu makan kurang sreg. Untuk pelayanannya memuaskan, pelayan sangat sopan dan menjelaskan dengan baik detil makanan yg ada di menu. Pelayannya juga selalu stand by di deket pengunjung. Recommend bgt bagi yg penasaran pengen nyobain kuliner khas kerajaan Yogyakarta 🍽"
"Bale Raos - The Sultan's Dishes","https://www.google.com/maps/search/?api=1&query=Bale%20Raos%20-%20The%20Sultan's%20Dishes&query_place_id=ChIJH03CYY1Xei4RTDTe65njvUk","4","Roy Ps","https://www.google.com/maps/reviews/data=!4m8!14m7!1m6!2m5!1sCi9DQUlRQUNvZENodHljRjlvT2xCdFozSkRja3RLWVVjdFpGUjFlRGhLWTNRMFdrRRAB!2m1!1s0x0:0x49bde399ebde344c!3m1!1s2@1:CAIQACodChtycF9oOlBtZ3JDcktKYUctZFR1eDhKY3Q0WkE%7C0dGD-k2Byuc%7C?hl=id","Tempatnya luas, makanan minuman rasanya ok plus pelayanannya cepat & baik"
"Bale Raos - The Sultan's Dishes","https://www.google.com/maps/search/?api=1&query=Bale%20Raos%20-%20The%20Sultan's%20Dishes&query_place_id=ChIJH03CYY1Xei4RTDTe65njvUk","4","Septiana Bella","https://www.google.com/maps/reviews/data=!4m8!14m7!1m6!2m5!1sChdDSUhNMG9nS0VKMlhwN2VDZ3VPY3dBRRAB!2m1!1s0x0:0x49bde399ebde344c!3m1!1s2@1:CIHM0ogKEJ2Xp7eCguOcwAE%7CCgwIkY7rwQYQgNaUzgE%7C?hl=id","Bale Raos merupakan restoran di lingkungan keraton Yogyakarta yg menghidangkan makanan khas keraton maupun makanan favorit raja-raja keraton Ngayogyakarta.
Tempatnya syahdu, luas dengan pemandangan hijau dan arsitektur hijau emas putih khas keraton.
Untuk makanannya saya pesan gudeg manggar set (nasi, telur, krecek, gudeg bunga pohon kelapa), sanggar (daging sapi bumbu repah dan santan, dan kapiratu (dadar telur gulung isi sapi cincang).
Untuk rasanya menurut saya biasa saja, kurang berempah dan agak dingin.
Tapi pelayanan para pegawainya bagus, ramah dan gesit.
Lingkungannya bersih dan nyaman, selain itu terdapat alunan gendang jawa yang mengalun merdu."
"Bale Raos - The Sultan's Dishes","https://www.google.com/maps/search/?api=1&query=Bale%20Raos%20-%20The%20Sultan's%20Dishes&query_place_id=ChIJH03CYY1Xei4RTDTe65njvUk","4","Fakhrudin Saleh","https://www.google.com/maps/reviews/data=!4m8!14m7!1m6!2m5!1sChdDSUhNMG9nS0VOcll6S2F6Z3JHZHBnRRAB!2m1!1s0x0:0x49bde399ebde344c!3m1!1s2@1:CIHM0ogKENrYzKazgrGdpgE%7CCgwI2Nv3wAYQ8PKJqgE%7C?hl=id","Menurut informasi yang ada, keraton yogyakarta termasuk dalam cagar budaya UNESCO, di satu sisi kami berkesempatan untuk berkunjung dan mencicipi hidangan The sultan’s Dishes. Beberapa aneka makanan yang dapat menjadi pilihan seperti “Aneka bestik atau “bestik Komplit , bestik Lidah , wedhang Rondhe , bakmi Godhok . Bestik komplit sangat enak sekali. Sepertinya berkunjung di siang hari jauh lebih baik untuk menikmati suasana keraton yang ada.Bangga menjadi bagian dari peninggalan sejarah indonesia."
"Bale Raos - The Sultan's Dishes","https://www.google.com/maps/search/?api=1&query=Bale%20Raos%20-%20The%20Sultan's%20Dishes&query_place_id=ChIJH03CYY1Xei4RTDTe65njvUk","4","Obi Jepara","https://www.google.com/maps/reviews/data=!4m8!14m7!1m6!2m5!1sCi9DQUlRQUNvZENodHljRjlvT21SdVRVTk1Xa1I2ZWxOQmVYbzBNVmd4ZFRaNUxYYxAB!2m1!1s0x0:0x49bde399ebde344c!3m1!1s2@1:CAIQACodChtycF9oOmRuTUNMWkR6elNBeXo0MVgxdTZ5LXc%7C0dDuqJpGsTw%7C?hl=id","Restoran khas raja Jawa
Dan tempat nya sebagai Cagar Budaya
👍👍👍"
"Bale Raos - The Sultan's Dishes","https://www.google.com/maps/search/?api=1&query=Bale%20Raos%20-%20The%20Sultan's%20Dishes&query_place_id=ChIJH03CYY1Xei4RTDTe65njvUk","4","Elvita Yuli","https://www.google.com/maps/reviews/data=!4m8!14m7!1m6!2m5!1sChdDSUhNMG9nS0VJQ0FnSUNMdXN2T3NBRRAB!2m1!1s0x0:0x49bde399ebde344c!3m1!1s2@1:CIHM0ogKEICAgICLusvOsAE%7CCgsI_OPeswYQ-MaKKA%7C?hl=id","Bale Raos merupakan resto yg berada di kawasan kraton yogya dengan suasana yg tenang, nyaman, sambil diringi musik gamelan. Makanan di hidangkan pada meja formal layaknya jamuan khas kraton. Pilihan menunya, beberapa merupakan menu favorit sultan hamengkubuwono dan keluarga. Banyak sekali menu pilihannya dari appetizer, main course, & dessert-nya. Untuk rasa, terasa sekali khas yogya-nya (manis). Jadi jangan cari makanan pedas dsini ya. Hehe.. Bagi saya, overall rasa makanan so-so. But, klo di nilai berdasar varian menu bagi yg kepingin coba2 dan suasananya yg tenang,,,,yaaaa boleh lah.."
"Bale Raos - The Sultan's Dishes","https://www.google.com/maps/search/?api=1&query=Bale%20Raos%20-%20The%20Sultan's%20Dishes&query_place_id=ChIJH03CYY1Xei4RTDTe65njvUk","4","miyaken","https://www.google.com/maps/reviews/data=!4m8!14m7!1m6!2m5!1sCi9DQUlRQUNvZENodHljRjlvT2xseFFsQTRWM2hCVVVGemNIbFhTMHhuTkZnMVoyYxAB!2m1!1s0x0:0x49bde399ebde344c!3m1!1s2@1:CAIQACodChtycF9oOllxQlA4V3hBUUFzcHlXS0xnNFg1Z2c%7C0d5JElVnlaq%7C?hl=id","Katanya ini beberapa menu favorit Sultan, jadi penasaran buat coba. Tapi sayangnya beberapa yang aku pesan kurang cocok di lidah. Garang asemnya asin banget, dan bakmi rebusnya bau telur jadi agak eneg. Bistik komplitnya masih oke 👍Untuk harga ya so-so lah. Tempatnya semi outdoor, ada alunan musik juga. Parkir gratis. Waktu masuk suasananya sepi banget kayak nggak ada orang, tapi overall pengalaman makan di sini 7.5/10."
"Bale Raos - The Sultan's Dishes","https://www.google.com/maps/search/?api=1&query=Bale%20Raos%20-%20The%20Sultan's%20Dishes&query_place_id=ChIJH03CYY1Xei4RTDTe65njvUk","4","Hako Jajan","https://www.google.com/maps/reviews/data=!4m8!14m7!1m6!2m5!1sChZDSUhNMG9nS0VJQ0FnSURiZ3YyVlRnEAE!2m1!1s0x0:0x49bde399ebde344c!3m1!1s2@1:CIHM0ogKEICAgIDbgv2VTg%7CCgwInoq4tQYQoKjYrwI%7C?hl=id","Restoran heritage di area keraton jogya ini sangat menarik.
Setelah kita duduk disini, pikiran sy menerawang & berkhayal seakan2 kita diundang keraton untuk makan siang di istana 🥴👍

Sy mencoba makanan rekomendasi dari menu yg disodorkan, dan kami memutuskan untuk memilih makanan kesukaan Sultan HB VII, VIII dan X ...

Ternyata selera kuliner yg paling mantabs menurut sy adalah

Juara 1. Sultan HB VIII diwakili oleh bestik Lidah, prawan kenes dan beer jawa

Juara 2. Sultan HB VII diwakili oleh semur piyik (burung dara semur)

Juara 3. Sultan HB X diwakili oleh gecok kambing (maaf menurut sy ini kurang lezat dan aneh rasanya🥴🙏)

Benar2 salut atas selera HB VII, VIII dan IX 👍👍👍

Viva Jogjakarta 🙏"
"Bale Raos - The Sultan's Dishes","https://www.google.com/maps/search/?api=1&query=Bale%20Raos%20-%20The%20Sultan's%20Dishes&query_place_id=ChIJH03CYY1Xei4RTDTe65njvUk","4","Dewi Puspitasari","https://www.google.com/maps/reviews/data=!4m8!14m7!1m6!2m5!1sChdDSUhNMG9nS0VJQ0FnSUNmbW8yc253RRAB!2m1!1s0x0:0x49bde399ebde344c!3m1!1s2@1:CIHM0ogKEICAgICfmo2snwE%7CCgwIz5q-uwYQ8N2txwI%7C?hl=id","untuk pelayanannya ramah, reservasi juga mudah, menu makanan jawa yg beragam, plattingnya cantik, makanannya enak kaya rasa, menu untuk pesanan daging kambing dan ayam dagingnya alot, tp overall cukup puas, terima kasih"
"Bale Raos - The Sultan's Dishes","https://www.google.com/maps/search/?api=1&query=Bale%20Raos%20-%20The%20Sultan's%20Dishes&query_place_id=ChIJH03CYY1Xei4RTDTe65njvUk","4","lu'lu-u azizah","https://www.google.com/maps/reviews/data=!4m8!14m7!1m6!2m5!1sChRDSUhNMG9nS0VJQ0FnSURqMDhrRhAB!2m1!1s0x0:0x49bde399ebde344c!3m1!1s2@1:CIHM0ogKEICAgIDj08kF%7CCgwI9bznsQYQkO7e5QE%7C?hl=id","Hati-hati buat yang pake maps krna kalau pakai jalan maps biasanya diarahkan dr blkg yg mana ga bs dilalui kendaraan. Tukang angkringan disitu juga bilang byk yg suka kesasar kesitu kalo pake maps. Ancer2nya dr pasar ngasem aja nnti ketemu pertigaan yg ada pohon beringinnya terus belok kiri kalo dr pasar ngasem, stlh itu lurus dah nyampek. Sekarang sy ulas menu2nya, waktu itu sy dipesankan bbrpa menu makanan. Favoritku dan aku rekomendasikan juga adalah java beer tapi lupa ga kefoto, selebihnya menu makanannya biasa aja rasanya. Dessertnya enaak tapi lupa namanya. Utk suasana tenang dan ayem dgn nuansa bangunan jawa.  Tempat bersih toilet bersih. Tapiii sgt disayangkan kolam air mancurnya bau menyengat, warnanya juga hijau. Waktu ksna ada pertunjukan tari juga. Dan disana juga ada galeri seninya jd bs sekalian keliling galeri seni. Dari segi pelayanan sudah bagus tapi ada karyawan yg menurut sy kurang ramah."
"Bale Raos - The Sultan's Dishes","https://www.google.com/maps/search/?api=1&query=Bale%20Raos%20-%20The%20Sultan's%20Dishes&query_place_id=ChIJH03CYY1Xei4RTDTe65njvUk","4","Billy Joe","https://www.google.com/maps/reviews/data=!4m8!14m7!1m6!2m5!1sChdDSUhNMG9nS0VJQ0FnTUNJZ3FLZ3ZBRRAB!2m1!1s0x0:0x49bde399ebde344c!3m1!1s2@1:CIHM0ogKEICAgMCIgqKgvAE%7CCgwIjeapvwYQ-MDv_gI%7C?hl=id","Klu urusan makanan jelas tidak ada pembandingnya, karna menunya memang menu spesial hanya bale raos yg lunya

Bangunan seperti minim maintenance, bahkan ketika masuk pertama kali seperti masuk ke bangunan kosong. Mengingat kebanyakan tamunya juga orang asing, mestinya juga disediakan ruang berpendingin udara (ada indoornya juga tp sperti bangunan yg ditinggalkan)"
"Bale Raos - The Sultan's Dishes","https://www.google.com/maps/search/?api=1&query=Bale%20Raos%20-%20The%20Sultan's%20Dishes&query_place_id=ChIJH03CYY1Xei4RTDTe65njvUk","4","Mimin Doyan Makan","https://www.google.com/maps/reviews/data=!4m8!14m7!1m6!2m5!1sChZDSUhNMG9nS0VJQ0FnSURKMHVIdEtREAE!2m1!1s0x0:0x49bde399ebde344c!3m1!1s2@1:CIHM0ogKEICAgIDJ0uHtKQ%7CCgwImYfDpQYQwLGtoQM%7C?hl=id","Suasana keraton nya kerasa banget. Service nya nice. Utk makanan yg mimin pilih hampir oke banget semua kecuali pudding 🙏 pudding nya mimin engga cocok 🤭 utk hrg termsk lil bit higher but nice to try and will come again"
"Bale Raos - The Sultan's Dishes","https://www.google.com/maps/search/?api=1&query=Bale%20Raos%20-%20The%20Sultan's%20Dishes&query_place_id=ChIJH03CYY1Xei4RTDTe65njvUk","4","agtifa primadani","https://www.google.com/maps/reviews/data=!4m8!14m7!1m6!2m5!1sChdDSUhNMG9nS0VJQ0FnSUN6by1LQWlnRRAB!2m1!1s0x0:0x49bde399ebde344c!3m1!1s2@1:CIHM0ogKEICAgICzo-KAigE%7CCgwIpdL8sgYQ-KCh5wE%7C?hl=id","Restoran yang menyajikan masakan kegemaran sultan dan keluarganya. Masih mempertahankan bentuk bangunan lama dan perabotnya. Area makan luas dan terbagi di beberapa ruangan terbuka. Masakan tidak menggunakan penyedap rasa dan bumbunya terasa ringan. Ada free keripik jagung untuk cemilan sambil menunggu pesanan makanan datang."
"Bale Raos - The Sultan's Dishes","https://www.google.com/maps/search/?api=1&query=Bale%20Raos%20-%20The%20Sultan's%20Dishes&query_place_id=ChIJH03CYY1Xei4RTDTe65njvUk","4","Endah Murniningtyas","https://www.google.com/maps/reviews/data=!4m8!14m7!1m6!2m5!1sChZDSUhNMG9nS0VJQ0FnSUNYckxySld3EAE!2m1!1s0x0:0x49bde399ebde344c!3m1!1s2@1:CIHM0ogKEICAgICXrLrJWw%7CCgsIt8exuAYQ8PLOFg%7C?hl=id","Beberapa kali mengunjungi utk mendapatkan makanan yg lumayan dan tempat enak.. masih cukup memuaskan… ada perubahan tempat masuk, jadi jalan cukup jauh utk yg sedang memiliki masalah dg jalan kaki, kebersihan perlu ditingkatkan… bistik enak tapi daging sangat perlu dibuat empuk… terus tingkatkan mutu ya"
"Bale Raos - The Sultan's Dishes","https://www.google.com/maps/search/?api=1&query=Bale%20Raos%20-%20The%20Sultan's%20Dishes&query_place_id=ChIJH03CYY1Xei4RTDTe65njvUk","4","Bertha Oktaviani","https://www.google.com/maps/reviews/data=!4m8!14m7!1m6!2m5!1sChZDSUhNMG9nS0VJQ0FnTURJM1k3VVZBEAE!2m1!1s0x0:0x49bde399ebde344c!3m1!1s2@1:CIHM0ogKEICAgMDI3Y7UVA%7CCgwIyPLovwYQ4LKupwI%7C?hl=id","Hbs ngelilingin taman sari n keraton nyoba minum mkn disini berasa jd anggota kerajaan lokasi di area keraton,harganya ya hrg resto pd umumnya,es campur gt 30rb,bir jawa rasa jahe sereh kayumanis dll sekitaran 20rban,makanan fav sultan mangut lele gitu 50rban,nasi 10rb,ada pajak,ada biaya layanan mas2nya 6rban,yah sekali2 dicoba"
"Bale Raos - The Sultan's Dishes","https://www.google.com/maps/search/?api=1&query=Bale%20Raos%20-%20The%20Sultan's%20Dishes&query_place_id=ChIJH03CYY1Xei4RTDTe65njvUk","4","Aidi Kamil Marzuki","https://www.google.com/maps/reviews/data=!4m8!14m7!1m6!2m5!1sCi9DQUlRQUNvZENodHljRjlvT2xoVWMwUTJWbkJrYmw5TmVqVm5WR05HY1dsQk0yYxAB!2m1!1s0x0:0x49bde399ebde344c!3m1!1s2@1:CAIQACodChtycF9oOlhUc0Q2VnBkbl9NejVnVGNGcWlBM2c%7C0cdkG_kmnVM%7C?hl=id","Bale Raos.
Di sini kita bisa kuliner sambil menikmati suasana keraton tempo dulu."
"Bale Raos - The Sultan's Dishes","https://www.google.com/maps/search/?api=1&query=Bale%20Raos%20-%20The%20Sultan's%20Dishes&query_place_id=ChIJH03CYY1Xei4RTDTe65njvUk","4","Dini Apriani","https://www.google.com/maps/reviews/data=!4m8!14m7!1m6!2m5!1sChdDSUhNMG9nS0VJQ0FnSUMxOHVEZDNnRRAB!2m1!1s0x0:0x49bde399ebde344c!3m1!1s2@1:CIHM0ogKEICAgIC18uDd3gE%7CCgwIyqSurAYQqPv42gE%7C?hl=id","Asli, lidah kampung dikasih makanan sultan mah ga nyambung. Tapi enak tapi bukan selera aja. Suasanya berasa jadi tamu keraton soalnya tempatnya bener2 disamping keraton. Fasilitas lengkap dari toilet sampaj mushola. Deket juga ke taman sari, jadi abis jalan2 di taman sari bisa makan disini."
"Bale Raos - The Sultan's Dishes","https://www.google.com/maps/search/?api=1&query=Bale%20Raos%20-%20The%20Sultan's%20Dishes&query_place_id=ChIJH03CYY1Xei4RTDTe65njvUk","4","Alen Alen","https://www.google.com/maps/reviews/data=!4m8!14m7!1m6!2m5!1sCi9DQUlRQUNvZENodHljRjlvT201WFVGOXlWRzl4T0c5bFpFNUpUR0prYVVVNFRWRRAB!2m1!1s0x0:0x49bde399ebde344c!3m1!1s2@1:CAIQACodChtycF9oOm5XUF9yVG9xOG9lZE5JTGJkaUU4TVE%7C0d5OwMbvDSu%7C?hl=id","Tempatnya dari dulu memang nyaman. Namun dengan tidak mengurangi hormat kami, kami tidak mengerti mengapa sajian kemarin malam fail semua. Kami rindu kenikmatan masakan anda yg dulu. Dan mohon maaf kami benar benar tidak sanggup menghabiskan sayur beningnya kemarin, karena sangat asin."
"Bale Raos - The Sultan's Dishes","https://www.google.com/maps/search/?api=1&query=Bale%20Raos%20-%20The%20Sultan's%20Dishes&query_place_id=ChIJH03CYY1Xei4RTDTe65njvUk","4","Afita SF","https://www.google.com/maps/reviews/data=!4m8!14m7!1m6!2m5!1sChZDSUhNMG9nS0VJQ0FnSUNObHByek1nEAE!2m1!1s0x0:0x49bde399ebde344c!3m1!1s2@1:CIHM0ogKEICAgICNlprzMg%7CCgwI45iOrQYQ0M6yiQM%7C?hl=id","tempatnya agak masuk kedalam komplek alun-alun kidul. makanannya cukup, pelayanannya bagus, harga cukup diatas rata-rata kota Jogja, ada live musicnya jadi suasana makin asik. makan juga cepat disajikan jadi tidak bakal kelaparan."
