"title","url","stars","name","reviewUrl","text"
"Bale Raos - The Sultan's Dishes","https://www.google.com/maps/search/?api=1&query=Bale%20Raos%20-%20The%20Sultan's%20Dishes&query_place_id=ChIJH03CYY1Xei4RTDTe65njvUk","5","Kang Ajat Channel","https://www.google.com/maps/reviews/data=!4m8!14m7!1m6!2m5!1sChZDSUhNMG9nS0VJQ0FnSURNcWVHSUpBEAE!2m1!1s0x0:0x49bde399ebde344c!3m1!1s2@1:CIHM0ogKEICAgIDMqeGIJA%7CCgsI_Mi_8AUQiK_cGA%7C?hl=id","Merasakan masakan Kraton dan hidangan Raja ya ke Bale Raos. Makan didalam Kraton sesuatu banget deh, suasana nya benar - benar berbeda. Ditambah menu makanan yang hanyanada disini ngga dijual ditempat lain. Kalau ke Jogja sempatkanlah makam disini."
"Bale Raos - The Sultan's Dishes","https://www.google.com/maps/search/?api=1&query=Bale%20Raos%20-%20The%20Sultan's%20Dishes&query_place_id=ChIJH03CYY1Xei4RTDTe65njvUk","5","Dian Irawan Dian","https://www.google.com/maps/reviews/data=!4m8!14m7!1m6!2m5!1sChZDSUhNMG9nS0VJQ0FnSUN1c05TQlFREAE!2m1!1s0x0:0x49bde399ebde344c!3m1!1s2@1:CIHM0ogKEICAgICusNSBQQ%7CCgwI7d_ZlgYQ2PvErwI%7C?hl=id","Menu yang disediakan adalah menu2 kesukaan Raja Jogjakarta ( menu kraton Jogja )"
"Bale Raos - The Sultan's Dishes","https://www.google.com/maps/search/?api=1&query=Bale%20Raos%20-%20The%20Sultan's%20Dishes&query_place_id=ChIJH03CYY1Xei4RTDTe65njvUk","5","Sugianto 9","https://www.google.com/maps/reviews/data=!4m8!14m7!1m6!2m5!1sChdDSUhNMG9nS0VJQ0FnSURncHRlQ2pRRRAB!2m1!1s0x0:0x49bde399ebde344c!3m1!1s2@1:CIHM0ogKEICAgIDgpteCjQE%7CCgwIweS5vgUQgOf24wE%7C?hl=id","Wowww.. mau makan ala Raja jaman Dahulu.. datang saja ke Bale Raos. Berlokasi di lingkungan keraton Jogyakarta. Tempatnya asri. Terasa seperti hidup di jaman kerajaan dahulu. Ornamen asli keratonan, masih melekat kuat di lokasi ini. Bicara menu makanannyapun sangat luar biasa, baik macam dan rasanya. Sangat khas sekali, tidak pasaran. Sangat harus dicoba bila sedang berkunjung ke Jogya."
"Bale Raos - The Sultan's Dishes","https://www.google.com/maps/search/?api=1&query=Bale%20Raos%20-%20The%20Sultan's%20Dishes&query_place_id=ChIJH03CYY1Xei4RTDTe65njvUk","5","Asep Haris","https://www.google.com/maps/reviews/data=!4m8!14m7!1m6!2m5!1sChdDSUhNMG9nS0VJQ0FnSUNmdm9Pa3NnRRAB!2m1!1s0x0:0x49bde399ebde344c!3m1!1s2@1:CIHM0ogKEICAgICfvoOksgE%7CCgwI853FuwYQiPXuoAI%7C?hl=id","Makanan enak, penyajian juga cepet, tempat besar, cocok untuk keluarga besar makan makan , rekomen gaissss"
"Bale Raos - The Sultan's Dishes","https://www.google.com/maps/search/?api=1&query=Bale%20Raos%20-%20The%20Sultan's%20Dishes&query_place_id=ChIJH03CYY1Xei4RTDTe65njvUk","5","Muhammad Raafi","https://www.google.com/maps/reviews/data=!4m8!14m7!1m6!2m5!1sChZDSUhNMG9nS0VJQ0FnSUNHbklYaVR3EAE!2m1!1s0x0:0x49bde399ebde344c!3m1!1s2@1:CIHM0ogKEICAgICGnIXiTw%7CCgwIvJvNiwYQuNvz1wI%7C?hl=id","Tempat berada di area Keraton Jogja, parkir luas, nyaman, makanan bervariasi, enak"" pula"
"Bale Raos - The Sultan's Dishes","https://www.google.com/maps/search/?api=1&query=Bale%20Raos%20-%20The%20Sultan's%20Dishes&query_place_id=ChIJH03CYY1Xei4RTDTe65njvUk","5","E lyana","https://www.google.com/maps/reviews/data=!4m8!14m7!1m6!2m5!1sChdDSUhNMG9nS0VJQ0FnSUNmdnJXSjhBRRAB!2m1!1s0x0:0x49bde399ebde344c!3m1!1s2@1:CIHM0ogKEICAgICfvrWJ8AE%7CCgwIvZrFuwYQuJClqQE%7C?hl=id","Ayamnya empuk, tempatnya nyaman"
"Bale Raos - The Sultan's Dishes","https://www.google.com/maps/search/?api=1&query=Bale%20Raos%20-%20The%20Sultan's%20Dishes&query_place_id=ChIJH03CYY1Xei4RTDTe65njvUk","5","Annie","https://www.google.com/maps/reviews/data=!4m8!14m7!1m6!2m5!1sChdDSUhNMG9nS0VJQ0FnSURTeWZXajVRRRAB!2m1!1s0x0:0x49bde399ebde344c!3m1!1s2@1:CIHM0ogKEICAgIDSyfWj5QE%7CCgwIityz_wUQwI2O3AI%7C?hl=id","Restauran bergaya keraton, tempatnya bagus, makannanya juga enak2, untuk harga  masih termasuk standar aja gak terlalu mahal juga, staffnya juga cepet responnya"
"Bale Raos - The Sultan's Dishes","https://www.google.com/maps/search/?api=1&query=Bale%20Raos%20-%20The%20Sultan's%20Dishes&query_place_id=ChIJH03CYY1Xei4RTDTe65njvUk","5","Karin","https://www.google.com/maps/reviews/data=!4m8!14m7!1m6!2m5!1sChdDSUhNMG9nS0VJQ0FnSUQzajdhM3ZnRRAB!2m1!1s0x0:0x49bde399ebde344c!3m1!1s2@1:CIHM0ogKEICAgID3j7a3vgE%7CCgwI3qP1uQYQsPjT6wE%7C?hl=id","Pertama kali makan sore bersama keluarga besar, beberapa lansia dengan usia di atas 70 tahun. Suasana klasik Jawa. Saat masuk sempat bingung karena tdk ada penunjuk ke resto/tempat makannya. Tidak ada petugas di depan pintu masuk mungkin karena bukan jam makan biasa. Sdh reservasi 2 minggu sebelumnya. Dengan inisiatif pribadi menyambut keluarga di depan pintu masuk. Maklum beberapa anggota keluarga baru pertama kali ke tempat makan Sultan Keraton ini. Menu kuliner Sultan enak, yg Sepuh bisa mencicipi. Kudapan bendul, chicken cheese bite lembut, rasa pas. Kami memesan menu ala carte, mangut ikan, sup ikan kemangi, nasi bakar/gurame bakar, bethak ayam (porsi personal), gudeg manggar komplit, jangan bobor komplit, bestik lidah, ayam goreng dan garang asem (1 potong ayam terasa alot). Aneka minuman beer Djawa hot, es djadoel, es sapaitu (seperti soda gembira dengan rasa sarsaparilla), es kelengkeng, sereh lime hot. Disediakan air putih gratis di meja. Menu kuliner Sultan mantap, pas dengan selera Indonesia. Pelayanan ramah, cepat."
"Bale Raos - The Sultan's Dishes","https://www.google.com/maps/search/?api=1&query=Bale%20Raos%20-%20The%20Sultan's%20Dishes&query_place_id=ChIJH03CYY1Xei4RTDTe65njvUk","5","PT.MEDINA SAFIRA","https://www.google.com/maps/reviews/data=!4m8!14m7!1m6!2m5!1sChZDSUhNMG9nS0VObi04Y0d2NUlXV0N3EAE!2m1!1s0x0:0x49bde399ebde344c!3m1!1s2@1:CIHM0ogKENn-8cGv5IWWCw%7CCgwIi-6KwgYQuOO-zwE%7C?hl=id","Makanannya benar-benar otentik jawa. Rasanya enak dan porsinya banyak, sultann bangett. Terimakasih Baleraos, sukses selali"
"Bale Raos - The Sultan's Dishes","https://www.google.com/maps/search/?api=1&query=Bale%20Raos%20-%20The%20Sultan's%20Dishes&query_place_id=ChIJH03CYY1Xei4RTDTe65njvUk","5","yustinus banup pri handoko","https://www.google.com/maps/reviews/data=!4m8!14m7!1m6!2m5!1sChZDSUhNMG9nS0VJQ0FnSURDOEltYklnEAE!2m1!1s0x0:0x49bde399ebde344c!3m1!1s2@1:CIHM0ogKEICAgIDC8ImbIg%7CCgwIjsDy-gUQ0KrL3gE%7C?hl=id","Tempat yg nyaman untuk makan siang maupun malam, di balut alunan musik gendang Jawa yg syahdu"
"Bale Raos - The Sultan's Dishes","https://www.google.com/maps/search/?api=1&query=Bale%20Raos%20-%20The%20Sultan's%20Dishes&query_place_id=ChIJH03CYY1Xei4RTDTe65njvUk","5","Nining Soewarto","https://www.google.com/maps/reviews/data=!4m8!14m7!1m6!2m5!1sChZDSUhNMG9nS0VJQ0FnSUR5eDctTkpREAE!2m1!1s0x0:0x49bde399ebde344c!3m1!1s2@1:CIHM0ogKEICAgIDyx7-NJQ%7CCgsIwqzUggYQgPiWFQ%7C?hl=id","Makanannya unik unik ...lumayan enak tempatnya juga asik ..cuman perlu dibersihin lagi kayaknya yaa ... biar tambah indah .."
"Bale Raos - The Sultan's Dishes","https://www.google.com/maps/search/?api=1&query=Bale%20Raos%20-%20The%20Sultan's%20Dishes&query_place_id=ChIJH03CYY1Xei4RTDTe65njvUk","5","Zahro Suryaputri","https://www.google.com/maps/reviews/data=!4m8!14m7!1m6!2m5!1sChZDSUhNMG9nS0VJQ0FnSURNdnBMRGFnEAE!2m1!1s0x0:0x49bde399ebde344c!3m1!1s2@1:CIHM0ogKEICAgIDMvpLDag%7CCgsImc-18AUQgMvefw%7C?hl=id","Masakannya enak. Ternyata masakan tradisional ga kalah sama masakan"" modern. Sekali-sekali la nyobain masakan para raja hahaha."
"Bale Raos - The Sultan's Dishes","https://www.google.com/maps/search/?api=1&query=Bale%20Raos%20-%20The%20Sultan's%20Dishes&query_place_id=ChIJH03CYY1Xei4RTDTe65njvUk","5","Susana Faida","https://www.google.com/maps/reviews/data=!4m8!14m7!1m6!2m5!1sChZDSUhNMG9nS0VJQ0FnSURSXzVqMEN3EAE!2m1!1s0x0:0x49bde399ebde344c!3m1!1s2@1:CIHM0ogKEICAgIDR_5j0Cw%7CCgsI-Z3fogYQuMOPBA%7C?hl=id","Makanan para raja orang keraton .
Harga cukup mahal buat kocekkuuu🙏.tempat dan pelayanan baik"
"Bale Raos - The Sultan's Dishes","https://www.google.com/maps/search/?api=1&query=Bale%20Raos%20-%20The%20Sultan's%20Dishes&query_place_id=ChIJH03CYY1Xei4RTDTe65njvUk","5","Nurul Arohmat","https://www.google.com/maps/reviews/data=!4m8!14m7!1m6!2m5!1sChZDSUhNMG9nS0VJQ0FnSURHbWJqY0lBEAE!2m1!1s0x0:0x49bde399ebde344c!3m1!1s2@1:CIHM0ogKEICAgIDGmbjcIA%7CCgwIo5KkjQYQoJv4jQE%7C?hl=id","Tidak pernah salah kalau makan di resto ini. Makanannya enak-enak sekali."
"Bale Raos - The Sultan's Dishes","https://www.google.com/maps/search/?api=1&query=Bale%20Raos%20-%20The%20Sultan's%20Dishes&query_place_id=ChIJH03CYY1Xei4RTDTe65njvUk","5","Kundhori Dori","https://www.google.com/maps/reviews/data=!4m8!14m7!1m6!2m5!1sChdDSUhNMG9nS0VJQ0FnSURJaFB1RWtnRRAB!2m1!1s0x0:0x49bde399ebde344c!3m1!1s2@1:CIHM0ogKEICAgIDIhPuEkgE%7CCgwItaX04AUQn63q5gI%7C?hl=id","Makanan nya enak pelayanan nya memuaskan sunguh special di tambah lokasi dekat keraton"
"Bale Raos - The Sultan's Dishes","https://www.google.com/maps/search/?api=1&query=Bale%20Raos%20-%20The%20Sultan's%20Dishes&query_place_id=ChIJH03CYY1Xei4RTDTe65njvUk","5","Raditya Dwiharli Pancayudhanto","https://www.google.com/maps/reviews/data=!4m8!14m7!1m6!2m5!1sChZDSUhNMG9nS0VJQ0FnSUNUOC0tX0hnEAE!2m1!1s0x0:0x49bde399ebde344c!3m1!1s2@1:CIHM0ogKEICAgICT8--_Hg%7CCgsI9tmlsgYQwPbdPA%7C?hl=id","Pelayanan nya bagus, makanan nya juga enak, must try!"
"Bale Raos - The Sultan's Dishes","https://www.google.com/maps/search/?api=1&query=Bale%20Raos%20-%20The%20Sultan's%20Dishes&query_place_id=ChIJH03CYY1Xei4RTDTe65njvUk","5","Mbak RR saja","https://www.google.com/maps/reviews/data=!4m8!14m7!1m6!2m5!1sChZDSUhNMG9nS0VJQ0FnSUNxX0o2MklBEAE!2m1!1s0x0:0x49bde399ebde344c!3m1!1s2@1:CIHM0ogKEICAgICq_J62IA%7CCgsIu_bRhQYQqPS4BA%7C?hl=id","Selalu suka dan ngangenin untuk bersantap siang hidangan istimewa ini. Matur nuwun."
"Bale Raos - The Sultan's Dishes","https://www.google.com/maps/search/?api=1&query=Bale%20Raos%20-%20The%20Sultan's%20Dishes&query_place_id=ChIJH03CYY1Xei4RTDTe65njvUk","5","Jokovik","https://www.google.com/maps/reviews/data=!4m8!14m7!1m6!2m5!1sChdDSUhNMG9nS0VJQ0FnSURKejd5bzdnRRAB!2m1!1s0x0:0x49bde399ebde344c!3m1!1s2@1:CIHM0ogKEICAgIDJz7yo7gE%7CCgwIjZf-pQYQwOXH2AM%7C?hl=id","Tempat makan yang adem dengan berbagai macam pilihan menu .. pelayanan bagus, gercep dan sopan."
"Bale Raos - The Sultan's Dishes","https://www.google.com/maps/search/?api=1&query=Bale%20Raos%20-%20The%20Sultan's%20Dishes&query_place_id=ChIJH03CYY1Xei4RTDTe65njvUk","5","aRoeM","https://www.google.com/maps/reviews/data=!4m8!14m7!1m6!2m5!1sChdDSUhNMG9nS0VJQ0FnSUM0aEw3S3p3RRAB!2m1!1s0x0:0x49bde399ebde344c!3m1!1s2@1:CIHM0ogKEICAgIC4hL7KzwE%7CCgwImaK6qAYQoKK9jwI%7C?hl=id","Makananya enakk..tempatnya estetik abis..kapan lagi nyobain makanan para raja kalo bukan dsni🥳"
"Bale Raos - The Sultan's Dishes","https://www.google.com/maps/search/?api=1&query=Bale%20Raos%20-%20The%20Sultan's%20Dishes&query_place_id=ChIJH03CYY1Xei4RTDTe65njvUk","5","Hermunanto Endro Prastowo","https://www.google.com/maps/reviews/data=!4m8!14m7!1m6!2m5!1sChZDSUhNMG9nS0VJQ0FnSUREa3J5cFZnEAE!2m1!1s0x0:0x49bde399ebde344c!3m1!1s2@1:CIHM0ogKEICAgIDDkrypVg%7CCgwIjKHKsAYQ0ODtoAI%7C?hl=id","Emang beda kelasnya...memang istimewa kalo ini"
"Bale Raos - The Sultan's Dishes","https://www.google.com/maps/search/?api=1&query=Bale%20Raos%20-%20The%20Sultan's%20Dishes&query_place_id=ChIJH03CYY1Xei4RTDTe65njvUk","5","mirna chaniago","https://www.google.com/maps/reviews/data=!4m8!14m7!1m6!2m5!1sChZDSUhNMG9nS0VJQ0FnSUNYX0tpVkhREAE!2m1!1s0x0:0x49bde399ebde344c!3m1!1s2@1:CIHM0ogKEICAgICX_KiVHQ%7CCgwIismzuAYQkNiBuwM%7C?hl=id","Makan ala sultan dengan suasana keratonan jogja.. diiringi musik gamelan jawa yang tenang. Menu makanan tradisional yang dilengkapi minuman yang beraneka ragam. Pegawai nya ramah dan service nya oke."
"Bale Raos - The Sultan's Dishes","https://www.google.com/maps/search/?api=1&query=Bale%20Raos%20-%20The%20Sultan's%20Dishes&query_place_id=ChIJH03CYY1Xei4RTDTe65njvUk","5","Aurelia Sekar Candhani","https://www.google.com/maps/reviews/data=!4m8!14m7!1m6!2m5!1sChZDSUhNMG9nS0VJQ0FnSUNIeHJUWVZREAE!2m1!1s0x0:0x49bde399ebde344c!3m1!1s2@1:CIHM0ogKEICAgICHxrTYVQ%7CCgwIjb3gtgYQ0I6yngM%7C?hl=id","Tempatnya luas dan bersih, pelayanannya juga ramah.."
"Bale Raos - The Sultan's Dishes","https://www.google.com/maps/search/?api=1&query=Bale%20Raos%20-%20The%20Sultan's%20Dishes&query_place_id=ChIJH03CYY1Xei4RTDTe65njvUk","5","Mirza Erapunagi","https://www.google.com/maps/reviews/data=!4m8!14m7!1m6!2m5!1sChdDSUhNMG9nS0VJQ0FnTUR3LU9XbHpnRRAB!2m1!1s0x0:0x49bde399ebde344c!3m1!1s2@1:CIHM0ogKEICAgMDw-OWlzgE%7CCgwI5O7_vgYQgOWZmwM%7C?hl=id","Iftar bersama keluarga di tempat Resto Bale Rais serasa suasana di Kraton Kesultanan Jogjakarta dan pelayanannya sat set ciri khas snak muda"
"Bale Raos - The Sultan's Dishes","https://www.google.com/maps/search/?api=1&query=Bale%20Raos%20-%20The%20Sultan's%20Dishes&query_place_id=ChIJH03CYY1Xei4RTDTe65njvUk","5","fitriyani fadhil","https://www.google.com/maps/reviews/data=!4m8!14m7!1m6!2m5!1sChdDSUhNMG9nS0VJQ0FnSUNtaXF2UjVnRRAB!2m1!1s0x0:0x49bde399ebde344c!3m1!1s2@1:CIHM0ogKEICAgICmiqvR5gE%7CCgwI_amWjgYQ4IuUtAI%7C?hl=id","Tempatnya benar2 khas keraton, kualitas makanan sangat baik, pelayanan sangat baik"
"Bale Raos - The Sultan's Dishes","https://www.google.com/maps/search/?api=1&query=Bale%20Raos%20-%20The%20Sultan's%20Dishes&query_place_id=ChIJH03CYY1Xei4RTDTe65njvUk","5","Bintaran Sukses","https://www.google.com/maps/reviews/data=!4m8!14m7!1m6!2m5!1sChZDSUhNMG9nS0VJQ0FnSUNaazZhSWNBEAE!2m1!1s0x0:0x49bde399ebde344c!3m1!1s2@1:CIHM0ogKEICAgICZk6aIcA%7CCgwIjLibqAYQgLbi_QE%7C?hl=id","suasananya nyaman, teduh, nuasa kraton yogyakarta"
"Bale Raos - The Sultan's Dishes","https://www.google.com/maps/search/?api=1&query=Bale%20Raos%20-%20The%20Sultan's%20Dishes&query_place_id=ChIJH03CYY1Xei4RTDTe65njvUk","5","Winnu Ayi Satria","https://www.google.com/maps/reviews/data=!4m8!14m7!1m6!2m5!1sChZDSUhNMG9nS0VJQ0FnSUNma19ucldBEAE!2m1!1s0x0:0x49bde399ebde344c!3m1!1s2@1:CIHM0ogKEICAgICfk_nrWA%7CCgwInfvTuwYQ0LWIhAE%7C?hl=id","Makanannya enak-enak. Yg gk nyangka itu lele filletnya, kuahnya enak.

Suasananya berasa jadi sultan.

Pelayannya ramah-ramah dan responsif."
"Bale Raos - The Sultan's Dishes","https://www.google.com/maps/search/?api=1&query=Bale%20Raos%20-%20The%20Sultan's%20Dishes&query_place_id=ChIJH03CYY1Xei4RTDTe65njvUk","5","Anna Setyowati","https://www.google.com/maps/reviews/data=!4m8!14m7!1m6!2m5!1sChdDSUhNMG9nS0VJQ0FnSURhdHNma3pBRRAB!2m1!1s0x0:0x49bde399ebde344c!3m1!1s2@1:CIHM0ogKEICAgIDatsfkzAE%7CCgwIoLiDiQYQwLWylAI%7C?hl=id","Paling suka ..bir jawa ..mantap
Makan ala sultan"
"Bale Raos - The Sultan's Dishes","https://www.google.com/maps/search/?api=1&query=Bale%20Raos%20-%20The%20Sultan's%20Dishes&query_place_id=ChIJH03CYY1Xei4RTDTe65njvUk","5","Awang Dhewangga","https://www.google.com/maps/reviews/data=!4m8!14m7!1m6!2m5!1sChZDSUhNMG9nS0VJQ0FnSUNvdTl2WUNnEAE!2m1!1s0x0:0x49bde399ebde344c!3m1!1s2@1:CIHM0ogKEICAgICou9vYCg%7CCgwI-6Dq4wUQqK2lqwE%7C?hl=id","Tempatnya cozy, makanan enak, pelayanan bagus"
"Bale Raos - The Sultan's Dishes","https://www.google.com/maps/search/?api=1&query=Bale%20Raos%20-%20The%20Sultan's%20Dishes&query_place_id=ChIJH03CYY1Xei4RTDTe65njvUk","5","Efrain Kristiarianto","https://www.google.com/maps/reviews/data=!4m8!14m7!1m6!2m5!1sChdDSUhNMG9nS0VJQ0FnSURJX2VXZS1BRRAB!2m1!1s0x0:0x49bde399ebde344c!3m1!1s2@1:CIHM0ogKEICAgIDI_eWe-AE%7CCgwImouG4gUQ08TVqwM%7C?hl=id","Bagi anda yang ingin merasakan masakan keluarga Keraton Jogja dan makan bagai bangsawan, disinilah tempat yang tepat. Letak resto ini dekat dengan keraton. Bangunan resto ini juga kuno dan unik, sangat kental suasana keraton. Untuk makan di Bale Raos disarankan untuk reservasi terlebih dahulu. Apalagi bila akan datang pada jam makan malam."
"Bale Raos - The Sultan's Dishes","https://www.google.com/maps/search/?api=1&query=Bale%20Raos%20-%20The%20Sultan's%20Dishes&query_place_id=ChIJH03CYY1Xei4RTDTe65njvUk","5","Giulia Torresin","https://www.google.com/maps/reviews/data=!4m8!14m7!1m6!2m5!1sCi9DQUlRQUNvZENodHljRjlvT25CTmFXZG9la3RrVmxNeE5UQTBVWFZyZGtWaWFFRRAB!2m1!1s0x0:0x49bde399ebde344c!3m1!1s2@1:CAIQACodChtycF9oOnBNaWdoektkVlMxNTA0UXVrdkViaEE%7C0cQD8gjqegq%7C?hl=id","Abbiamo mangiato in questo ristorante a caso spinti dalle recensioni trovate su Google.
Posto frequentato molto dai turisti, anche occidentali.
Ottimo servizio, piatti tipici; economici, porzioni poco abbondanti.
Ambiente spartano (tovagliette di carta e acqua in bottiglia senza bicchiere).
Merita per il rapporto qualità prezzo"
"Bale Raos - The Sultan's Dishes","https://www.google.com/maps/search/?api=1&query=Bale%20Raos%20-%20The%20Sultan's%20Dishes&query_place_id=ChIJH03CYY1Xei4RTDTe65njvUk","5","Olga SA","https://www.google.com/maps/reviews/data=!4m8!14m7!1m6!2m5!1sCi9DQUlRQUNvZENodHljRjlvT25wUVJrcHhSRGhMWkdGQ2NWOWpNalJQYWxKdFFYYxAB!2m1!1s0x0:0x49bde399ebde344c!3m1!1s2@1:CAIQACodChtycF9oOnpQRkpxRDhLZGFCcV9jMjRPalJtQXc%7C0cbnL4UpDhP%7C?hl=id","The local was clean, spacious and lavish. The food was meticulously prepared and served, evoking a feeling of cleanliness. The dishes tasted delicious. The thematic was well-chosen, all the dishes were supposed to be King’s favourite dishes. And you will feel like him, indeed."
"Bale Raos - The Sultan's Dishes","https://www.google.com/maps/search/?api=1&query=Bale%20Raos%20-%20The%20Sultan's%20Dishes&query_place_id=ChIJH03CYY1Xei4RTDTe65njvUk","5","gold Stay","https://www.google.com/maps/reviews/data=!4m8!14m7!1m6!2m5!1sCi9DQUlRQUNvZENodHljRjlvT2pSUWJ6aDRXbk5vUkd0bU9YTlpNMmxWTkUxbVVrRRAB!2m1!1s0x0:0x49bde399ebde344c!3m1!1s2@1:CAIQACodChtycF9oOjRQbzh4WnNoRGtmOXNZM2lVNE1mUkE%7C0c_qBLiP4EV%7C?hl=id","土曜の夜8時に予約なしで１人で行きましたが、入りました（ただ、それなりに混んでいるので、家族とかで行くなら予約したほうがいいかも）
いただいた料理はどれも美味しく、雰囲気も良く、バンドの生演奏もあり、これで200Kは相当お得だと思います。オススメします。"
"Bale Raos - The Sultan's Dishes","https://www.google.com/maps/search/?api=1&query=Bale%20Raos%20-%20The%20Sultan's%20Dishes&query_place_id=ChIJH03CYY1Xei4RTDTe65njvUk","5","girudo yamamoto","https://www.google.com/maps/reviews/data=!4m8!14m7!1m6!2m5!1sCi9DQUlRQUNvZENodHljRjlvT205M1dHNVdhR2hIYTJ0VU9HZFhjSGxrT0RGT1YzYxAB!2m1!1s0x0:0x49bde399ebde344c!3m1!1s2@1:CAIQACodChtycF9oOm93WG5WaGhHa2tUOGdXcHlkODFOV3c%7C0cz3f09rAKu%7C?hl=id","2025/10/21
王宮に入場して南の方へ順路を進むと西側辺りにあります
王宮料理が食べられるレストラン🍴
メニューを開いて料理の説明を見てみると
誰が好んで食べられていたのか等の説明もあるので
興味がそそられます
色々頼んでも残してしまうので
お腹の具合の限界ギリギリまで頼んで王宮の料理を堪能してきました🫅

日本人ならなるほど、となる話で
トマトスープなんですが味の素のクノールの完熟トマトのスープパスタに近い味がしました🍅🍅🍅美味しかったですよ
平日の雨だったのであまり人がいなくてのんびり味わえて良かったです
メニューを高画質で撮ってあるので良かったら写真をご覧ください"
"Bale Raos - The Sultan's Dishes","https://www.google.com/maps/search/?api=1&query=Bale%20Raos%20-%20The%20Sultan's%20Dishes&query_place_id=ChIJH03CYY1Xei4RTDTe65njvUk","5","Chiara Marocco","https://www.google.com/maps/reviews/data=!4m8!14m7!1m6!2m5!1sCi9DQUlRQUNvZENodHljRjlvT21SV1ZGUmhaMGhCYkZSWU4yVk1iMTl5TmxCSVVIYxAB!2m1!1s0x0:0x49bde399ebde344c!3m1!1s2@1:CAIQACodChtycF9oOmRWVFRhZ0hBbFRYN2VMb19yNlBIUHc%7C0cZmd9W_gfA%7C?hl=id","Il posto nell'elenco dei migliori ristoranti su trip-advisor è meritato.
Ristorante intimo e carino, cibo davvero buono, prezzi ottimi.
Non lasciatevi ""intimorire"" dal quartiere, la zona è molto tranquilla e il ristorante si raggiunge facilmente in Grab.
Super consigliato!"
"Bale Raos - The Sultan's Dishes","https://www.google.com/maps/search/?api=1&query=Bale%20Raos%20-%20The%20Sultan's%20Dishes&query_place_id=ChIJH03CYY1Xei4RTDTe65njvUk","5","Fakhri Khaulany","https://www.google.com/maps/reviews/data=!4m8!14m7!1m6!2m5!1sCi9DQUlRQUNvZENodHljRjlvT25kNVNYaG1OM0Z5VlZOcWFYaEdPRVI0Wm1jemRYYxAB!2m1!1s0x0:0x49bde399ebde344c!3m1!1s2@1:CAIQACodChtycF9oOnd5SXhmN3FyVVNqaXhGOER4ZmczdXc%7C0cKziKNs7NV%7C?hl=id","First time trying Javanese “kratonese” fine dining, and the experience was truly special. The ambiance is regal yet warm—perfect for sharing a meal with friends or a loved one.

Here’s a breakdown of the dishes I tried:
- Secang (8/10): Warm, soothing, and refreshing drink—perfect as a starter for a cool evening.
- Terancam Kemul (6/10): I dont know what is this. A bit too dry, sticky, and bland for my taste. Not my favorite.
- Stoop Macaroni (8/10): Light, comforting broth—though a bit too watery.
- Main Course (8/10): The yellow rice was flavorful, and the grilled shrimp (udang bago) was juicy and well-seasoned. The empal suwir was a bit tough, and the rolled omelette was forgettable. Pickled vegetables were spicy but felt mismatched with the yellow rice—maybe better suited with Sambal instead this pickled. Rambah was crispy, as expected.
- Guava Juice (5/10): Standard, but way too sweet for me.
- Rujak Buah (8/10): First time trying it—delicious and balanced. Pro tip: mix it with the ice cream for a better flavor experience!
- Tea/Coffee (9/10): Can’t go wrong—choose based on your mood.

The overall experience? A solid 10/10. Each dish came out with an air of royalty, and it felt exciting to explore classic flavors with a fine-dining twist. Would absolutely recommend trying it at least once!"
"Bale Raos - The Sultan's Dishes","https://www.google.com/maps/search/?api=1&query=Bale%20Raos%20-%20The%20Sultan's%20Dishes&query_place_id=ChIJH03CYY1Xei4RTDTe65njvUk","5","irsan Ilmar","https://www.google.com/maps/reviews/data=!4m8!14m7!1m6!2m5!1sCi9DQUlRQUNvZENodHljRjlvT2psR1dtOWpSbTUxUzA5R1F6TTRhbE53YkhaUk9GRRAB!2m1!1s0x0:0x49bde399ebde344c!3m1!1s2@1:CAIQACodChtycF9oOjlGWm9jRm51S09GQzM4alNwbHZROFE%7C0clKIj0BIsp%7C?hl=id","Nice experience. The food ordered tasted good. Attentive staff. Not expensive despite being in a pretty exclusive place. Can be a little hot during sunny day's, though."
"Bale Raos - The Sultan's Dishes","https://www.google.com/maps/search/?api=1&query=Bale%20Raos%20-%20The%20Sultan's%20Dishes&query_place_id=ChIJH03CYY1Xei4RTDTe65njvUk","5","Thanakorn Alfandari","https://www.google.com/maps/reviews/data=!4m8!14m7!1m6!2m5!1sCi9DQUlRQUNvZENodHljRjlvT25aMU1rMW9XWEJIU2xsWFkyWjBXREZQWVRSRFNtYxAB!2m1!1s0x0:0x49bde399ebde344c!3m1!1s2@1:CAIQACodChtycF9oOnZ1Mk1oWXBHSllXY2Z0WDFPYTRDSmc%7C0cYXOLPRQFk%7C?hl=id","Very unique restaurant in Yogyakarta. Interesting mix of Dutch, Chinese and local cooking techniques.

Drinks were very refreshing and the place was very airy and cool."
"Bale Raos - The Sultan's Dishes","https://www.google.com/maps/search/?api=1&query=Bale%20Raos%20-%20The%20Sultan's%20Dishes&query_place_id=ChIJH03CYY1Xei4RTDTe65njvUk","5","Alejandro","https://www.google.com/maps/reviews/data=!4m8!14m7!1m6!2m5!1sCi9DQUlRQUNvZENodHljRjlvT2tsVGR6TlNRa0puT0hnMVlVbHJZVUUyUldWclJuYxAB!2m1!1s0x0:0x49bde399ebde344c!3m1!1s2@1:CAIQACodChtycF9oOklTdzNSQkJnOHg1YUlrYUE2RWVrRnc%7C0cbnJ3o3bxL%7C?hl=id","Muy buen trato, comida local exquisita y servicio muy rápido. Es conocido por ofrecer platos que comían los sultanes, y realmente comes como un sultán. Restaurante imprescindible si visitas Yogyakarta."
"Bale Raos - The Sultan's Dishes","https://www.google.com/maps/search/?api=1&query=Bale%20Raos%20-%20The%20Sultan's%20Dishes&query_place_id=ChIJH03CYY1Xei4RTDTe65njvUk","5","Mara Cazzola","https://www.google.com/maps/reviews/data=!4m8!14m7!1m6!2m5!1sCi9DQUlRQUNvZENodHljRjlvT2xoZmRWWnNWbGxUYm5FNU1FUjBOa1pWVm5OSE1sRRAB!2m1!1s0x0:0x49bde399ebde344c!3m1!1s2@1:CAIQACodChtycF9oOlhfdVZsVllTbnE5MER0NkZVVnNHMlE%7C0cswlNk01rB%7C?hl=id","The food is amazing and the waiters are very kind and friendly! The price is good and i recommend to try the soup with shrimps, chips and carrots.. Also the dessert with cacao mousse and creamy. So yummy!"
"Bale Raos - The Sultan's Dishes","https://www.google.com/maps/search/?api=1&query=Bale%20Raos%20-%20The%20Sultan's%20Dishes&query_place_id=ChIJH03CYY1Xei4RTDTe65njvUk","5","PramagiST4RS","https://www.google.com/maps/reviews/data=!4m8!14m7!1m6!2m5!1sCi9DQUlRQUNvZENodHljRjlvT2s5dmNXcDBWMnQ0WVUxelV6QjFYMlJNVnpOM1MyYxAB!2m1!1s0x0:0x49bde399ebde344c!3m1!1s2@1:CAIQACodChtycF9oOk9vcWp0V2t4YU1zUzB1X2RMVzN3S2c%7C0d0r9MXTplT%7C?hl=id","Seperti sedang menjadi keluarga kerajaan, wkkk, pilih menu yg jadi makanan sehari2 anggota kerjaaan."
"Bale Raos - The Sultan's Dishes","https://www.google.com/maps/search/?api=1&query=Bale%20Raos%20-%20The%20Sultan's%20Dishes&query_place_id=ChIJH03CYY1Xei4RTDTe65njvUk","5","Galih D. Putranto","https://www.google.com/maps/reviews/data=!4m8!14m7!1m6!2m5!1sChdDSUhNMG9nS0VJQ0FnTURvamJIMzdRRRAB!2m1!1s0x0:0x49bde399ebde344c!3m1!1s2@1:CIHM0ogKEICAgMDojbH37QE%7CCgwIj8S4wAYQgMDGngM%7C?hl=id","This is the culinary traditionally for Jogja palace's big family, served from generation to generation and now it can be enjoyed by the general public. I came here out of curiosity after seeing the review of chef renatta and chef juna. The restaurant has a palace nuance because it is still in the same complex with the palace. The concept is fine dining. The service was good and friendly, treated like a king's guest. Taste wise it is 7 / 10."
