"title","url","stars","name","reviewUrl","text"
"Gudeg Sagan","https://www.google.com/maps/search/?api=1&query=Gudeg%20Sagan&query_place_id=ChIJteEkQlRZei4R2SGA1sRmVzY","5","Y. J Sarah","https://www.google.com/maps/reviews/data=!4m8!14m7!1m6!2m5!1sCi9DQUlRQUNvZENodHljRjlvT2xScU5YaHNkbVJpVnpCMFdpMVphMlp4WHpkSk4yYxAB!2m1!1s0x0:0x365766c4d68021d9!3m1!1s2@1:CAIQACodChtycF9oOlRqNXhsdmRiVzB0Wi1Za2ZxXzdJN2c%7C0dJXhXiRDSE%7C?hl=id","Untuk cita rasa gudeg, gudeg ini menurut saya ok, tidak terlalu kemanisan, karna, gudeg itu identik dengan segala yang manis, baik kuah opor nya, sayur nangka dan bacem an nya, tetapi untuk yang satu ini, rasa manisnya pas. Hanya saja memang, untuk makan disini, jika tidak datang pagi2 lebih baik datang agak malam (dengan konsekuensi beberapa menu habis) sebab, bila di jam normal waktu makan, siap2 mengantri panjang."
"Gudeg Sagan","https://www.google.com/maps/search/?api=1&query=Gudeg%20Sagan&query_place_id=ChIJteEkQlRZei4R2SGA1sRmVzY","1","Noni cahayani Amiko","https://www.google.com/maps/reviews/data=!4m8!14m7!1m6!2m5!1sCi9DQUlRQUNvZENodHljRjlvT2psUGNGQmFPREJWV0ZSaE1WOUlWM2c0Ykd3elpGRRAB!2m1!1s0x0:0x365766c4d68021d9!3m1!1s2@1:CAIQACodChtycF9oOjlPcFBaODBVWFRhMV9IV3g4bGwzZFE%7C0dJXFm9uE58%7C?hl=id","Gaada masalah dengan makananya, tapi kmu punya usaha yg terbilang rame kog bisa bisa nya ga nyewa lahan buat parkir?!!
Itu parkir di jalan umum, paham gak kalau buat macet! Nyusahin aja..
Yg kaya 1 orang yg harus susah 1 kota, duitnya buat sewa lahan parkir dongggg
Heran"
"Gudeg Sagan","https://www.google.com/maps/search/?api=1&query=Gudeg%20Sagan&query_place_id=ChIJteEkQlRZei4R2SGA1sRmVzY","1","Rijal Haidar","https://www.google.com/maps/reviews/data=!4m8!14m7!1m6!2m5!1sCi9DQUlRQUNvZENodHljRjlvT2tZNU1HaGxVR2hIVW5oSlpFMW9WMk5CVGxaRVZGRRAB!2m1!1s0x0:0x365766c4d68021d9!3m1!1s2@1:CAIQACodChtycF9oOkY5MGhlUGhHUnhJZE1oV2NBTlZEVFE%7C0dJW51tVMRx%7C?hl=id","ga ada masalah sama makanannya, parkirnya menuhin jalan. itu jalan umum kak bukan jalan lo sendiri"
"Gudeg Sagan","https://www.google.com/maps/search/?api=1&query=Gudeg%20Sagan&query_place_id=ChIJteEkQlRZei4R2SGA1sRmVzY","1","Arnold Lasut","https://www.google.com/maps/reviews/data=!4m8!14m7!1m6!2m5!1sCi9DQUlRQUNvZENodHljRjlvT2twUWVsRmhTVjgwV1ROYVNVVTJTa1ZpWTI5dmJVRRAB!2m1!1s0x0:0x365766c4d68021d9!3m1!1s2@1:CAIQACodChtycF9oOkpQelFhSV80WTNaSUU2SkViY29vbUE%7C0dJW-MZ0Pb4%7C?hl=id","Sewa lahan buat parkiran !"
"Gudeg Sagan","https://www.google.com/maps/search/?api=1&query=Gudeg%20Sagan&query_place_id=ChIJteEkQlRZei4R2SGA1sRmVzY","4","awis jalan-jalan","https://www.google.com/maps/reviews/data=!4m8!14m7!1m6!2m5!1sCi9DQUlRQUNvZENodHljRjlvT25wTFNYRlVkRU5oV1VGRkxVZFBhMDFPUVdwd05IYxAB!2m1!1s0x0:0x365766c4d68021d9!3m1!1s2@1:CAIQACodChtycF9oOnpLSXFUdENhWUFFLUdPa01OQWpwNHc%7C0dJVEc-mdPd%7C?hl=id","gudegnya enak, tipe berkuah yg kurang manisnya. pelayanan staff ramah dan cepat.
masukan tolong... tolong banget sediakan kantong parkir. kita yg makan jadi kurang nyaman karena parkir merasa mengganggu lalu lintas jalan di sekitarnya.😌🙏🙏"
"Gudeg Sagan","https://www.google.com/maps/search/?api=1&query=Gudeg%20Sagan&query_place_id=ChIJteEkQlRZei4R2SGA1sRmVzY","5","Silvia Djuarto","https://www.google.com/maps/reviews/data=!4m8!14m7!1m6!2m5!1sCi9DQUlRQUNvZENodHljRjlvT25JMFRqWk1PSFpGTTJKYWMwdHFWMFEwWVVSTWJIYxAB!2m1!1s0x0:0x365766c4d68021d9!3m1!1s2@1:CAIQACodChtycF9oOnI0TjZMOHZFM2Jac0tqV0Q0YURMbHc%7C0dJU8B4WLqY%7C?hl=id","Personally lebih suka gudeg ini drpd yujum krn ini lebih gurih asin sedangkan yujum manis bener. Beli utk bungkus dan pelayanan cukup cepat. Bisa dgn box atau daun. Tp saran lebih baik dgn box biar kuah2 ga langsung tercampur dan bikin cepat basi. Tmpt makan cukup luas. Tp area outdoornya kalau pagi, panas banget."
"Gudeg Sagan","https://www.google.com/maps/search/?api=1&query=Gudeg%20Sagan&query_place_id=ChIJteEkQlRZei4R2SGA1sRmVzY","1","galuh swandari","https://www.google.com/maps/reviews/data=!4m8!14m7!1m6!2m5!1sCi9DQUlRQUNvZENodHljRjlvT21oRk5rMXJjSHBaTUZKcFFuUmlSVkZhT1U5SVFtYxAB!2m1!1s0x0:0x365766c4d68021d9!3m1!1s2@1:CAIQACodChtycF9oOmhFNk1rcHpZMFJpQnRiRVFaOU9IQmc%7C0dJI70487_0%7C?hl=id",
"Gudeg Sagan","https://www.google.com/maps/search/?api=1&query=Gudeg%20Sagan&query_place_id=ChIJteEkQlRZei4R2SGA1sRmVzY","5","Imam freeman","https://www.google.com/maps/reviews/data=!4m8!14m7!1m6!2m5!1sCi9DQUlRQUNvZENodHljRjlvT21KTWRFOVRXamx2YVRsc2MxOXBkbnBLYVhCVlVtYxAB!2m1!1s0x0:0x365766c4d68021d9!3m1!1s2@1:CAIQACodChtycF9oOmJMdE9TWjlvaTlsc19pdnpKaXBVUmc%7C0dJHup63cFa%7C?hl=id",
"Gudeg Sagan","https://www.google.com/maps/search/?api=1&query=Gudeg%20Sagan&query_place_id=ChIJteEkQlRZei4R2SGA1sRmVzY","5","antonius dudun","https://www.google.com/maps/reviews/data=!4m8!14m7!1m6!2m5!1sCi9DQUlRQUNvZENodHljRjlvT2xFdGFHSnhVSFpNWDJGalJ6UkthbVpzVmtaMWJtYxAB!2m1!1s0x0:0x365766c4d68021d9!3m1!1s2@1:CAIQACodChtycF9oOlEtaGJxUHZMX2FjRzRKamZsVkZ1bmc%7C0dJGG57iZ0A%7C?hl=id","Gudeg basah, gurih, manisnya pas buat yang tidak suka manis. Pas makan malam suka penuh, antri"
"Gudeg Sagan","https://www.google.com/maps/search/?api=1&query=Gudeg%20Sagan&query_place_id=ChIJteEkQlRZei4R2SGA1sRmVzY","3","Septia Yudha Rennaningtyas","https://www.google.com/maps/reviews/data=!4m8!14m7!1m6!2m5!1sCi9DQUlRQUNvZENodHljRjlvT2xScmJXeGhkMGR5YUZBMGNtcGlVRUZPU2t0U1ZrRRAB!2m1!1s0x0:0x365766c4d68021d9!3m1!1s2@1:CAIQACodChtycF9oOlRrbWxhd0dyaFA0cmpiUEFOSktSVkE%7C0dJD9l_f88O%7C?hl=id","Enak aja, tapi bukan yg terbaik. Manis doang rasanya, kurang gurih, kurang terasa bumbunya. Tempatnya asik kalo malem, klo siang wassalam. Heran kenapa rame buangettt"
"Gudeg Sagan","https://www.google.com/maps/search/?api=1&query=Gudeg%20Sagan&query_place_id=ChIJteEkQlRZei4R2SGA1sRmVzY","5","dimas rury","https://www.google.com/maps/reviews/data=!4m8!14m7!1m6!2m5!1sCi9DQUlRQUNvZENodHljRjlvT2xWSVdUWmFXbUp6Vm5KZloweFJkRWRFVTFrNU9YYxAB!2m1!1s0x0:0x365766c4d68021d9!3m1!1s2@1:CAIQACodChtycF9oOlVIWTZaWmJzVnJfZ0xRdEdEU1k5OXc%7C0dJBpofZnzg%7C?hl=id",
"Gudeg Sagan","https://www.google.com/maps/search/?api=1&query=Gudeg%20Sagan&query_place_id=ChIJteEkQlRZei4R2SGA1sRmVzY","1","Sakura Azzahra","https://www.google.com/maps/reviews/data=!4m8!14m7!1m6!2m5!1sCi9DQUlRQUNvZENodHljRjlvT2pWWVlURm9VM0E1YjJKVmVEaFNSemt5YjB4NFdXYxAB!2m1!1s0x0:0x365766c4d68021d9!3m1!1s2@1:CAIQACodChtycF9oOjVYYTFoU3A5b2JVeDhSRzkyb0x4WWc%7C0dJBk8XmRme%7C?hl=id","Baru nyoba, biasa bangettt.. Enak gudeg Yu Djum.. Udah gt pelayannya judes!! Mana parkirnya semrawut bikin macet.. Penasaran ajja kok rame n bikin macet seenak apa.. Ternyata rasanya biasa bangett.. Minimal pelayannya ditingkatkan lg tuu, di brifing kek jgn sampe judes ke pembeli"
"Gudeg Sagan","https://www.google.com/maps/search/?api=1&query=Gudeg%20Sagan&query_place_id=ChIJteEkQlRZei4R2SGA1sRmVzY","5","imas Ummu ja'far (0789_Imas Marsela)","https://www.google.com/maps/reviews/data=!4m8!14m7!1m6!2m5!1sCi9DQUlRQUNvZENodHljRjlvT2pCd01XOU5RWFJHWHpaMk1EaHZWVmxuUm14a2IyYxAB!2m1!1s0x0:0x365766c4d68021d9!3m1!1s2@1:CAIQACodChtycF9oOjBwMW9NQXRGXzZ2MDhvVVlnRmxkb2c%7C0dJAeIXRLnU%7C?hl=id","Makanan nya Enakk,, tapi ngntri banget nunggu meja kosong dan geurah..."
"Gudeg Sagan","https://www.google.com/maps/search/?api=1&query=Gudeg%20Sagan&query_place_id=ChIJteEkQlRZei4R2SGA1sRmVzY","5","Daniel Tanan","https://www.google.com/maps/reviews/data=!4m8!14m7!1m6!2m5!1sCi9DQUlRQUNvZENodHljRjlvT2xwTk1sZHBhRmxmYjA5dk5rZHFVMmxZV21sMmVrRRAB!2m1!1s0x0:0x365766c4d68021d9!3m1!1s2@1:CAIQACodChtycF9oOlpNMldpaFlfb09vNkdqU2lYWml2ekE%7C0dJ8tjQtfmR%7C?hl=id",
"Gudeg Sagan","https://www.google.com/maps/search/?api=1&query=Gudeg%20Sagan&query_place_id=ChIJteEkQlRZei4R2SGA1sRmVzY","4","Randy Kurniawan","https://www.google.com/maps/reviews/data=!4m8!14m7!1m6!2m5!1sCi9DQUlRQUNvZENodHljRjlvT2tSbWFVNDVSbVYwT1RsM1puVjFSVzE2UmpKTFJrRRAB!2m1!1s0x0:0x365766c4d68021d9!3m1!1s2@1:CAIQACodChtycF9oOkRmaU45RmV0OTl3ZnV1RW16RjJLRkE%7C0dJ8GTXCLCK%7C?hl=id","+ : kualitas makanan baik
- : tidak ada waiting list. Customer cari meja sendiri & menunggu org yg lg mkn. Siapa cepat dia dapat."
"Gudeg Sagan","https://www.google.com/maps/search/?api=1&query=Gudeg%20Sagan&query_place_id=ChIJteEkQlRZei4R2SGA1sRmVzY","1","Didik Itopurwonegoro","https://www.google.com/maps/reviews/data=!4m8!14m7!1m6!2m5!1sCi9DQUlRQUNvZENodHljRjlvT25aaWIzaFBNbEpEVDFKaFh6WTJOMHQ1YWxwcE5sRRAB!2m1!1s0x0:0x365766c4d68021d9!3m1!1s2@1:CAIQACodChtycF9oOnZib3hPMlJDT1JhXzY2N0t5alppNlE%7C0dJ7k_0KRZW%7C?hl=id","Pelayanan ketus, tempat panas, parkir susah dan rasa ayam kayak opor, kreceknya biasa saja."
"Gudeg Sagan","https://www.google.com/maps/search/?api=1&query=Gudeg%20Sagan&query_place_id=ChIJteEkQlRZei4R2SGA1sRmVzY","5","Anita L18RA","https://www.google.com/maps/reviews/data=!4m8!14m7!1m6!2m5!1sCi9DQUlRQUNvZENodHljRjlvT2pGWVZtMUVYMUYzTTJJdFF6TXplWEZZZFhaMFNFRRAB!2m1!1s0x0:0x365766c4d68021d9!3m1!1s2@1:CAIQACodChtycF9oOjFYVm1EX1F3M2ItQzMzeXFYdXZ0SEE%7C0dJ7jngUc1P%7C?hl=id","Datang pas mendekati libur natal
HR biasa BKN HR libur
Ramai banget tempat duduk full
Mkn dibawa plg Krn tempatnya GK memungkinkan. Rasa nya enk TDK terlalu manis sesuai ada gurihnya."
"Gudeg Sagan","https://www.google.com/maps/search/?api=1&query=Gudeg%20Sagan&query_place_id=ChIJteEkQlRZei4R2SGA1sRmVzY","5","veronica cg","https://www.google.com/maps/reviews/data=!4m8!14m7!1m6!2m5!1sCi9DQUlRQUNvZENodHljRjlvT2sxbmRYWTJOUzFRVkd0WlJUSm9kWFpDTjBwNWIyYxAB!2m1!1s0x0:0x365766c4d68021d9!3m1!1s2@1:CAIQACodChtycF9oOk1ndXY2NS1QVGtZRTJodXZCN0p5b2c%7C0dJ2_DJCVQB%7C?hl=id","gudeg langganan wisatawan karena gudegnya tidak semanis gudeg2 kering tersohor lainnya

saat musim liburan, dari pagi baru buka saja sudah penuh pengunjung. bagian outdoornya betul2 terbuka tanpa kanopi, jadi pas hujan langsung pada kabur bawa makanannya. saat panas ya kepanggang

untuk kreceknya lumayan pedes, yang ga doyan pedes bakal berasa kepedesan. untuk telornya karena dimasak lama jadi bagian putihnya keras, jadi favorit anak muda, tapi orang tua susah kunyah

harga nasi gudeg krecek telor 18rb, telornya aja 9rb. bubur baru ada di siang hari sekitar jam 13"
"Gudeg Sagan","https://www.google.com/maps/search/?api=1&query=Gudeg%20Sagan&query_place_id=ChIJteEkQlRZei4R2SGA1sRmVzY","5","Adianti Prametya","https://www.google.com/maps/reviews/data=!4m8!14m7!1m6!2m5!1sCi9DQUlRQUNvZENodHljRjlvT2xkYVZGbzVXV1JUVkRKelREWkVjRXBHUWtaZlNtYxAB!2m1!1s0x0:0x365766c4d68021d9!3m1!1s2@1:CAIQACodChtycF9oOldaVFo5WWRTVDJzTDZEcEpGQkZfSmc%7C0dJ-BNfMaEs%7C?hl=id","Pertama kali nyobain gudeg Sagan dengan take away
Rasa gudegnya paling enak no 1 di Yogyakarta apalagi sambal goreng kreceknya pedes banget cocok buat yang suka pedes seperti saya ❤️
Staffnya ramah semua serta harga murah"
"Gudeg Sagan","https://www.google.com/maps/search/?api=1&query=Gudeg%20Sagan&query_place_id=ChIJteEkQlRZei4R2SGA1sRmVzY","5","Martin Suhendra","https://www.google.com/maps/reviews/data=!4m8!14m7!1m6!2m5!1sCi9DQUlRQUNvZENodHljRjlvT20xdVoxRmxWMnMxYVZCNVYwUkdVVUZGWTE4MGJWRRAB!2m1!1s0x0:0x365766c4d68021d9!3m1!1s2@1:CAIQACodChtycF9oOm1uZ1FlV2s1aVB5V0RGUUFFY180bVE%7C0dItDsLEHQL%7C?hl=id",
"Gudeg Sagan","https://www.google.com/maps/search/?api=1&query=Gudeg%20Sagan&query_place_id=ChIJteEkQlRZei4R2SGA1sRmVzY","5","cindy Nova","https://www.google.com/maps/reviews/data=!4m8!14m7!1m6!2m5!1sCi9DQUlRQUNvZENodHljRjlvT2tObWRIRmlTalUyUVhkNE1YcEtWbGxJYlRaUk5FRRAB!2m1!1s0x0:0x365766c4d68021d9!3m1!1s2@1:CAIQACodChtycF9oOkNmdHFiSjU2QXd4MXpKVllIbTZRNEE%7C0dIswbpCIT4%7C?hl=id",
"Gudeg Sagan","https://www.google.com/maps/search/?api=1&query=Gudeg%20Sagan&query_place_id=ChIJteEkQlRZei4R2SGA1sRmVzY","4","919homeuser 919homeuser","https://www.google.com/maps/reviews/data=!4m8!14m7!1m6!2m5!1sCi9DQUlRQUNvZENodHljRjlvT2s1Mlowd3hhbG81VFcxTGJVZEdTbmxuZUcxR04yYxAB!2m1!1s0x0:0x365766c4d68021d9!3m1!1s2@1:CAIQACodChtycF9oOk52Z0wxalo5TW1LbUdGSnlneG1GN2c%7C0dIrQoos6uK%7C?hl=id","Wonderful moment having dine in. Very crowded during my visit. Be prepared for having a list wait around the table."
"Gudeg Sagan","https://www.google.com/maps/search/?api=1&query=Gudeg%20Sagan&query_place_id=ChIJteEkQlRZei4R2SGA1sRmVzY","4","Jack Susanta","https://www.google.com/maps/reviews/data=!4m8!14m7!1m6!2m5!1sCi9DQUlRQUNvZENodHljRjlvT21Wc1gxOVBObkE0Y25GTWQyVnZPWE55UjNKeWFrRRAB!2m1!1s0x0:0x365766c4d68021d9!3m1!1s2@1:CAIQACodChtycF9oOmVsX19PNnA4cnFMd2VvOXNyR3JyakE%7C0dIrPODjJuX%7C?hl=id","Crowded"
"Gudeg Sagan","https://www.google.com/maps/search/?api=1&query=Gudeg%20Sagan&query_place_id=ChIJteEkQlRZei4R2SGA1sRmVzY","5","Jaisy AS","https://www.google.com/maps/reviews/data=!4m8!14m7!1m6!2m5!1sCi9DQUlRQUNvZENodHljRjlvT2tsWE9GOHpZV0ptVGw5bk5IZGZOR2d0YTFFelFrRRAB!2m1!1s0x0:0x365766c4d68021d9!3m1!1s2@1:CAIQACodChtycF9oOklXOF8zYWJmTl9nNHdfNGgta1EzQkE%7C0dIpKVGt_44%7C?hl=id","Ke sini di ajak temen yg asli org jogja, dan ternyata enak cocok juga buat lidah saya. Harganya lumayan terjangkau, tempat selalu ramai tapi nyaman, pelayanan sangat cepat dan ramah, pas ke sini malam-malam ada live music juga."
"Gudeg Sagan","https://www.google.com/maps/search/?api=1&query=Gudeg%20Sagan&query_place_id=ChIJteEkQlRZei4R2SGA1sRmVzY","3","Yulia Rippi","https://www.google.com/maps/reviews/data=!4m8!14m7!1m6!2m5!1sCi9DQUlRQUNvZENodHljRjlvT21WSFp6Rk9kakozUkhSVWVtUjFkaTFNVDBrdFZuYxAB!2m1!1s0x0:0x365766c4d68021d9!3m1!1s2@1:CAIQACodChtycF9oOmVHZzFOdjJ3RHRUemR1di1MT0ktVnc%7C0dIoGx54NLd%7C?hl=id","Antara kasir dan yg packing ga ada kordinasi, baiknya klo sdh dipacking tas kresek dikasi nama . Type gudeg basah, rasa spt gideg pd umumnya cuma banyak lauk pilihan saja dari ceker, uritan dkk. cuma ya ga sesuai sama ngantrinya"
"Gudeg Sagan","https://www.google.com/maps/search/?api=1&query=Gudeg%20Sagan&query_place_id=ChIJteEkQlRZei4R2SGA1sRmVzY","4","KC Lee","https://www.google.com/maps/reviews/data=!4m8!14m7!1m6!2m5!1sCi9DQUlRQUNvZENodHljRjlvT2xJMlUzWmxNRUZLUVcxcFZXaEtURVZ0YUdob09YYxAB!2m1!1s0x0:0x365766c4d68021d9!3m1!1s2@1:CAIQACodChtycF9oOlI2U3ZlMEFKQW1pVWhKTEVtaGhoOXc%7C0dIcnEQEbIO%7C?hl=id","Warm and stuffy, crowded and need luck to find seats and need to wait for some time cos the queue is non stop.  Be prepared to find separate seating if you come in big groups. Other than that, get ready to tuck in for what everyone is waiting for. See for yourself"
"Gudeg Sagan","https://www.google.com/maps/search/?api=1&query=Gudeg%20Sagan&query_place_id=ChIJteEkQlRZei4R2SGA1sRmVzY","5","Fahmi Candra Permana","https://www.google.com/maps/reviews/data=!4m8!14m7!1m6!2m5!1sCi9DQUlRQUNvZENodHljRjlvT21oaVYxRkRiVU42T0hsMFNYWTBjbGxpYTBOelVYYxAB!2m1!1s0x0:0x365766c4d68021d9!3m1!1s2@1:CAIQACodChtycF9oOmhiV1FDbUN6OHl0SXY0cllia0NzUXc%7C0dIbnTfLstU%7C?hl=id",
"Gudeg Sagan","https://www.google.com/maps/search/?api=1&query=Gudeg%20Sagan&query_place_id=ChIJteEkQlRZei4R2SGA1sRmVzY","5","Zuroid Zuzu","https://www.google.com/maps/reviews/data=!4m8!14m7!1m6!2m5!1sCi9DQUlRQUNvZENodHljRjlvT2xVdFZuWTNWSFozYjE5RFpGaEtUMmR5VEZVMFdsRRAB!2m1!1s0x0:0x365766c4d68021d9!3m1!1s2@1:CAIQACodChtycF9oOlUtVnY3VHZ3b19DZFhKT2dyTFU0WlE%7C0dIa_R1QK9x%7C?hl=id","Murah meriah enak hahahahahaha"
"Gudeg Sagan","https://www.google.com/maps/search/?api=1&query=Gudeg%20Sagan&query_place_id=ChIJteEkQlRZei4R2SGA1sRmVzY","4","Hendry Widianto","https://www.google.com/maps/reviews/data=!4m8!14m7!1m6!2m5!1sCi9DQUlRQUNvZENodHljRjlvT25aalNGUXlRWGRPTWxGMk9FOUNTMEZuVjA5TFEzYxAB!2m1!1s0x0:0x365766c4d68021d9!3m1!1s2@1:CAIQACodChtycF9oOnZjSFQyQXdOMlF2OE9CS0FnV09LQ3c%7C0dI_sq-gTZG%7C?hl=id","murah, rame, bersih"
"Gudeg Sagan","https://www.google.com/maps/search/?api=1&query=Gudeg%20Sagan&query_place_id=ChIJteEkQlRZei4R2SGA1sRmVzY","5","Dinda Pradipta","https://www.google.com/maps/reviews/data=!4m8!14m7!1m6!2m5!1sCi9DQUlRQUNvZENodHljRjlvT21ONVlXVlhXRGRmTTFkb1ducFljMDlGY0hsMk1uYxAB!2m1!1s0x0:0x365766c4d68021d9!3m1!1s2@1:CAIQACodChtycF9oOmN5YWVXWDdfM1doWnpYc09FcHl2Mnc%7C0dI_KITPVVQ%7C?hl=id","gudeg ter the best se jogja. tipikal gudeg basah, yaaa. dan area outdoor sama sekali ga ada kanopi atau atap. dijemur siang hari bolong panas matahari, makan di luar krn area di dalam sudah full. coba deh dipertimbangkan lagi pakein kanopi atau atap. kan kalau hujan, makin repot. kalian kehilangan pelanggan juga, mau makan malah ga jadi makan. masa makan tapi basah2an"
"Gudeg Sagan","https://www.google.com/maps/search/?api=1&query=Gudeg%20Sagan&query_place_id=ChIJteEkQlRZei4R2SGA1sRmVzY","1","Rara Sari Prahastuti","https://www.google.com/maps/reviews/data=!4m8!14m7!1m6!2m5!1sCi9DQUlRQUNvZENodHljRjlvT2tsU1VtWkhaMlI2ZW1GZlZtODNZalZGTW5wUFZuYxAB!2m1!1s0x0:0x365766c4d68021d9!3m1!1s2@1:CAIQACodChtycF9oOklSUmZHZ2R6emFfVm83YjVFMnpPVnc%7C0dIZti1G_mf%7C?hl=id","Sudah tau musim hujan tp owner tidak punya pikiran pasang kanopi, pengunjung kehujanan dgn makanan di meja juga dibiarkan dan ditelantarkan. Sangat tidak etis dan tidak pelayanan prima."
"Gudeg Sagan","https://www.google.com/maps/search/?api=1&query=Gudeg%20Sagan&query_place_id=ChIJteEkQlRZei4R2SGA1sRmVzY","4","Agung Pribadi","https://www.google.com/maps/reviews/data=!4m8!14m7!1m6!2m5!1sCi9DQUlRQUNvZENodHljRjlvT2xoQlQwUk9la3AwYTFoMlpuTktia2ROYkRCalJrRRAB!2m1!1s0x0:0x365766c4d68021d9!3m1!1s2@1:CAIQACodChtycF9oOlhBT0ROekp0a1h2ZnNKbkdNbDBjRkE%7C0dIZf80ViEs%7C?hl=id","Rasanya biasa saja. Cuma ruame banget lho. Tidak seberapa legit dan tidak seberapa manis. Wuih kl. Makan malam antrinya berjibun oiii"
"Gudeg Sagan","https://www.google.com/maps/search/?api=1&query=Gudeg%20Sagan&query_place_id=ChIJteEkQlRZei4R2SGA1sRmVzY","5","francois cew","https://www.google.com/maps/reviews/data=!4m8!14m7!1m6!2m5!1sCi9DQUlRQUNvZENodHljRjlvT21aamNIaHBNazVLU0d4TVlsUXlSa1JZU2tKNWRVRRAB!2m1!1s0x0:0x365766c4d68021d9!3m1!1s2@1:CAIQACodChtycF9oOmZjcHhpMk5KSGxMYlQyRkRYSkJ5dUE%7C0dIYCuFGw5E%7C?hl=id","Gudeg Sagan

1. Gedungnya unik sekali, mudah dikenali, bisa makan di bagian outdoor / indoor
2. Rata2 smoking area
3. Harga bersahabat
4. Porsi sangat banyak, bisa sharing berdua
5. Rasanya balance asin gurih tidak terlalu manis jadi gak bikin eneg
6. Ayam gorengnya sangat empuk, bumbunya meresap plus dapat sambal
7. Toilet ada 2, sedikit kotor dan perlu antri agak lama
8. Kebersihan standard
9. Parkir mobil bisa di jalan sekitar restaurant"
"Gudeg Sagan","https://www.google.com/maps/search/?api=1&query=Gudeg%20Sagan&query_place_id=ChIJteEkQlRZei4R2SGA1sRmVzY","4","Nani Santoso","https://www.google.com/maps/reviews/data=!4m8!14m7!1m6!2m5!1sCi9DQUlRQUNvZENodHljRjlvT2xSRFExSlRkRlpTUjBkWFoySk5hemh2Wm1ZMWQyYxAB!2m1!1s0x0:0x365766c4d68021d9!3m1!1s2@1:CAIQACodChtycF9oOlRDQ1JTdFZSR0dXZ2JNazhvZmY1d2c%7C0dIVP5Vdp3w%7C?hl=id","Salah satu gudeg viral
Harus lebih bersabar ya kalau mau makan disini..karena antri banget..rame puolll..
Ada indoor & outdoor tempat makannya..
Pesan: nasi gudeg krecek telur & ayam
Untuk rasa: enak. Tidak terlalu manis. Gudegnya manis dikit, orek tempenya pas gak manis, telur tidak manis, Ayamnya lembut, kuah opornya enak..

Pelayanannya cukup cepat, hanya harus bersabar tunggu antrian pesanannya keluar..

Kalau yang bawa lansia atau yang pakai kursi roda, harus lebih diperhatikan. Karena harus naik tangga untuk makan.

Parkir dipinggir jalan berbayar 5ribu"
"Gudeg Sagan","https://www.google.com/maps/search/?api=1&query=Gudeg%20Sagan&query_place_id=ChIJteEkQlRZei4R2SGA1sRmVzY","5","Herbert Wongsosaputro","https://www.google.com/maps/reviews/data=!4m8!14m7!1m6!2m5!1sChZDSUhNMG9nS0VJQ0FnSUQydGZud0JnEAE!2m1!1s0x0:0x365766c4d68021d9!3m1!1s2@1:CIHM0ogKEICAgID2tfnwBg%7CCgwI1OWhlAYQqKK56AI%7C?hl=id",
"Gudeg Sagan","https://www.google.com/maps/search/?api=1&query=Gudeg%20Sagan&query_place_id=ChIJteEkQlRZei4R2SGA1sRmVzY","5","Puji Astutiningsih Firmansyah","https://www.google.com/maps/reviews/data=!4m8!14m7!1m6!2m5!1sCi9DQUlRQUNvZENodHljRjlvT2psNlFWQkdjWGhTVVZsM2NWUjFNWFE0U0hJMFRVRRAB!2m1!1s0x0:0x365766c4d68021d9!3m1!1s2@1:CAIQACodChtycF9oOjl6QVBGcXhSUVl3cVR1MXQ4SHI0TUE%7C0dIRI_ag6ji%7C?hl=id","Ngantree"
"Gudeg Sagan","https://www.google.com/maps/search/?api=1&query=Gudeg%20Sagan&query_place_id=ChIJteEkQlRZei4R2SGA1sRmVzY","5","Sab Bidin","https://www.google.com/maps/reviews/data=!4m8!14m7!1m6!2m5!1sCi9DQUlRQUNvZENodHljRjlvT2s1a1dFVTVjakJhT1dGTlMzQmtUV1p0UVc5VVdrRRAB!2m1!1s0x0:0x365766c4d68021d9!3m1!1s2@1:CAIQACodChtycF9oOk5kWEU5cjBaOWFNS3BkTWZtQW9UWkE%7C0dIJUbFdJ4n%7C?hl=id",
"Gudeg Sagan","https://www.google.com/maps/search/?api=1&query=Gudeg%20Sagan&query_place_id=ChIJteEkQlRZei4R2SGA1sRmVzY","1","Bagus Irawann","https://www.google.com/maps/reviews/data=!4m8!14m7!1m6!2m5!1sCi9DQUlRQUNvZENodHljRjlvT2s5UVJGaHhkSFJ6V1ZGNFgxOVFjek53UW1WdFVrRRAB!2m1!1s0x0:0x365766c4d68021d9!3m1!1s2@1:CAIQACodChtycF9oOk9QRFhxdHRzWVF4X19QczNwQmVtUkE%7C0dII5DMt7Ew%7C?hl=id","parkiranmu MARAI MACET!"
"Gudeg Sagan","https://www.google.com/maps/search/?api=1&query=Gudeg%20Sagan&query_place_id=ChIJteEkQlRZei4R2SGA1sRmVzY","5","Gunawan Santoso","https://www.google.com/maps/reviews/data=!4m8!14m7!1m6!2m5!1sCi9DQUlRQUNvZENodHljRjlvT25oTlUyWkNiMVZFWVRKM2ExRnNWbkp4ZUhCMmNIYxAB!2m1!1s0x0:0x365766c4d68021d9!3m1!1s2@1:CAIQACodChtycF9oOnhNU2ZCb1VEYTJ3a1FsVnJxeHB2cHc%7C0dIHxQ6c6XC%7C?hl=id","TOP gudegnya enakkk"
"Gudeg Sagan","https://www.google.com/maps/search/?api=1&query=Gudeg%20Sagan&query_place_id=ChIJteEkQlRZei4R2SGA1sRmVzY","5","Steven","https://www.google.com/maps/reviews/data=!4m8!14m7!1m6!2m5!1sCi9DQUlRQUNvZENodHljRjlvT2tNNVEydHRkbmRZVW5KSVFsVk1VM0JPVjB3eVVWRRAB!2m1!1s0x0:0x365766c4d68021d9!3m1!1s2@1:CAIQACodChtycF9oOkM5Q2ttdndYUnJIQlVMU3BOV0wyUVE%7C0dID__63Hwn%7C?hl=id","hari ini makan di gudeg sagan, suasana sangat ramai, untungnya tafi langsung dapat meja. ini rasa gudegnya tipikal yang tidak terlalu manis, saya sekeluarga suka. sukses terus 👍🙏"
"Gudeg Sagan","https://www.google.com/maps/search/?api=1&query=Gudeg%20Sagan&query_place_id=ChIJteEkQlRZei4R2SGA1sRmVzY","4","Andi Wijanarko","https://www.google.com/maps/reviews/data=!4m8!14m7!1m6!2m5!1sChZDSUhNMG9nS0VJQ0FnSUMyNjYyRWVBEAE!2m1!1s0x0:0x365766c4d68021d9!3m1!1s2@1:CIHM0ogKEICAgIC2662EeA%7CCgwI7J2pkwYQgLLw1wM%7C?hl=id",
"Gudeg Sagan","https://www.google.com/maps/search/?api=1&query=Gudeg%20Sagan&query_place_id=ChIJteEkQlRZei4R2SGA1sRmVzY","1","mikh H","https://www.google.com/maps/reviews/data=!4m8!14m7!1m6!2m5!1sCi9DQUlRQUNvZENodHljRjlvT25wa1kwMW5kV1pEWjFCRWJHSjFVM1pwTUdoUmVIYxAB!2m1!1s0x0:0x365766c4d68021d9!3m1!1s2@1:CAIQACodChtycF9oOnpkY01ndWZDZ1BEbGJ1U3ZpMGhReHc%7C0dHsSnKiQN1%7C?hl=id","Belon dimakan cuma liat pelayanannya udah malesin..nga ada ramah2nya.."
"Gudeg Sagan","https://www.google.com/maps/search/?api=1&query=Gudeg%20Sagan&query_place_id=ChIJteEkQlRZei4R2SGA1sRmVzY","5","Dandy Sondakh","https://www.google.com/maps/reviews/data=!4m8!14m7!1m6!2m5!1sCi9DQUlRQUNvZENodHljRjlvT2xoclpraHpUMjQwUmpSVlpVZGxlWEZNTnpZeWQwRRAB!2m1!1s0x0:0x365766c4d68021d9!3m1!1s2@1:CAIQACodChtycF9oOlhrZkhzT240RjRVZUdleXFMNzYyd0E%7C0dHmRmun_DW%7C?hl=id","Rame poll. Parkir bisa pinggir jalan. Suka ama gudegnya karena ga terlalu manis. Selalu kesini saat ke yogya. Mantapp"
"Gudeg Sagan","https://www.google.com/maps/search/?api=1&query=Gudeg%20Sagan&query_place_id=ChIJteEkQlRZei4R2SGA1sRmVzY","4","Heri Pratama","https://www.google.com/maps/reviews/data=!4m8!14m7!1m6!2m5!1sCi9DQUlRQUNvZENodHljRjlvT201MlduQTRUa2RTVm1GNVJrcDZNV2xRU2xZNGNHYxAB!2m1!1s0x0:0x365766c4d68021d9!3m1!1s2@1:CAIQACodChtycF9oOm52WnA4TkdSVmF5Rkp6MWlQSlY4cGc%7C0dHet-aDcKc%7C?hl=id","Salah satu gudeg yang bisa di jogja... Harga masih bersaing .."
"Gudeg Sagan","https://www.google.com/maps/search/?api=1&query=Gudeg%20Sagan&query_place_id=ChIJteEkQlRZei4R2SGA1sRmVzY","1","Meita Nur Afianti","https://www.google.com/maps/reviews/data=!4m8!14m7!1m6!2m5!1sCi9DQUlRQUNvZENodHljRjlvT2tKaE4xUk5WbGRCV21KTk0yTmljakpaYWpBMFgyYxAB!2m1!1s0x0:0x365766c4d68021d9!3m1!1s2@1:CAIQACodChtycF9oOkJhN1RNVldBWmJNM2NicjJZajA0X2c%7C0dHbe95ztBe%7C?hl=id","sewa lahan parkir lah, ngrepotin aja bikin macet parkir di kanan kiri jalan, yg dapet duit siape yg repot siape😤"
"Gudeg Sagan","https://www.google.com/maps/search/?api=1&query=Gudeg%20Sagan&query_place_id=ChIJteEkQlRZei4R2SGA1sRmVzY","5","mardiana setyaning","https://www.google.com/maps/reviews/data=!4m8!14m7!1m6!2m5!1sCi9DQUlRQUNvZENodHljRjlvT205dFYwOVhaVzlEUTNaNVRYcHVZM1pvUkZKQ2MwRRAB!2m1!1s0x0:0x365766c4d68021d9!3m1!1s2@1:CAIQACodChtycF9oOm9tV09XZW9DQ3Z5TXpuY3ZoRFJCc0E%7C0dHb8XEyepU%7C?hl=id","Gudeg paling istimewa di Jogja.Buat yg ga suka gudeg manis, maka ini pilihan terbaik.  Menu favorit saya adalah bubur gudeg telur. Istimewa!!!"
"Gudeg Sagan","https://www.google.com/maps/search/?api=1&query=Gudeg%20Sagan&query_place_id=ChIJteEkQlRZei4R2SGA1sRmVzY","5","ajeng ratnasari","https://www.google.com/maps/reviews/data=!4m8!14m7!1m6!2m5!1sChdDSUhNMG9nS0VJQ0FnTURJNm83VXVRRRAB!2m1!1s0x0:0x365766c4d68021d9!3m1!1s2@1:CIHM0ogKEICAgMDI6o7UuQE%7CCgwIndvWvwYQqIbToAE%7C?hl=id","Sejauh ini gudeg sagan jd paling favorit kalo ke Jogja, krn rasanya yg tdk terlalu manis dibandingkan gudeg2 lain nya. Ayam kampungnya lembut & tasty suka banget....cuman kmrem kesini pas musim libur lebaran jadi sangant antri. Tapi tetep okkee....."
"Gudeg Sagan","https://www.google.com/maps/search/?api=1&query=Gudeg%20Sagan&query_place_id=ChIJteEkQlRZei4R2SGA1sRmVzY","5","Tony Haryanto","https://www.google.com/maps/reviews/data=!4m8!14m7!1m6!2m5!1sCi9DQUlRQUNvZENodHljRjlvT25GSFExQTBSREp0VDNGaVVWVnhOMGhQZFVSMk1uYxAB!2m1!1s0x0:0x365766c4d68021d9!3m1!1s2@1:CAIQACodChtycF9oOnFHQ1A0RDJtT3FiUVVxN0hPdUR2Mnc%7C0dH_0cEyIqo%7C?hl=id","Karena saya suka gudeg jenis basah, saya suka gudeg disini, dan memang enak"
