"title","url","stars","name","reviewUrl","text"
"Gudeg Sagan","https://www.google.com/maps/search/?api=1&query=Gudeg%20Sagan&query_place_id=ChIJteEkQlRZei4R2SGA1sRmVzY","5","Ronald Harmanto","https://www.google.com/maps/reviews/data=!4m8!14m7!1m6!2m5!1sCi9DQUlRQUNvZENodHljRjlvT2t0WmFFWjVYM1YyYld4SVQyTkViVWhxVjFoVE5IYxAB!2m1!1s0x0:0x365766c4d68021d9!3m1!1s2@1:CAIQACodChtycF9oOktZaEZ5X3V2bWxIT2NEbUhqV1hTNHc%7C0cjOiSdX6qO%7C?hl=id","Gudeg terenak di jogja, tidak terlalu manis, kreceknya juara pedes nagih, ayamnya lembut, pelyananan nya cepet.
Yg perlu diperbaiki cuma meja kursi di bagian depan yg terkena sinar matahari panas sekali, kalau bisa diberi terop atau penutup supaya tidak kena matahari dan hujan"
"Gudeg Sagan","https://www.google.com/maps/search/?api=1&query=Gudeg%20Sagan&query_place_id=ChIJteEkQlRZei4R2SGA1sRmVzY","3","Ntaya Sinuraya","https://www.google.com/maps/reviews/data=!4m8!14m7!1m6!2m5!1sCi9DQUlRQUNvZENodHljRjlvT2xFMk0xZFJOa2xDY2pNd2FFWlJNRzlDTW1VMWEzYxAB!2m1!1s0x0:0x365766c4d68021d9!3m1!1s2@1:CAIQACodChtycF9oOlE2M1dRNklCcjMwaEZRMG9CMmU1a3c%7C0cjLLqN-bt3%7C?hl=id",
"Gudeg Sagan","https://www.google.com/maps/search/?api=1&query=Gudeg%20Sagan&query_place_id=ChIJteEkQlRZei4R2SGA1sRmVzY","5","Amelya Rosha","https://www.google.com/maps/reviews/data=!4m8!14m7!1m6!2m5!1sCi9DQUlRQUNvZENodHljRjlvT25aSk5tTkhibUpVT0dWdVEzZ3RNWEJRUTNwTGJuYxAB!2m1!1s0x0:0x365766c4d68021d9!3m1!1s2@1:CAIQACodChtycF9oOnZJNmNHbmJUOGVuQ3gtMXBQQ3pLbnc%7C0cjJQx-YkxS%7C?hl=id","Gudegnya enak banget👍🏻
Harganya sangat terjangkau untuk gudeg yang seenak itu

1 kali dateng gak cukup, harus lebih🙌🏻"
"Gudeg Sagan","https://www.google.com/maps/search/?api=1&query=Gudeg%20Sagan&query_place_id=ChIJteEkQlRZei4R2SGA1sRmVzY","5","anggun desi wulandari","https://www.google.com/maps/reviews/data=!4m8!14m7!1m6!2m5!1sCi9DQUlRQUNvZENodHljRjlvT2kxaGMwdHdRa2xpY2tKUlVVUkZjekZDVFZWbWVrRRAB!2m1!1s0x0:0x365766c4d68021d9!3m1!1s2@1:CAIQACodChtycF9oOi1hc0twQklickJRUURFczFCTVVmekE%7C0cjF6riEsS5%7C?hl=id",
"Gudeg Sagan","https://www.google.com/maps/search/?api=1&query=Gudeg%20Sagan&query_place_id=ChIJteEkQlRZei4R2SGA1sRmVzY","5","Ardian Indrajaya","https://www.google.com/maps/reviews/data=!4m8!14m7!1m6!2m5!1sCi9DQUlRQUNvZENodHljRjlvT25FdGJVUndXSE5RYURNdFFuSnRYMUpuWm1GRFpVRRAB!2m1!1s0x0:0x365766c4d68021d9!3m1!1s2@1:CAIQACodChtycF9oOnEtbURwWHNQaDMtQnJtX1JnZmFDZUE%7C0cjD9fh6Nwx%7C?hl=id","Mantab"
"Gudeg Sagan","https://www.google.com/maps/search/?api=1&query=Gudeg%20Sagan&query_place_id=ChIJteEkQlRZei4R2SGA1sRmVzY","2","Ayah Arini","https://www.google.com/maps/reviews/data=!4m8!14m7!1m6!2m5!1sChZDSUhNMG9nS0VJQ0FnSURNeDRlS2J3EAE!2m1!1s0x0:0x365766c4d68021d9!3m1!1s2@1:CIHM0ogKEICAgIDMx4eKbw%7C0cj9oCauM8e%7C?hl=id","Salah satu gudeg favorit di Jogja. Beberapa kali makan disini. Lokasi strategis di daerah Sagan namun tidak tersedia parkir yg memadai menyebabkan kemacetan di sekitar lokasi. Area makan cukup luas, pilian menu gudeg beragam. Namun untuk kunjungan kali ini (jam makan siang & long weekend) cukup mengecewakan dibanding sebelum2nya, pelayanan menurun jauh  (mayoritas petugas ketus & jutek, hampir tidak ada senyum ketika diminta bantuan untuk order makanan terkesan saling lempar maupun saat bayar. Mungkin karena capek kondisi sangat ramai) Secara rasa tidak berubah masih konsisten.  Overall rating turun dibanding sebelumnya karena alasan diatas"
"Gudeg Sagan","https://www.google.com/maps/search/?api=1&query=Gudeg%20Sagan&query_place_id=ChIJteEkQlRZei4R2SGA1sRmVzY","1","Gita Mariza","https://www.google.com/maps/reviews/data=!4m8!14m7!1m6!2m5!1sCi9DQUlRQUNvZENodHljRjlvT201eVVXMXdORVl0WmxSZk5GTXhjbWR4V1d4UGEzYxAB!2m1!1s0x0:0x365766c4d68021d9!3m1!1s2@1:CAIQACodChtycF9oOm5yUW1wNEYtZlRfNFMxcmdxWWxPa3c%7C0cj06ttE-e7%7C?hl=id","Baru ini makan disini pelayananny buruk bgt, bgt !! Tolong dilatih lg karyawanny, sini uda nunggu lama sejam lebih g dpt apa2, yg dluan dateng uda dapet duluan malah uda pda abis, sini uda sabar , coba tanya lg malah bilang kurang 8 antrian lg! Gak logis woyy ini jelas2 depan mata yg diluan uda dapet makanny!!"
"Gudeg Sagan","https://www.google.com/maps/search/?api=1&query=Gudeg%20Sagan&query_place_id=ChIJteEkQlRZei4R2SGA1sRmVzY","5","Trias Putra","https://www.google.com/maps/reviews/data=!4m8!14m7!1m6!2m5!1sCi9DQUlRQUNvZENodHljRjlvT2psVldFTnNjM1ZmYjB4R1dGRlVWMUZ0Um00eVVHYxAB!2m1!1s0x0:0x365766c4d68021d9!3m1!1s2@1:CAIQACodChtycF9oOjlVWENsc3Vfb0xGWFFUV1FtRm4yUGc%7C0ciysmsydJT%7C?hl=id","Pernah gak sih ngerasa lidah lagi butuh petualangan baru di Yogyakarta? Kalau iya, wajib banget cobain Gudeg Sagan. Gudeg di sini beda, gak cuma manis kayak pacar orang, tapi juga punya rasa gurih yang bikin nagih.
Saat pertama kali ke sana, tempatnya memang sederhana. Gak ada AC, gak ada kursi sofa empuk, cuma warung kaki lima biasa. Tapi justru itu yang bikin suasananya otentik. Bau gudegnya nyebar ke mana-mana, kayak lagi dikasih parfum wangi rempah. Dijamin langsung laper!
Yang paling epik, gudegnya masih dimasak pakai cara tradisional. Dibuat pakai kuali tanah liat dengan kayu bakar. Jadi wangi asapnya itu loh, gak ada duanya! Gudegnya hangat, rasanya otentik, dan teksturnya pas. Gak terlalu lembek, tapi juga gak keras. Pas di lidah, pas juga di hati.
Kalau ke sini, jangan lupa pesan gudeg kreceknya. Krecek di sini gak cuma lembek tapi masih ada tekstur kenyal-kenyalnya gitu. Rasanya juga pedasnya pas, gak bikin bibir dower tapi cukup bikin jidat berkeringat.
Selain itu, gudegnya juga bisa dipesan dalam kemasan kaleng, cocok buat oleh-oleh. Jadi, buat kalian yang gak bisa bawa gudeg banyak-banyak, gudeg kaleng ini bisa jadi solusi. Praktis dan rasanya tetap sama nikmatnya.
Gudeg Sagan ini bukan cuma sekadar makanan, tapi juga pengalaman. Jadi, kalau lagi di Yogyakarta, jangan cuma ke mal atau kafe-kafe kekinian. Mampir sebentar ke Gudeg Sagan, dijamin gak bakal nyesel! Lidah happy, perut kenyang, hati pun riang."
"Gudeg Sagan","https://www.google.com/maps/search/?api=1&query=Gudeg%20Sagan&query_place_id=ChIJteEkQlRZei4R2SGA1sRmVzY","5","Yenatha Santosa","https://www.google.com/maps/reviews/data=!4m8!14m7!1m6!2m5!1sCi9DQUlRQUNvZENodHljRjlvT21WU1FubGtRM05KY25aWE5ucENiRTVzV0hkNmRWRRAB!2m1!1s0x0:0x365766c4d68021d9!3m1!1s2@1:CAIQACodChtycF9oOmVSQnlkQ3NJcnZXNnpCbE5sWHd6dVE%7C0ciyVQ1Aarx%7C?hl=id","Berbeda dari gudheg pada umumnya, lebih dominan rasa gurih drpd manisnya"
"Gudeg Sagan","https://www.google.com/maps/search/?api=1&query=Gudeg%20Sagan&query_place_id=ChIJteEkQlRZei4R2SGA1sRmVzY","4","Bray Wok","https://www.google.com/maps/reviews/data=!4m8!14m7!1m6!2m5!1sCi9DQUlRQUNvZENodHljRjlvT2pOWVdXcHBaVE5sV25aSldsUndhMEZGZFdablNtYxAB!2m1!1s0x0:0x365766c4d68021d9!3m1!1s2@1:CAIQACodChtycF9oOjNYWWppZTNlWnZJWlRwa0FFdWZnSmc%7C0ciyBf8OPVR%7C?hl=id","Very tasty n less sweet gudeg, the egg, chicken n krecek was one of the best. Always crowded on peak hours. The prices were quite cheap."
"Gudeg Sagan","https://www.google.com/maps/search/?api=1&query=Gudeg%20Sagan&query_place_id=ChIJteEkQlRZei4R2SGA1sRmVzY","1","Emil Fawwaz","https://www.google.com/maps/reviews/data=!4m8!14m7!1m6!2m5!1sCi9DQUlRQUNvZENodHljRjlvT2pkRGNqSnBPRUZTYURNdGRrbElRbXczZVU5c1IyYxAB!2m1!1s0x0:0x365766c4d68021d9!3m1!1s2@1:CAIQACodChtycF9oOjdDcjJpOEFSaDMtdklIQmw3eU9sR2c%7C0cirRsYA6cM%7C?hl=id","Mahal, berasa makan di pik"
"Gudeg Sagan","https://www.google.com/maps/search/?api=1&query=Gudeg%20Sagan&query_place_id=ChIJteEkQlRZei4R2SGA1sRmVzY","5","Hendra Fauzi","https://www.google.com/maps/reviews/data=!4m8!14m7!1m6!2m5!1sCi9DQUlRQUNvZENodHljRjlvT21kaVQyczNjMlpWZFdsM01HTlplRWxzWW5kR1IwRRAB!2m1!1s0x0:0x365766c4d68021d9!3m1!1s2@1:CAIQACodChtycF9oOmdiT2s3c2ZVdWl3MGNZeElsYndGR0E%7C0cikdHaUFnA%7C?hl=id",
"Gudeg Sagan","https://www.google.com/maps/search/?api=1&query=Gudeg%20Sagan&query_place_id=ChIJteEkQlRZei4R2SGA1sRmVzY","5","Indra Irawanto","https://www.google.com/maps/reviews/data=!4m8!14m7!1m6!2m5!1sChZDSUhNMG9nS0VJQ0FnSURQdE1DTEF3EAE!2m1!1s0x0:0x365766c4d68021d9!3m1!1s2@1:CIHM0ogKEICAgIDPtMCLAw%7C0cihhqtnyRM%7C?hl=id",
"Gudeg Sagan","https://www.google.com/maps/search/?api=1&query=Gudeg%20Sagan&query_place_id=ChIJteEkQlRZei4R2SGA1sRmVzY","5","Ferry Purnama","https://www.google.com/maps/reviews/data=!4m8!14m7!1m6!2m5!1sCi9DQUlRQUNvZENodHljRjlvT21oMmFEZHRaVmd6UjFsaFJWOXBTWGRoYldnNFlWRRAB!2m1!1s0x0:0x365766c4d68021d9!3m1!1s2@1:CAIQACodChtycF9oOmh2aDdtZVgzR1lhRV9pSXdhbWg4YVE%7C0cih_MNUV25%7C?hl=id","Penuh, salah satu tempat wajib kuliner klo datang ke kota Yogyakarta. Gudeg komplit ayam kampung rasanya enak, tapi buat saya ayam goreng kremesnya lebih enak lagi, apalagi sambalnya pooll.."
"Gudeg Sagan","https://www.google.com/maps/search/?api=1&query=Gudeg%20Sagan&query_place_id=ChIJteEkQlRZei4R2SGA1sRmVzY","5","alfin putratama","https://www.google.com/maps/reviews/data=!4m8!14m7!1m6!2m5!1sCi9DQUlRQUNvZENodHljRjlvT25OdVQycHlVVzl5UVZKUFJDMXNRMFYxUTJ0SFluYxAB!2m1!1s0x0:0x365766c4d68021d9!3m1!1s2@1:CAIQACodChtycF9oOnNuT2pyUW9yQVJPRC1sQ0V1Q2tHYnc%7C0cif-5c7050%7C?hl=id",
"Gudeg Sagan","https://www.google.com/maps/search/?api=1&query=Gudeg%20Sagan&query_place_id=ChIJteEkQlRZei4R2SGA1sRmVzY","5","meiliana meiliana","https://www.google.com/maps/reviews/data=!4m8!14m7!1m6!2m5!1sCi9DQUlRQUNvZENodHljRjlvT2pkeGJtVmFOM0JtWjFVM1RWQlBkelpQYkhwUFZXYxAB!2m1!1s0x0:0x365766c4d68021d9!3m1!1s2@1:CAIQACodChtycF9oOjdxbmVaN3BmZ1U3TVBPdzZPbHpPVWc%7C0cicXhnFhpD%7C?hl=id","Kali kedua kali ini. Berhubung long weekend ramai sekali, dine in full. Harus menunggu. Dari rasa emang mantap gudeg ini. Mungkin perlu dipertimbangkan untuk memperluas area."
"Gudeg Sagan","https://www.google.com/maps/search/?api=1&query=Gudeg%20Sagan&query_place_id=ChIJteEkQlRZei4R2SGA1sRmVzY","5","Sang","https://www.google.com/maps/reviews/data=!4m8!14m7!1m6!2m5!1sCi9DQUlRQUNvZENodHljRjlvT21JNVpWRmxVRUUzWWxOSlVVWlVkMVpIU0hRek1rRRAB!2m1!1s0x0:0x365766c4d68021d9!3m1!1s2@1:CAIQACodChtycF9oOmI5ZVFlUEE3YlNJUUZUd1ZHSHQzMkE%7C0ciauF9oeVH%7C?hl=id","Enak enak"
"Gudeg Sagan","https://www.google.com/maps/search/?api=1&query=Gudeg%20Sagan&query_place_id=ChIJteEkQlRZei4R2SGA1sRmVzY","5","Muhammad Rosa Sya'Roni","https://www.google.com/maps/reviews/data=!4m8!14m7!1m6!2m5!1sCi9DQUlRQUNvZENodHljRjlvT2sxM2MwMXJkVWRsVm1OaVMzSmhTblZ3UnpnNE1HYxAB!2m1!1s0x0:0x365766c4d68021d9!3m1!1s2@1:CAIQACodChtycF9oOk13c01rdUdlVmNiS3JhSnVwRzg4MGc%7C0ci_NWHhP6-%7C?hl=id","Gudeg enak, murce dan worth"
"Gudeg Sagan","https://www.google.com/maps/search/?api=1&query=Gudeg%20Sagan&query_place_id=ChIJteEkQlRZei4R2SGA1sRmVzY","4","Olav Walker","https://www.google.com/maps/reviews/data=!4m8!14m7!1m6!2m5!1sCi9DQUlRQUNvZENodHljRjlvT2padlgwcElabTlsWjNaRFNVcGFOM2xKZFZVeldsRRAB!2m1!1s0x0:0x365766c4d68021d9!3m1!1s2@1:CAIQACodChtycF9oOjZvX0pIZm9lZ3ZDSUpaN3lJdVUzWlE%7C0ciRbmmzwio%7C?hl=id","First time nyoba gudeg sagan. Yaa lumayan sih typical manis ya krecek nya ueenaaak tp kurang banyak hehe. Cocok buat family sihh ini. Tapi ku tetep prefer gudeg bromo keknya hehew"
"Gudeg Sagan","https://www.google.com/maps/search/?api=1&query=Gudeg%20Sagan&query_place_id=ChIJteEkQlRZei4R2SGA1sRmVzY","5","KaGuna","https://www.google.com/maps/reviews/data=!4m8!14m7!1m6!2m5!1sChdDSUhNMG9nS0VJQ0FnTUNBd2Z1QmxnRRAB!2m1!1s0x0:0x365766c4d68021d9!3m1!1s2@1:CIHM0ogKEICAgMCAwfuBlgE%7C0ciHSS_bLWz%7C?hl=id","Buat pecinta gudeg dengan rasa yg tdk terlalu manis bs cobain gudeg sagan, harganya jg msh affordable. Pelayanan cepat, makanan terhidang dalam keadaan msh panas, cm jangan kesini pas posisi libur panjang, rame & antri

Seporsi nasi gudeg, krecek, ayam dada 41.000"
"Gudeg Sagan","https://www.google.com/maps/search/?api=1&query=Gudeg%20Sagan&query_place_id=ChIJteEkQlRZei4R2SGA1sRmVzY","5","Anhar Adhi Firdaus","https://www.google.com/maps/reviews/data=!4m8!14m7!1m6!2m5!1sCi9DQUlRQUNvZENodHljRjlvT2kxMWJVWlFXVzVGVkhwSmJEZFpSekp4TUY5NWMzYxAB!2m1!1s0x0:0x365766c4d68021d9!3m1!1s2@1:CAIQACodChtycF9oOi11bUZQWW5FVHpJbDdZRzJxMF95c3c%7C0ciBefincL_%7C?hl=id",
"Gudeg Sagan","https://www.google.com/maps/search/?api=1&query=Gudeg%20Sagan&query_place_id=ChIJteEkQlRZei4R2SGA1sRmVzY","5","Permata Attenuator Mandiri","https://www.google.com/maps/reviews/data=!4m8!14m7!1m6!2m5!1sCi9DQUlRQUNvZENodHljRjlvT2xoSU1raDBXbGxxV1hWWmNVMURaMDl5VjFOMFVuYxAB!2m1!1s0x0:0x365766c4d68021d9!3m1!1s2@1:CAIQACodChtycF9oOlhIMkh0WllqWXVZcU1DZ09yV1N0Unc%7C0ci4X0sgrwX%7C?hl=id","Antri banyak berarti pd suka dan emang enak sih"
"Gudeg Sagan","https://www.google.com/maps/search/?api=1&query=Gudeg%20Sagan&query_place_id=ChIJteEkQlRZei4R2SGA1sRmVzY","5","Airel","https://www.google.com/maps/reviews/data=!4m8!14m7!1m6!2m5!1sCi9DQUlRQUNvZENodHljRjlvT201elp6bEhWR0p1VGtOT2FUQXhTWEZDV1RKaU9IYxAB!2m1!1s0x0:0x365766c4d68021d9!3m1!1s2@1:CAIQACodChtycF9oOm5zZzlHVGJuTkNOaTAxSXFCWTJiOHc%7C0ci3Td_KL5a%7C?hl=id","Enak bangeetttt, my fav gudeg, wajib ke sini kalo ke jogja. Ga terlalu manis gudegnya, kreceknya lembut and pedesnya pas bgt 💯

What we ordered:
- Krecek porsian (2 porsi 33rb)
- Nasi gudeg krecek rempelo ati (14,5rb)
- Nasi gudeg krecek telur (4 porsi 72rb)
- Tahu (@4rb)
- Tempe (@3rb)
- Es teh tawar (@2,5rb)
- Es jeruk nipis (9rb)
- Es batu (1rb)

Ber6 makan sampe kenyang bgt cuma 178,200 totalnya 😭(untuk standar jogja agak lebih mahal tapi kalo dari jkt murah bgt huu)"
"Gudeg Sagan","https://www.google.com/maps/search/?api=1&query=Gudeg%20Sagan&query_place_id=ChIJteEkQlRZei4R2SGA1sRmVzY","1","Rizka C","https://www.google.com/maps/reviews/data=!4m8!14m7!1m6!2m5!1sCi9DQUlRQUNvZENodHljRjlvT2kxWVdrMTFWbnB3WnkxaE1USnlPRFpqVkRsMWRtYxAB!2m1!1s0x0:0x365766c4d68021d9!3m1!1s2@1:CAIQACodChtycF9oOi1YWk11VnpwZy1hMTJyODZjVDl1dmc%7C0chzbsT-Sc7%7C?hl=id","makanannya enak , tapi sayang bgt pelayanannya kurang . karyawan nya jutek terutama yg perempuan tdk pakai kerudung pakai baju livin . ketika serving agak di lempar , dan ketika bertanya nadanya tdk sopan sambil pergi . baru pertama kesini , tidak untuk kedua kali deh"
"Gudeg Sagan","https://www.google.com/maps/search/?api=1&query=Gudeg%20Sagan&query_place_id=ChIJteEkQlRZei4R2SGA1sRmVzY","5","LIMA","https://www.google.com/maps/reviews/data=!4m8!14m7!1m6!2m5!1sCi9DQUlRQUNvZENodHljRjlvT25FMVNYRnVWRjgwTWxoMWJ6TjVPVXQ1TnkxSlpuYxAB!2m1!1s0x0:0x365766c4d68021d9!3m1!1s2@1:CAIQACodChtycF9oOnE1SXFuVF80Mlh1bzN5OUt5Ny1JZnc%7C0chv0qoSKcC%7C?hl=id",
"Gudeg Sagan","https://www.google.com/maps/search/?api=1&query=Gudeg%20Sagan&query_place_id=ChIJteEkQlRZei4R2SGA1sRmVzY","4","hipsterlookslikehobo","https://www.google.com/maps/reviews/data=!4m8!14m7!1m6!2m5!1sCi9DQUlRQUNvZENodHljRjlvT2xWNGFGRllNV0kzU1hOTlJrTTNWbWxsVkhsVlIyYxAB!2m1!1s0x0:0x365766c4d68021d9!3m1!1s2@1:CAIQACodChtycF9oOlV4aFFYMWI3SXNNRkM3VmllVHlVR2c%7C0chjylHyB1V%7C?hl=id","Rumah makan yg ada live music. Rame banget. Kalau suka gudeg ini versi yg ga terlalu manis. Ayam goreng cenderung asin. Berhubung saya ga demen2 amat sama gudeg, ya cukup coba sekali aja. Tapi buat yg suka gudeg, ini wajib dicoba."
"Gudeg Sagan","https://www.google.com/maps/search/?api=1&query=Gudeg%20Sagan&query_place_id=ChIJteEkQlRZei4R2SGA1sRmVzY","5","Bamroung Tangsanga","https://www.google.com/maps/reviews/data=!4m8!14m7!1m6!2m5!1sCi9DQUlRQUNvZENodHljRjlvT2sxNVZYVldUVWRuZUZOTFdITlliVVZ3TkhjMllVRRAB!2m1!1s0x0:0x365766c4d68021d9!3m1!1s2@1:CAIQACodChtycF9oOk15VXVWTUdneFNLWHNYbUVwNHc2YUE%7C0chjcoZIIQ9%7C?hl=id","มาต่างแดนมีเพื่อนรุ่นน้องคนไทยที่มาอยู่ประเทศอินโดหลายสิบปีพามาลองทานอาหารกูเดกที่เป็นอาหารพื้นเมืองของที่นี่ ร้านอยู่ริมถนนหาจอดรถริมถนนร้านนี้ขายดีลูกค้าเต็มร้านเราโชคดีมีโต๊ะใหญ่ออกพอดี
อาหารคล้ายข้าวแกงราดแต่จะออกรสหวานเล็กน้อยใกล้เคียงแกงมัสมั่นแถมมีไข่พะโล้และหนังวัวตุ๋นจนนุ่มที่ทานง่ายและถูกใจกลุ่มเราก็คือไก่อดร้อนๆ เค้าเอาไก่ต้มก่อนแล้วนำมาทอดรสชาติกรอบนอกนุ่มในรสชาติไก่คล้ายกับไก่วันสาร์ทหรือตรุษจีนที่ไหว้เหลือจับมารวนเค็มยังไงยังงั้น รสชาติอาหารสำหรับคนไทยเรียกว่าอร่อยทานง่ายๆครับราคาไม่แพง"
"Gudeg Sagan","https://www.google.com/maps/search/?api=1&query=Gudeg%20Sagan&query_place_id=ChIJteEkQlRZei4R2SGA1sRmVzY","5","Mohamad Imam Wicaksono","https://www.google.com/maps/reviews/data=!4m8!14m7!1m6!2m5!1sCi9DQUlRQUNvZENodHljRjlvT21GMVQxSnJla2N5ZVRsQlJGSlRXVEoyWjJsemJXYxAB!2m1!1s0x0:0x365766c4d68021d9!3m1!1s2@1:CAIQACodChtycF9oOmF1T1JrekcyeTlBRFJTWTJ2Z2lzbWc%7C0chh1NYYBe_%7C?hl=id","A must-visit spot in Jogja, especially if you’re into local culinary with modern concept and flavor.

I went to Gudeg Sagan for an early dinner (at around 5PM). It wasn’t too crowded at that time, and the service was pretty fast.

I ordered the classic gudeg with egg. Tender, flavorful and perfectly balanced with a bit of sweetness.

Pros: balance taste (suitable for children and foreigners), lively ambience (with live music, been there on weekend), spacious place with outdoor & semi-indoor

Cons: limited parking spaces (it’s easier to bring motorcycle or use taxi)"
"Gudeg Sagan","https://www.google.com/maps/search/?api=1&query=Gudeg%20Sagan&query_place_id=ChIJteEkQlRZei4R2SGA1sRmVzY","5","murtono","https://www.google.com/maps/reviews/data=!4m8!14m7!1m6!2m5!1sCi9DQUlRQUNvZENodHljRjlvT25kSmRYUkpTeTFsVTNsQ1VtaHlXSEIxU1VoemNXYxAB!2m1!1s0x0:0x365766c4d68021d9!3m1!1s2@1:CAIQACodChtycF9oOndJdXRJSy1lU3lCUmhyWHB1SUhzcWc%7C0chRY07vHJH%7C?hl=id","gudegnya pas tdk terlalu manis.. tempatnyabagus"
"Gudeg Sagan","https://www.google.com/maps/search/?api=1&query=Gudeg%20Sagan&query_place_id=ChIJteEkQlRZei4R2SGA1sRmVzY","5","elletarianti cardianasari","https://www.google.com/maps/reviews/data=!4m8!14m7!1m6!2m5!1sCi9DQUlRQUNvZENodHljRjlvT2xoSWFXRkdOV05CWXpad1NtSktaRE56V0RSbmJrRRAB!2m1!1s0x0:0x365766c4d68021d9!3m1!1s2@1:CAIQACodChtycF9oOlhIaWFGNWNBYzZwSmJKZDNzWDRnbkE%7C0chKTqojEza%7C?hl=id","Gudeg yang manisnya sopan"
"Gudeg Sagan","https://www.google.com/maps/search/?api=1&query=Gudeg%20Sagan&query_place_id=ChIJteEkQlRZei4R2SGA1sRmVzY","5","Stephanie A","https://www.google.com/maps/reviews/data=!4m8!14m7!1m6!2m5!1sCi9DQUlRQUNvZENodHljRjlvT21KUldGOUtZMGd0V213eGMzRnJibkZIU0hoV1JFRRAB!2m1!1s0x0:0x365766c4d68021d9!3m1!1s2@1:CAIQACodChtycF9oOmJRWF9KY0gtWmwxc3FrbnFHSHhWREE%7C0chGSebx4Im%7C?hl=id","Datang ke sini setelah Jumatan, jadi ramai sekali tapi pelayanannya cepat. Staffnya ramah. Untuk yang datang 4-5 orang masih lebih mudah dapat tempat, yang sulit kalau rombongan besar.

Rasanya enak, tidak terlalu manis seperti gudeg pada umumnya. Hanya untuk saya gudegnya masih kemanisan (saya tidak suka dan tidak kuat manis). Untuk yang suka gudeg tapi tidak kemanisan, dia oke untuk dicoba. Tipe gudegnya ga kering karena ada kuah dari krecek dan ayamnya kalau pesan pakai ayam. Saya pesan gudeg krecek paha atas, saya pikir benar2 cuma akan dapat bagian paha atas, tp ternyata waktu datang, dapat 1 paha utuh. Jadi kurang paham saya kalau gudeg krecek paha bawah, ayamnya bagaimana potongannya, kebetulan kemarin habis katanya."
"Gudeg Sagan","https://www.google.com/maps/search/?api=1&query=Gudeg%20Sagan&query_place_id=ChIJteEkQlRZei4R2SGA1sRmVzY","5","shelfitaafy anantha","https://www.google.com/maps/reviews/data=!4m8!14m7!1m6!2m5!1sCi9DQUlRQUNvZENodHljRjlvT214b1ozbGxkR3hFTlVaQllqbGFObFk1YVRaVVYzYxAB!2m1!1s0x0:0x365766c4d68021d9!3m1!1s2@1:CAIQACodChtycF9oOmxoZ3lldGxENUZBYjlaNlY5aTZUV3c%7C0ch60Un_WCG%7C?hl=id","enakkk bangettt, salah satu gudeg favorit aku di Jogja, harga murah dan pelayanannya cepett bangett walaupun rame, gaada foto makanannya, entah kenapa tiap kali kesana pasti lowbatt jadi engga sempet foto"
"Gudeg Sagan","https://www.google.com/maps/search/?api=1&query=Gudeg%20Sagan&query_place_id=ChIJteEkQlRZei4R2SGA1sRmVzY","5","linda yudiana","https://www.google.com/maps/reviews/data=!4m8!14m7!1m6!2m5!1sCi9DQUlRQUNvZENodHljRjlvT2kxR2NHWjBOazVoUVZaT1EwWnpOM2hmZFZoRU9GRRAB!2m1!1s0x0:0x365766c4d68021d9!3m1!1s2@1:CAIQACodChtycF9oOi1GcGZ0Nk5hQVZOQ0ZzN3hfdVhEOFE%7C0ch3_Ke-1AZ%7C?hl=id","Mantull"
"Gudeg Sagan","https://www.google.com/maps/search/?api=1&query=Gudeg%20Sagan&query_place_id=ChIJteEkQlRZei4R2SGA1sRmVzY","5","Sutarman Tarman","https://www.google.com/maps/reviews/data=!4m8!14m7!1m6!2m5!1sCi9DQUlRQUNvZENodHljRjlvT2xZd2FGa3RjM000VWtwck1sbEVYM0JZZDA1UmJWRRAB!2m1!1s0x0:0x365766c4d68021d9!3m1!1s2@1:CAIQACodChtycF9oOlYwaFktc3M4UkprMllEX3BYd05RbVE%7C0cgy-dMD9Ak%7C?hl=id","Jam 8 pagi waktunya orang sarapan... tidak perlu nunggu lama orang silih berganti utk menikmati gudeg sagan yg populer di Yogya. Baik utk sarapan maupun makan siang bersama keluarga atau kerabat
Dengan pelayanan yg ramah dan cepat anda aksn merasakan kuliner Yogya ini yg takkan terlupakan"
"Gudeg Sagan","https://www.google.com/maps/search/?api=1&query=Gudeg%20Sagan&query_place_id=ChIJteEkQlRZei4R2SGA1sRmVzY","5","Suparwoto Whatstar_official_chanel","https://www.google.com/maps/reviews/data=!4m8!14m7!1m6!2m5!1sCi9DQUlRQUNvZENodHljRjlvT21wNmVtMUdUV1ZuVHpKWU5sbDNXamhKTkhoU1VYYxAB!2m1!1s0x0:0x365766c4d68021d9!3m1!1s2@1:CAIQACodChtycF9oOmp6em1GTWVnTzJYNll3WjhJNHhSUXc%7C0cgwHziroCZ%7C?hl=id",
"Gudeg Sagan","https://www.google.com/maps/search/?api=1&query=Gudeg%20Sagan&query_place_id=ChIJteEkQlRZei4R2SGA1sRmVzY","5","Anugrah Tembang","https://www.google.com/maps/reviews/data=!4m8!14m7!1m6!2m5!1sCi9DQUlRQUNvZENodHljRjlvT21SUmJ6RkJVa2RtYjBOME9GaEtXbFl0TW1jMVJIYxAB!2m1!1s0x0:0x365766c4d68021d9!3m1!1s2@1:CAIQACodChtycF9oOmRRbzFBUkdmb0N0OFhKWlYtMmc1RHc%7C0cgvzSR7cTI%7C?hl=id",
"Gudeg Sagan","https://www.google.com/maps/search/?api=1&query=Gudeg%20Sagan&query_place_id=ChIJteEkQlRZei4R2SGA1sRmVzY","5","priy 889","https://www.google.com/maps/reviews/data=!4m8!14m7!1m6!2m5!1sCi9DQUlRQUNvZENodHljRjlvT25CRWVtcHFRekJLZFdKZlZrVkRlakpoUVRaQk4wRRAB!2m1!1s0x0:0x365766c4d68021d9!3m1!1s2@1:CAIQACodChtycF9oOnBEempqQzBKdWJfVkVDejJhQTZBN0E%7C0cgvyVfePzM%7C?hl=id",
"Gudeg Sagan","https://www.google.com/maps/search/?api=1&query=Gudeg%20Sagan&query_place_id=ChIJteEkQlRZei4R2SGA1sRmVzY","4","okkylh","https://www.google.com/maps/reviews/data=!4m8!14m7!1m6!2m5!1sCi9DQUlRQUNvZENodHljRjlvT205bmEycHBla2g1VnpGM1pXaENNMTlET1ZNdFlWRRAB!2m1!1s0x0:0x365766c4d68021d9!3m1!1s2@1:CAIQACodChtycF9oOm9na2ppekh5VzF3ZWhCM19DOVMtYVE%7C0cgkU8pJew6%7C?hl=id",
"Gudeg Sagan","https://www.google.com/maps/search/?api=1&query=Gudeg%20Sagan&query_place_id=ChIJteEkQlRZei4R2SGA1sRmVzY","5","Junaidi Cerdas Tarigan","https://www.google.com/maps/reviews/data=!4m8!14m7!1m6!2m5!1sCi9DQUlRQUNvZENodHljRjlvT2s1Sk1uRlJNak5UTjBFNFZuSlliR1ZuVmt0M1RWRRAB!2m1!1s0x0:0x365766c4d68021d9!3m1!1s2@1:CAIQACodChtycF9oOk5JMnFRMjNTN0E4VnJYbGVnVkt3TVE%7C0cgfnQgihzS%7C?hl=id",
"Gudeg Sagan","https://www.google.com/maps/search/?api=1&query=Gudeg%20Sagan&query_place_id=ChIJteEkQlRZei4R2SGA1sRmVzY","5","dwi nurfitriya","https://www.google.com/maps/reviews/data=!4m8!14m7!1m6!2m5!1sCi9DQUlRQUNvZENodHljRjlvT21oWVFrWTVabXBRVjJsaVIyNU9jMWt6ZUZaV1IwRRAB!2m1!1s0x0:0x365766c4d68021d9!3m1!1s2@1:CAIQACodChtycF9oOmhYQkY5ZmpQV2liR25Oc1kzeFZWR0E%7C0cgXtAVY9cD%7C?hl=id","Gudegnya mantul rasanya, nagih banget. Harga juga murah, cuma pelayanan lama, dan suasannya ramai"
"Gudeg Sagan","https://www.google.com/maps/search/?api=1&query=Gudeg%20Sagan&query_place_id=ChIJteEkQlRZei4R2SGA1sRmVzY","5","Gandu Yulio","https://www.google.com/maps/reviews/data=!4m8!14m7!1m6!2m5!1sCi9DQUlRQUNvZENodHljRjlvT21aTFVGRlZiMjFSYlhseGVHZzFSVGRMY1hCT1pXYxAB!2m1!1s0x0:0x365766c4d68021d9!3m1!1s2@1:CAIQACodChtycF9oOmZLUFFVb21RbXlxeGg1RTdLcXBOZWc%7C0cgQXwLzMs0%7C?hl=id",
"Gudeg Sagan","https://www.google.com/maps/search/?api=1&query=Gudeg%20Sagan&query_place_id=ChIJteEkQlRZei4R2SGA1sRmVzY","5","Agus Nurwahid","https://www.google.com/maps/reviews/data=!4m8!14m7!1m6!2m5!1sCi9DQUlRQUNvZENodHljRjlvT20wMmRWcFBTM1JYYlMxb1RqQkxNemh3U0RnMVFYYxAB!2m1!1s0x0:0x365766c4d68021d9!3m1!1s2@1:CAIQACodChtycF9oOm02dVpPS3RXbS1oTjBLMzhwSDg1QXc%7C0cgMjdemlTo%7C?hl=id","Datang kesiangan sampai Yogyakarta langsung kesini"
"Gudeg Sagan","https://www.google.com/maps/search/?api=1&query=Gudeg%20Sagan&query_place_id=ChIJteEkQlRZei4R2SGA1sRmVzY","5","Subandi Hadiwijoyo","https://www.google.com/maps/reviews/data=!4m8!14m7!1m6!2m5!1sCi9DQUlRQUNvZENodHljRjlvT2s5Zk5sQk9hV1o2VVdWb2FVRkdiVWRMY1hobWJtYxAB!2m1!1s0x0:0x365766c4d68021d9!3m1!1s2@1:CAIQACodChtycF9oOk9fNlBOaWZ6UWVoaUFGbUdLcXhmbmc%7C0cgMCFlKsqZ%7C?hl=id",
"Gudeg Sagan","https://www.google.com/maps/search/?api=1&query=Gudeg%20Sagan&query_place_id=ChIJteEkQlRZei4R2SGA1sRmVzY","5","karine ravienna","https://www.google.com/maps/reviews/data=!4m8!14m7!1m6!2m5!1sCi9DQUlRQUNvZENodHljRjlvT2tWa1JEWjFlSFEwTjJKaU5FaFVVRE5CZFZsc2NrRRAB!2m1!1s0x0:0x365766c4d68021d9!3m1!1s2@1:CAIQACodChtycF9oOkVkRDZ1eHQ0N2JiNEhUUDNBdVlsckE%7C0cgL__8kUbo%7C?hl=id","Like it all. Food always good.. best krecek and ayam goreng yumm! Atmosphere though crowded but i dont mind"
"Gudeg Sagan","https://www.google.com/maps/search/?api=1&query=Gudeg%20Sagan&query_place_id=ChIJteEkQlRZei4R2SGA1sRmVzY","5","Dadan Ramdani","https://www.google.com/maps/reviews/data=!4m8!14m7!1m6!2m5!1sCi9DQUlRQUNvZENodHljRjlvT2xZek5EZGpYM3BHZWtKYU5WRnlNbTF5WDNCUFdYYxAB!2m1!1s0x0:0x365766c4d68021d9!3m1!1s2@1:CAIQACodChtycF9oOlYzNDdjX3pGekJaNVFyMm1yX3BPWXc%7C0cgL49GYBKX%7C?hl=id","Baru sekali ini k tempat ini, tp langsung jatuh hati.... Pas maksi lg....mantappp"
