"title","url","stars","name","reviewUrl","text"
"Toean Watiman","https://www.google.com/maps/search/?api=1&query=Toean%20Watiman&query_place_id=ChIJk-7zsZ9Xei4RFWlj8oCWixs","5","Daniel Dicky","https://www.google.com/maps/reviews/data=!4m8!14m7!1m6!2m5!1sCi9DQUlRQUNvZENodHljRjlvT201S1lXWkZheTFaYmtSclJuUkRWazA0YW1WTlRHYxAB!2m1!1s0x0:0x1b8b9680f2636915!3m1!1s2@1:CAIQACodChtycF9oOm5KYWZFay1ZbkRrRnRDVk04amVNTGc%7C0d2-rK3i8r-%7C?hl=id","Pertama kali coba ke Toean Watiman karena tertarik dengan logo Ayam Jago yang terpampang di depan resto. Resto ini cocok buat family time. Tempatnya cukup luas dan lega, ada area smoking dan non smoking. Menunya beraneka ragam, dari western sampai asian food. Penyajian makanannya terbilang cepat dengan detail yang diperhatikan. Untuk rasa terbilang enak dan pas di lidah. Sejauh ini sangat memuaskan. Recommended to try."
"Toean Watiman","https://www.google.com/maps/search/?api=1&query=Toean%20Watiman&query_place_id=ChIJk-7zsZ9Xei4RFWlj8oCWixs","5","Addin hsn","https://www.google.com/maps/reviews/data=!4m8!14m7!1m6!2m5!1sCi9DQUlRQUNvZENodHljRjlvT25Gd1ZrSkNiREUxTFZkNE5EUlphVnB4ZURNellYYxAB!2m1!1s0x0:0x1b8b9680f2636915!3m1!1s2@1:CAIQACodChtycF9oOnFwVkJCbDE1LVd4NDRZaVpxeDMzYXc%7C0coLJvd3TSQ%7C?hl=id","Resto yg menyajikan berbagai varian menu, ada Western, Asian, tradisional, dan rata2 semuanya enak. Sepertinya tiap menu dimasak sungguh2 dengan memperhatikan taste nya. Hanya untuk minuman tidak terlalu istimewa, cenderung manis yg menonjol. Untuk harga sesuai standar resto, kalau terlihat pricey itu karena porsinya juga woww sih menurut saya. Satu porsi menu kadang bisa buat sharing, jadi jatuhnya nggk terlalu mahal sebenarnya. Tempatnya bersih, cukup luas, fasilitas toilet & mushola ada. Pelayanan termasuk cepat, kalau siang. Menjelang sore - malam mulai ramai sih.
Lokasinya menyatu dengan toko kue / dessert, tapi parkir mobil dan area masuknya lewat belakang resto."
"Toean Watiman","https://www.google.com/maps/search/?api=1&query=Toean%20Watiman&query_place_id=ChIJk-7zsZ9Xei4RFWlj8oCWixs","5","Khalisa Khairani","https://www.google.com/maps/reviews/data=!4m8!14m7!1m6!2m5!1sCi9DQUlRQUNvZENodHljRjlvT2tKRFgyZ3Rka1UyZWprdGEydFlOemczT1VwZkxVRRAB!2m1!1s0x0:0x1b8b9680f2636915!3m1!1s2@1:CAIQACodChtycF9oOkJDX2gtdkU2ejkta2tYNzg3OUpfLUE%7C0dEJuWIRGk1%7C?hl=id","Udah lama tempat ini masuk ke wishlist jajan dan akhirnya keturutan. Tempatnya lumayan luas dan poin plusnya ada mushola. Kebetulan lokasinya jadi satu dengan dopio donut jadi space nya lumayan luas, bisa pilih tempat duduk di area watiman ataupun dopio. Tersedia area AC dan smoking area. Pilihan menu ada western, asian, dan Indonesian food. Menu maincourse nya lumayan banyak. Sayangnya menu snack nya tidak terlalu banyak. Harga dan rasa menurutku cukup worth it."
"Toean Watiman","https://www.google.com/maps/search/?api=1&query=Toean%20Watiman&query_place_id=ChIJk-7zsZ9Xei4RFWlj8oCWixs","5","Arichi Reyji","https://www.google.com/maps/reviews/data=!4m8!14m7!1m6!2m5!1sCi9DQUlRQUNvZENodHljRjlvT2xaUVNqRkpOUzFVZWxGV016WmxUak15ZUdoNUxWRRAB!2m1!1s0x0:0x1b8b9680f2636915!3m1!1s2@1:CAIQACodChtycF9oOlZQSjFJNS1UelFWMzZlTjMyeGh5LVE%7C0d6d8ISJGqJ%7C?hl=id","Salah satu resto di jogja yang highly recommended buat family gathering (tapi bukan buat keluarga besar ya). Tempatnya nyaman, bersih, dan cukup fancy. Service nya worth the price; ramah, komunikatif, responsif, dan satset. Cita rasa makanannya sejauh ini nggk ada yang gagal. Menunya seabrek dan banyak style masakan; nusantara, western, oriental, japanese, dll. Cashless available. Toiletnya bersih. Ada kang parkir."
"Toean Watiman","https://www.google.com/maps/search/?api=1&query=Toean%20Watiman&query_place_id=ChIJk-7zsZ9Xei4RFWlj8oCWixs","5","Novi Anggraini","https://www.google.com/maps/reviews/data=!4m8!14m7!1m6!2m5!1sCi9DQUlRQUNvZENodHljRjlvT2tkMlZreElhazV4U0dRMWRXb3RNMHg0Wkd4eFduYxAB!2m1!1s0x0:0x1b8b9680f2636915!3m1!1s2@1:CAIQACodChtycF9oOkd2VkxIak5xSGQ1dWotM0x4ZGxxWnc%7C0dEBx8eIyZ3%7C?hl=id","Pelayanan sangat baik, kk nya ramah😍, makanannya enak tempatnya nyaman bersih, adek aku dikasi balon mksi ya kak. minumannya enak, dari aku lebih diperhatikan n teliti lg ya kk  untuk minumannya mksi😊"
"Toean Watiman","https://www.google.com/maps/search/?api=1&query=Toean%20Watiman&query_place_id=ChIJk-7zsZ9Xei4RFWlj8oCWixs","5","alfiafia dianika","https://www.google.com/maps/reviews/data=!4m8!14m7!1m6!2m5!1sCi9DQUlRQUNvZENodHljRjlvT2pabllWZ3diVk56Y0c5UFJVOU9kbmd4TW5sZmNYYxAB!2m1!1s0x0:0x1b8b9680f2636915!3m1!1s2@1:CAIQACodChtycF9oOjZnYVgwbVNzcG9PRU9OdngxMnlfcXc%7C0cVDHZLAKt_%7C?hl=id","Beberapa kali kesini, ga kapok sama sekali dengan pelayanan dan rasa dari makanan, kalian harus bgt cobain menu baru “sate nusantara” yg rasanya enak, dagingnya ga alot sama sekali, bumbunya juga meresap😍 dngn harga 38k an udh dapet es teh sama nasi juga 😍, harga sangat bersahabat mengingat kualitas makanan yg disajikan dan pelayanan yg ramah kepada para pelanggan!!!  Kalian bisa juga nyobain menu baru “burger” dengan 3 varian rasa yg bikin ketagihan karena rasa dan ukurannya yg gedhee🫶✨"
"Toean Watiman","https://www.google.com/maps/search/?api=1&query=Toean%20Watiman&query_place_id=ChIJk-7zsZ9Xei4RFWlj8oCWixs","5","Ristiani","https://www.google.com/maps/reviews/data=!4m8!14m7!1m6!2m5!1sCi9DQUlRQUNvZENodHljRjlvT25KNFgyc3lSSEZ1TUdsMFpIbEpORkoyYjAxRGRHYxAB!2m1!1s0x0:0x1b8b9680f2636915!3m1!1s2@1:CAIQACodChtycF9oOnJ4X2syRHFuMGl0ZHlJNFJ2b01DdGc%7C0cgFCa5SgAJ%7C?hl=id","Tempat nya enak buat pergi main sama temen atau buat wfc. Matchanyaa enakkk, type matcha yang aku sukaa😍 donat strawberry nya juga enakkk, asem manis selainya pass poll. Kemarin kesana beli bundling donat sama minuman cuma 30k. Beli pizza jugaa enak , type pizza garing tipis kejunya banyak. Beli chicken nasville juga tapi sayang kurang masuk diaku karna isinya lebih banyak tepung 😔. Tapi ttep rekomend buat yang mau makan cantik bareng keluarga atau sama temen✨"
"Toean Watiman","https://www.google.com/maps/search/?api=1&query=Toean%20Watiman&query_place_id=ChIJk-7zsZ9Xei4RFWlj8oCWixs","5","Mey Lina Hermayanti","https://www.google.com/maps/reviews/data=!4m8!14m7!1m6!2m5!1sCi9DQUlRQUNvZENodHljRjlvT25aWk5HWlljRUoyVkZoUE9EVXRVVUZmZEhCbU1tYxAB!2m1!1s0x0:0x1b8b9680f2636915!3m1!1s2@1:CAIQACodChtycF9oOnZZNGZYcEJ2VFhPODUtUUFfdHBmMmc%7C0cT49YWxhgE%7C?hl=id","Makan malam bersama keluarga besar disini, tempatnya nyaman,cukup luas,dan rapi,menu makanan juga sangat lengkap bervariasi, banyak pilihan menu sehat ya di resto ini ,jadi cocok jika yang sedang diet sehat tinggi protein bisa mencoba kesini.

Sekedar saran jika ingin pelayanan lebih cepat dalam penyajian hidangan lebih baik reservasi dulu,kami pun kemarin memesan tempat dan menu via WA ,dan alhamdulillah saat datang segera dilayani dengan baik. Area parkir roda 4 bisa lewat jalan samping resto ke belakang, tersedia juga toilet dan mushola di area belakang resto."
"Toean Watiman","https://www.google.com/maps/search/?api=1&query=Toean%20Watiman&query_place_id=ChIJk-7zsZ9Xei4RFWlj8oCWixs","5","Catarina Novitasari","https://www.google.com/maps/reviews/data=!4m8!14m7!1m6!2m5!1sCi9DQUlRQUNvZENodHljRjlvT2tVdGJGWnJPVGR1TlZwWloxbHVZV1psY201UFozYxAB!2m1!1s0x0:0x1b8b9680f2636915!3m1!1s2@1:CAIQACodChtycF9oOkUtbFZrOTduNVpZZ1luYWZlcm5PZ3c%7C0d4NXw4EBz1%7C?hl=id","first time coba kesini, pelayanan oke, makanan not bad 4.5/5, aku suka banget sama dessertnya ga eneg pokonya enak recommend🫶🏻"
"Toean Watiman","https://www.google.com/maps/search/?api=1&query=Toean%20Watiman&query_place_id=ChIJk-7zsZ9Xei4RFWlj8oCWixs","5","Resa Anjani","https://www.google.com/maps/reviews/data=!4m8!14m7!1m6!2m5!1sCi9DQUlRQUNvZENodHljRjlvT21SQ1lURlhialZXUWtSbFJqWk1NVkZZWlRaWGJVRRAB!2m1!1s0x0:0x1b8b9680f2636915!3m1!1s2@1:CAIQACodChtycF9oOmRCYTFXbjVWQkRlRjZMMVFYZTZXbUE%7C0dGXGyJp1si%7C?hl=id","Makanannya enak banget nget nget  jujur sempet kesel karena baru tau, cuma tolong dong ac nya ya ampun kita makan sampe keringetan. 😌😌🙏🏻"
"Toean Watiman","https://www.google.com/maps/search/?api=1&query=Toean%20Watiman&query_place_id=ChIJk-7zsZ9Xei4RFWlj8oCWixs","5","Advian Citra Perdana","https://www.google.com/maps/reviews/data=!4m8!14m7!1m6!2m5!1sCi9DQUlRQUNvZENodHljRjlvT21OcloyeFNWMHh6UmxaSVRURkZVR2hMWTNsZmRrRRAB!2m1!1s0x0:0x1b8b9680f2636915!3m1!1s2@1:CAIQACodChtycF9oOmNrZ2xSV0xzRlZITTFFUGhLY3lfdkE%7C0cqJ-73HkdX%7C?hl=id","Variasi makanan sangat beragam, tinggal pilih, rasa lumayan enak, dibagian depan ada donat dan cheese cake, pembayaran untuk makanan dan minuman terpisah, parkir motor di depan, parkir mobil dibelakang lewat jalan samping, tempat nya nyaman dan artistik"
"Toean Watiman","https://www.google.com/maps/search/?api=1&query=Toean%20Watiman&query_place_id=ChIJk-7zsZ9Xei4RFWlj8oCWixs","5","Nadiya Nisrina","https://www.google.com/maps/reviews/data=!4m8!14m7!1m6!2m5!1sCi9DQUlRQUNvZENodHljRjlvT214dU4xcEdNRTFwVVd0cWNYYzRVMnRNUkd0TFYxRRAB!2m1!1s0x0:0x1b8b9680f2636915!3m1!1s2@1:CAIQACodChtycF9oOmxuN1pGME1pUWtqcXc4U2tMRGtLV1E%7C0cdRLKPhN8u%7C?hl=id","Makanannya enak, suasananya adem, deket kampus jadi lapak nugas sekaligus nongkrong yang bagus. suka sama menu makan beratnya dan satu tempat juga sama makanan dessert gitu. pelayanannya juga ramah dan tempat yang cukup bersih."
"Toean Watiman","https://www.google.com/maps/search/?api=1&query=Toean%20Watiman&query_place_id=ChIJk-7zsZ9Xei4RFWlj8oCWixs","5","YOLANDA AGNES PUTRI","https://www.google.com/maps/reviews/data=!4m8!14m7!1m6!2m5!1sCi9DQUlRQUNvZENodHljRjlvT21kMVV6UnFlSFZGYnpkZmJHbEVRVXAwWkhaR2JYYxAB!2m1!1s0x0:0x1b8b9680f2636915!3m1!1s2@1:CAIQACodChtycF9oOmd1UzRqeHVFbzdfbGlEQUp0ZHZGbXc%7C0ck2Yw2B4JX%7C?hl=id","Area dipinggir jalan dan akses terjangkau ✅
Area Parkir cukup luas ✅
Untuk makan di area smoking juga ada ✅
Banyak menu pilihan dari Lokal maupun Western ✅
Untuk rasa enak dengan presentasi yang indah ✅
Westafel dekat smoking area, bagian belakang mau ke dapur ✅

Paling suka melihat para waiter saat clear up tidak setengah, namun keseluruhan. Sampai memilah menaruh sampah clear up nya (Organik / an organik) 👏👍✅

Sedikit masukan :
""Untuk pintu antara area smoking ataupun non smoking dan bila sehabis cuci tangan. Gagang Besinya yang mau berkarat mungkin bisa diganti. Jadi, tidak sia2 kalau cuci tangan. Walau, pakai tangan kiri sekalipun. Atau bisa mungkin ada area westafel di depan atau area makan yang tidak jauh dan tidak perlu membuka pintu."" 📝✨

Terima Kasih dan Sukses Selalu
🙏👍✨"
"Toean Watiman","https://www.google.com/maps/search/?api=1&query=Toean%20Watiman&query_place_id=ChIJk-7zsZ9Xei4RFWlj8oCWixs","5","Lian","https://www.google.com/maps/reviews/data=!4m8!14m7!1m6!2m5!1sCi9DQUlRQUNvZENodHljRjlvT2pkRmNVVlJXVkZ4TURGRWVITnlZV0k1UkhkalFWRRAB!2m1!1s0x0:0x1b8b9680f2636915!3m1!1s2@1:CAIQACodChtycF9oOjdFcUVRWVFxMDFEeHNyYWI5RHdjQVE%7C0cyCs20ReQL%7C?hl=id","Resto di jalan Tamsis yang luas, nyaman, adem dan selalu ramai pengunjung..

Walaupun kondisi ramai tapi pelayanan cepat, mb n mas pelayan nya sigap dan ramah..

Variasi menu masakan dan minuman banyak pilihan nya, harga masih normal,makanan nya enak semua..

Parkiran luas ada di belakang resto."
"Toean Watiman","https://www.google.com/maps/search/?api=1&query=Toean%20Watiman&query_place_id=ChIJk-7zsZ9Xei4RFWlj8oCWixs","5","Meisy Putri","https://www.google.com/maps/reviews/data=!4m8!14m7!1m6!2m5!1sCi9DQUlRQUNvZENodHljRjlvT21OMlVFTkJOa3MzZW5sMVYzQllSR0ZvYVdzd1ZYYxAB!2m1!1s0x0:0x1b8b9680f2636915!3m1!1s2@1:CAIQACodChtycF9oOmN2UENBNks3enl1V3BYRGFoaWswVXc%7C0d0Y6U7SPRp%7C?hl=id","Pelayanannya ramah"", cekatan, murah senyum, informatif, tempatnya nyaman, bagus buat spot foto, makanannya enak, gk nunggu lama juga, banyak pilihan menu, harganya standard. Rekomended🫶"
"Toean Watiman","https://www.google.com/maps/search/?api=1&query=Toean%20Watiman&query_place_id=ChIJk-7zsZ9Xei4RFWlj8oCWixs","5","Lunetta Ezra","https://www.google.com/maps/reviews/data=!4m8!14m7!1m6!2m5!1sCi9DQUlRQUNvZENodHljRjlvT25wQ1dXcHhNbkpSZUdWSGEwbFFSbkpLZWpoWU9HYxAB!2m1!1s0x0:0x1b8b9680f2636915!3m1!1s2@1:CAIQACodChtycF9oOnpCWWpxMnJReGVHa0lQRnJKejhYOGc%7C0dDfQhM6Wt_%7C?hl=id","penasaran sama tempat ini dr dulu, Tempatnya luas dan terang, menunya banyak bgt lebih kyk western gitu, dari segi harga menurutku affordable sesuai dgn porsi makanan dan rasanya yaa. Cocok buat kalian yg pengen cari hotpot malem-malem. Parkir motor di depan dan mobil di belakang bangunan"
"Toean Watiman","https://www.google.com/maps/search/?api=1&query=Toean%20Watiman&query_place_id=ChIJk-7zsZ9Xei4RFWlj8oCWixs","5","A. Suci Rizky Ananda","https://www.google.com/maps/reviews/data=!4m8!14m7!1m6!2m5!1sCi9DQUlRQUNvZENodHljRjlvT2tkUFNFOUdSRzh5VWxVeE5tNTVOR2MyVlhCSVZrRRAB!2m1!1s0x0:0x1b8b9680f2636915!3m1!1s2@1:CAIQACodChtycF9oOkdPSE9GRG8yUlUxNm55NGc2VXBIVkE%7C0cVn_rEPNdz%7C?hl=id","Tempatnya nyaman dan luas. Dri luar kelihatan sempit ternyata lebih luas. Anak"" dapat balon gratis. Untuk makanannya maaf untuk nasi gorengnya agak keasinan (saya pesan nasi goreng kecombrang), untuk satenya enak. Kemudian ebi roll nya enak."
"Toean Watiman","https://www.google.com/maps/search/?api=1&query=Toean%20Watiman&query_place_id=ChIJk-7zsZ9Xei4RFWlj8oCWixs","5","Ulis Dawanti","https://www.google.com/maps/reviews/data=!4m8!14m7!1m6!2m5!1sCi9DQUlRQUNvZENodHljRjlvT2w5Q1ZGZE1WM0F4YVVveU4wTkRhWFpxTm5kVU1HYxAB!2m1!1s0x0:0x1b8b9680f2636915!3m1!1s2@1:CAIQACodChtycF9oOl9CVFdMV3AxaUoyN0NDaXZqNndUMGc%7C0cpCAN501Xx%7C?hl=id","Tempat makan cukup luas, ada indoor dengan ac dan outdoor. Sampai resto jam 11 siang, makanan menunggu cukup lama karena mungkin sudah jam makan siang.
Kondisi resto ramai.
Rasa salad sayurnya enak, untuk kentangnya pesan mashed potato tapi kosong dan diganti potato wedges, untuk saya pribadi yang kurang suka dengan potato wedges merasa kurang suka, tetapi untuk ayamnya enak dan satu porsi cukup mengenyangkan.
Tukang parkir sangat membantu."
"Toean Watiman","https://www.google.com/maps/search/?api=1&query=Toean%20Watiman&query_place_id=ChIJk-7zsZ9Xei4RFWlj8oCWixs","5","Rtu Pradnya","https://www.google.com/maps/reviews/data=!4m8!14m7!1m6!2m5!1sCi9DQUlRQUNvZENodHljRjlvT2s5c01XNDJVVXBFTURCZlVrMXdVVXR0UkhKT1VtYxAB!2m1!1s0x0:0x1b8b9680f2636915!3m1!1s2@1:CAIQACodChtycF9oOk9sMW42UUpEMDBfUk1wUUttRHJOUmc%7C0cQI15pvLrO%7C?hl=id","Makanannya porsinya buanyak dan ENAK BANGET! tentunya dengan harga yang masih terjangkau 🥰👍

Beli pizza free jus😁 tehnya juga enak tapi aku lupa ini teh apa... Nasi goreng sapi (aku juga lupa) ini juga enak, dagingnya empuk, bumbunya sampe kedalam dalam! Rasanya pengen nyobain semua menunya hahaha

Tempatnya juga luas, pelayannya juga ramah👍"
"Toean Watiman","https://www.google.com/maps/search/?api=1&query=Toean%20Watiman&query_place_id=ChIJk-7zsZ9Xei4RFWlj8oCWixs","5","Shelma Ghusa Primasti","https://www.google.com/maps/reviews/data=!4m8!14m7!1m6!2m5!1sCi9DQUlRQUNvZENodHljRjlvT201NFVGTmZiMGh3VEdwblVVMDNjekI0Vm5wUlExRRAB!2m1!1s0x0:0x1b8b9680f2636915!3m1!1s2@1:CAIQACodChtycF9oOm54UFNfb0hwTGpnUU03czB4VnpRQ1E%7C0caRcsZFgQV%7C?hl=id","Tongkrongan zaman kuliah dan baru ke sini lg tahun ini, selain tetep cozy, ternyata kualitas makanannya masih bagus dan lebih improve. Pelayanan juga baik, staffnya ramah dan gercep. Hari ini pesen toean satay, enak. Makanan nusantara but make it western. Dapet free es teh dan nasi putih🥰"
"Toean Watiman","https://www.google.com/maps/search/?api=1&query=Toean%20Watiman&query_place_id=ChIJk-7zsZ9Xei4RFWlj8oCWixs","5","Karlina Adyaswari","https://www.google.com/maps/reviews/data=!4m8!14m7!1m6!2m5!1sChZDSUhNMG9nS0VJQ0FnTURveHIzMGJBEAE!2m1!1s0x0:0x1b8b9680f2636915!3m1!1s2@1:CIHM0ogKEICAgMDoxr30bA%7CCgwIz4WowAYQgKCeoQM%7C?hl=id","First time nyobain birthday dinner di Toean Watiman Tamsis sama keluarga. Sebelumnya pernah mau bukber disini tapi tidak jadi karena penuh ketika reservasi. Ternyata untuk parkiran mobil dibelakang, parkir depan hanya untuk motor. Tempatnya jadi satu dengan Dopio donut, tapi karena parkir dibelakang jadinya masuk lewat pintu belakang.

Sudah booking dan pesan menu via WA, jadi ketika datang tidak menunggu terlalu lama walaupun pesanan keluar lebih dari jam yang ditulis pas reservasi. Agak shock dikit karena pas liet wow porsiannya banyak bagi keluarga kami.

Yang pertama datang premium australian meltique beef steak (well done), wow walaupun ini di menu ditulis new menu tapi enak banget! Bener-bener worth the price! Kemudian menu yang lain datang dan wow juga enak semua! Cheezy cordonbleu nya terbilang gede porsinya belum lagi sama ada mashed potatonya, saking porsinya buat kami gede jadi butuh waktu lama buat habisin. Grill chicken mushroomnya juicy, dagingnya gak alot tapi kulitnya tebel. Mie goreng ayamnya smooky, mie kuning kecil gitu. Fried chicken steak dan chicken  cheese melted mirip-mirip, ayamnya ditepung crispy keriting gitu. Dressing salad kurang kerasa, mungkin ada baiknya ditambah untuk dressingnya. Untuk minumannya nothing special.

Untuk pelayanan sangat baik, sempat lama fried chcken steaknya, setelah ditanyakan baru keluar. Ntah kelupaan atau gimana. Untuk menunya sangat banyak dan variatif, walaupun macem-macem menunya tapi dari yang kami pesan semua enak. Harga masih masuk akal, kalaupun dianggap mahal tapi rasanya sebanding dengan harga.

Harga belum termasuk pajak 10% dan ada service charge sekitar 5% (tidak dicantumkan berapa persennya dinota). Kami sekeluarga akan balik lagi untuk mencoba menu yang lain, karena first impresion dinner disini sangat berkesan bagi kami. Terima kasih, semoga makin sukses."
"Toean Watiman","https://www.google.com/maps/search/?api=1&query=Toean%20Watiman&query_place_id=ChIJk-7zsZ9Xei4RFWlj8oCWixs","5","Firman Fin","https://www.google.com/maps/reviews/data=!4m8!14m7!1m6!2m5!1sCi9DQUlRQUNvZENodHljRjlvT2xSaFFVWXpjMFoxZHpCdlowSjZURzFrY1RONVpIYxAB!2m1!1s0x0:0x1b8b9680f2636915!3m1!1s2@1:CAIQACodChtycF9oOlRhQUYzc0Z1dzBvZ0J6TG1kcTN5ZHc%7C0cOn7I3yYh4%7C?hl=id","Selalu suka dengan menu menu yang ada di restoran ini, semua menu yang kami pesan enak, harga sesuai dengan porsi yang kita dapat..

Kalau jam makan malam pasti rame banget, jadi kalau mau makan disini dengan suasana yang ga begitu rame mungkin kita bisa makan siang aja kesininya..

Porsinya lumayan besar untuk bakmi jawanya, bisa untuk 2 orang..

Oiya, ramennya juga enak banget gaes..

Yuk gaass.."
"Toean Watiman","https://www.google.com/maps/search/?api=1&query=Toean%20Watiman&query_place_id=ChIJk-7zsZ9Xei4RFWlj8oCWixs","5","Risma","https://www.google.com/maps/reviews/data=!4m8!14m7!1m6!2m5!1sCi9DQUlRQUNvZENodHljRjlvT2poZlpuazJNMDlFWlRkRWFrMWpSVXRyTTA4elltYxAB!2m1!1s0x0:0x1b8b9680f2636915!3m1!1s2@1:CAIQACodChtycF9oOjhfZnk2M09EZTdEak1jRUtrM08zYmc%7C0cnpPIPXm-X%7C?hl=id","Makanannya enak, porsinya banyak sangat worth it dengan harganya. Pelayanan juga bagus ramah, minta password wifi dikasih sama mbaknya. Best dehh sangat recommended 👍🏻"
"Toean Watiman","https://www.google.com/maps/search/?api=1&query=Toean%20Watiman&query_place_id=ChIJk-7zsZ9Xei4RFWlj8oCWixs","5","Tiwik Puji","https://www.google.com/maps/reviews/data=!4m8!14m7!1m6!2m5!1sCi9DQUlRQUNvZENodHljRjlvT21wdk1GRmFUbmcyY20xdVUwMUNlVGxoZDFaaVZtYxAB!2m1!1s0x0:0x1b8b9680f2636915!3m1!1s2@1:CAIQACodChtycF9oOmpvMFFaTng2cm1uU01CeTlhd1ZiVmc%7C0crac8PWX4o%7C?hl=id","Worth it harga nya cukup ramah di kantong, suasana full ramai namun nyaman,untuk minumannya dibayar terpisah ya man teman, parkir bisa di belakang lumayan luas"
"Toean Watiman","https://www.google.com/maps/search/?api=1&query=Toean%20Watiman&query_place_id=ChIJk-7zsZ9Xei4RFWlj8oCWixs","5","aglin zalsabilla anwar","https://www.google.com/maps/reviews/data=!4m8!14m7!1m6!2m5!1sCi9DQUlRQUNvZENodHljRjlvT2paM2VVWktUbHBRY0UxbFoybG1ZVTU0ZEd0R05IYxAB!2m1!1s0x0:0x1b8b9680f2636915!3m1!1s2@1:CAIQACodChtycF9oOjZ3eUZKTlpQcE1lZ2lmYU54dGtGNHc%7C0cRjumnRTpC%7C?hl=id","Sudah tiga kali ke sini, pelayanan ramah banget, makanannya juga enak², suasananya tenang dan nyaman. Kemarin rayain birthday di sini jugaa. Terima kasih banyak kakk."
"Toean Watiman","https://www.google.com/maps/search/?api=1&query=Toean%20Watiman&query_place_id=ChIJk-7zsZ9Xei4RFWlj8oCWixs","5","Della Aisyah Amalia","https://www.google.com/maps/reviews/data=!4m8!14m7!1m6!2m5!1sCi9DQUlRQUNvZENodHljRjlvT210aVlsaDFXRkJEUm5aVkxWa3RaMjgxVW10NmNWRRAB!2m1!1s0x0:0x1b8b9680f2636915!3m1!1s2@1:CAIQACodChtycF9oOmtiYlh1WFBDRnZVLVktZ281Umt6cVE%7C0d-XGNnF9e5%7C?hl=id","Staffnya ramah dan membantu mencarikan meja kosong, pelayanannya lumayan cepet, beef teriyaki nya lumayan asin🫠 black paper nya oke sih, chocolate milk nya standar sesuai dengan harga"
"Toean Watiman","https://www.google.com/maps/search/?api=1&query=Toean%20Watiman&query_place_id=ChIJk-7zsZ9Xei4RFWlj8oCWixs","5","Andrey Chilkid","https://www.google.com/maps/reviews/data=!4m8!14m7!1m6!2m5!1sCi9DQUlRQUNvZENodHljRjlvT2xKclRUa3diRFY1YUhkNGVtVndZVXhZV2pOdlVuYxAB!2m1!1s0x0:0x1b8b9680f2636915!3m1!1s2@1:CAIQACodChtycF9oOlJrTTkwbDV5aHd4emVwYUxYWjNvUnc%7C0d0pS7MngsJ%7C?hl=id","Makanan enak, harga standar, tempat lumayan nyaman meskipun crowded masih oke lah buat family time atau sekedar berbincang bersama kawan"
"Toean Watiman","https://www.google.com/maps/search/?api=1&query=Toean%20Watiman&query_place_id=ChIJk-7zsZ9Xei4RFWlj8oCWixs","5","Melu Lemu","https://www.google.com/maps/reviews/data=!4m8!14m7!1m6!2m5!1sCi9DQUlRQUNvZENodHljRjlvT25Sc2FEUkdjbE5FZVU0M2VIcEtYMmgxWmtWM1pXYxAB!2m1!1s0x0:0x1b8b9680f2636915!3m1!1s2@1:CAIQACodChtycF9oOnRsaDRGclNEeU43eHpKX2h1ZkV3ZWc%7C0dHAS3LJCWj%7C?hl=id","Lagi ke Jogja.? Wajib mampir disini.. pelayanan super baguuuss banget. Enak terjangkau mengenyangkan. Cobain yaa"
"Toean Watiman","https://www.google.com/maps/search/?api=1&query=Toean%20Watiman&query_place_id=ChIJk-7zsZ9Xei4RFWlj8oCWixs","5","Wikry Erlinda","https://www.google.com/maps/reviews/data=!4m8!14m7!1m6!2m5!1sCi9DQUlRQUNvZENodHljRjlvT2t4MWVUWlZiMDlWU2xZMmNHRldiMnhyU0c5eU9VRRAB!2m1!1s0x0:0x1b8b9680f2636915!3m1!1s2@1:CAIQACodChtycF9oOkx1eTZVb09VSlY2cGFWb2xrSG9yOUE%7C0d-aQxBH-V8%7C?hl=id","pas kesini menu yg dicari lagi kosong, alhasil ngasal beli nasgor kecombrang. ternyata enakkkkqqwhhhh.
kyny ini 2 resto jdi satu yahhhh..."
"Toean Watiman","https://www.google.com/maps/search/?api=1&query=Toean%20Watiman&query_place_id=ChIJk-7zsZ9Xei4RFWlj8oCWixs","5","Hai Chan","https://www.google.com/maps/reviews/data=!4m8!14m7!1m6!2m5!1sCi9DQUlRQUNvZENodHljRjlvT21WYVZYSkxYMjR5Wm5GMVYwTmhjVVY1WDNkRmEzYxAB!2m1!1s0x0:0x1b8b9680f2636915!3m1!1s2@1:CAIQACodChtycF9oOmVaVXJLX24yZnF1V0NhcUV5X3dFa3c%7C0ch_tUo8JY7%7C?hl=id","Akhirnya coba dateng langsung ke Toean Watiman. Dari makanannya enak, murah, dan platingnya sesuai gambar😍 tapi ada beberapa makanan yang rasanya dominan asin
Pelayannya juga ramah-ramah semua dan makanan cepat jadi😍
Untuk suasananya juga nyaman banget, ramah buat lansia, kursinya juga kuat-kuat, dan sangat cocok buat makan bersama keluarga🩷✨️"
"Toean Watiman","https://www.google.com/maps/search/?api=1&query=Toean%20Watiman&query_place_id=ChIJk-7zsZ9Xei4RFWlj8oCWixs","5","Lucia Dhinta","https://www.google.com/maps/reviews/data=!4m8!14m7!1m6!2m5!1sCi9DQUlRQUNvZENodHljRjlvT213dE1IQjBWa1ZyZGs1SmNIQktVV3hWUmpVNVlYYxAB!2m1!1s0x0:0x1b8b9680f2636915!3m1!1s2@1:CAIQACodChtycF9oOmwtMHB0VkVrdk5JcHBKUWxVRjU5YXc%7C0cYrB7-u18i%7C?hl=id","Tempat makannya cocok untuk keluarga, rekan kerja, sahabat/pasangan. Menu makanan dan minumannya sangat beragam, kolaborasi dengan Dopio jadi cocok untuk mahasiswa/pekerja yang mau ngerjain tugas. Tempat parkir roda 4 terbatas, dan roda 2 sangat cukup. Harga menu makanannya sangat ekonomis, rasa setiap makanan dan minuman sangat enak sekali.  Pelayanannya sangat baik dan ramah. Tempat disetiap ruangan semuanya terjaga kebersihannya. Dilarang untuk bawa makanan/minuman dari luar yaa."
"Toean Watiman","https://www.google.com/maps/search/?api=1&query=Toean%20Watiman&query_place_id=ChIJk-7zsZ9Xei4RFWlj8oCWixs","5","umi nurrosidah","https://www.google.com/maps/reviews/data=!4m8!14m7!1m6!2m5!1sCi9DQUlRQUNvZENodHljRjlvT2xCck5XeHBiM2xsYVVWTVJHRndWak5HY1hKUlVXYxAB!2m1!1s0x0:0x1b8b9680f2636915!3m1!1s2@1:CAIQACodChtycF9oOlBrNWxpb3llaUVMRGFwVjNGcXJRUWc%7C0cYkGGTDvGt%7C?hl=id","Ramai banget. Menu bervariasi. Dari yang ndeso. Modern. Western. Ready. Banyak tempat kursi. Tapi memang kalau ramai harus sabar menunggu. sambil menunggu, ada menu dessert. Dari donat dopio sampai Thai tea."
"Toean Watiman","https://www.google.com/maps/search/?api=1&query=Toean%20Watiman&query_place_id=ChIJk-7zsZ9Xei4RFWlj8oCWixs","5","istyawan priyahapsara","https://www.google.com/maps/reviews/data=!4m8!14m7!1m6!2m5!1sCi9DQUlRQUNvZENodHljRjlvT2kxaVdFbDRjSGN6UkVzdE9HZHRWa2d5UWpSbFQyYxAB!2m1!1s0x0:0x1b8b9680f2636915!3m1!1s2@1:CAIQACodChtycF9oOi1iWEl4cHczREstOGdtVkgyQjRlT2c%7C0dEbCh8p3jw%7C?hl=id","Toean Satay Nusantara is an excellent choice. Bumbu merahnya meliputi daging yang melimpah. Worth every penny. Dengan side diah kentang goreng dan salad sayur melengkapi"
"Toean Watiman","https://www.google.com/maps/search/?api=1&query=Toean%20Watiman&query_place_id=ChIJk-7zsZ9Xei4RFWlj8oCWixs","5","audii cacaa","https://www.google.com/maps/reviews/data=!4m8!14m7!1m6!2m5!1sCi9DQUlRQUNvZENodHljRjlvT2xWMmFWWkhhMTlDTTJsR1JtSmhTVUpYTjJrNFdXYxAB!2m1!1s0x0:0x1b8b9680f2636915!3m1!1s2@1:CAIQACodChtycF9oOlV2aVZHa19CM2lGRmJhSUJXN2k4WWc%7C0dDiVvU7dKY%7C?hl=id","gapernah skip cheese shoft crepes nya klo ke watiman, plss ka jangan hapus menu ini yaa senagihh ituuu😭😭 makanan yang lainn juga enakk, kakak2 nya ramahhh. sukaaak❤️💐"
