"title","url","stars","name","reviewUrl","text"
"Toean Watiman","https://www.google.com/maps/search/?api=1&query=Toean%20Watiman&query_place_id=ChIJk-7zsZ9Xei4RFWlj8oCWixs","4","Rahadinda Mutiara","https://www.google.com/maps/reviews/data=!4m8!14m7!1m6!2m5!1sChZDSUhNMG9nS0VJQ0FnSURyMk1XWlVBEAE!2m1!1s0x0:0x1b8b9680f2636915!3m1!1s2@1:CIHM0ogKEICAgIDr2MWZUA%7CCgsIgq_OtAYQ2NfgBg%7C?hl=id","Sebelumnya maaf ya watiman🙏🏼 dr rasa ya standar yaa, tempat jg ok kok enak. Tp lama bgt nunggunya demi 2 makanan ini nunggu sejam hikz dr laper sampe ga pengen makan🥲 mungkin emg kitchennya chaos atau orangnya terbatas tp dr awal kalo emg lg chaos boleh diinfoin ke pelanggan ngga sih biar kitanya jg ga suudzon dan bs ngira2:( apa kitanya yg kurang inisiatif buat tanya estimasi pelayanan hehe. Semuanya ok, udh langganan dr 2017/2018 tp emg dua kali terakhir kesini lama bgt pelayanannya tp yg sblmnya ga selama yg hari ini:( klo lg laper pikir2 lg kesini biar ga badmood nunggu makanan hehe.
Bonus bbrp makanan yg sempet kefoto pas kesini bbrp tahun terakhir😇"
"Toean Watiman","https://www.google.com/maps/search/?api=1&query=Toean%20Watiman&query_place_id=ChIJk-7zsZ9Xei4RFWlj8oCWixs","4","Lucia Winda Dibta Ardiyani","https://www.google.com/maps/reviews/data=!4m8!14m7!1m6!2m5!1sChdDSUhNMG9nS0VJQ0FnSUQ5cWFfRGhRRRAB!2m1!1s0x0:0x1b8b9680f2636915!3m1!1s2@1:CIHM0ogKEICAgID9qa_DhQE%7CCgsImtfgrwYQqM6ZWA%7C?hl=id","Kemarin kesini kebetulan pesan paket buka puasa untuk rasa makanan menurutku biasa aja mungkin bisa ditingkatkan lagi untuk rasanya, kalau pelayanannya baik gercep dan ramah, mungkin next time kesini lagi cobain menu regulernya"
"Toean Watiman","https://www.google.com/maps/search/?api=1&query=Toean%20Watiman&query_place_id=ChIJk-7zsZ9Xei4RFWlj8oCWixs","4","Cushy Bitey","https://www.google.com/maps/reviews/data=!4m8!14m7!1m6!2m5!1sChdDSUhNMG9nS0VJQ0FnSUN2eklIWHBRRRAB!2m1!1s0x0:0x1b8b9680f2636915!3m1!1s2@1:CIHM0ogKEICAgICvzIHXpQE%7CCgwI0I3XugYQ8KG2ngM%7C?hl=id","Untuk rasa, B aja sih, untuk harga murah, makanan banyak menu nya, tapi sayang tidak menjalankan FIFO, jamu basi untung segera lapor dan diganti Compliment, Rasa minumnya To Much ngga balance and refresh"
"Toean Watiman","https://www.google.com/maps/search/?api=1&query=Toean%20Watiman&query_place_id=ChIJk-7zsZ9Xei4RFWlj8oCWixs","4","Nur Pancha Putra Batubara","https://www.google.com/maps/reviews/data=!4m8!14m7!1m6!2m5!1sChZDSUhNMG9nS0VJQ0FnSUNLbXNYSUx3EAE!2m1!1s0x0:0x1b8b9680f2636915!3m1!1s2@1:CIHM0ogKEICAgICKmsXILw%7CCgwIgfiagwYQyNfsoAE%7C?hl=id","SPOT MAKAN HOTPLATE CUMA Rp18.000

Baru pertama kesini, ternyata tempatnya cukup luas & nyaman. Cocok banget untuk bareng keluarga dan harga cukup terjangkau, parkir luas fasilitas mushola, wifi lumayan.

Lagi ada PROMO
- Chicken original watiman steak Rp18.430
- Chicken crispy sunny steak Rp18.430
- Aneka boba cuma Rp15.000

Pembelian  minimal 100rb,200rb dan 300rb mendapatkan voucher :
- 100rb : nasgor ayam
- 200rb : steamboat soup
- 300rb : Hamburg Steak

Ada PROMO TAKEAWAY DISKON 25% !!!"
"Toean Watiman","https://www.google.com/maps/search/?api=1&query=Toean%20Watiman&query_place_id=ChIJk-7zsZ9Xei4RFWlj8oCWixs","4","Anna Wulandari","https://www.google.com/maps/reviews/data=!4m8!14m7!1m6!2m5!1sChdDSUhNMG9nS0VJQ0FnSURycHJXZDV3RRAB!2m1!1s0x0:0x1b8b9680f2636915!3m1!1s2@1:CIHM0ogKEICAgIDrprWd5wE%7CCgwIkd_dtAYQ-Pb1-QE%7C?hl=id","Kalau kesini jangan pas lapar bgt atau jam makan siang karena nunggu sampai 40menit, tapi kita diberitahu sama pegawainya kalau menunggu 40menit..

Makanan worth to try.. Tidak terlalu mahal"
"Toean Watiman","https://www.google.com/maps/search/?api=1&query=Toean%20Watiman&query_place_id=ChIJk-7zsZ9Xei4RFWlj8oCWixs","4","Tretya A","https://www.google.com/maps/reviews/data=!4m8!14m7!1m6!2m5!1sChZDSUhNMG9nS0VJQ0FnSUMxcllTN09BEAE!2m1!1s0x0:0x1b8b9680f2636915!3m1!1s2@1:CIHM0ogKEICAgIC1rYS7OA%7CCgwI0-TPrAYQ-PnJtAE%7C?hl=id","Kalau mau cari tempat untuk kumpul-kumpul bareng temen agak cocok ya, tempatnya luas. Interior juga menarik. Tapi, kurang sesuai untuk wfc karena plug nya di bawah kursi dan jauh dari meja.
Porsi dan harga makanan/minuman sebanding. Rasa makanan standar."
"Toean Watiman","https://www.google.com/maps/search/?api=1&query=Toean%20Watiman&query_place_id=ChIJk-7zsZ9Xei4RFWlj8oCWixs","4","Lila Nafisha","https://www.google.com/maps/reviews/data=!4m8!14m7!1m6!2m5!1sChdDSUhNMG9nS0VJQ0FnSURmN0tERXp3RRAB!2m1!1s0x0:0x1b8b9680f2636915!3m1!1s2@1:CIHM0ogKEICAgIDf7KDEzwE%7CCgwI5PDkuwYQuIPSzQM%7C?hl=id","Tempatnya cocok untuk rapat, diskusi, dan kumpul bersama keluarga. Karena jadi satu sama Dopio Donut, varian menunya jadi banyak sekali. Sampai bingung mau pesan apa aja, hehehe. Harganya menurut saya cukup pas untuk porsi menu yang mengenyangkan perut. Banyak kursi juga jadi pengunjung bisa milih mau dimana aja."
"Toean Watiman","https://www.google.com/maps/search/?api=1&query=Toean%20Watiman&query_place_id=ChIJk-7zsZ9Xei4RFWlj8oCWixs","4","Ivania Citra","https://www.google.com/maps/reviews/data=!4m8!14m7!1m6!2m5!1sChRDSUhNMG9nS0VJQ0FnSUNSay1wcxAB!2m1!1s0x0:0x1b8b9680f2636915!3m1!1s2@1:CIHM0ogKEICAgICRk-ps%7CCgsI3vnMoQYQ4JeHPQ%7C?hl=id","2x makan disini karna buka bersama. Pengalaman 1 order menu bukber kaya ala2 steak gitu dan agak zonk karna tepungnya keras bgt trs makanannya gaada rasanya sama sekali, rate 3/5. Pengalaman ke 2 order menu yg bukan menu bukber, lumayan enak rate 4/5 lah walaupun makanannya dingin karna ready dan disajikannya sblm jam 5 sore🤣
Utk tempatnya bersih dan nyaman, kamar mandi bersih. Musholanya lumayan kecil ya, klo pas bukber gini jd ngantree panjang huahahaha. Utk harganya standar lah, ga mahal2 bgt. Semoga ada peningkatan rasa utk makanannya yah"
"Toean Watiman","https://www.google.com/maps/search/?api=1&query=Toean%20Watiman&query_place_id=ChIJk-7zsZ9Xei4RFWlj8oCWixs","4","Sa Dian","https://www.google.com/maps/reviews/data=!4m8!14m7!1m6!2m5!1sChdDSUhNMG9nS0VJQ0FnSUM5a2NXVHR3RRAB!2m1!1s0x0:0x1b8b9680f2636915!3m1!1s2@1:CIHM0ogKEICAgIC9kcWTtwE%7CCgwI3_ehrwYQqIKF8gE%7C?hl=id","Menunya banyak banget. Harganya termasuk murah untuk sebuah resto. Porsi makanan dan rasanya enak. Udah 3x makan disini. Kemarin saya order nasi hainan dan basil ricenya, ayamnya enak, tapi sayang banget. Nasi hainan sama basil ricenya terlalu berminyak, kaya makan nasi sama minyak. Jadi eneg.

Masukan untuk restonya, nasi hainan dan sejenisnya tolong diperbaiki lagi cara masaknya, biar ga terlalu berminyak.

Terakhir, puas banget sama pelayanannya. Pelayanannya sangat baik dan ramah."
"Toean Watiman","https://www.google.com/maps/search/?api=1&query=Toean%20Watiman&query_place_id=ChIJk-7zsZ9Xei4RFWlj8oCWixs","4","Lutsfi s","https://www.google.com/maps/reviews/data=!4m8!14m7!1m6!2m5!1sChdDSUhNMG9nS0VJQ0FnSUN6Z2ViQWt3RRAB!2m1!1s0x0:0x1b8b9680f2636915!3m1!1s2@1:CIHM0ogKEICAgICzgebAkwE%7CCgwI7OzxsgYQuMqgwAE%7C?hl=id","Salah satu tempat makan atau sekedar nongkrong yang rekomended. Bisa bersama teman atau keluarga Anda.
Menunya cukup variatif dan enak.
Lokasi nya dipinggir jalan sehingga mudah dijangkau. Berada di jalam taman siswa jogja
Makanannya juga enak, tersedia juga wifi bagi yg mau nongkrong.
Cobalah sendiri datang kesini"
"Toean Watiman","https://www.google.com/maps/search/?api=1&query=Toean%20Watiman&query_place_id=ChIJk-7zsZ9Xei4RFWlj8oCWixs","4","Setri Wulan","https://www.google.com/maps/reviews/data=!4m8!14m7!1m6!2m5!1sChdDSUhNMG9nS0VJQ0FnTUNZNE9HMzBRRRAB!2m1!1s0x0:0x1b8b9680f2636915!3m1!1s2@1:CIHM0ogKEICAgMCY4OG30QE%7CCgwI-ozHwAYQ-IjyogI%7C?hl=id","Pilihan makanan banyak, harga standar, es teh nya enak rasanya. Pelayanan lumayan cepat. Ada mushola, kamar mandi 2, tempat parkir berbayar"
"Toean Watiman","https://www.google.com/maps/search/?api=1&query=Toean%20Watiman&query_place_id=ChIJk-7zsZ9Xei4RFWlj8oCWixs","4","Tiara Sukma","https://www.google.com/maps/reviews/data=!4m8!14m7!1m6!2m5!1sChZDSUhNMG9nS0VJQ0FnTUN3b05iZkp3EAE!2m1!1s0x0:0x1b8b9680f2636915!3m1!1s2@1:CIHM0ogKEICAgMCwoNbfJw%7CCgwIk_DXvgYQ4NCf_AI%7C?hl=id","Tersedia banyak varian menu yang bisa dipilih, tapi untuk reservasi buka bersama hanya dapat memilih dari beberapa menu paket yang tersedia. Waktu kesini pesen chicken mushroom, bumbu agak kurang meresap dan untuk sauce mushroomnya kurang berasa, tapi garden saladnya enak banget."
"Toean Watiman","https://www.google.com/maps/search/?api=1&query=Toean%20Watiman&query_place_id=ChIJk-7zsZ9Xei4RFWlj8oCWixs","4","Dhini Nabilla","https://www.google.com/maps/reviews/data=!4m8!14m7!1m6!2m5!1sChZDSUhNMG9nS0VJQ0FnSUNnLXVycUlBEAE!2m1!1s0x0:0x1b8b9680f2636915!3m1!1s2@1:CIHM0ogKEICAgICg-urqIA%7CCgwI4Mfj2QUQwPjTygE%7C?hl=id","Lokasinya gampang banget di cari, parkir luas di belakang gaes. Kopinya biasa aja, belum nemu feel yg pas. Steak enak, tp konsistensi tingkat kematangan agak kurang pas dikiiitttt, minta medium, yg datang medium well, warna pink di dalam hampir ngga ada, ehehehe.... Tp enak banget rasanya, sausnya juga juara. Suasanya juga instagramable buat yg doyan poto2, yg sekedar nongkrong juga aseekkk banget dah, bakal lupa waktu kalau udah di sono. Makanan yg lain belom nyoba gaes... Over all yg aku pesen 4,5/5 😁😁😁😁"
"Toean Watiman","https://www.google.com/maps/search/?api=1&query=Toean%20Watiman&query_place_id=ChIJk-7zsZ9Xei4RFWlj8oCWixs","4","Om Bob Official (om Bob)","https://www.google.com/maps/reviews/data=!4m8!14m7!1m6!2m5!1sChdDSUhNMG9nS0VJQ0FnSUNqdHYyMXNRRRAB!2m1!1s0x0:0x1b8b9680f2636915!3m1!1s2@1:CIHM0ogKEICAgICjtv21sQE%7CCgwIkuWTsQYQ4K3h2QM%7C?hl=id","Lokasi di taman siswa, Harganya termasuk murah untuk sebuah resto. Ada donut juga ...Porsi makanan dan rasanya cukup enak.  Cm untuk nasi gorengnya kurang nendang ..Cm memang entah mengapa 1 jam baru keluar pesanannya.. dan sepertinya  urutannya perlu di perbaiki karena yg belakang datang malah sudah keluar menunya...."
"Toean Watiman","https://www.google.com/maps/search/?api=1&query=Toean%20Watiman&query_place_id=ChIJk-7zsZ9Xei4RFWlj8oCWixs","4","Abdul Aziz","https://www.google.com/maps/reviews/data=!4m8!14m7!1m6!2m5!1sChdDSUhNMG9nS0VJQ0FnSUMtdmZMMnZBRRAB!2m1!1s0x0:0x1b8b9680f2636915!3m1!1s2@1:CIHM0ogKEICAgIC-vfL2vAE%7CCgsI99K4mwYQqLuLQw%7C?hl=id","Cafe harga terjangkau untuk acara keluarga. Pesen ricebowl, dapet ayam & nugget. Porsi nasinya banyak, saosnya enak & tidak terlalu spicy. Untuk steak ayam, tepungnya terlalu banyak jadi udah kenyang makan tepung duluan. Lasagna yang paling worth it, kejunya tidak pelit, daging juga banyak, porsi cukup bikin kenyang.
Pelayanan sangat ramah dan membantu."
"Toean Watiman","https://www.google.com/maps/search/?api=1&query=Toean%20Watiman&query_place_id=ChIJk-7zsZ9Xei4RFWlj8oCWixs","4","Titaa Hadid","https://www.google.com/maps/reviews/data=!4m8!14m7!1m6!2m5!1sChdDSUhNMG9nS0VJQ0FnSUNUdHBYN3dBRRAB!2m1!1s0x0:0x1b8b9680f2636915!3m1!1s2@1:CIHM0ogKEICAgICTtpX7wAE%7CCgwIl_iNsgYQ0JCWtQM%7C?hl=id","Tempatnya bagus, dingin juga, tempatnya juga banyak
Menu nya bervariasi
Pelayanannya bagus petugasnya ramah
Makanannya tomyam oke tapi kurang asam
Untuk chicken teriyaki bowl nya dingin, sampe ke gorengannya, saran saja seenggaknya hangat sedikit bisa dikasih ke microwave, atau goreng sebentar gorengan nya atau nasi yg hangat
Bisa Qris
Ada tukang parkir"
"Toean Watiman","https://www.google.com/maps/search/?api=1&query=Toean%20Watiman&query_place_id=ChIJk-7zsZ9Xei4RFWlj8oCWixs","4","Dini Yasa Istiqomah","https://www.google.com/maps/reviews/data=!4m8!14m7!1m6!2m5!1sChZDSUhNMG9nS0VJQ0FnSUNCMnJxdll3EAE!2m1!1s0x0:0x1b8b9680f2636915!3m1!1s2@1:CIHM0ogKEICAgICB2rqvYw%7CCgwIwMaTnQYQ2N_iswM%7C?hl=id","Restoran keluarga yg menyajikan makanan perporsi dgn harga yg cukup terjangkau. Untuk rasa makanannya kurang berasa bumbunya. Rasa spagheti carbonaranya hambar, lasagna lapisan pastanya tidak berasa.

Pelayannya cukup ramah, namun sering salah mengantar makanan.

Suasanya seprti cafe dan sepertinya banyak mahasiswa yg makan di sini. Parkirannya masuk kedalam gang dan utk masuknya dipintu belakang restoran."
"Toean Watiman","https://www.google.com/maps/search/?api=1&query=Toean%20Watiman&query_place_id=ChIJk-7zsZ9Xei4RFWlj8oCWixs","4","yuni astuti","https://www.google.com/maps/reviews/data=!4m8!14m7!1m6!2m5!1sCi9DQUlRQUNvZENodHljRjlvT25CNFQyRkxYMkZrVldoak4xUXhVbFI0Y2xaVGRHYxAB!2m1!1s0x0:0x1b8b9680f2636915!3m1!1s2@1:CAIQACodChtycF9oOnB4T2FLX2FkVWhjN1QxUlR4clZTdGc%7C0cytzatxbWI%7C?hl=id","Pesan beef stroganof rasanya enak, untuk crispy skin sedikit terlalu keras menurut kami, lalu Ruangan non smokingnya kurang dingin. Pelayanan dari staf baik"
"Toean Watiman","https://www.google.com/maps/search/?api=1&query=Toean%20Watiman&query_place_id=ChIJk-7zsZ9Xei4RFWlj8oCWixs","4","Kessa yuananda sinulingga","https://www.google.com/maps/reviews/data=!4m8!14m7!1m6!2m5!1sChdDSUhNMG9nS0VJQ0FnSURkdWRmb2hBRRAB!2m1!1s0x0:0x1b8b9680f2636915!3m1!1s2@1:CIHM0ogKEICAgIDdudfohAE%7CCgwIguflvgYQ8IaC4gE%7C?hl=id","Grill chicken mushroom tapi ga ada mushroom'nya?? Cukup byk yg ajak anak krna menunya jg menu ramah anak, syg restonya tdk ramah anak (tdk ada spot anak) . Kalau makanan sih enak, ramennya enak banget, hampir semua enak, minuman jg enak kecuali jahe sereh. Pernah pesen es teh manis tp ga manis, trs diganti yg baru...bagus bgt."
"Toean Watiman","https://www.google.com/maps/search/?api=1&query=Toean%20Watiman&query_place_id=ChIJk-7zsZ9Xei4RFWlj8oCWixs","4","Yoomand - Channel","https://www.google.com/maps/reviews/data=!4m8!14m7!1m6!2m5!1sChdDSUhNMG9nS0VJQ0FnSURYczRlQXZRRRAB!2m1!1s0x0:0x1b8b9680f2636915!3m1!1s2@1:CIHM0ogKEICAgIDXs4eAvQE%7CCgwIyqGLuQYQuJ7X9QI%7C?hl=id","beberapa kali ksini makananya tdk terllu zonk, nasgornya enak gurih dan dagingnya lembut, pizzanya jg enak dan kejunya lumerr
suasannya jg bagus,
tapi ada tukang parkirnya"
"Toean Watiman","https://www.google.com/maps/search/?api=1&query=Toean%20Watiman&query_place_id=ChIJk-7zsZ9Xei4RFWlj8oCWixs","4","CitRaa AR","https://www.google.com/maps/reviews/data=!4m8!14m7!1m6!2m5!1sChZDSUhNMG9nS0VJQ0FnSUNxdU1TQ0xBEAE!2m1!1s0x0:0x1b8b9680f2636915!3m1!1s2@1:CIHM0ogKEICAgICquMSCLA%7CCgwIpJW5hQYQwOav2AE%7C?hl=id","MushoLanya maa syaa Allah keren bgt..khusus utk wudhu akhwat disediakan rak sepatu plus bangku duduk ddlm. Tempat luas, nyaman.. Harga makanan relatif murah, enakk..soup steam bot sama agiteri crispy sambal bawang nya enakk.. Nasgitel'nya jg top bgt.. Wajib mampir kalo lagi di seputaran Jl.TamSis.."
"Toean Watiman","https://www.google.com/maps/search/?api=1&query=Toean%20Watiman&query_place_id=ChIJk-7zsZ9Xei4RFWlj8oCWixs","4","M. Huda","https://www.google.com/maps/reviews/data=!4m8!14m7!1m6!2m5!1sChdDSUhNMG9nS0VJQ0FnSURKbTQzT3JnRRAB!2m1!1s0x0:0x1b8b9680f2636915!3m1!1s2@1:CIHM0ogKEICAgIDJm43OrgE%7CCgwI5ob0pQYQ2MOohAM%7C?hl=id","Makanan enak, harga standar. Sayang request makanan pedas, yg dateng ga pedas sama sekali. Untuk parkir mobil di belakang resto."
"Toean Watiman","https://www.google.com/maps/search/?api=1&query=Toean%20Watiman&query_place_id=ChIJk-7zsZ9Xei4RFWlj8oCWixs","4","Nufahn","https://www.google.com/maps/reviews/data=!4m8!14m7!1m6!2m5!1sChdDSUhNMG9nS0VJQ0FnSUNNejVpLXRRRRAB!2m1!1s0x0:0x1b8b9680f2636915!3m1!1s2@1:CIHM0ogKEICAgICMz5i-tQE%7CCgwIgaCA8QUQkOXjjgI%7C?hl=id","Tempatnya asli nyaman banget. Enak buat kumpul kumpul bareng temen atau keluarga. Makanannya berbagai macam. Mulai makanan tradisional sampe internasional. Harganya juga standar, terjangkau"
"Toean Watiman","https://www.google.com/maps/search/?api=1&query=Toean%20Watiman&query_place_id=ChIJk-7zsZ9Xei4RFWlj8oCWixs","4","Alfira wahyudk","https://www.google.com/maps/reviews/data=!4m8!14m7!1m6!2m5!1sChZDSUhNMG9nS0VJQ0FnSURodDZtSkV3EAE!2m1!1s0x0:0x1b8b9680f2636915!3m1!1s2@1:CIHM0ogKEICAgIDht6mJEw%7CCgwIwc7goAYQ6IHZ3QE%7C?hl=id","Makanan nya rasanya biasa aja sih tapi porsinya lumayan banyak, pas kesini pesen ayam teriyaki tapi ini teriyakinya ga kaya teriyaki lain yg biasa saya makan. Temen saya pesen rice bowl bbq tapi bbq nya entah kenapa manis bgt. Tapi jujur kondimen lain nya enak banget sih, lain kali bakal kesini lagi buat cobain menu lainnya"
"Toean Watiman","https://www.google.com/maps/search/?api=1&query=Toean%20Watiman&query_place_id=ChIJk-7zsZ9Xei4RFWlj8oCWixs","4","Akhid Khirohmah Mansyaroh","https://www.google.com/maps/reviews/data=!4m8!14m7!1m6!2m5!1sChdDSUhNMG9nS0VJQ0FnSURBd2QtOTh3RRAB!2m1!1s0x0:0x1b8b9680f2636915!3m1!1s2@1:CIHM0ogKEICAgIDAwd-98wE%7CCgwItrT7lwYQ4P7P1gM%7C?hl=id","A great place untuk makan. Menu sangat bervariasi & harganya murah banget. 150rb bisa dapet 7-8 dish yg mengenyangkan 😭👍🏼"
"Toean Watiman","https://www.google.com/maps/search/?api=1&query=Toean%20Watiman&query_place_id=ChIJk-7zsZ9Xei4RFWlj8oCWixs","4","deruromansa","https://www.google.com/maps/reviews/data=!4m8!14m7!1m6!2m5!1sCi9DQUlRQUNvZENodHljRjlvT2sxTlpDMHhSa2xyUmtwaFRVNW9hWEJ5T1V0RWNuYxAB!2m1!1s0x0:0x1b8b9680f2636915!3m1!1s2@1:CAIQACodChtycF9oOk1NZC0xRklrRkphTU5oaXByOUtEcnc%7C0cPBIvc4FnL%7C?hl=id","Tau tempat makan ini karena sempet beberapa kali lewat FYP Tiktok. Entah, tapi aku jadi punya ekspektasi yang bisa dibilang cukup tinggi untuk Toean Watiman.

Dateng kesini sekitar jam 21.00 masih rame banget bahkan harus nunggu makanan dan minuman 45 menit (which is fine, ga ada masalah sama sekali. Wajar dan cukup dibilang cepat juga untuk kondisi se-ramai itu). Btw ramenya bener2 full semua tempat duduk di dalam sudah taken dan ada satu meja reserved.

Ternyata, sayangnya, menurutku masih kurang worth it. Untuk rasanya sebenernya masih bisa ditingkatkan lebih lagi. Lalu ada satu menu yang telat keluar. Kami harus mengingatkan waitress dulu. Sepertinya mereka lupa. Akhirnya menu tsb kami takeaway dan dapat free es teh karena sudah terlalu lama menunggu (kami apresiasi hal tsb.)."
"Toean Watiman","https://www.google.com/maps/search/?api=1&query=Toean%20Watiman&query_place_id=ChIJk-7zsZ9Xei4RFWlj8oCWixs","4","Achmad Basyr","https://www.google.com/maps/reviews/data=!4m8!14m7!1m6!2m5!1sChZDSUhNMG9nS0VJQ0FnSUM5cnFMTlBnEAE!2m1!1s0x0:0x1b8b9680f2636915!3m1!1s2@1:CIHM0ogKEICAgIC9rqLNPg%7CCgsIytCdrwYQwNPZXQ%7C?hl=id","Bento, rasa chicken teriyakinya seperti ayam kecap, hanya saja sedikit asin. Saladnya gak ada rasanya, kalau rasanya asem mungkin lebih enak dan jd balance.
Chicken agetori bbq, saya kira ayam fillet ternyata ayam olahan kayak nugget, rasanya cenderung manis, kurang asin.
Cheese soft crepes, rasanya sangat sangat manis, bikin diabetes. Cream cheese filling dan blueberry saucenya sangat manis pake banget, jdnya makan setengah roll itu aja udh eneg. Tapi cookie crumble sama es krimnya enak kok.
Overall, tempat dan pelayanannya enak dan cepat. Tapi, Mungkin untuk dessert di serve pas terakhir aja, jgn di awal sebelum makanan utama dateng."
"Toean Watiman","https://www.google.com/maps/search/?api=1&query=Toean%20Watiman&query_place_id=ChIJk-7zsZ9Xei4RFWlj8oCWixs","4","Ade Putra","https://www.google.com/maps/reviews/data=!4m8!14m7!1m6!2m5!1sChdDSUhNMG9nS0VJQ0FnSUNvaFBtY2l3RRAB!2m1!1s0x0:0x1b8b9680f2636915!3m1!1s2@1:CIHM0ogKEICAgICohPmciwE%7CCgwIzt7l4gUQ_6qqgAI%7C?hl=id","Parkirnya luas ada dibelakang. Suasana nyaman walaupun ketika siang hari AC kurang berasa adem. Wifinya lumayan kencang. Cocok buat nugas. Tadi pesan chicken katsu, rasanya cukup enak."
"Toean Watiman","https://www.google.com/maps/search/?api=1&query=Toean%20Watiman&query_place_id=ChIJk-7zsZ9Xei4RFWlj8oCWixs","4","Indah Prastiwi","https://www.google.com/maps/reviews/data=!4m8!14m7!1m6!2m5!1sChZDSUhNMG9nS0VJQ0FnSUN4OFBtd0VnEAE!2m1!1s0x0:0x1b8b9680f2636915!3m1!1s2@1:CIHM0ogKEICAgICx8PmwEg%7CCgwIsbjnogYQ0NeOmgE%7C?hl=id","Makanan enak, pelayanan baik, tempat parkir luas, tempat nyaman namun suasana kurang sangat berisik mungkin karena family resto dan ruangan menggema. terdapat mushola dan toilet bersih"
"Toean Watiman","https://www.google.com/maps/search/?api=1&query=Toean%20Watiman&query_place_id=ChIJk-7zsZ9Xei4RFWlj8oCWixs","4","Tinwarotul Fatonah","https://www.google.com/maps/reviews/data=!4m8!14m7!1m6!2m5!1sChdDSUhNMG9nS0VJQ0FnSURJNmQtRC1BRRAB!2m1!1s0x0:0x1b8b9680f2636915!3m1!1s2@1:CIHM0ogKEICAgIDI6d-D-AE%7CCgwI_dvi4QUQwfO1rwM%7C?hl=id","Nice. Toean Watiman tempatnya luas. Enak buat ngumpul besama teman maupun keluarga. Karena tempatnya luas coco nih buat yang punya keluarga besar dan pingin sekali-kali makan di luar. Bukan cuma keluarga, acara kantor juga bisa, misal rapat sekalian makan biar nggak bosan di kantor terus, Toen Watiman ini patut dicoba. Oh ya, kalau mau buat pacaran atau gosip-gosip manja sama temen juga bisa kok. Tenang ada ruangan indoor dan outdoor (buat yang mau ngerokok). Buat makanan, juara deh. Harganya nggak terlalu mahal tapi rasanya endolita alias enak. Ada juga paket buat pelajar (pake student card yes). Walaupub harganya terjangkau rasanya nggak kalah deh buat yang paket. Ini yang penting, porsi makanannya juga banyak, so pasti kamu kenyang deh. Apalagi buat pencinta keju, sudahlah ini surganya."
"Toean Watiman","https://www.google.com/maps/search/?api=1&query=Toean%20Watiman&query_place_id=ChIJk-7zsZ9Xei4RFWlj8oCWixs","4","Yahya Adinugraha Mumtaz","https://www.google.com/maps/reviews/data=!4m8!14m7!1m6!2m5!1sChdDSUhNMG9nS0VJQ0FnSURrcWE2ODVBRRAB!2m1!1s0x0:0x1b8b9680f2636915!3m1!1s2@1:CIHM0ogKEICAgIDkqa685AE%7CCgsIjsbg6AUQkOeXOw%7C?hl=id","Tempat nyaman, makanan lumayan, cuma nunggunya agak lama aja padahal gak terlalu rame pas itu. Boleh lah kali2 makan disini. Harga mungkin agak mahal bagi pelajar/mahasiswa.

Anehnya, pas kita udh milih tempat duduk, tiba2 disuruh pindah ke tempat lain katanya udh direserve, ternyata sampai makan selesai tempat yg tadi gaada yg make. 🤔"
"Toean Watiman","https://www.google.com/maps/search/?api=1&query=Toean%20Watiman&query_place_id=ChIJk-7zsZ9Xei4RFWlj8oCWixs","4","Liza June","https://www.google.com/maps/reviews/data=!4m8!14m7!1m6!2m5!1sChdDSUhNMG9nS0VJQ0FnSUNoOEw2UG9nRRAB!2m1!1s0x0:0x1b8b9680f2636915!3m1!1s2@1:CIHM0ogKEICAgICh8L6PogE%7CCgwItKT0ngYQwLXchgI%7C?hl=id","Tempatnya enak buat ngumpul bareng temen teman, ataupun dengan keluarga, untuk makanan dan minuman banyak pilihan menunya. Porsinya cukup banyak sesuai dengan harganya."
"Toean Watiman","https://www.google.com/maps/search/?api=1&query=Toean%20Watiman&query_place_id=ChIJk-7zsZ9Xei4RFWlj8oCWixs","4","Lien Lien","https://www.google.com/maps/reviews/data=!4m8!14m7!1m6!2m5!1sChdDSUhNMG9nS0VJQ0FnSUNRMUpqUzd3RRAB!2m1!1s0x0:0x1b8b9680f2636915!3m1!1s2@1:CIHM0ogKEICAgICQ1JjS7wE%7CCgwI_PbQ2gUQwNDX1QM%7C?hl=id","Salah satu resto yang nyaman di sekitar jalan Tamansiswa. Menunya lumayan variatif & harganya terjangkau Wifi juga kenceng koneksinya. Pelayanan ramah. Ada beberapa menu steak dan variasi nasi goreng serta aneka minuman serta cheese cake dan choco lava. Untuk yang order choco lava, pastikan waktu anda luang karena harus menunggu lumayan lama hingga ready to serve."
"Toean Watiman","https://www.google.com/maps/search/?api=1&query=Toean%20Watiman&query_place_id=ChIJk-7zsZ9Xei4RFWlj8oCWixs","4","Irene랜","https://www.google.com/maps/reviews/data=!4m8!14m7!1m6!2m5!1sChdDSUhNMG9nS0VJQ0FnSUN1M3JEbTlBRRAB!2m1!1s0x0:0x1b8b9680f2636915!3m1!1s2@1:CIHM0ogKEICAgICu3rDm9AE%7CCgwIie2NlwYQ8MKy8gI%7C?hl=id","Rasanya lumayaan, tempatnya bersih nyaman,pelayanan oke, terus nemu bbrp menu unik disini. Baru kali ini coba nasi hainan huehue 🌸🌸"
"Toean Watiman","https://www.google.com/maps/search/?api=1&query=Toean%20Watiman&query_place_id=ChIJk-7zsZ9Xei4RFWlj8oCWixs","4","Noor Farikhah","https://www.google.com/maps/reviews/data=!4m8!14m7!1m6!2m5!1sChdDSUhNMG9nS0VJQ0FnSURfOF9fX3BRRRAB!2m1!1s0x0:0x1b8b9680f2636915!3m1!1s2@1:CIHM0ogKEICAgID_8___pQE%7CCgsI9tLbvAYQ0IubLw%7C?hl=id","Pertama kali kesini, kebetulan tinggal di sleman utara..., kami ber5 pesan berbagai macam menu....semua enak, yummi...anak2 suka...
Minus ramee, tempat waiting list..(karena baru sadar long weekend); makanan datang nunggu 40menitan...sdah di info sih...tapi terlanjur...wkwkwk
Alhwmdulillah bs order donat dulu...lumayan enak utk ganjel perut..
Minus lagi...TOILET, (cuma 1 putra, 1putri)jadi antri..., trs juga mohon maaf agak kotor.. hadeuhh gegara sudah gak tahan🤭"
"Toean Watiman","https://www.google.com/maps/search/?api=1&query=Toean%20Watiman&query_place_id=ChIJk-7zsZ9Xei4RFWlj8oCWixs","4","Annisa Arifin","https://www.google.com/maps/reviews/data=!4m8!14m7!1m6!2m5!1sChdDSUhNMG9nS0VPRHU1X3lvbS03b3BnRRAB!2m1!1s0x0:0x1b8b9680f2636915!3m1!1s2@1:CIHM0ogKEODu5_yom-7opgE%7CCgwIzNGnwQYQuN2OtgE%7C?hl=id","makanan yg gue pesen enak dan saladnya fresh bgt. Kalau ngga salah namanya cordonblue cheezy. Harga2nya affordable bgt"
"Toean Watiman","https://www.google.com/maps/search/?api=1&query=Toean%20Watiman&query_place_id=ChIJk-7zsZ9Xei4RFWlj8oCWixs","4","Mei Wulandari","https://www.google.com/maps/reviews/data=!4m8!14m7!1m6!2m5!1sChdDSUhNMG9nS0VJQ0FnSURDcVAtSHlRRRAB!2m1!1s0x0:0x1b8b9680f2636915!3m1!1s2@1:CIHM0ogKEICAgIDCqP-HyQE%7CCgsImcjprQYQ0ILdGg%7C?hl=id","Paling suka kesini untuk kumpul bersama keluarga. Karena anak2 suka dg ragam macam makanannya. Kekinian, enak, harga ramah"
"Toean Watiman","https://www.google.com/maps/search/?api=1&query=Toean%20Watiman&query_place_id=ChIJk-7zsZ9Xei4RFWlj8oCWixs","4","khansa bunga","https://www.google.com/maps/reviews/data=!4m8!14m7!1m6!2m5!1sChZDSUhNMG9nS0VJQ0FnSURkNjhTZ1VBEAE!2m1!1s0x0:0x1b8b9680f2636915!3m1!1s2@1:CIHM0ogKEICAgIDd68SgUA%7CCgwImfX2rgYQ8Ji39QI%7C?hl=id","Tempatnya nyatu sama dopio, jadi toean watimannya didalem. Family friendly waktu dateng agak bingung ini self service atau resto gt. Pas udah ambil menu trs nulis pas mau berdiri dicegat mbaknya. Disebutin menunya apa aja trs dikasih maksimal 40 menit pesen 2 menu. Menu pertama dtg 10 menit, menu kedua dateng pas bgt 40 menit. Cukup lama sih ditambah crewnya bolak balik makesure masih kurang tapi gajadi-jadi. Buat makannya enak, especially salted eggnya ga ke foto bcs enak bgt beneran legit telur asinnya. Menunya variatif banget ga heran disebut 3 generasi"
