"title","url","stars","name","reviewUrl","text"
"Toean Watiman","https://www.google.com/maps/search/?api=1&query=Toean%20Watiman&query_place_id=ChIJk-7zsZ9Xei4RFWlj8oCWixs","4","Dian Saraswati","https://www.google.com/maps/reviews/data=!4m8!14m7!1m6!2m5!1sChZDSUhNMG9nS0VJQ0FnSURRMXNQbEtnEAE!2m1!1s0x0:0x1b8b9680f2636915!3m1!1s2@1:CIHM0ogKEICAgIDQ1sPlKg%7CCgwI-73I2AUQwJKdkQI%7C?hl=id","Tempatnya nyaman, makanannya enak.. Cuma yang bikin bete pesanan 1 meja ga dikeluarin bareng2... Nunggunya lama pula,, sering kayak gini, temenku makanannya udh keluar semua, makananku nunggu lama.."
"Toean Watiman","https://www.google.com/maps/search/?api=1&query=Toean%20Watiman&query_place_id=ChIJk-7zsZ9Xei4RFWlj8oCWixs","4","Uun Triyani","https://www.google.com/maps/reviews/data=!4m8!14m7!1m6!2m5!1sChZDSUhNMG9nS0VJQ0FnSUR3NU9DR1V3EAE!2m1!1s0x0:0x1b8b9680f2636915!3m1!1s2@1:CIHM0ogKEICAgIDw5OCGUw%7CCgwImqOf3wUQz9OpnAI%7C?hl=id","Tempat cukup nyaman. Kalau mau datang rame-rame lebih baik reservasi dulu. Karena di jam-jam tertentu ramai. Harga menu relatif murah dan sering ada promo. Rasa masakan lumayan. Menurut saya ukuran 1 porsi disini banyak jadi cukup bikin perut kenyang.. Pelayanan cukup baik."
"Toean Watiman","https://www.google.com/maps/search/?api=1&query=Toean%20Watiman&query_place_id=ChIJk-7zsZ9Xei4RFWlj8oCWixs","4","shinta intan","https://www.google.com/maps/reviews/data=!4m8!14m7!1m6!2m5!1sChZDSUhNMG9nS0VJQ0FnSURJai1MSWF3EAE!2m1!1s0x0:0x1b8b9680f2636915!3m1!1s2@1:CIHM0ogKEICAgIDIj-LIaw%7CCgwI5Nq04gUQsJORwAM%7C?hl=id","Salah satu tempat favorit buat makan dan ngerjain tugas karena wifinya kenceng banget. Variasi makanannya lengkap banget, minuman jugs lengkap, ada jus, kopi, dll. Tempatnya nyaman ada smoking area dan non smokingg area. Tapi terakhir kesana pas pesan minuman tambahan sama mas2 pelayananya (padahal sudah bilang mau nambah minum) akhirnya nunggu lama dengan harapan minumannya segera datang, setelah beberapa waktu kok ngga dateng2 lalu nanya ke mbak2 pelayannya dan nanya minumnya uda belum. Daaan ternyata sama mas2 pelayannya tadi ngga ditulis tambahan minumnya. Agak sedikit kesel sih karena uda nunggu lama. Semoga bisa nambah karyawan untuk melayani yang didalam karena kemaren sepertinya hectic banget saat jam makan malam."
"Toean Watiman","https://www.google.com/maps/search/?api=1&query=Toean%20Watiman&query_place_id=ChIJk-7zsZ9Xei4RFWlj8oCWixs","4","nurlailatul bayyinah","https://www.google.com/maps/reviews/data=!4m8!14m7!1m6!2m5!1sChZDSUhNMG9nS0VJQ0FnSURRODhhYWJREAE!2m1!1s0x0:0x1b8b9680f2636915!3m1!1s2@1:CIHM0ogKEICAgIDQ88aabQ%7CCgwI9Lmy2gUQwIfQnQI%7C?hl=id","Ini salah satu tempat makan yang ada di jalan taman siswa. Berkonsep kafe modern dengan menu utama steak dan milk shake.

Dengan harga min 8000.an keatas.
Tempatnya lumayan nyaman, dan buka sampai jam 10 malam.

Untuk tempat parkir luas parkir mobil di belakang dan larkir motor di depan.

Diatasnya ada warnet yang buka 24 jam."
"Toean Watiman","https://www.google.com/maps/search/?api=1&query=Toean%20Watiman&query_place_id=ChIJk-7zsZ9Xei4RFWlj8oCWixs","4","niar kuncoro","https://www.google.com/maps/reviews/data=!4m8!14m7!1m6!2m5!1sChZDSUhNMG9nS0VJQ0FnSUNxenNmc0Z3EAE!2m1!1s0x0:0x1b8b9680f2636915!3m1!1s2@1:CIHM0ogKEICAgICqzsfsFw%7CCgsImfz1hQYQoPaLRg%7C?hl=id","Makanannya enak..tp pesan spageti tuna dan 1 lg lupa namanya (ayam jahe nasi briyani kayaknya) lama....sdh dilewati 4 rombongan, belum juga keluar....
Sip...uji kesabaran buat kami..😁👍"
"Toean Watiman","https://www.google.com/maps/search/?api=1&query=Toean%20Watiman&query_place_id=ChIJk-7zsZ9Xei4RFWlj8oCWixs","4","Sri Uci","https://www.google.com/maps/reviews/data=!4m8!14m7!1m6!2m5!1sChdDSUhNMG9nS0VJQ0FnSUNBOWZYQ3JBRRAB!2m1!1s0x0:0x1b8b9680f2636915!3m1!1s2@1:CIHM0ogKEICAgICA9fXCrAE%7CCgsIsdbo2QUQwLLNOw%7C?hl=id","Pilihan makanan banyak. Menu indonesia, asia dan western ada. Cocok buat grup/keluarga yg seleranya macam2. Harga cukup terjangkau. Kisaran 10-30 rb. Steamboat enak dan muraah. Cuma 25rb. Ada sofa buat yg pengen duduk2 santai"
"Toean Watiman","https://www.google.com/maps/search/?api=1&query=Toean%20Watiman&query_place_id=ChIJk-7zsZ9Xei4RFWlj8oCWixs","4","aprilia ayudya","https://www.google.com/maps/reviews/data=!4m8!14m7!1m6!2m5!1sChdDSUhNMG9nS0VJQ0FnSURJOFBDd3pRRRAB!2m1!1s0x0:0x1b8b9680f2636915!3m1!1s2@1:CIHM0ogKEICAgIDI8PCwzQE%7CCgsIjJvi4AUQiq6wXg%7C?hl=id","Good place with super affordable  price! Rasanya pun cukup enak.  Pilihan banget kalo ajak anak yg lagi susah makan kesini.  Bisa pilih macem2 menu.  Yg aku suka krn disini menu minumannya ada banyak 😊"
"Toean Watiman","https://www.google.com/maps/search/?api=1&query=Toean%20Watiman&query_place_id=ChIJk-7zsZ9Xei4RFWlj8oCWixs","4","dewati rahmayani","https://www.google.com/maps/reviews/data=!4m8!14m7!1m6!2m5!1sChZDSUhNMG9nS0VJQ0FnSUNRamY2Z1RREAE!2m1!1s0x0:0x1b8b9680f2636915!3m1!1s2@1:CIHM0ogKEICAgICQjf6gTQ%7CCgwIyfnn2QUQwKeJwgE%7C?hl=id","Makanannya enak-enak dan surprisingly dengan harga yang murah menurut saya, makanan juga nggak lama dateng nya, cuma satu kurangnya servicenya kurang gercep & greget, tapi so far so good sih semoga semakin membaik biar perfect hehe ❤"
"Toean Watiman","https://www.google.com/maps/search/?api=1&query=Toean%20Watiman&query_place_id=ChIJk-7zsZ9Xei4RFWlj8oCWixs","4","julian r","https://www.google.com/maps/reviews/data=!4m8!14m7!1m6!2m5!1sChdDSUhNMG9nS0VJQ0FnSUNRMGR6OThRRRAB!2m1!1s0x0:0x1b8b9680f2636915!3m1!1s2@1:CIHM0ogKEICAgICQ0dz98QE%7CCgwIm42j3AUQiIzMtAM%7C?hl=id","Tempat yang nyaman untuk makan dan kumpul bareng keluarga, pacar, teman, dan yang lainnya. Menunya pun banyak pilihan, rasa pun lumayan, lokasi parkir masuk dan cukup luas untuk mobil, sering sekali saya kesini karena aksesnya mudah. Overall menurut saya cocok sekali buat kalian semua yang ingin kumpul makan dan berfoto bersama, pelayannya juga ramah dan baik jika direpotkan hehe"
"Toean Watiman","https://www.google.com/maps/search/?api=1&query=Toean%20Watiman&query_place_id=ChIJk-7zsZ9Xei4RFWlj8oCWixs","4","Hermawan","https://www.google.com/maps/reviews/data=!4m8!14m7!1m6!2m5!1sChZDSUhNMG9nS0VJQ0FnSURnX1lXX1JBEAE!2m1!1s0x0:0x1b8b9680f2636915!3m1!1s2@1:CIHM0ogKEICAgIDg_YW_RA%7CCgwInsy50QUQwMKAvwI%7C?hl=id","Makanan enak dengan banyak sekali variasi juga ditambah menu minuman yg juga sangat banyak, harga masuk akal, cuma parkiran depan terbatas dan porsi nasi yang kecil terasa kurang buat segmen mahasiswa/anak kost.."
"Toean Watiman","https://www.google.com/maps/search/?api=1&query=Toean%20Watiman&query_place_id=ChIJk-7zsZ9Xei4RFWlj8oCWixs","4","Nuansa Falsafia","https://www.google.com/maps/reviews/data=!4m8!14m7!1m6!2m5!1sChdDSUhNMG9nS0VJQ0FnSURRaU5Eb2d3RRAB!2m1!1s0x0:0x1b8b9680f2636915!3m1!1s2@1:CIHM0ogKEICAgIDQiNDogwE%7CCgwI0qjI0gUQgK6rqQM%7C?hl=id","Kemarin nyobain beli minuman yg harganya 20an keatas hampir 30rb, kirain penyajiannya bakal sama kyk minuman yg hrganya belasan ribu yaitu pakai gelas. Ternyata cuma pake gelas plastik doang. Kecewanya di situ doang sih."
"Toean Watiman","https://www.google.com/maps/search/?api=1&query=Toean%20Watiman&query_place_id=ChIJk-7zsZ9Xei4RFWlj8oCWixs","4","24_Naufal Ahmad","https://www.google.com/maps/reviews/data=!4m8!14m7!1m6!2m5!1sChdDSUhNMG9nS0VJQ0FnSUNCMy1Dc3d3RRAB!2m1!1s0x0:0x1b8b9680f2636915!3m1!1s2@1:CIHM0ogKEICAgICB3-CswwE%7CCgwI9drpnQYQsIyM5QE%7C?hl=id","Makanannya enak tapi ada tidak saya rekomendasikan saat jam makan siang yang pertama nunggunya lama sekali ini sudah 1 jam pesanan saya belum datang, yang kedua kualitas makanannya menurun saat kondisi ramai, kesimpulannya kunjungilah resto ini jangan pada saat jam makan, mohon pihak restonya untuk bisa mengatasi hal ini, dan juga mohon untuk sirkulasi udara di restaurant nya mohon lebih diperhatikan"
"Toean Watiman","https://www.google.com/maps/search/?api=1&query=Toean%20Watiman&query_place_id=ChIJk-7zsZ9Xei4RFWlj8oCWixs","4","Gabriella Natalingrum","https://www.google.com/maps/reviews/data=!4m8!14m7!1m6!2m5!1sChdDSUhNMG9nS0VJQ0FnSUR3cUlDM2hnRRAB!2m1!1s0x0:0x1b8b9680f2636915!3m1!1s2@1:CIHM0ogKEICAgIDwqIC3hgE%7CCgwI1sC63gUQ_OXcqgM%7C?hl=id","tempatnya nyaman tidak sempit, bisa jadi tempat ngumpul yang asyik. banyak menu makann pilihan dari western, indonesian dan chinnese food. minuman juga sangat bervariasi dan penyajian makanan yg cantik dan rapih. belum pernah kecewa selama ini. 👍"
"Toean Watiman","https://www.google.com/maps/search/?api=1&query=Toean%20Watiman&query_place_id=ChIJk-7zsZ9Xei4RFWlj8oCWixs","4","Alice AL","https://www.google.com/maps/reviews/data=!4m8!14m7!1m6!2m5!1sChZDSUhNMG9nS0VJQ0FnSURBbUpXVFdBEAE!2m1!1s0x0:0x1b8b9680f2636915!3m1!1s2@1:CIHM0ogKEICAgIDAmJWTWA%7CCgwI0cnV1AUQgLD1oQI%7C?hl=id","Beberapa kali ke sini ada perubahan menu sejak awal buka,  dan pesan ada yg beda & ada yg sama dg sebelumnya (menu yg gak berubah). Rasa cukup memuaskan di beberapa menu,  dan ada yang suka banget, menu dessertnya.
Menu berat yang beberapa kali nyoba terakhir agak beda sensasinya dg yang awal nyoba, padahal saya sangat suka menu itu awal buka tempat ini,  tapi tetap rekomended kok.
Menu yang beraneka ragam,  mulai dari makanan, beverage, hingga dessertnya.
Tempat nyaman,  ada Wifi,  ruang yg smooking & no smooking (AC). Cocok untuk nongkrong,  plus instagramable."
"Toean Watiman","https://www.google.com/maps/search/?api=1&query=Toean%20Watiman&query_place_id=ChIJk-7zsZ9Xei4RFWlj8oCWixs","4","Denice Frank","https://www.google.com/maps/reviews/data=!4m8!14m7!1m6!2m5!1sChZDSUhNMG9nS0VJQ0FnSURVMFoteExnEAE!2m1!1s0x0:0x1b8b9680f2636915!3m1!1s2@1:CIHM0ogKEICAgIDU0Z-xLg%7CCgwIrZzWgAYQiOKl9QE%7C?hl=id","Terletak di Jalan Taman Siswa, Yogya. Menjual makanan dan minuman. Makanan berupa makanan barat dan Indonesia. Harga terjangkau. Parkir mobil dan motor tersedia. Wifi tersedia. Menjual donat, yang diberi nama dopio. Rasa makanan enak. Pelayanan cepat."
"Toean Watiman","https://www.google.com/maps/search/?api=1&query=Toean%20Watiman&query_place_id=ChIJk-7zsZ9Xei4RFWlj8oCWixs","4","Handarini Cinta Wati","https://www.google.com/maps/reviews/data=!4m8!14m7!1m6!2m5!1sChZDSUhNMG9nS0VJQ0FnSURtdDUzYldBEAE!2m1!1s0x0:0x1b8b9680f2636915!3m1!1s2@1:CIHM0ogKEICAgIDmt53bWA%7CCgsI2ryekAYQ2NfIDg%7C?hl=id","Enak dan murah, pilihan menu tolong ditambah ayam bakar original, spy bisa jadi opsi buat kami yg rada nyirik minyak dan pedes bisa ikut makan di sana 😆😆"
"Toean Watiman","https://www.google.com/maps/search/?api=1&query=Toean%20Watiman&query_place_id=ChIJk-7zsZ9Xei4RFWlj8oCWixs","4","Ari Muharam","https://www.google.com/maps/reviews/data=!4m8!14m7!1m6!2m5!1sChZDSUhNMG9nS0VJQ0FnSURVNWFMeENBEAE!2m1!1s0x0:0x1b8b9680f2636915!3m1!1s2@1:CIHM0ogKEICAgIDU5aLxCA%7CCgwIq4ej6wUQqPn2ygI%7C?hl=id","tempat nyaman parkiran juga luas di belakang restoran, hrga menengah sekitar 50 ribuan per org udh makan dan minum, rasa standar gl ada yg unik"
"Toean Watiman","https://www.google.com/maps/search/?api=1&query=Toean%20Watiman&query_place_id=ChIJk-7zsZ9Xei4RFWlj8oCWixs","4","Ahmad Amin Fahmi","https://www.google.com/maps/reviews/data=!4m8!14m7!1m6!2m5!1sChdDSUhNMG9nS0VJQ0FnSURJcE5xR3pnRRAB!2m1!1s0x0:0x1b8b9680f2636915!3m1!1s2@1:CIHM0ogKEICAgIDIpNqGzgE%7CCgwI1Lb34AUQiYuX0AE%7C?hl=id","Lumayan asyik buat nongkrong berlama-lama, ada smoking room juga. Makanannya lumayan harga sesuai.

Sayang ruangannya kurang peredam suara sehingg terasa bising atau berisik."
"Toean Watiman","https://www.google.com/maps/search/?api=1&query=Toean%20Watiman&query_place_id=ChIJk-7zsZ9Xei4RFWlj8oCWixs","4","Sesha Ayu","https://www.google.com/maps/reviews/data=!4m8!14m7!1m6!2m5!1sChZDSUhNMG9nS0VJQ0FnSUN3eTdQR013EAE!2m1!1s0x0:0x1b8b9680f2636915!3m1!1s2@1:CIHM0ogKEICAgICwy7PGMw%7CCgwI44-_0QUQwMrMiQI%7C?hl=id","Tempatnya asik buat nongkrong,  ada wifi juga tapi wifinya agak lemot mungkin yg pake banyak,  menu makanan harga standar. Dan paling fav disini es cream nya nggak tau kenapa kalau makan es crean di sini kayak ngebawa ke masa jadul aja,  the best ever es cream di jogja sih menurutku"
"Toean Watiman","https://www.google.com/maps/search/?api=1&query=Toean%20Watiman&query_place_id=ChIJk-7zsZ9Xei4RFWlj8oCWixs","4","Ibnu Damanudin Prince December","https://www.google.com/maps/reviews/data=!4m8!14m7!1m6!2m5!1sChZDSUhNMG9nS0VJQ0FnSURHbU9hUUx3EAE!2m1!1s0x0:0x1b8b9680f2636915!3m1!1s2@1:CIHM0ogKEICAgIDGmOaQLw%7CCgsIhcHTjAYQ4MyfPQ%7C?hl=id","Tempat bernuansa klasik modern, staff restaurant yang ramah, tersedia kamar mandi dan mushola.
Banyak varian makanan.
Untuk harga standar.
Rasa makanan lumayan.
Cocok buat bersantai bersama teman"
"Toean Watiman","https://www.google.com/maps/search/?api=1&query=Toean%20Watiman&query_place_id=ChIJk-7zsZ9Xei4RFWlj8oCWixs","4","Tantriana Herawati","https://www.google.com/maps/reviews/data=!4m8!14m7!1m6!2m5!1sChZDSUhNMG9nS0VJQ0FnSUNzLWU2OUtnEAE!2m1!1s0x0:0x1b8b9680f2636915!3m1!1s2@1:CIHM0ogKEICAgICs-e69Kg%7CCgwIxu348QUQkKO0ogM%7C?hl=id","Pelayanan oc, menu bervariasi, rasanya nendaaang..."
"Toean Watiman","https://www.google.com/maps/search/?api=1&query=Toean%20Watiman&query_place_id=ChIJk-7zsZ9Xei4RFWlj8oCWixs","4","Lucy 888","https://www.google.com/maps/reviews/data=!4m8!14m7!1m6!2m5!1sChdDSUhNMG9nS0VJQ0FnSURRcXFfMW93RRAB!2m1!1s0x0:0x1b8b9680f2636915!3m1!1s2@1:CIHM0ogKEICAgIDQqq_1owE%7CCgwIlLyi0gUQgMfGuQM%7C?hl=id","Harga tergolong cukup terjangkau, rasa enak, menu lengkap. Dekorasi asik, gaul, terdapat colokan listrik di setiap kursi. Ada ruangan smoking dan no smoking. Parkir mobil di belakang."
"Toean Watiman","https://www.google.com/maps/search/?api=1&query=Toean%20Watiman&query_place_id=ChIJk-7zsZ9Xei4RFWlj8oCWixs","4","apri yuliana","https://www.google.com/maps/reviews/data=!4m8!14m7!1m6!2m5!1sChZDSUhNMG9nS0VJQ0FnSUMtMzZDSk93EAE!2m1!1s0x0:0x1b8b9680f2636915!3m1!1s2@1:CIHM0ogKEICAgIC-36CJOw%7CCgsIq8LYmwYQsJXHfQ%7C?hl=id","Makanannya enak dan porsinya lumayan, staffnya friendly juga. Cuma untuk kebeesihan dan sofa mungkin perlu di tingkatkan dan pembaharuan"
"Toean Watiman","https://www.google.com/maps/search/?api=1&query=Toean%20Watiman&query_place_id=ChIJk-7zsZ9Xei4RFWlj8oCWixs","4","Cahyaningtyas MH","https://www.google.com/maps/reviews/data=!4m8!14m7!1m6!2m5!1sChZDSUhNMG9nS0VJQ0FnSURnbU5Ed1pBEAE!2m1!1s0x0:0x1b8b9680f2636915!3m1!1s2@1:CIHM0ogKEICAgIDgmNDwZA%7CCgsIxtu42QUQgKfpLA%7C?hl=id","Nyetel lagunya terlalu keras , jd kurang nyaman. Kami jajan kan perlu ngobrol tp jd teriak2 ngobrolnya. Akan bagus lg kalau lagi dikurangi vol nya, spy tdk terlalu berisik."
"Toean Watiman","https://www.google.com/maps/search/?api=1&query=Toean%20Watiman&query_place_id=ChIJk-7zsZ9Xei4RFWlj8oCWixs","4","Lalita Gandaputri","https://www.google.com/maps/reviews/data=!4m8!14m7!1m6!2m5!1sChdDSUhNMG9nS0VJQ0FnSURBamJHQXRRRRAB!2m1!1s0x0:0x1b8b9680f2636915!3m1!1s2@1:CIHM0ogKEICAgIDAjbGAtQE%7CCgwIm57YzQUQwLqr-gE%7C?hl=id","Tempatnya enak.. Kayak restoran jadul. Rasa makanannya juga enak dan sesuai harganya"
"Toean Watiman","https://www.google.com/maps/search/?api=1&query=Toean%20Watiman&query_place_id=ChIJk-7zsZ9Xei4RFWlj8oCWixs","4","Nur Sara","https://www.google.com/maps/reviews/data=!4m8!14m7!1m6!2m5!1sChdDSUhNMG9nS0VJQ0FnSUQybjRMaG13RRAB!2m1!1s0x0:0x1b8b9680f2636915!3m1!1s2@1:CIHM0ogKEICAgID2n4LhmwE%7CCgsI7L_MlAYQwJaEEQ%7C?hl=id","untuk porsinya disini banyak banget dengan harga yang relatif standar tapi yang disayangkan adalah dagingnya gak asli alias kayak model nugget yang gede itu.."
"Toean Watiman","https://www.google.com/maps/search/?api=1&query=Toean%20Watiman&query_place_id=ChIJk-7zsZ9Xei4RFWlj8oCWixs","4","fitri indriani","https://www.google.com/maps/reviews/data=!4m8!14m7!1m6!2m5!1sChdDSUhNMG9nS0VJQ0FnSURHN2RyYmdBRRAB!2m1!1s0x0:0x1b8b9680f2636915!3m1!1s2@1:CIHM0ogKEICAgIDG7drbgAE%7CCgwI06q4jQYQuMv9jQM%7C?hl=id","Tempatnya nyaman bagus makanannya enak enak porsi makanan puas wkwk"
"Toean Watiman","https://www.google.com/maps/search/?api=1&query=Toean%20Watiman&query_place_id=ChIJk-7zsZ9Xei4RFWlj8oCWixs","4","Nadia Rahmania","https://www.google.com/maps/reviews/data=!4m8!14m7!1m6!2m5!1sChZDSUhNMG9nS0VJQ0FnSUNvLXNhc1lREAE!2m1!1s0x0:0x1b8b9680f2636915!3m1!1s2@1:CIHM0ogKEICAgICo-sasYQ%7CCgsIq4n35AUQwLfXRQ%7C?hl=id","Tempat makan ini menyajikan berbagai macam makanan, indonesian food, western food, asian food..menu nya banyak jadi untuk yang makan grup/rombongan ini bisa jadi pilihan..
Pilihan minuman nya juga beragam, saya paling suka bagian kopu nya karena nikmat..
Makanan untuk anak nya juga ada..

Tempat nyaman, ber AC, ada smooking dan non..
Mushola ada, toilet juga nyaman..
Parkir mobil juga nyaman karena memiliki area parkir tersendiri di belakang..

Lokasi nya mudah d jangkau karena d tengah kota dan juga d area kuliner..

Untuk harga, saya masih menilai ini standar tidak murah tidak juga mahal..

Rekomendasi untuk acara makan keluarga/grup 😉😉😉👌👌👌👌"
"Toean Watiman","https://www.google.com/maps/search/?api=1&query=Toean%20Watiman&query_place_id=ChIJk-7zsZ9Xei4RFWlj8oCWixs","4","uki mukti","https://www.google.com/maps/reviews/data=!4m8!14m7!1m6!2m5!1sChZDSUhNMG9nS0VJQ0FnSUQ0Z09YOU9REAE!2m1!1s0x0:0x1b8b9680f2636915!3m1!1s2@1:CIHM0ogKEICAgID4gOX9OQ%7CCgwI_tGD6AUQsLnnkgM%7C?hl=id","Tempatnya lumayan nyaman. Makanannya enak, orangnya ramah dan baik, cm kurang dingin tempatnya"
"Toean Watiman","https://www.google.com/maps/search/?api=1&query=Toean%20Watiman&query_place_id=ChIJk-7zsZ9Xei4RFWlj8oCWixs","4","Teguh Santoso","https://www.google.com/maps/reviews/data=!4m8!14m7!1m6!2m5!1sChZDSUhNMG9nS0VJQ0FnSUR1aVpYek93EAE!2m1!1s0x0:0x1b8b9680f2636915!3m1!1s2@1:CIHM0ogKEICAgIDuiZXzOw%7CCgwIh_uTmAYQgN7fvwI%7C?hl=id","Enak, cobain steam bot kiah tomyam dan nasi  ayamnya. Minus bintang satu karena pas kesini kesannya seperti kekurangan pramu saji."
"Toean Watiman","https://www.google.com/maps/search/?api=1&query=Toean%20Watiman&query_place_id=ChIJk-7zsZ9Xei4RFWlj8oCWixs","4","say puLe","https://www.google.com/maps/reviews/data=!4m8!14m7!1m6!2m5!1sChdDSUhNMG9nS0VJQ0FnSUQtN296Q19BRRAB!2m1!1s0x0:0x1b8b9680f2636915!3m1!1s2@1:CIHM0ogKEICAgID-7ozC_AE%7CCgsIzLqcnAYQkKm-Jw%7C?hl=id","Harga ok, waktu tunggu ga ok"
"Toean Watiman","https://www.google.com/maps/search/?api=1&query=Toean%20Watiman&query_place_id=ChIJk-7zsZ9Xei4RFWlj8oCWixs","4","Yedida Octha Adrianas Tuhumena","https://www.google.com/maps/reviews/data=!4m8!14m7!1m6!2m5!1sChZDSUhNMG9nS0VJQ0FnSURldGUtSkZ3EAE!2m1!1s0x0:0x1b8b9680f2636915!3m1!1s2@1:CIHM0ogKEICAgIDete-JFw%7CCgwI46SumgYQgP3zpwI%7C?hl=id","Makanannya enak, tempatnya nyaman 👍🏻"
"Toean Watiman","https://www.google.com/maps/search/?api=1&query=Toean%20Watiman&query_place_id=ChIJk-7zsZ9Xei4RFWlj8oCWixs","4","Retno Wulandari","https://www.google.com/maps/reviews/data=!4m8!14m7!1m6!2m5!1sChdDSUhNMG9nS0VJQ0FnSUNPcWFHUW9nRRAB!2m1!1s0x0:0x1b8b9680f2636915!3m1!1s2@1:CIHM0ogKEICAgICOqaGQogE%7CCgwIwZqmrAYQ8MPT1gM%7C?hl=id","Tempatnya bagus, menunya banyak pilihannya, karyawannya ramah dan helpful"
"Toean Watiman","https://www.google.com/maps/search/?api=1&query=Toean%20Watiman&query_place_id=ChIJk-7zsZ9Xei4RFWlj8oCWixs","4","Krisostomus Nova Rahmanto","https://www.google.com/maps/reviews/data=!4m8!14m7!1m6!2m5!1sChZDSUhNMG9nS0VJQ0FnSURBNjczb1ZREAE!2m1!1s0x0:0x1b8b9680f2636915!3m1!1s2@1:CIHM0ogKEICAgIDA673oVQ%7CCgsImNiN1QUQwIvkDg%7C?hl=id","Cafe yang cukup cozy untuk mengerjakan tugas kuliah atau sekedar hang out bareng teman-teman. Harga makanan dan minuman berkisar 15-60K"
"Toean Watiman","https://www.google.com/maps/search/?api=1&query=Toean%20Watiman&query_place_id=ChIJk-7zsZ9Xei4RFWlj8oCWixs","4","Aji Prasetyo","https://www.google.com/maps/reviews/data=!4m8!14m7!1m6!2m5!1sChZDSUhNMG9nS0VJQ0FnSUNNdWRpVFV3EAE!2m1!1s0x0:0x1b8b9680f2636915!3m1!1s2@1:CIHM0ogKEICAgICMudiTUw%7CCgwIg5717gUQ6OjR8AE%7C?hl=id","Recomended dg tempat fancy tapi harga gak mencekik. Sesekali boleh lah kalau ada yg ngajak reuni kecil2an pas tanggal muda"
"Toean Watiman","https://www.google.com/maps/search/?api=1&query=Toean%20Watiman&query_place_id=ChIJk-7zsZ9Xei4RFWlj8oCWixs","4","Ni'matul Baroroh","https://www.google.com/maps/reviews/data=!4m8!14m7!1m6!2m5!1sChZDSUhNMG9nS0VJQ0FnSURBc2ZQdExREAE!2m1!1s0x0:0x1b8b9680f2636915!3m1!1s2@1:CIHM0ogKEICAgIDAsfPtLQ%7CCgwIqq382QUQwOW6jAI%7C?hl=id","Tempatnya lumayan, masakan lumayan utk orang yg blm terbiasa makanan asing disini bisa utk arena penjajagan.."
"Toean Watiman","https://www.google.com/maps/search/?api=1&query=Toean%20Watiman&query_place_id=ChIJk-7zsZ9Xei4RFWlj8oCWixs","4","Dhinka Puruhito","https://www.google.com/maps/reviews/data=!4m8!14m7!1m6!2m5!1sChdDSUhNMG9nS0VJQ0FnSUNnam9EbDBBRRAB!2m1!1s0x0:0x1b8b9680f2636915!3m1!1s2@1:CIHM0ogKEICAgICgjoDl0AE%7CCgsIge6J2AUQgOa_Mw%7C?hl=id","Es teh nya mantap dengan harga 5000 es teh nya enak. Vegie salad nya enak, cukup makan salad ni aja dah kenyang. Makaroni nya biasa saja."
"Toean Watiman","https://www.google.com/maps/search/?api=1&query=Toean%20Watiman&query_place_id=ChIJk-7zsZ9Xei4RFWlj8oCWixs","4","Trisca Fariana","https://www.google.com/maps/reviews/data=!4m8!14m7!1m6!2m5!1sChZDSUhNMG9nS0VJQ0FnSUNlMnRYWEpnEAE!2m1!1s0x0:0x1b8b9680f2636915!3m1!1s2@1:CIHM0ogKEICAgICe2tXXJg%7CCgwItOf5mAYQqIWdugM%7C?hl=id","Menu makan minum bervariasi, tempat luas dan bersih, parkiran mobil luas, masak agak lama"
"Toean Watiman","https://www.google.com/maps/search/?api=1&query=Toean%20Watiman&query_place_id=ChIJk-7zsZ9Xei4RFWlj8oCWixs","4","Gilang N Firdaus","https://www.google.com/maps/reviews/data=!4m8!14m7!1m6!2m5!1sChZDSUhNMG9nS0VJQ0FnSURBMkkybENBEAE!2m1!1s0x0:0x1b8b9680f2636915!3m1!1s2@1:CIHM0ogKEICAgIDA2I2lCA%7CCgwIjPLS3AUQmIm3xwI%7C?hl=id","cocok jika dijadikan sesekali tempat nongkrong, hidangannya instagramable

recommended spot around here: XT-Square, dagadu jogjatorium, sentra kerajinan perak Kotagede"
"Toean Watiman","https://www.google.com/maps/search/?api=1&query=Toean%20Watiman&query_place_id=ChIJk-7zsZ9Xei4RFWlj8oCWixs","4","warmiati","https://www.google.com/maps/reviews/data=!4m8!14m7!1m6!2m5!1sChZDSUhNMG9nS0VJQ0FnSURnOUtlUVdREAE!2m1!1s0x0:0x1b8b9680f2636915!3m1!1s2@1:CIHM0ogKEICAgIDg9KeQWQ%7CCgsI2eTk2gUQgP2HUQ%7C?hl=id","tempat nyaman, makanan ada yg enak ada yg biasa aja, harus cermat milih"
"Toean Watiman","https://www.google.com/maps/search/?api=1&query=Toean%20Watiman&query_place_id=ChIJk-7zsZ9Xei4RFWlj8oCWixs","4","dea natalia","https://www.google.com/maps/reviews/data=!4m8!14m7!1m6!2m5!1sChZDSUhNMG9nS0VJQ0FnSURBclp6REJBEAE!2m1!1s0x0:0x1b8b9680f2636915!3m1!1s2@1:CIHM0ogKEICAgIDArZzDBA%7CCgwIm5fN1gUQwOu83gI%7C?hl=id","menu nya lengkap, enakk..utk harga bersahabat dgn kantong..penyajian sedikit agak lama.."
"Toean Watiman","https://www.google.com/maps/search/?api=1&query=Toean%20Watiman&query_place_id=ChIJk-7zsZ9Xei4RFWlj8oCWixs","4","usman ba'bud","https://www.google.com/maps/reviews/data=!4m8!14m7!1m6!2m5!1sChZDSUhNMG9nS0VJQ0FnSURoZ0lLdkJBEAE!2m1!1s0x0:0x1b8b9680f2636915!3m1!1s2@1:CIHM0ogKEICAgIDhgIKvBA%7CCgwIl77tnwYQ0MCxgwE%7C?hl=id","Makanannya lama datengnya, rasa utk western lumayan tp karna lama jd mengsedih"
"Toean Watiman","https://www.google.com/maps/search/?api=1&query=Toean%20Watiman&query_place_id=ChIJk-7zsZ9Xei4RFWlj8oCWixs","4","ZATRA BABYSHOPLINE","https://www.google.com/maps/reviews/data=!4m8!14m7!1m6!2m5!1sChZDSUhNMG9nS0VJQ0FnSUNvOU1iVWJREAE!2m1!1s0x0:0x1b8b9680f2636915!3m1!1s2@1:CIHM0ogKEICAgICo9MbUbQ%7CCgwIoujr4gUQpJvNowI%7C?hl=id","Masakannya enak... Sayang tadi siang AC nya tidak terasa... Jd kurang nyaman.."
"Toean Watiman","https://www.google.com/maps/search/?api=1&query=Toean%20Watiman&query_place_id=ChIJk-7zsZ9Xei4RFWlj8oCWixs","4","novita sari","https://www.google.com/maps/reviews/data=!4m8!14m7!1m6!2m5!1sChZDSUhNMG9nS0VJQ0FnSUNnM3VuQkNnEAE!2m1!1s0x0:0x1b8b9680f2636915!3m1!1s2@1:CIHM0ogKEICAgICg3unBCg%7CCgwIgJG-0gUQwLSpqAE%7C?hl=id","Harganya terjangkau,tempatnya enak,nyaman pokokny sukak,untuk taste semua ya bolehlah dengan harga swgitu"
"Toean Watiman","https://www.google.com/maps/search/?api=1&query=Toean%20Watiman&query_place_id=ChIJk-7zsZ9Xei4RFWlj8oCWixs","4","Tiara Dewi Ascosenda","https://www.google.com/maps/reviews/data=!4m8!14m7!1m6!2m5!1sChdDSUhNMG9nS0VJQ0FnSURJdkoybnRRRRAB!2m1!1s0x0:0x1b8b9680f2636915!3m1!1s2@1:CIHM0ogKEICAgIDIvJ2ntQE%7CCgwIsfyQ4QUQ79rtzAM%7C?hl=id","Tempatnya nyaman, makanannya enak, cocok untuk kumpul2 bareng teman dan keluarga"
"Toean Watiman","https://www.google.com/maps/search/?api=1&query=Toean%20Watiman&query_place_id=ChIJk-7zsZ9Xei4RFWlj8oCWixs","4","* Kapim *","https://www.google.com/maps/reviews/data=!4m8!14m7!1m6!2m5!1sChdDSUhNMG9nS0VJQ0FnSUNvbWNXVG9RRRAB!2m1!1s0x0:0x1b8b9680f2636915!3m1!1s2@1:CIHM0ogKEICAgIComcWToQE%7CCgwI4-2A3wUQiJDH1AI%7C?hl=id","Kaget pas bayar di kasir, ternyata cuma habis sedikit, padahal pesanan cukup banyak (dan semuanya enak)."
"Toean Watiman","https://www.google.com/maps/search/?api=1&query=Toean%20Watiman&query_place_id=ChIJk-7zsZ9Xei4RFWlj8oCWixs","4","Dewi Ratnasari","https://www.google.com/maps/reviews/data=!4m8!14m7!1m6!2m5!1sChdDSUhNMG9nS0VJQ0FnSUNnbF9QYm13RRAB!2m1!1s0x0:0x1b8b9680f2636915!3m1!1s2@1:CIHM0ogKEICAgICgl_PbmwE%7CCgwI_I2W0AUQwI-u3AM%7C?hl=id","Suasananya cocok buat nyante.rapat kantor atau kumpulan.tdk terlalu crowded jd bs menikmati makanan dan suasananya"
"Toean Watiman","https://www.google.com/maps/search/?api=1&query=Toean%20Watiman&query_place_id=ChIJk-7zsZ9Xei4RFWlj8oCWixs","4","Zunnan Ns","https://www.google.com/maps/reviews/data=!4m8!14m7!1m6!2m5!1sCi9DQUlRQUNvZENodHljRjlvT2paMFREZGtVbVJVTW1adWRUQXlXVEJZZGs1SFgxRRAB!2m1!1s0x0:0x1b8b9680f2636915!3m1!1s2@1:CAIQACodChtycF9oOjZ0TDdkUmRUMmZudTAyWTBYdk5HX1E%7C0cRyHiIHvyz%7C?hl=id","Untuk maincourse kebanyakan daging ayam drpd daging sapi...untuk rasa..ma'af saya kasih standart aja..."
